"Is it a fact, under your definition, that homeopathy is nonsense?

Is it a fact that Obama was born in the United States?

Is it a fact that organic food is no safer than normal food?

Which of the above three things am I allowed to report on during the ""fact"" portion of my show?",1
"I am as confused as you are. Can you imagine the mess we would be in if *McCain* had been elected President? I think President Obama has done an amazing job at keeping us afloat in a financial crisis, and moving forward on progressive yet controversial Healthcare legislation. Plus, he's nice to look at, his wife is trying to get kids off their asses to lose some weight, he's extremely intelligent, and he doesn't fly off the handle in a crisis (I still can't understand why people think it would be a *good* thing for President Obama to lose his temper over the oil spill.)",0
"Over the past couple of years, the medical marijuana industry in Los  Angeles has exploded. Estimates vary, but there may be as many as 800 dispensaries currently open for business in the city of angels. An ordinance recently passed by the LA city council, however, is about to change all that.

The new ordinance will force hundreds of dispensaries to close and all but a few to relocate. The goal was to bring clarity to the medical marijuana industry, but the only thing that's clear is that the transition process will be difficult. Especially now that the DEA has begun raiding dispensaries again despite the promises made by the Obama administration.

While federal, state and local governments struggle to make sense of medical marijuana laws, an increasing number of Californians support a completely different approach: marijuana legalization. Nothing more than a pipe dream? Maybe. But consider this: Fixty-six percent of Californians currently support pot legalization, the same proportion of Californians who voted for the Compassionate Use Act, which legalized medical marijuana, back in 1996.

Produced by Paul Feine. Shot and edited by Alex Manning. Graphics by Hawk Jensen.

Hosted by Nick Gillespie.

Approximately 9 minutes.

Scroll down for iPod, HD, and audio versions of the video.

Watch it at Reason.tv's YouTube channel (subscribe and receive automatic notification when new material goes live!).",1
"Iraqis had weapons during Saddam's rule. And they couldn't do shit because they were against a trained army with more than just rifles and pistols.

Imagine how that would work out. Actually, imagine that the Tea Party nuts see Obama as a tyrant and use arms against the government. Civil war anyone?",3
"During and shortly after the election I thought about looking into moving overseas. Should I go ahead and get out now, or wait and see if Obama can help dig us out of this mess? It wasnt like I was heavily for or against him. The strongest I felt towards either of the candidates whats an absolute 'hell no!!' for McCain. Other wise it was 'whatever', and by default the lesser of two evils.   
Sometimes I think I should have left. ",1
"Ron Paul has been in Congress for over 30 years.  He has written a SHIT load of legislation.  He has also run a business and been in the military.  His has a multitude more experience than Obama.  No, he would not have gotten everything he wanted by a long shot.  But I bet he would have vetoed a LOT of stuff and made Congress override him.  But he does know how to get legislation written and passed. Obama didn't even serve one full term as Senator.  Give me a fucking break.",4
unfortunately the docs probably wont do too much now under this new obama healthcare because they know they wont get paid.  Offer to pay cash and you will get the best healthcare.,1
"Oh youtube... somehow I got from that to this: http://www.youtube.com/watch?v=1qGmq-peRM8&amp;feature=related

I have never seen this!  Willy and Obama?",1
Noam Chomsky giving a flying kick at Barack Obama,4
"I have a Rush Limbaugh, Glenn Beck and Fox News loving, racist, foul-mouthed, ""Obama is the anti-Christ"", ignorant piece of shit older brother.  So, in other words, yes.  BTW, in my case, it isn't hard to do at all.",2
"100 Obama Bucks.

[http://www.amazon.com/Barack-President-Collectors-FEDERAL-INAUGURAL/dp/B001QA4RA2](http://www.amazon.com/Barack-President-Collectors-FEDERAL-INAUGURAL/dp/B001QA4RA2)",1
"Who cares?  Obama is doing it now so it's cool.
",0
"Richard Feynman

Anthony Kiedis

Steve Jobs

Barack Obama

Baruch Spinoza

Then we'd all get wasted and go pick up chicks.",5
"Here is what Obama said about Trent Lott:
&gt;“The Republican Party itself has to drive out Trent Lott. If they have to stand for something, they have to stand up and say this is not the person we want representing our party.”

Will he say the same thing about a man from his own party? Most definatly not. ",2
"Obama did it, and he doesn't even LIKE America!

/tea party",3
"How many Obama supporters does it take toscrew in a lightbulb ? 

9,000 
1 to hold a burned out bulb 
and 8,999 to remark on how bright things are looking already",2
"Nice try Obama, we know it's you.",1
"&gt;the police of AskReddit

More likely the lawyers. Or Obama, if you could get a hold of him - his area of expertise was constitutional law. :)

Police, unfortunately, are not required or expected to be experts on the law. Although this is probably an area they should be briefed on.",1
"Think of yourself as a hybrid. Hybrids are the future. I myself am one as well.

Also, Obama.",1
"That's assuming the americans are able to reverse what has been done and stop this constant move toward a police state that is policing the world. Otherwise the next leader will be who will keep pushing this mentality such as pretty much all the republicans.

Basically since obama has absolutely no chance to win. Whoever the republicans run will likely end up getting the name.",2
Ive been getting learned on the pops. I guess if I don't bring up Obama and like blaze orange I am set.,1
"""Me and Obama took this picture together, yo.""",1
Nice try Obama.,21
I think Barack Obama is a damn cool name.,11
"""Damn it feels good to be a gangster""
-Barack Obama",3
According to the front page of reddit the past couple of days...yes...the USA under Obama....,1
"Till all the new outcasts look for a new place to populate and they all end up here. 

Imagine the self posts.. ""VoTE ThIs UP 2 1,000,000 iF yOu hAte obAma""",82
"No, call Obama. He's got his eye on everyone.",3
"Have a job I have to attend. Just like they saying went for the Obama inauguration: ""One million attended, only 14 missed work."" It's funny if you can stand back from it and have a sense of humor. But in all seriousness, it would be a blast to go to.",1
"&gt;Do you support the guy who flew his plane into the IRS offices

If I thought those IRS workers really knew what they were doing and fundamentally supported the IRS, then yeah. But I don't. They weren't tyrants, even though they did assist in perpetuating the oppression. They weren't the ones who caused all the things that guy was pissed off about.

&gt;and think Obama is a secrit muslin born in Nigeria, 

I really don't care. Religion and nationality mean almost nothing to me. He could be a Muslim; he's an atheist as far as I've seen.",-3
"yeah, it passed.
now you youngsters who voted for obama can pay for my share of healthcare.
I'm an old guy",1
"I've done 4 years in the Navy stationed in Hawaii. I enlisted shortly after 9/11 cause I couldn't stand sitting on my ass and doing nothing about it. I left for boot camp in July of 2004. Well I've been out for almost 3 years now. 
The time I was in it was awsome. I mean I was shore duty living in Hawaii and only working 15 days a month and lived a block from the beach. 
Realizing that I was ganna be stuck in Hawaii for 4 years with no deployments I decided to voulenteer for 7 months in Africa with the Marines.
  This was a the best idea ever! An experiance I'll never forget and am glad I did. Can't talk a whole lot about it but I can say a few things. 
While I was aout there Senator Barack Obama flew to Africa to show his support for the troops ( I say senator becuase at the time he was only senator and hadn't announced his running for presidency yet). So he came out and asked if anyone wanted to play basketball with him. Long story short.. we all balled it up and Obama schooled us all. Afterward we all smoked a cigarette. ( Obama included). Stand up awesome guy.
Lets see after I left Africa and flew back to Hawaii. Me and several other service members were invited to have breakfast with President Bush. Of course I jumped on that. So we all ate breakfast and it was a dandy ole' time. I wanted to have something I can chalk up on my ' what I've done list'.... So when it was appropriate I asked the Presidnet over to my house for a barbeque.. ( You should have seen everyones reaction, not to mention the ear full I heard/ applause I got after the breakfast). Bush laughed and asked what I was cooking. He said ""if your cooking ribs I'll come."" Well I waited and waited for a blackhawk to land in my backyard so Bush could come eat with me... again. And well.... he never came... 
That was my experiance with the military",3
"So they wanted to give Obama a fair shot at being a hero?  We can spin this oil disaster any which way, but I don't see how any of those ways lands much blame on the current President.  The worst we can say (based on what the Repubs have been accusing) is that the President is either dragging his feet or trying to crush big oil by kicking ass in the name of coastal fisherman.  I don't think many of the public are going to get up in arms about either of those.",1
"Barack Hussein Obama.

Duh.",1
That Obama craps sunshine and pisses rainbows.,13
This is why Obama and Congress needs to pass laws that set limit at how much you have to pay back in loans each month based on your income,4
"I think you hit the nail on the head. The reason why I think this will be an absolute waste of time is that the questions he would get will likely be softball and predictable questions, and would come with the typical answers. 

That, and they give what I can only call ""politician answers."" In other words, they don't give answers, they give vague generalities that sound pretty. Obama seemed to do less of this during the campaign, but it seems to me that this has changed.",4
[You're not the only one](http://www.equipbiz.co.nz/blog/pictures/mccain-obama-handshake.jpg). :),1
"At the present, Obama is President and shouldn't worry himself with the GOP agenda. He needs to lead and not be worried with running for reelection. ",2
"To answer the original post:

 No, most Americans just vote the way they're told and have no passion for their countries stability or growth. All they truly care about is having more than the next guy, plenty of food and cable TV. That's about a third of them, the rest is divided between the extremes of both major parties and moderates. War and religion twisted into a Gordian knot and somehow our economy got sucked in with it. Not our proudest moment.

Most Americans don't care about history and in the past 30 or so years we've been conditioned to instant gratification and politics is no different, we expected as a whole for Obama to swoop in and rescue everyone and conveniently we ignore the interference of the opposition party, churches and extremist organizations without holding them accountable.

We got what we deserved, sorry if you  in Europe and Asia got dragged into the mess. Can't promise another moron won't destroy the economy and his replacement being stonewalled, but I don't think it'll happen again anytime soon. It takes time to breed morons and get them electable by the sheeple.,",2
"Before I answer, I'm going to start off with this. Your questions seem very loaded, and you have an obvious pre-existing bias towards the US. If you're going to ask this, you should try to be a bit more open minded then you seem.

* From what I've seen while living here, people are generally happy. However, I'm not sure how you would really judge that. How can you judge any country and their citizen's happiness? Many of the people here aren't very pleased with our foreign policy, but as a nation we are the highest educated per capita and with great living conditions.

But of course that could be different when you're talking about different parts of the US. (I live in Chicago) But the same could be said about anywhere.

* It is very easy to start a business here. But then again, it is also easy for a business to go under. It's all the luck of of the draw. I feel that it's much easier to get a job here in comparison to many other places in the world. As per starting a business, I'm not entirely sure on that point. Many of my family members have started their own businesses, and they've all been very successful. So from personal experience I guess I'd have to give a yes to that one.

* We have a LOT of colleges and universities here in the US. That's one of the biggest reasons people come here in the first place. Most (if not all) colleges and universities encourage the arts. I know at my university we place a very heavy emphasis on the arts, and encourage it as much as possible.

Overall I'd say it's a great place to be an artist, whether it's musical or other. A very large portion of the world-renown artists that exist today came from the US. It's a great place to get started due to all the opportunities.

* This one is ridiculously loaded, but I guess I'll bite. 

The desperate - It is very easy to find a job in the US in comparison to many of the countries in the world, so I'd say yes.

The intelligent - Obama is putting a very large emphasis on science, and funding is getting easier and easier to obtain. Also, as I said before, I believe we are the most educated per capita due to all of our colleges and universities. (I work at Argonne National Laboratories)

The exploited - Everybody exploits everybody. I don't even know what you want to say here.

The hungry and the needy - We give a lot to our hungry and needy in the US. We have a large amount of organizations that deal in just that, and charitable donations are easy to come by. I often go with a bunch of my friends to soup kitchens or old folks' homes to help out and do some community service.

The US is much more charitable then you would like to believe.

* The radicals here give us a bad face, I understand. The radical religious folks, the radical republicans, and even some of the radical liberals are the ones that get press. But despite what you see on the news, I assure you that it's not bad here. I love it in the US, and I would choose it over most other places in the world. Don't judge a place by what the hivemind tells you.

Hell we all would still be hating Keanu Reeves if somebody hadn't decide to actually check him out. Put your bias aside and give it a chance. Don't let the crazies be the face of our country, they are a very small part of us.

I realize that we are far from perfect; nobody is. We have a pretty shitty healthcare system, and our standards of living could be much higher. We jam our faces into the entire world's business, and through our weight around the  globe for no apparent reason. But if were up to the majority, I don't think this would be the case. I think that most of us here in Chicago lament that it's the crazies that end up in office. I can't believe Bush was voted in twice. It astounds me. But as far as the world goes, we're pretty far up there.",3
"Many of the democrats I have encountered who aren't happy with Obama are upset because he isn't too dramatic and he tries to be bipartisan, actually working with both parties. Yes it would be great if he had the support to just totally steamroll America but he doesn't- and in all honesty, as much as I'd love the guy to be totally liberal and just disconcern himself with any kind of compromise, I respect the fact that he si trying to work with both parties. I don't think he is doing it to try and please all the people at the same time and play the middle field so to speak, I think he is doing it to try and start a new era of politics in our nation- for once, a president who is willing to work and compromise with both sides instead of having them squabble against each other like snot nosed brats, which is what we don't need more of.",1
I think Barack obama's will be amazing. ,3
"&gt; Barack Obama, the leader of the world's richest country,

What...

Edited for clarification: **America is not rich**",-4
obama,-2
"I started the website firstdogcharlie.com. I leaked a picture of the Obama's dog. Had 3 million hits in about three days thanks to a call to TMZ. It made national new and the president put out a release that it was a fake picture. It was not, as the world found out the monday after we went live with our site.",1
"Didn't mean to delete it, I responded to my own comment instead of editing to address your edit. Fixed.

&gt;If someone hates obama they live in a world where they find supports for that belief no matter how incorrect those supports are.

That applies to absolutely everything.  ",1
"&gt;I think Obama owes you that.

Yeah, **if** he was the dictator of America, he could change laws by himself. **In reality** however he needs congress for that. No matter what he ""owes"" anyone, he can't make it magically happen if Americans vote for a congress that doesn't allow it.",8
"Wait, are you telling me the government is funding the practice of stalking? What the fuck king Obama. Something something Communism, something something Hitler.  ",3
"Sure, it's not perfect. But no voting is...how many Americans would have wanted to withdraw their vote for Bush or Obama a year into their presidencies? But you cast your vote at the time allotted and you have to stick with it.  I think an argument against early voting on constitutional grounds sounds extremely flimsy. What if I vote when the polls open at 6AM and you vote right before they close at 9PM? Am I not similarly disenfranchised, under your example?  But hey, people like to sue and lawyers need work...let them test it in court.
",0
"Dress as a giant quarter with an Obama mask

Now that's change",3
I was accused of liking obama once. Still sends shivers down my spine,-15
"Buzzwords. The more the media mentions them, the more the proles can say, ""oh hey, Twitter, I can relate to that, I use Twitter!"", and thus more of them watch the news. If they kept the news factual, coherent and interesting then we would have no updates about how many times Labour tweeted about Obama's pregnant jellyfish made of candy, and the news places would all go out of business. The job of news outlets isn't to accurately represent events, it's to make you think they are.",0
"Well, I am single, but for now I think we should settle for [one of these](http://www.ihighfive.com/).

Or a [terrorist fist jab](http://www.huffingtonpost.com/2008/06/09/fox-anchor-calls-obama-fi_n_106027.html) if you're black.",2
"Sign: ""The rich deserve their tax cut too. Stop Obama's middle class salvation.""",7
"Regardless of what Obama does with the remainder of his term, I'll be voting for the first time this election season and seeing as so few candidates match my personal views, it's always going to be the lesser of two evils.

Which in this case, would always be Obama.",1
I heard George Bush colluded with al-Qaeda to force Obama's Nigerian brethren to contact their secret alien masters on the moon in order to fill vaccinations with a special serum to make the Egyptians build the pyramids faster. Then Bush blew them up with a controlled demolition/cruise missile.,1
"I had this exact same feeling a while ago. I tried to pin down exactly why I felt that way, and I realized it was the music I listened to from 1998-2003 compared to the music that I listen to today. 

A lot of people (particularly white people) in their teens and early twenties prior to 2003 listened to alternative rock and different kinds of pop. This was the dominant music from Nirvana to Incubus.

Living in LA I remember a distinct racial divide between the hip hop and alternative rock stations KROQ (106.7) and POWER 106 (105.9).

Almost no black artists on KROQ and few white artists on POWER.

In 2003 a major shift happened in musical tastes - for the first time all of the top 10 songs on the Billboard 100 were African American. This shift had been happening since 2000 in the form of white hip hop artists (mostly now derided) such as Limp Bizkit, Eminem, and Kid Rock (uggghhh). Since then, all kinds of rock music (which started off as a bunch of white artists imitating black R&amp;B singers) have fallen by the wayside among the youth of America. Hardly anyone I know under 18 listens to alt rock or indie anymore, except for people trying to be eccentric.

Today if you talk to teenagers, few actually listen to alt rock. Very few people take so-called indie musicians all that seriously. The last ""rock"" group I truly enjoyed were the Killers.

The major music artist of the past decade (and I know many of you don't care for him) is Kanye West (2004-Present).

The major events of the past decade:

Iraq - Afghan War,
9/11,
Katrina,
Obama elected,
Economic disaster,
2003 Music shift (comparable to 1964 Beatles),
Growth and supremacy of the Internet post dotcom bubble,

Note that three of the events of the above list have to do with shifting racial politics.

The next decade will probably be characterized by changes from the growing Hispanic cohort. Today both POWER and KROQ are mostly deejayed and operated by Mexican-Americans who grew up in Southern California.",1
"Where is Osama bin Laden?

To be fair, I'd like to ask that of Obama too...",0
"&gt;1) Religious people cannot prove God exists. Argument solved until proof is found.

The New York Times cannot prove that Afghanistan exists.  Argument solved until proof is found.

&gt;2) Bush Senior was conservative, Clinton was liberal, Bush Junior was conservative, Obama was liberal. A pure statistical win.

Only by our standards.

&gt;3) Pro-lifers say that two connected cells become a human just because they potentially can. From that we can logically conclude that condoms and masturbating should be forbidden because they kill billions of potential people. Reductio ad absurdum.

Reductio ad absurdum, or the slippery-slope fallacy, is the error you just made.",0
"I like this clip a little better... you'll see why.

http://www.youtube.com/watch?v=cQfbbSQ5FXY&amp;feature=related

Bonus: Fox also referred to Michelle Obama as ""Obama's Baby Mama"" during that same week, I believe.",10
"Oh how short American memories are.  Obama held an online townhall, last March, where the public voted on questions for the President to answer.  The legalization of marijuana was, you guessed it, one of the top questions posed.  ""With over 1 out of 30 Americans controlled by the penal system, why not legalize, control, and tax marijuana to change the failed war on drugs into a money making, money saving boost to the economy? Do we really need that many victimless criminals?""

&gt;“The answer is, no, I don't think that is a good strategy to grow our economy,” the president said. His answer prompted applause from the audience.
(White House press secretary Robert Gibbs later clarified Mr. Obama's position: ""The president opposes the legalization of marijuana…he does not think that’s the right plan for America.” Pressed by CBS News White House correspondent Mark Knoller, Gibbs declined to discuss the president's position on medical marijuana.)

[source](http://www.cbsnews.com/blogs/2009/03/26/politics/politicalhotsheet/entry4894639.shtml)
",25
"Barack Obama. Execution style with a .357 magnum. Also he has to yell ""I am a MOTHERFUCKER!!""",1
It will be another year full of the same shit.  Expect Obama doing big time PR to save his job.,1
Obama was my keynote speaker so I went for the novelty. It was several hours of sitting in the sun but it was probably worth the experience. If it had been anyone else I would have probably stayed home. ,1
"What more did you want Obama to do? 

He laid the groundwork for what will eventually become nationalized healthcare in this country. If history written for the 21st century come from the same sources as the twentieth then Obama will be canonized as hero the same way FDR was. 

Obama is pushing hard to raise taxes in a down economy. Keeping the middle class tax cuts was a concession to Dems up for re-election but it is clear he did not want to do that either. Democrats should be creaming their jeans over this guy. 

He is single-handedly dragging the US into social democracy. Without Obama the US may have turned away from the redistributive death spiral that European nations find themselves in but Obama is assuring that we stay the course until this capitalist freedom nightmare experiment implodes. 

Short of sterilizing all Conservative women and setting Libertarians on fire at political rallies what more could you possibly want Obama to do?",2
"Obama 2012, imagine what a republican president and senate will do.",2
