Probably because the only people who gave a shit was the media.,1
Tina Belcher on *The Walking Dead*,3
"Before they can say, ""I love you too.""",1
"i did not get herpes. but i worried about it for months.  she knew she had herpes.  She made me feel guilty for fucking her and leaving, so I stayed with he for months.  I was a bitch.  Now not so much.",2
It's a Game of Thrones reference. ,0
"September 7, 1990. Met first college girlfriend ... a day for which I'd rather have a do-over. ",1
ONE ON ONE WITH DA UNDERTAKUH,2
teaching kindergarteners robotics,1
im gonna puke,2
"LSAT 165, GPA: 3.5. Got into a 50-25 rank state school with some scholarship, and graduated at top half of the class (though I was right below top 25% when I was applying for 2L jobs). Now working as first-year at a smaller-midsize firm in the South, making about 90k. 

As people have said before, unless you're going to a T-10 (14? I forget), rank matters more than anything else. I got my job because I randomly started shooting out resumes in cities I was interested in living. I went to law school that was about a 12 hour drive away from home, and went to work at a place that was another 12 hours away from my school. 

I would advise that you not panic, but I assume you will anyway. I mean, I did the same. I didn't even apply to law school until 2 years after college, actually- partially due to panicking about the job market. Let me know if you need any other advice.",1
LOL! Those kids are freaking awesome. ,7
You can't sneeze. You only get the feeling you get before you sneeze over and over.,1
They oppose hunting because they don't realize that the the ability to indulge their dietary preferences is a luxury afforded them by the perseverance of meat-eaters who helped develop the culture and lifestyle that allows them to be able to make a choice about what they eat. ,1
"I work for e-commerce for a Pro Audio website.  
  
I love when customers talk to me about a brands ""audio"" quality.

After I hang up with them I usually contemplate suicide.",44
"The lesbian porn I watch involves a scenario where girl A gets mad at girl B for something money related and then Girl A proceeds to take it out on Girl B's ass. 

So, if I follow your advice, I should pin my girl down and fuck her ass with a huge strap on when she ask k for oral. ",1
[Lost in the Light by Bahamas.](https://www.youtube.com/watch?v=jPJNt1eTVNY),2
"Wait what is this ""knowing look""? Can you explain??",0
I'm in the wrong here.,3
Glock.,2
What I don't understand about the anti gun people is their obsession with 'assault' weapons. The vast majority of shootings are committed with handguns.,149
"I highly doubt it. That's putting a lot of faith in the system and the supposed list coming from no reputable source. To me it sounds like a very pared-down pyramid scheme which works in theory, except the people at the bottom get shafted eventually.",1
But isn't a copying machine a printer that prints out a copy of a physical sheet instead of a data file?,30
"I see all these ""clean as you go"" tips, which work fine, but when I moved out of my house with a dishwasher and roommate to living alone in an apartment without a dishwasher, I found that the easiest way to keep the dishes clean is to not own many dishes. I have like four forks, four spoons, four plates and four glasses. If I go more than a day without doing the dishes, I ain't eating on a dish. 

Also, get rid of frisbees, because theyre great makeshift plates and no cheating.",3
It has the date written on the board at the girl's school the day before.,2
LoOk GuYs Im SoOoOoOo WaCkY aNd RaNdOm!1!!!1!!1,0
I guess you could try roasting zombies with rocket exhaust in the mean time. ,2
"Some of it is pushed based on your likes.

But some of them are pushed because that advertiser pays more.

Its kind of like the advertisements you see behind the plate at baseball games.  That is always on TV so it costs more.

If you pay more, yours gets pushed a lot more, overriding the data it has collected to present ""targeted"" ads.",1
"That's because pickup trucks are no longer trucks and instead marketed as toys.

If you care about scratching the bed, it's a toy truck",24
"Yeah fuck your rhetorical bathroom note.  Seriously though, if you left a note and were surprised when someone pissed on it, maybe you should try a good old fashioned conversation.  ",1
My god... I have hated that so much for so long and now I have a name for it. Thank you.,14
"I thought I was a *star* all this time, but I never thought of it that way!",1
"Half-Life.

",2
"I go by the rule that if the car was made in America (by an American company) it's will most likely be on the drivers side and if it's made in another country (or by a non-american company) it will most likely be on the passenger side. 

P.S. Driver and passenger sides in America vice versa in other countries. ",2
Samuel L. Jackson of course,1
Have a great way of the year and I don't think that I have a great way of the year.,1
"A tosser or ""tossa"" in Australian slang is a wanker. A jerk off. ",1
Dixie Chicks.,2
"Hi Cajunfiend, your submission has been removed for the following reason(s)

* It violates [[Rule 3]](http://www.reddit.com/r/AskReddit/wiki/index#wiki_-rule_3-): Askreddit is for open-ended, discussion questions. Questions with definite answers are not appropriate, and for those, try /r/answers. Yes/No, either/or, ['Does Anybody Else'](/r/doesanybodyelse), [Would-You-Rather](/r/wouldyourather), [poll-type questions](/r/pollquestions), or [surveys](/r/samplesize) are not conducive to community discussion.



*If you feel this was done in error, or would like further clarification, please don't hesitate to [message the mods](http://www.reddit.com/message/compose?to=%2Fr%2FAskReddit&amp;message=My%20Post:%20https://www.reddit.com/r/AskReddit/comments/3qk22m/old_southbend_range_can_anyone_tell_me_a_little/).*",1
so many people who list feeling abnormally tired as one of their symptoms...,2
"Well, [we have a city in the middle of this region](https://www.youtube.com/watch?v=iPEJX8ZhgMw) so it's not only small towns. The city is on commuting distance for most people living here. The mountains you see are beyng the populated area and are mianly for tourists and aboriginals.",3
Thank you. I still think she is pretty awesome.,6
Short Island Iced Teas,4
fite me in irl,0
"I feel Monopoly gets a pass.  It's the only game where there are no poor winners  or poor losers, just shit happens.",5
kiss?,5
"Sounds like a cool story, please elaborate ",3
"Can you post a link to what body type you're talking about? To me it sounds like you just mean girls with a little bit of extra meat on their bones, not overweight. Are we talking Kate Winslet or Tess Holliday?",2
Just tell them they woke you up last night/week or whatever. People find it hard to justify obvious hypocrisy. ,3
"As I mentioned above, for me it was pretty much anytime after the baby was cleaned up.",1
"The Last Airbender. Good God that movie sucked.
",1
"I listen to Spotify mobile on my phone for free.  They are professionals of pushing their paid service using the worst commercials.  Its impressive, but as a result is annoying as shit.

* Commercials are 25-30% louder than the music
* They use a lot of annoying high pitched background noise while yammering on about their commercial free stuff
* They play music and advertise other genres that completely kills the mood.  ""Oh youre listening to alternative?  WELL SIMMER DOWN AND LISTEN TO THIS COMMERCIAL ABOUT PREACHY FUCKING CHRISTIAN ROCK!""
* They have commercials that arent commercials.  Sometimes its random shit like ""30 seconds of random loud angry traffic noise and police sirens""

This is just some of the stuff they do to encourage people to buy premium.  I give them props for being so close with me, but Im a rebellious fucker about micro transactions, and will still avoid paying a monthly fee until they give a b2p option.",2
There is something called.. The autoblow? *unzips pants*,98
I have no idea ,2
"It's just this empty sucking vortex.  I'm sure it's somewhat different for different people but here's a couple of things I experienced that may illustrate it:

I was working out in a neighborhood gym I really liked about 3 times a week, frankly because I was trying to fight feeling depressed.  After a few months, I started not wanting to go, so I developed a strategy - I would tell myself that all I had to do was put on my workout clothes and then see how I felt...and I would feel like going, it was a good experience.  Then a week or two later putting on my workout clothes didn't help, so I'd go sit in my car and then I'd feel like going.  Then, that didn't work, so I'd tell myself, just drive there.  Then, it got down to just go in...and then even when I went in I just felt like I was making a dead body push weights and cycle.  The third time I drove there and couldn't make myself get out of the car, I just gave up and stopped renewing the membership.

So here I was doing something that helped the depression but the depression overtook it and killed it.  Sucky stuff.

I would make myself do things with people, even though I didn't want to because I thought it would help.  In the beginning, it did but as time went on and things went downhill, it actually made it worse.  I realized that unless I picked a time when I wasn't feeling too bad, making myself go out with people would be such a negative experience that it would make me even less likely to do it the next time.  So I started being afraid to do things with people, especially in a group and especially ""fun"" things for fear it would isolate me even further.

I guess the bottom line is, be gentle.  LISTEN to what they tell you and don't assume you know what's best for that particular person based on some article or anything you read here.  Realize they're going to have some bad days and may withdraw or even push you away at times.  Never underestimate the power of a simple text or a few words - if you think about them, let them know but respect their boundaries for anything more than that when they're having a bad time.

You rock for asking this - you have a lucky friend =)

",1
"Forever ever- they auctioned it off for profit.  With ""asset forfeiture"" laws it doesn't matter if the charges against the person are dropped or if they're found innocent, there's a separate process for property that they seize and the burden is on you to prove that your property is ""innocent"".  A better explanation with info about the ACLU challenging the law is [here](http://www.phoenixnewtimes.com/news/arizona-civil-asset-forfeiture-laws-unconstitutional-says-aclu-lawsuit-7505975).",2
Maybe you should post the link one more time. ,6
"Don't talk about your ex, ever, let alone on first date. Also never compare them to an ex regarding anything. ",7
Still working on gifts for 2014.,1
Mariana trench.,3
Sit,2
Wasn't it cancelled?,2
"This shit right here!!! I can't begin to describe how infuriating it is to find garbage right next to a garbage can! Like someone made 99% of the effort to be a responsible human being, then decided ""nah"".",1
So I've been told.  Not many guys like the stuff I like.,0
"I'll start: 

[Flip phones!] (http://photos1.blogger.com/blogger/1885/1710/320/LG%205225jpeg.jpg)",3
"Not really, I've been with my SO for three years and I encourage him to go see his friends or go on work nights out because we're saving money we don't go out much and he lives with me so doesn't see his friends often.",1
Facebook,2
"Surprisingly underrated, [also surprising was the amount of stunts that weren't complete CGI](https://www.youtube.com/watch?v=spD2KAgBH-s)",1
"on an island, in the middle of the Pacific Ocean. Far from humanity",1
"Torrid.

When I was in 8th grade, they held the our first formal dance at the end of the year. I was tall and busty and awkward and didn't fit into 'normal' clothes for my age.

After spending an entire weekend trying to find a dress with my mother, I broke down crying in a mall. I was heartbroken and thought I was ugly and doomed to wearing untrendy, old-lady clothes to my first dance (yes, I *am* aware of how much of a First World Problem that is but I was 13 so cut me some slack, yeah?)

A very...um, *large*...woman approached my mother and I and asked if we had ever been inside a Torrid. I hadn't because I had a prejudice against plus size stores,  but she took us to the one in the mall. 

They had tons of dresses for me to try on. I think I finally settled on something atrociously hot pink with skulls and polka dots on it. But I was treated as a human being, and a beautiful person, even though ever other store had made me feel awful with every practiced sneer of, ""You won't fit anything *here*.""

But Torrid made me feel beautiful. I was painfully self-conscious of my acne and my body and they helped me find something I loved without criticizing me. 

Of course, that was back when Torrid was a big girls Hot Topic. Now it's a fashion store, and I'm so glad that Torrid grew out of its awkward punk faze with me. 

I've been a loyal customer for 12 years, and I'll definitely keep going- I'm not an awkward 13 year old anymore, but I still love feeling beautiful. 


",3
"/r/reactiongifs 

Discovered it some days ago and I loved it.",1
that 99.95% of 100 is 99.95%,1
"I don't understand why circle jerk still says ""ayy lmao"" I've actually never seen anyone on Reddit say that at all.",2
Welding ,1
I think they are something like 28 now.,1
Smoking ,1
"Make sure school always comes first. Make yourself focus and go to class. You're not missing anything at 9 am on a Tuesday that's worth skipping class over. Don't. Skip. Class. You learn so much more by being there than 'catching up on it later'.

Stay within your limits. If you know you can't get your ass out of bed to get to class if you go out the night before, then do something about it. Schedule later classes, or don't go out the night before. Set yourself up for success in advance, don't always try to be reactive to shitty situations you've put yourself in, like not starting a 20 page paper until the night before it's due. Make yourself write one page a day for a couple of weeks or whatever. 

One strategy a friend used was this: school was his job. 9am-5pm M-F, he was in school. He was either in class, studying, or doing school work during that time. After 5, the time was his to do whatever with. It mirrors the real world pretty well, and 40 hours a week is plenty of time to get everything done if you focus.",2
The Inbetweeners.,1
"I find it unfair that my generation is pegged as being useless when previous generations treated this world like it was given to them with unlimited resources. 

The children of millenials will be great, because they will have to be if we are going to recover from what the generations before us have done to our planet/society/government.",2
A GT-R,1
Jeremy Corbyn happened,1
Good handshake ,2
I tried to put and old pair of boxer shorts on after my shower. They fell apart in my hands and now reside in my bin.,2
I have no idea what is going on.  ,1
Chocolat croissant!,0
"I usually go with either ""nothing, what's up with you?"" or ""clouds"", but when I go with the former people just keep walking and I don't have time to get it out, but when I reply with the latter people just get annoyed cause I'm being an annoying shit.",1
Here we can silence the voices of those who aren't far-left!,0
WEW WEW!,1
millinillion is fun to say. that's 10 to the 3003rd power,3
"The same exact cards as before,  but the copyright is to somebody else. ",1
"Mother Gothel from Tangled was a passive aggressive, gas-lighting, psycho [hosebeast](https://youtu.be/yHK_i6AYmEs).",115
"Definitely a dude, he mentioned Grindr at the beginning. Grindr is a dating/hookup app for gay men - Tinder was originally intended, IIRC, as a sort of ""straight Grindr.""",2
Oh no he said racist things. He might hurt somebody's feelings.,-4
"It's I Am The Messenger in the US. I tried reading the Book Thief several times, never finished it but loved it nonetheless. Gonna see if my school has a copy.

Really liked I Am The Messenger.",3
I'm in Scotland. :) ,1
What mental health system. ,20
Because you need them and you are willing to pay.,1
"Laser eye surgery, would do it again in a heart beat. I love the cheap sunglasses, walking in the rain, and being able to see when I wake up in the morning.",3
Clone trooper. Sick.,1
It's a gradual process with great instant gratification on the way every single time.,1
Wut,1
"I wanted to like Arrested Development, I'd heard so many people talk about how hilarious and clever it was, but I found it to be neither of those things.  
I'm constantly told now that I obviously *didn't get it* because it's apparently so clever and only intellectuals get the jokes, but I'm not sure that's true. I chuckled in parts, it's farcical and silly enough for my 1980s British sit-com upbringing, it just wasn't as good as everyone made it out to be. I watched until about two-thirds into season 2 and gave it up.  ",1
"Cleaning up after yourself! 
Shits annoying if you're living with other people. No one likes to babysit adults.",1
Damn. Unforgettable. My condolences. I think it's wonderful that you keep her memory alive.,2
"It isn't. The Rule #1 of being a professor is ""Generate as much money as possible for the Department through grants and awards.""",11
"I honestly see no appeal in metal. I respect those who like it, but to me it's just screaming and loud noise.",-1
"This speaks to me, my ex was trying to have sex with me when I was asleep after a suicide attempt the day before because I was so miserable with him. No sympathy, just a heartless person who used me as a sexual outlet.",1
"I recall elsewhere from another series that a group of dragons was called a Thunder. Disaster sounds cooler, to be honest.",1
so what are you like brazilian then?,2
It's a yokel laugh.  Look up Disney goofy laugh on YouTube.,2
"&gt; Stop hating on yourself, it's not useful.",0
This is one I could actually see coming back.,2
beat me to it!,1
"The week before my exams I had to run a small piece - like 20 meters - and realised I was completely out of breath. At that time I smoked about 1 full pack a day. 
I threw my last pack in the trash and said to myself not to smoke anymore. That's it. Haven't smoked a cigarette ever since, more than 3 years ago now.",1
"borislav herak.......a Serbian war criminal who is accused of killing 29, including women, elderly, and children during the Bosnian war. also raped and killed young women. he is now out of prison and only served 18 yrs or sumthin.  probably the creepiest one on here lol  youtube him if u wanna hear his confession",1
"many people were instantly corrupted by the ring just by getting near it, Frodo had it around his neck for a hella long time and only succumbed when he was literally right next to the thing when the ring was as strong as possible.  this in no way makes Frodo the villain",27
"I can do a decent Gollum impression. Um. And I'm pretty good at Puzzle Fighter.

... I'm terrible at being useful...",2
"Note: only recommended when the two parties have equal information or when you have more information. If you are at an information disadvantage, you can wind up ""anchoring"" yourself to a worse deal than you would have gotten if the other side opens up first.",7
Because it was cool.,1
Dad jokes start at 10cm dilation I believe. ,3
"I was a bank teller. This old comes into cash her check. She says ""uh oh"" real quite I barely heard it, then said ""excuse me."" She walk to the bathroom. A few minutes later she returns to get her cash. I notice a smell. The lady turns to leave and has shit from the top of her sweater to the bottom of her pants, think of a skunk. I start laughing my ass off and tell the manager. The manager goes to check the womens bathroom and I guess their was shit everywhere.  Im a guy and didnt feel like checking it out. I always wondered how bad she messed up her car seats when she left.",1
"I have all my grandpa's tools as well. Sadly, they're just sitting on a shelf on display with a photo of him, his WW2 medals, his harmonica, and a horse bridle he made for my mum's horse before I was born. My husband wants to use them, but he breaks so many tools at work (he's a tradesman). I'm not sure if it's shitty products his work provides him with or if he's unco as fuck, but I'm not risking it.",5
Some cocks can't be unsucked. ,1
"I feel like a lot of people don't always get Kendrick, beyond the bangin' beats.",1
"Makes sense, I've done Flux core (I believe it's called) welding. Father welds on the side for a company so he showed me how and we made a hockey net.",1
on reddit reading reposts,4
Indianapolis?,0
"I know this channel. He does a lot of neat explorations in areas I know and I don't think it's faked. He's always careful, usually takes people with him, and has other paranormal random encounters in other mines. This is one of the more popular ones since he cites the feeling as 'malicious'. There could definitely be more explanations, but usually his explorations are uneventful.",0
...with a set of jumper cables,3
"That time I managed to memorise everything, so I had the answers in my head the whole time, teachers didn't even suspect lol",1
"It's okay, I never liked avocados anyways.",6
fuck yall downvoting I want to know,268
How is your stapled ball?,3
Still waiting on that 1%,1
and it was a he or a she?,1
The Harry Tipper one? Could never beat that on hard either ,1
"Honestly, being pro-life. As sad as a lot of people say it is, and as much criticism as it gets, I honestly don't see why it's even a topic for discussion. Unwanted children don't have to grow up, live life abandoned, and have miserable lifestyles. Children (who could be aborted) grow up in harsh environments, and usually don't do too well.

I won't drag on about it. One thing that really interest me was the abortion/crime link. Steven Levitt wrote an amazing book explaining the link. Here's a blog that will give you an idea of how it works: http://freakonomics.com/2005/05/15/abortion-and-crime-who-should-you-believe/. I highly recommend this book, and it has given me the evidence which has opened my eyes and shown me how much better a pro-choice society would be.",21
Twas a sad day for the car community on that day,1
"A friend and I were playing a game of ""that's what she said"" in concert band. The thing that made this funny was because it was run by the assistant band director, who would almost always say something that sounded bad to anyone with a dirty mind.

 One particular day, he was berating the trombone players, and went into a string of questionable comments. We were laughing so hard we almost dropped our tubas.

Alternately, another moment in which the same director was pissed at all of us and called us ""a bunch of boners. Cue the entire band's silence as everyone tried not to laugh, when a friend of mine bluntly says: ""that word does not mean what you think it means."" Everyone erupted in laughter.",8
He still hosts a sports talk show everyday on Fox Sports. I listen to it on my drive home from work.,1
"This is misinformation spread by bad mass media. Yes, long distance runners may develope chronic injuries such as knee problems, but in general they are also about 10,000 times healthier than the average couch potato. Saying running is unhealthy is click bait writing to make lazy people feel better about themselves. ",42
Wait is the problem here the jamming technique? Or the fingernails?,3
"I was just downvoted into oblivion for making a comment about exactly where the fluoride comes from that goes into the water supply, but nobody ever explained why they were so mad to hear it - I thought you might be one of those types - I really am just curious why people accuse anyone that questions fluoride of being a looney tune",2
"Reading, writing or painting",1
I could have sworn I saw someone make a dating app homepage for you and your beautiful sole once too...,3
/r/classic4chan has what youre looking for.,1
"When I have finished stating this quip, multitudes of shrimp shall crawl from the pockets and bags of every nationalist baby in this district.",1
Oberyn seems like quite the party animal aswell!,3
The badass female and pussy guy character. it was funny when it hadn't been done but now its just stale. ,2
In your opinion what made America great in this time period you're referring to?,1
"**PLEASE READ THIS MESSAGE IN ITS ENTIRETY BEFORE TAKING ACTION.**

Hi there! Your post was removed as it looks like you're asking a ""Would you rather"" question!

These types of questions are [not allowed](http://www.reddit.com/r/AskReddit/wiki/index#wiki_-rule_3-) in Askreddit. You may resubmit this question to /r/wouldyourather. Thanks!


*I am a bot, and this action was performed automatically. Please [contact the moderators of this subreddit](/message/compose/?to=/r/AskReddit) if you have any questions or concerns.*",1
"Ant Man. Watched it during a 9.5 hour flight between Vienna and NY. Thougt it was gonna be another lame superhero movie, but instead it was great fun and it made me laugh out loud. Would recommend.",1
Hanging around morons makes me feel smart. Also when I'm conversing with vendors overseas in multiple languages makes me feel pretty smart. ,2
"""Hey I think you dropped your name tag?"" 

It was a packet of sugar. 
He was the worst boyfriend I ever had and is now married to my ex-best freind.",2
That's one of the sassiest things I've ever heard. ,1
2girls1cup,2
"My personal insecurities prevent me from being good to the people who are important to me in my life. I think about them after the moment is passed, but too often I am too wrapped up in my own worries to do the right thing at the right time.",1
