"Obamacare was a huge feat. ALSO, saving the automobile industry. But because we're in a race stricken ""free"" world, he will always be remembered as the first Black president. ",-1
"Obamacare is shit. The plans cost more and cover less for the most part, the only people benefiting are insurance companies.

My preference would to have it be state run, however I think the Federal government should pass a basis of the minimums it should cover and that anyone can get it regardless of health. 

Personally I do not trust the Federal Government to administer my health care in any way shape or form. There is a good reason the military contracts it out to several other companies who run it phenomenally. (Except here in Florida for some god forsaken reason it's run through Humana.)",11
"The thing is, I always say thanks Obama but I never mean it, I'm just making fun of the people who actually do mean it.  ",1
Obama,-11
"In theory, sure. All arms treaties are about reducing the amount or capability of weapons. 

However, the problem with the ""throw our guns into the ocean"" approach is: each player has a rational incentive to withhold and mislead about the amount and capabilities of their weapons. Nation 2 throws all their guns in the ocean while Nation 1 (or vice versa) secretly keeps some guns and now Nation 1 has a strategic advantage over Nation 2. Each player screens information thinking they are going to get the better of the other country.  

This is one of main problems with international agreements in general. Two nations cannot enter into binding agreements because of the rational incentive to cheat the agreement. That is why you need a third party enforcement mechanism: the United States or another international institution that can enforce compliance. 

But as we know now, many nations are reluctant to have any nation or international institution serve as a third party enforcement mechanism because each signatory thinks the third party favors the other side (whether it is correct or not, it doesn't matter). 

Think of Israel-Palestine. Israel would gladly enter into an arrangement with the United States serving as a third party enforcement mechanism (this has somewhat changed because of some Obama statements on settlements) while Palestine would have basically said ""fuck that."" This is because Hamas is on a shit load of terrorist organization designations by the United States and pretty much all US allies. Likewise, Israel would never let the UN be the main third party because of the influence on anti-Israel sentiment on a number of committees and the general flame wars that start every year at the UN general assembly (it seems like every year Iran goes on stage and says the Holocaust didn't happen or threatens Israel).

Sorry for the long winded answer. ",1
Obama,0
"Definitely not the kind of situation I'm referring to, but feel free to tell me about what I'm doing. The people in my community are hive-minded and aren't really looking for solutions past ""Obama's Kenyan."" Fix that problem.",0
"Yeah, he said: ""Obama has been a good President."" I cringed in embarrassment for him.",-4
Obama.,1
http://www.coinion.com/2013/12/14/obamacoin-promises-change/,3
"&gt; Electing George W Bush, twice.

You spelled Barack Obama wrong.",4
"His wife.  Not crazy about Obama as a President, but she is a great first lady.",1
"The stuff you mentioned (unpaid OT, threatening) maybe has happened to Wal-Mart in the past (like 15 or more years ago). But after lawsuits they don't do anything like this anymore (and are afraid of even claims as courts go against them more than not) and have many systems in place to stop it or report it. 

I worked at Wal-Mart from 2004-2011 so I can tell you truthfully. I stayed objective about them, I will call out their shit when needed and defend them where they deserve (which there are a few). They have every system in place to report retaliation stuff from management, every employee has easy access to district, regional and corporate level management to report this kind of stuff, and I never once saw people working without getting paid. Now were they given unrealistic expectations to complete in 40 hours a week, yes but that seems to be corporate America's model in general to bleed people for as much as possible. The one thing I noticed towards the last few years was cutting jobs. I saw the supercenter I worked at which was the busiest in the state go from 500+ employees to under 300, this was in direct response to Obamacare I do believe, it lead to less coverage in departments around the stores and fewer people covering more area. However stats would show the whole country was doing this. 

I know it was anecdotal but much of people's perception is from thing a very long time ago, if we are going to talk about the problems let's talk about current problems and to be fair let's hold the greater corporate landscape accountable for things like wages because it is far from a singular problem, in fact in 2004 I had just graduated high school and had a little work experience and was offered a few low skill jobs and Wal-Mart was the best wages by nearly a dollar an hour (this is before the minimum wage raised a few bucks an hour a few years back).  ",8
"[White Shoe](http://en.wikipedia.org/wiki/White_shoe_firm#The_.22new.22_white-shoe_law_firms) is a term used to describe the oldest, most well established or well respected law firms in the country. Sidley Austin of Chicago, where both of the Obamas worked when they were younger, is an example. The competition for jobs at those firms is intense and a lot of them recruit exclusively from the top 15-20% of Ivy League law school graduates. The first 5-10 years on the job are famously high stress, with 90+ hour, seven day work weeks. [Here's an interesting article](http://www.bloomberg.com/news/2014-05-09/young-bankers-fed-up-with-90-hour-weeks-move-to-startups.html) about the burn-out rate in investment banking entry programs, which are similar.",9
/r/ThanksObama ,-1
"If Obamacare does its job of eliminating the uninsured, then it will be much easier to make this happen. ",1
"fuckin' Obama, maan.",1
If Obama was to be president in Kenya; he would be their first white president.,2
"&gt; Thanks Obama!!""",11
"Dated a girl who squirted the first time we had sex. She was riding on top and all of the sudden my balls and all the way down to my ass felt really warm. at first I thought she was just leaning further back and her ass was resting back there. But it was like someone poured a warm cup of water on my balls/ass. Pretty cool and we were both surprised! 
Second surprise was when I hooked up with a girl who could deepthroat. I was drunk and she went down. Her hair was in the way and I originally thought she was using her hands to help out but then in my drunken stupor it slowly registered that my entire dick was disappearing in he mouth (and throat guess). Ha I wish I had a pic of my expression when I saw that. Probably looked like that ""not bad"" Obama meme.",2
Obama: got nobel prize for being black,0
"Since this was tagged with serious, that Barrack Obama was born in Kenya.",-2
"Thanks, Obama. ",3
"Ray Kurzweil, Bill Gates, Obama and Stephen Hawking.",1
"Let me be clear, I am not Barack Obama.",14
Mrs. Obama's arms,3
"Cliven Bundy, the Nevada rancher who got the US government to back off of his land, is actually a paid operative of the Russian government.  The ranch standoff was Putin's way of making Obama look like a chump as revenge for the US encouraging protests in Ukraine.  This is all fiction, of course.  Don't bring me up on libel or slander charges because none of this is true.  But it's fun to pretend.",-1
"During his first election, I expressed that I was not a fan of Obama to a friend in high-school. A black female in my class angrily turned and said ""Why don't you want a black president!?!"" 

(I hadn't mentioned anything about race while talking to my friend)",2
Obama.,1
"&gt; It will just lead to you quoting fox news articles and NRA statistics. 

Ah, yes. The ""Fox News and NRA propaganda"" cop-out. Pathetic. 

http://www.nap.edu/openbook.php?record_id=18319

Here's a study commissioned by the CDC under Obama to support more gun control. Instead, they found that armed citizens are less likely to be harmed by attackers, that Americans use their guns for self defense more often than they do for crime, and that mass shooting fatalities, which already constitute a tiny minority of gun fatalities in the US, are steadily declining.

Besides, my goal is not to change your mind. I know that that's impossible. My goal is to make you look like an idiot who does not use facts and statistics (because there are none to support gun control), and can only use emotional appeals, so that everyone else will disagree with you and agree with me. 

",3
"Imagine having this thought as Barack Obama.

*I was born in a country where you could be lynched for being black in the wrong place. Now I'm the president of the US. This simulation isn't trying very hard to be plausible.*",1
Obamacare,-2
Thanks obama,1
"In a way, yes.  Kissinger had a record you could examine and find fault.  Obama had *zero* accomplishments to even be considered.  ",3
They'd have to answer like... 6 questions to top Obama's dedication to the forum. ,2
"""I've now been in 57 states — I think one left to go.""   Barack Obama",0
"As an atheist I feel that no matter how much a religious persons political beliefs aligned with my own there would be such a large disconnect in regards to that one aspect of my life that religious people would inevitably shy away from voting for me, which is a shame but I feel it is reality.. You could probably replace the word Atheist with Muslim and you likely would get a similar response, does anyone actually think Obama would be president right now if he was openly Muslim, Atheist, or anything other than a major Christian theology?",-3
Something to do with Ferguson or obama,1
"To America- ""Mind control test 1. Testing, testing. Why isnt this working dammit! Man Obamas gunna be pissed when he hears his plan will have to be postponed. Oh shit i left the mic *stops suddenly*"" - watch and wait as America falls into protest.",1
"We actually comment on democrats vs republicans, because we get enough information about your politics to know the difference. Usually, its laughing at the republicans. 

* Why did the republicans disagree with Obama's decision (which was very similar to Reagan's and Bush's) which made 50 million self-sufficient people who worked and lived in the country for years citizens so they can start paying taxes to seriously help fix the economy? Because Obama was in favour of it. (*since this was very recent, [link](http://www.dailykos.com/story/2014/11/17/1345455/-GOP-outraged-that-Obama-might-follow-in-Reagan-s-footsteps-on-immigration). The joke is about how republicans don't care about the arguments presented, merely who presented them*)

* What is the pinnacle of republicans? Criminalizing something and blaming the government when they get arrested for engaging in it. (*Any drugs and prostitution/downloading*)

* How do republicans screw a lightbulb? They blame Obama for not having done it already and won't allow Obama to touch the lightbulb simultaneously. (*Any of Obama's promises the republican's voted against yet bring up in their criticism of Obama*)

* Why did the republicans vote to invade another country? Because they don't want any immigrants. (*Middle East and Mexican immigrants*)

* Why do the republicans want to keep marijuana criminalized? So they don't have to pay taxes. (*Drug policy and anti-government sentiments + political hypocrisy*)

* Why was the republican pissed at the atheist and the muslim? Because they reject Christian institutions such as Catholicism. (*hypocrisy regarding religions*)

* Why did the republicans vote in favour of Israel? Because they know the terrible influence fascism has had. (*America's love of Israel combined with their (relative to us) fascism*)

And many, many more. You guys are a goldmine in this regard. If it didn't have so many real consequences, we would consider american politics a comedy. Basically, you are to us as North Korea is to you, with the difference that the decisions North Korea makes don't affect anyone outside of their borders.",19
"&gt; Republicans arent the only ones who hate the Health care law, I have family in Iowa who are Democrat and regret putting a vote in for Obama

You seem to contradict yourself.",-1
"Suspicious, not in my part of the country but I am from one of the freer states. As far as bulk purchases, never done one but if the gun shop owner was suspicious about you for some it would be because you might be a straw purchaser buying for those who legally can't, not because you yourself can't/shouldn't have a gun. Safeguards? I would support a reexamination of mental health policy in the USA as without foreknowledge of someones intent to kill their is no way to prevent it. Impact of Obama and Feinstein's proposal, just made the NRA stronger as their arbitrary and constitutionally illegal intent to ban weapons made the portion of the country that cares about civil liberties even more distrustful.",1
"Ah, you must think reddit idolizes cats, too. 

Of course people outside America are most affected by America's foreign policy. 

In our history books, Obama will just be ""the first black President."" ",1
In Obama's eye so I can whistle blow every shady thing he does.,1
"When's the last time our rights were actually infringed on? Outside of Obamacare anyways, we're basically free to do almost anything that doesnt physically or emotionally harm other people..",2
"&gt; They don't give a shit about voting for how long, then a black man runs and votes from ALL the black people.

Look at the voting history of black people prior to Obama. About the same percentage of black people voted  democrat. Sure, he brought out more votes among minorities and young people, but you can't say they voted disproportinoatedly democrat. That's just stupid. Also,  as long as we're looking at race, let's look at white people's voting patterns. What percentage of white people historically vote for white candidates? lol
 
Get serious. You've been trotting out this tired ass argument for six years and no doubt been schooled each time you bring it up. Why keep up the transparent propaganda. Clearly you know it's bullshit. Why repeat it ad nauseum? Seriously? 

",3
Obamacare.,3
Obama hates you back.,2
"FOX: ""Obama was a commie tyrant!"" 

CNN, MSNBC, ect.: ""Our glorious president, dare I say god-king, has left us to ascend into the heavens with his dear friends Jesus and Buddha.""",16
"Not everyone hates him. You just don't here about the people that don't. of those that do, they generally fall into three categories:

1) About have the country didn't vote for him, a subset of those would hate him no matter what he did. Same as some of the other half would hate McCain if he had won.

2) People pissed about the ""you can keep your own insurance"" lie (his fault entirely for not realizing his policies would make it inevitable), or more generally unhappy with Obamacare in general.

3) He still takes blame for Gitmo being still around, which is not at all his fault. 

4) A lot of people think there was a coverup as opposed to merely extreme incompetance at Benghazi",0
http://www.theblaze.com/stories/2014/12/17/michelle-obama-i-was-asked-to-get-something-off-the-shelf-at-target/,1
Thank you Obama for giving millions of people basis for jokes ,1
"Years ago, the Halloween before Obama was elected,  my friend went in blackface as Obama. ",0
"We aren't against healthcare, we are against the way Obama wants to do healthcare. As is, a minimum wage employee is mandated to get healthcare because he makes just enough money to not opt out, but the healthcare options are absolutely horrid (meaning medical costs are still crippling, just less so) because he makes too much to just get his bills paid for by the government. Not only that, but a lot of people that previously had decent healthcare now have way higher premiums.

I don't speak for all Americans, but I would be super cool with socialized healthcare, if we would actually do it, and not whatever this clusterfuck is.",2
"Nowadays, whenever I think about any bad news, I picture it being delivered by 'Bad News Barrett' of WWE fame. Thanks, Obama! ",1
Obama?,2
"He was literally replying to a comment asking for a viable alternative to Obama. If he wasn't directly refuting it, he was off topic. ",1
"So my question is assuming that myriad other sources are legitimate, or at least can be combined to a full perspective of an event.

It seems to me that mass media outlets cycle the same stories of individual murders, Republican/Democrat muck slinging, and social commentary.

i.e Zimmerman, Casey Anthony, OJ Simpson, Obama's nationality, Tea party conservatives, celebrity stories, and the war on Christmas.",1
"The support for obamacare. The sooner people wake up and see that it isn't going to work, the sooner we can get a health care system that will work. The fact that it's obamas pride and joy has made it hard for a lot of liberals to let go of. ",1
Obama hasn't screwed things up as badly as Bush has. ,1
Do you believe president Obama was born in the US? ,2
"The Obama's were sharing their experiences with racism and this is the story our First Lady, Michelle Obama, told people: 

""I tell this story – I mean, even as the first lady – during that wonderfully publicized trip I took to Target, not highly disguised, the only person who came up to me in the store was a woman who asked me to help her take something off a shelf. Because she didn't see me as the first lady, she saw me as someone who could help her. Those kinds of things happen in life. So it isn't anything new,"" Michelle Obama, who is 5'11"", said. 

I've read this on many sites and I want to know what people think about Michelle Obama claiming this to be a ""racist encounter"". I am personally calling bullshit and have more reason to dislike Michelle Obama. 

source for anyone interested: http://www.theblaze.com/stories/2014/12/17/michelle-obama-i-was-asked-to-get-something-off-the-shelf-at-target/",1
"The slippery slope is real, and if Barrack Hussein Obamacare has his way, soon not only will the gays be marrying, but people will be marrying their dogs, cats, brothers, and sisters. Then the sanctity of Marriage (a sacred covenant) will be lost forever.  

",0
"Karhashians... any of them

Aston Kutcher

Demi Lovato

Any Reality TV stars with exception to The Deadliest Catch

Barack Obama

Ryan Seacrest ",3
"""Net neutrality is the Obamacare of the internet""

Politicians are the best for this.

Source: https://twitter.com/SenTedCruz/status/531834493922189313?s=09",4
"eh, in the US he is considered black, and race is a social construct so I would argue that he is black and mixed race. Most black people in the US are very often a little bit mixed unless they're like a 1st-3rd generation from Africa. And also, people who are mixed race and part black encounter a lot of the same racism that people who aren't mixed do. I definitely agree that racism is still alive and well, especially institutional and systematic racism, but saying that Obama is not black is kind of ignoring a huge social construct and ignores the fact that a lot of people who are __% black have similar fucked up experiences regarding racism.",5
I could probably quote half the Obama soundbytes from the last 6 years and have more than enough material.,1
"Nice try, Obama.",2
*thanks Obama ,1
"I have a ton:

* Once a man died of starvation from eating aspargus.
* Salvador Dalí designed the Chupa-Chups logo.
* He also invented [pixel art](http://cdn.all-that-is-interesting.com/wordpress/wp-content/uploads/2012/12/lincoln-dalivision-painting.jpg).
* 0,999999... equals 1.
* Mel Blanc, who used to voice Bugs Bunny, was allergic to carrots,
* Quentin Tarantino has an IQ of 160.
* Stanley Kubrick was a friend of Steven Spielberg.
* ""Pajero"" means ""masturbator.
* As a teenager, Mark Wahlberg did racial crimes such as partially blinding a vietnamese man.
* Christopher Nolan loves Micheal Bay's films.
* The longest literature piece in the world is a Super Smash Brothers Brawl fanfic.
* While in Alcatraz's hospital, in the later stages of neurosyphilis, former gangster Al Capone engaged in a poo-throwing battle with another crazy patient.
* The experimental eletronic duo [Bull of Heaven](http://en.wikipedia.org/wiki/Bull_of_Heaven) has made pieces of music the could theoretically ""play"" for times longer than the age of the universe itself.
* The creator of Pokémon has autism.
* Barack Obama loves House of Cards and is currently watching it.
* People die when they are killed.

Edit: changed some facts beacause **facts**.",8
"I actually saw Stevie Wonder at the DC-Reagan Airport as well...probably for the same reason as you saw him.

I was in the baggage claim at around 3-4am. As I was walking out out the claim area, an unmarked door with no handle opened up, and an entourage of about 10 dudes walked out. One of them was a heavy-ish balding black guy with small back-dreads, sunglasses and was wearing kind of a green/gold silk daishiki. It was Stevie Wonder, and he was being led out to a private car.

I saw in the news the next day that Stevie Wonder had attended a private birthday party for Obama the day before. I assumed that was what he was in town for",3
"Michelle Obama went to my school. Pretty sure we got an HBO movie made too. Whitney Young High School in Chicago. It felt rather than pretentious, a safe haven for all Chicago geeks. Amazing time of my life",3
Thanks Obama,1
"""If you like the plan you have, you can keep it.  If you like the doctor you have, you can keep your doctor, too.  The only change you’ll see are falling costs as our reforms take hold."" -Hussein Obama",-2
"Allow me to explain.

If Mr. Smith and Mr. Jones run against each other for president, and both candidates qualify for the ballot in Texas, then Mr. Smith picks his 34 Texas electoral college people, and Mr. Jones picks his 34 Texas electoral college people. The winner of the statewide vote gets to send all 34 of their people to the electoral college. Presumably, the people you pick will be loyal to you, and in many states, they must by law vote with their ""slate"" of electors.

This is how 48 states do things. In Nebraska and Maine, they vote by congressional district instead of statewide. In fact, in the 2008 election, Obama won a congressional district in Nebraska. So 4 of the state's electoral votes were McCain people, and one was an Obama guy.

In Texas, where we vote winner-take-all (I am also Texan), this is why Austin's city-wide vote is irrelevant, as it gets no representation in the Electoral College whatsoever. ",2
Obama. It would be nice to have some payback.,1
"Oh!  Barack Obama probably WOULD share a beer, once the Secret Service settle down.",2
Thanks Obama!,-1
"I have to agree with you. If you read western source news and RT and you keep in mind that both sides have political agendas and public opinions to sway, you can pretty much make your own ""average"" of the information and sense the real truth. 

But I have to say that I was pretty socked to observe that RT is more likely to post both Putin and Obama points of view than west news channels do. I mean, with the time, news and facts that are already accumulated regarding the Ukraine issue... I am feeling kind of shocked that, looking back, I find more past RT news to be true than the main source US news channels. I am talking about things like the big headline ""Russia invaded Ukraine's air space"" witch, looking back and being completely honest come out to be nothing more than shameful propaganda. ",2
Anyone but Obama ,1
Obama has ruined our once great nation.,-1
"Great work, but I have to say Nixon was a football player and Obama is soft like silly putty. Either you didn't research Nixon enough or are bias to Obama. Nixon wouldn't have gone much further past Obama though.",1
"Where do I start?



* gauges and piercings. 




* tattoos ""that mean something""




* an Obama t-shirt/sticker/tattoo",-1
"&gt;You know I really hate this subreddit for all the hate Israel gets. This poor guy was in a coma for 8 years, and all he gets is criticized. Israel can't catch a break. Sure he killed people, he was a fucking leader! You could say that about Obama when he sent troops in Iraq and drones as well!. People here have no respect for the middle east. I'm not saying he is praiseworthy, but someone like him does not deserve to be mocked and spit on.

Poor Ariel Sharon",1
"Michelle Obama. She condescends to overweight people, which crushes their self esteem (as if their self esteem isn't already really fragile), and is known to have sent people who aren't actually overweight into eating disorders. I just don't understand how she can sleep at night.",-12
