Working with fabric. I'm guessing leather.,2
Someone broke my nose trying to do this to me :(,1
That's a terrible thing to do.,2
"I got pulled over the by cops less than a month after my 16th birthday.  They ended up hassling the crap out of me, but let me go.  They said they called my parents. . .(this was the 90's).   I get home expecting to get absolutely reemed.  When I walked in the door my parents immediately looked pissed off and said, ""Where is your brother, he got pulled over again and we are not happy.""  I could have let it slide, but I took the rap and we all had a good laugh.  Turns out they were way more angry about the possibility of him getting pulled over again and didn't care so much that I popped my police cherry.  ",1
"I think that St. Louis is recognized as the ""most"" Catholic city - but it could also be Boston ",1
Wtf?,1
"""Wow, these crayons actually taste terrible...""",3
Wooopsy!,1
"The center of Texas is approximately eight hours from the coast or another state. I'm in Austin though and it takes about 4 hours to reach either Galveston, Texas or Oklahoma from here. ",1
Therapy,1
"I actually have my own office! I don't have much Lisa Frank stuff aside from a calendar, but my book club is the Lisa Frank Book Club and I got us some stickers and coloring books. So maybe more to come! I also dyed my hair pink and am planning on a Lisa Frank inspired tattoo.",2
"&gt; The human body is weird.

To put it mildly.
",2
"Thank you, and yes, that's my birth year. I'm 46 and still single.",1
thas wt im 4 bby,2
Perfect - Hedley,1
"I think 9/10 people who smoke spice have had the same or similar experience. I felt like I was losing consciousness when I tried it, and I started to drift into a deep sleep. I also could barely breathe, and a friend who actually had experience with spice was trying to keep me awake. Probably one of the top five worst experiences of my life. 

I always wonder, why is a product that has been known to cause near death experiences legal while the drug it is trying to imitate completely safe to use and illegal? (This is rhetorical) ",6
"He didn't know that in the southern hemisphere, the seasons are opposite to the north. When I explained to him that in Australia it's summer in December, he became aggressive and called me a stupid bitch.",110
Dragonite,1
Everday I think about my vacation in Austria so I can get vacation vibes,2
"I totally get that, however for me personally it's a lot easier to learn while reading. I don't need a professor standing there explaining stuff, I need full notes to work with. I'm in engineering though, so I guess that doesn't work as well for history or literature.

(Also, some of my lectures are just really not that great, which is a bit disappointing considering this is supposed to be a really good university, but on the other hand that's something most universities seem to have in common.)",1
"Yes. Bring it, and please provide my winnings in a bank draft from a top five bank in the US, Canada or the UK.",2
"Facebook is all drama. My mom has one and every other day it's a story about how someone blocked or unfriended someone. Can people grow up? They are in their 40s, that behavior is disturbing.",1
"My bias is based on the fact that I have trained in the style for 16 years. During that time I looked into other forms including jujitsu and other forms of karate and Tae Kwon Do. TKO and Brazilian Jiu Jitsu all have something to offer, but there are some limitations regarding use in a practical everyday environment and application.

Isshinryu is known for being up close and personal. You're not going to want to take somebody down to the ground in an armbar or throw a sweeping fancy kick to someone's head if you are threatened in a dark parking lot. However training to hit the knees, head, groin of your assailant is very practical and useful in the event of an attack.

No matter what form you train, there is a mental sense of accomplishment of having bettered yourself and the relief that you can know defend yourself if needed. This sounds like something you would greatly benefit from.

Just keep in mind THE #1 most important rule of any martial art in terms of engagement:  DON'T BE THERE. Avoid potential danger by increasing your  awareness. But if you cannot flee from the danger, WIN/SURVIVE by any means necessary. ",1
It's basically like making fun of one of the stereotypical cliques in school but for a bygone era.,1
Well cmon lets be honest it helps... with uh... nothing,3
"When I first heard Skrillex, shook my head, and reminisced about the good old days of Prodigy.",1
What are you most excited for in the next couple months?,3
"The voice of Patrick Star in the animated series *SpongeBob SquarePants* and Michael ""Dauber"" Dybinski on the sitcom *Coach*- Bill Fagerbakke.

He's actually a university grad with locally storied football experience and a background in theater: https://en.wikipedia.org/wiki/Bill_Fagerbakke",1
A few people I went to high school with.,1
Ah thank you!,1
depends on context.,2
"This submission has been automatically removed because it has 3 words or less. Please write your question in a proper full sentence, thank you.

*I am a bot, and this action was performed automatically. Please [contact the moderators of this subreddit](/message/compose/?to=/r/AskReddit) if you have any questions or concerns.*",1
"You could be hypoglycemic. I would encourage you to look at ""that sugar film"". It's a free documentary you can watch on youtube.",1
"While I don't agree with your belief, I respect it. +1",1
If you're being serious it's from the movie The Other Guys.,8
"Not an error but using ""B"" or ""U"" instead of ""be"" and ""you"" is just the most lazy thing to do. It's fine to shorten long words but to shorten a 2-letter word is a bit ridiculous",7
Holy. Shit. ,1
"Nice! Keep on trucking on, you're doing great. :D",1
"Irrelevant, but username brother! ",36
golang,1
"/r/lockpicking has a lot of good resources.

Just remember, only pick what you own(or have permission for), and never pick what you use.

For hacking, there is [hackthissite](http://www.hackthissite.org), though it doesn't really hold your hand much.",10
Ignorance is bliss. Follow your heart and you'll be broke but happy.,2
"Add a little of your favourite vinegar. It takes away some of the ""I just ate a brick"" feeling.
And make sure you get the fancy kind of ramen with the little packet of sesame oil.",1
The only good one I've found was The Red Wedding Reaction video. Because I knew what they were about to know...,1
You mean mentally retarded? ,1
"That does make a lot of sense, thanks for the reply!",2
Yo-yos. They got popular and the old white administration was fearful of gangs. So my town was spared of the dreaded yo-yo gang. ,1
"I don't have one, I don't see the point of them, I want to be as good as I can be for being me, not by emulating someone else. ",1
I actually prefer Danger Days over The Black Parade. I didn't even know people hate it...,1
'The Breakfast Club' bored me. I wanted to like it.,2
"What doesn't kill you makes you stronger. Live life on the edge.
The table you're sitting at is probably dirtier. Same cloth that is never washed or rinsed is used to wipe down everything. Take a chance on that lemon slice!",3
Art Garfunkel. He yelled at me while wearing nothing but his underwear. I've commented too late. No one will ever see this. edit: The full story is in the comments below. ,5383
"Every now and then, thirteen year old girls strike gold. You just have to be patient.

",1
relevant xkcd https://xkcd.com/1594/,1
Was it necessary for you to make it sound hot? Because that sounds hot.,0
My wife REALLY wanted a Cuisinart stand mixer for her birthday a couple of years ago. Talk about a nervous purchase and presentation.  ,4
"Kingdom of the Crystal Skull was fine, just not nearly as good as the original.  You can't compare it to Jar Jar, angsty Anakin, and ""I hate sand.  It's coarse, and rough, and irritating, and it gets everywhere"".",1
Being chased around an empty grocery store by bald blue people.,2
"This submission has been automatically removed because you did not include a question mark (""?"") in your title. Reddit does not allow post titles to be edited, so if you would like, you can post the question again.  Please write your title in proper question format, and include a question mark, thank you.

*I am a bot, and this action was performed automatically. Please [contact the moderators of this subreddit](/message/compose/?to=/r/AskReddit) if you have any questions or concerns.*",1
"WE HAVE THOSE, which is why the 1st post and your follow up is ignorant.

If you want to talk about mental illness, let's...

half of Reddit would be in mental institutions again instead of being allowed to post on the internet",0
Gone with the wind,2
"What do you mean? I'm not sure I understand.

The pap was awful. They always had to use the smallest size speculum. It sucked. If tell them, they didn't believe me, would use normal and it would have me almost in tears as they shoved it in then realize huh it's too long!! 

I usually have to take a clotopin before exams now. They're so shitty I get worked up and my anxiety flares and I start panicking. :/ I only do it because I'm so not in tune with myself down there. PCOS so I'm never regular so I haven't figured myself out, never had a yeast infection or uti so I get paranoid if things feel off, ""Omfg I have a yeast infection/uti!!"" Lol",1
"That's a good idea, I'll check it out. Cheers ",2
I'm glad you're getting therapy. I hope the very best for you.,1
Yeah I mean I'm not trying to insult you or anything you're obviously free to do what you want ,1
Double the fun!,977
"&gt;I see that you're no longer saying that the sentence ""Americans are genuinely the most thin-skinned, mean spirited people on reddit"" is ""exactly"" the same as saying, ""many Americans on Reddit are thin-skinned.""

That's exactly what I still maintain - you just don't comprehend proper English y' dumb yank.

&gt;And now you're in the uncomfortable position of admitting that you made a mistake or pretending to be a complete moron.

I think we all know that you're the moron here. ",1
"Imelda Staunton as Dolores Umbridge in the Harry Potter films, but i can't tell if she played it too well or the character is just super infuriating. ",1
Same. That shit was probably invented by Satan himself. Fuck that shitty alphabet math.,0
"I had someone post a series of posts/images for some skin care pyramid scheme. When I mention that I though she might be caught in a scam(i.e. NOT accusing her, but offering to help) she replied with a clearly cut and paste response, complete with graphic, explaining that it definitely was not a pyramid scheme.",3
"I remember those photographs in the tabloids of her snorting coke in her own bathroom. Surely the bigger story is, what the fuck was a photographer doing in her bathroom?!",143
Oh shit,1
"""Where are you going to college?""
As a high school senior, I've probably gotten this question a hundred times over the past few months, but the worst part is not having a real answer. Feels bad, bro.",1
"Some women are born that way, some are forged in a sea of cocks.",2
"Thread won't take off because this question, or questions like it, are asked all the time",2
"Super legit, theres lots of neat little features if you play on the slash realm and, for the most part, folks are super helpful. Plus the ladder just reset a couple weeks ago.",1
Sometimes at a coffee shop I will pay for the next person's drink. I do not expect them to buy the next person's either. I don't try to start a chain in other words.,1
Because its god damn awesome!,1
I think this whole argument is just because we see differently,2
"""She asked me to give her 9"" and make it hurt so I fucked her three times and punched her in the mouth""",2
"I learned the preamble in 2nd grade. My sister insisted I needed to, and to this day I remember the song. I also never ended up needing to know it, so that's good",1
I like to imagine lil Jon terrorizing a SE Asian country with his music ,2
"I was very mad but like I said it makes you want to do stuff and hands were going places. I was more mad at the fact that my junk wouldent work. A jokingly hold it over her all the time "" o ya well remember that time you made us do meth"". Never got a craving or anything so never touched it again never will. ",2
What did she do? I remember a few movies from her a few years back but I never heard about a scandel that destroyed her career?,618
"Insert a quarter into his phone headset every day for a month then, take them all out. Just watch Conflict Resolution from The Office. ",11
Attempted Rape.. it used to be a capital crime (death penalty) now it is nothing more than a minor misdemeanor.,1
In the Netherlands we call that de zesjescultuur. (the sixes culture. 5.5 or higher is a pass),24
Talk about != talk to lol,13
"Honestly I envy they way they're taught to respect everyone in elementary school now.   I have an 8yr old and when I was his age, bullying was just a normal thing that everyone did to everyone in some form or another.   Now, that is sooooooo gone....my kid (and ALL his classmates) respects and treats everyone equally regardless of perceived shortcomings and everybody supports and helps each other.  I know it can be thought of as ""weakening them"" or ""setting them up for an unrealistic view of the real world"" but I rather enjoy seeing them all help each other and work together rather than resort to bullying and name calling",2
"Boulder has lots of great places to eat, this isn't on of them. When the place was Daddy Bruces it was really questionable, almost to the point of an SNL skit, but the owner was really cool and even though the bbq sauce was a tad to vinegary I still went back.  ",1
"Do military chicks typically just become hoes that sleep with all the guys? I mean it makes sense, surrounded by in shape dudes in uniform, and they're all horny as fuck.",2
Using a cell phone at a gas pump. Mythbusters put it to the test and found you'd be dead from inhaling air saturated with gas before the cell phone sparked any ignition. ,3
Where exactly is it? I don't see anything,2
"with the numbers given in the article sighted:

2.9 deaths in every 100000 were gun related
That's 0.000029% for a total of 9106 deaths in the US in 2012
In 2012 610000 Americans died of Heart Disease

But I've still never seen a Mothers Against High Fructose Corn Syrup group",3
"Sleep I can deal with, but I have hypoglycemia (and not from diabetes, don't worry), so when I'm hungry I go into fight mode. I'm pretty sure if it gets bad enough I'll punch a grandma for a piece of cake.",1
How much is Chocolate Rain?,51
**Yes.** I swam in it once and hated every minute. Sometimes the wind blows the lake smell from miles away into the town where I live. I've heard it used to be a pleasant tourist destination and people came to swim in it for the supposed health benefits.,1
"No dictionary, only *rage*.",6
Yes and they didnt even pay for the plates the next time we saw each other. Fucking idiots,2
"I just started teaching 5th grade when ""It's a Hard Knock Life"" came out. We randomly took this field trip to the local high school to see their production of the musical Annie. My students thought it was totally ""gangsta"" that they used a Jay Z song. Umm hmm, whatever kids.",1
"**Attention! [Serious] Tag Notice**

* Jokes, puns, and off-topic comments are not permitted in **any** comment, parent or child.

* Parent comments that aren't from the target group will be removed, along with their child replies. 

* Report comments that violate these rules.

Posts that have few relevant answers within the first hour, and posts that are not appropriate for the [Serious] tag will be removed. Consider doing an AMA request instead.

Thanks for your cooperation and enjoy the discussion!


*I am a bot, and this action was performed automatically. Please [contact the moderators of this subreddit](/message/compose/?to=/r/AskReddit) if you have any questions or concerns.*",1
The Riches,1
Electricity,1
"Jensen ackles before, now and the future ♡♡♡♡ ",2
You got the reference.  What are the odds. ,1
Funfact after he died the voice of slinky was taken over by his good friend Blake Clark (the  crazy gibberish guy from waterboy). It just happened they had very similar voices. ,95
"The only thing I can think of that's slightly reasonable is to eat 10,000 skittles/small chocolates. But even then that's not particularly reasonable.

Journey to somewhere 10,000 miles away for a holiday?

",2
Quack quack ,2
Moving to California for college when I was 18 from NY. I didnt see the school I was attending until I already committed and it was 2 weeks until the first day. I ended up loving every second. I've been here now for almost 8 years and dont intend on leaving anytime soon.,2
"I threw a fit and sprayed blood against a wall. 

  
Had nasal polyps removed at the age of 5~6.",1
Water expands in its solid form.,1
Center Stage,4
Youve encompassed the same image im seeing. ,2
Coming out as trans. I have the right to pursue my own happiness.  we all do. ,12
War,0
"Blister packs, aka ""clam shells"". They're a bitch to open but a hand operated can opener supposedly helps open them!",1
Multiplayer Mario games.,1
"Probably true. I'm surrounded by like-minded people, so maybe I'm just biased towards thinking most people here are like that. ",2
Horses.,0
"When library is pronounced ""Lie Barry"". ",2
"I met a girl from Beverly Hills off of Craigslist, she was into law.  She advertised as being ""athletic"" (with a face shot, never trust just face shots) but the only thing athletic about her was her treadmill.

I didn't back out.  She was probably about 40 lbs over my ideal, but I did the deed regardless.  I proceeded to down a 6 pac to get over the ice and bought 3 condoms.  Apparently I did such a great job she emailed me at 12 AM while I was passed out about how great I was.

Next day I did the polite thing and asked if she wanted breakfast, but she was in a hurry to see me go because her ex husband was going to be stopping by to drop off alimony.

Yeah, awkward.  I lied and said I'd keep in touch and that was that.  I was honest with her via email afterwards, but... yeah, I didn't feel obligated with the awkward ""my ex will be here soon"" anyways.",-2
Yessssss,2
We either had sex or argued. It didn't make any sense to stay together.,1
"Star Wars: The Old Republic

I was a Pre-CU SWG player who quit SWG after $OE put the NGE in. To this day I still get a little depressed when I think of the day the NGE went in and I deleted all of my characters across three accounts. I had hope that BioWare could give us a Star Wars MMO that was fun, and full of life like SWG was.

What we got was a pile of shit that got worse over time.

Right now TOR is ignoring real MMO content like raids and pvp in order to do a very poorly done story. Players are leaving by the droves for other games thanks in part to this. Add in one of the most anti-consumer F2P systems around.

I really hope Disney looks at how badly TOR is doing, word has it TOR will be shut down in the next six months. After TOR and Battlefront failed my hope is Disney will give Star Wars to someone that cares about us.",0
"I have heard many people trash speak TV in the past. I myself am a TV subscriber and I have always liked it.

But this is the 1st time I read a post from the other side that actually made me reconsider my position.",2
"""If I knew you were going to be such a horrible person, I would have never had you."" My mom has said worse things but I don't really know why this one hurt a gajabillion times more than any other. ",1
She sounds like Donald Duck,3
"'Allo mucker, would yer like ter go on a date wiv me?
",2
Critical mass any moment now...,1
"This is a strange line to draw, especially when torture could help more in certain situations hypothetically.

Although I'm not saying I'm for it.",1
Natural Causes at the age of 105 or more in the United States of Earth.,1
"When people loose a SECOND smelly fart in a confined space. You get a free pass on the first one because sometimes The Stink can creep up on you, but there's no excuse for knowingly bombing a room.",1
"Beard guyz beard balm 33. Also beard oil 25, same dudes",2
"The massiv nuclear arsenals.

Easily.
",1
"""It was on sale"" whenever I buy something expensive. Actually Mom, I paid hundreds of dollars for it, and it was within my budget, but if I told you you'd rant about how I'm gonna end up homeless because of my 'excessive spending'.",2
These posts are very annoying.,1
"Was drinking at a friends house party recently and some one made a 9/11 joke. The stranger next to me said something to the effect 'Wow that must have been something to see in real life""
And my friends and I kind of stopped and looked at each other and just kind of had a collective moment of ""Oh shit..a) Who the fuck invited a 16 year old and b) Holy shit kids born after 9/11 are crashing parties and drinking other people's beer already...",1
I love that Archer addresses this. :),1
"He never went to the hospital or the morgue or anything, the sheriff's dept called us straight out to the house. They did not give any details to the guys that went to do the removal, so it was two 65 year olds with a regular stretcher and some latex gloves. If they had known what they were getting into things would have gone differently (body bag, protective gear, etc).",1
dejavu,0
Life.,1
Or French,1
I watched both seasons in 3 days. Probably the best television I've ever watched. ,2
Enjoy that playoff run while you can cause you won't be back any time soon - Oilers fans,1
Sitting in Anatomy. I feel you. Oooooh shouldn't that scare some people. Future health provider here.,1
"Well, I searched for it and no one seems to have mentioned so: skateboarding, it is cool and fun right now as it was in the 90s, same culture about local scenes and stuff, it's been fun getting into it again and seeing the good things about it just like it was in the 90s.",1
"I remember when I was at a local youth club 20 years or so ago, a local lad had sneaked his .177 pistol in.

He somehow accidentally let it off with the pellet getting stuck in a girl's cheek. As I remember nothing really came of it, but it's a memory I have from my youth.",3
people in dormitory and school bathrooms all my life will disagree with you,1
I used to have 2 rats when I was young and I remember being terrified of putting my hand in thei cage because when they bit me I have never bled so much. ,-1
The killer feed him chicken after he saw it and killed him. ,2
"Well the simple answer is that it depends.

It can be a slippery slope.  ",2
True! I gather the kids in my neighborhood on weekends for tutoring (it's free lol) and I love my 3 yr olds. They're really excited to learn. Cuties. ,1
"James Franco went to Yale and has published a novel.
",1
"We've also mostly only explored the exposed bits of it. I mean, if Earth is our girlfriend, we've barely even made it to 2nd base.",0
"Flat Earthers.  The few I met are impossible to have a conversation with, and disbelieve everything out there showing them the earth is roughly spherical.  They repeat flawed math and science they find from other flat earthers and think NASA is in on the whole deal.  I am biased because I love NASA so they irritate me. ",6
Starting college next fall so I know my timeless days are  numbered. ,1
"Lol, classing the place up.  ;)",1
My boyfriend now started off as a Tinder fling but dammit we had so much chemistry it ended up being a real thing. Crazy what you find when you're just trying to find someone to have sex with.,344
badmitten,1
"California has 38 million people, Canada does not have 19 million people.",1
"Prion researcher here! Yes, prions can be passed down by consuming cells containing prions that have human analogs (see kuru), but a lot of prions form because there is a defect in one of the chaperon proteins that enclose a new protein as it forms.  Without this protection, it misfolds and starts a chain of prions.  If your family has a defect on one of these chaperons, it can greatly increase your chances of getting the disease. ",5
"No reference, just a dumb joke that I got gold for apparently. If there's 1.6 million ants *for* every human, I'm waiting for mine. ",2
"&gt;1.Sanders

&gt;2.Trump

Wut",1
PC Master Racers,1
An asston of heroin,4
Nailed it!,1
"Recently - Everest. I knew it was based on a real event but I didn't research into it before seeing the movie. I love the movie but it makes me feel so empty and sad. 

Over all - the Elephant Man. I watched this with my parents when I was about 14 or 15. I've never been so gutted by a movie. I refuse to ever watch it again. ",1
"Goths, Emos - The ones that use tumblr and have those black floral necklaces around their neck.",1
It would if it wanted to fly people to the moon.,8
"if that's the case, we're all fucked.  I'm about 600 miles from any ocean",1
Thank you for those corrections.,5
"Eugh I HATE this. I'm still incredibly angry at this one woman who, when I complained about my limited dietry options as a type 1 diabetic, said that I had no right to complain because she had it so much worse with having a peanut allergy?? 

Is this what your peanut allergy looks like?

* take injections 5+ times a day with stuff that could LITERALLY KILL YOU
* have the possibility of KILLING YOU IN YOUR SLEEP
* have frequent cognitive effects meaning you could easily crash a car
* will result in nerve damage, blindness, renal failure

FUCK THAT BITCH",2
as a PC builder i can relate :),6
