"It's crazy how patently obvious it is, yet how difficult it is to abide by it. For example, I'm politically moderate with a slight liberal bias. My uncle is a hard-to-the-right tea party kind of guy. Lots of guns, absolutely detests liberals and Obama and will rant about them for hours at home. I find that kind of politically oriented person to be incredibly irksome, and I honestly think less of people's intelligence when they sympathize with tea party radicals.

However, when we are out in public, and he interacts with the filthy liberals, he treats them with a respect that you don't see many people treat each other with even if they agree politically. The guy is a member of FEMA and was in New Orleans slugging away trying to help people survive after Katrina. He was even pinned down by gunfire from roving gangs while checking houses for survivors, and continued to do his work after the gangs were chased off because ""not everyone is like them, and we're here to help 'em all anyway"". If you talk politics with him he'll give you an earful, but you can be damn sure he'll stick his neck out to help you if you need it. I like to believe that most people have this kind of decency that we aren't exposed to on our surface level observations and interactions.",6
Obama shits... ,1
"Depending on which side of the fence you sit on it's either Obama or Putin.  
",0
"Barack Obama
""Thanks, Obama""",9
"Don't fuck about weighing pros and cons over small decisions.
I read about Obama having only two different colour suits. One or the other. Stops you wasting time.
Same with Steve jobs and mark zuckerberg.

I adapted that thinking to a few more areas and moments in my life.....either do x or y. Do it. Don't dilly dally. Just choose and get on with your life.

Tl;Dr be more decisive and quicker about it. Worry less about the choice you didn't make.",1
An Obama presidency.,-3
"Thanks, Obama.",2
"""Yes We can"" Barrack Obama #movinonup",9
ISIS - Thanks Obama!,1
Obama is literally Hitler. ,2
"Obama is still well liked abroad (saying you chose Bush last time it could be worse).

There are things like Guantanamo bay which he promised to close, which he hasn't.",1
"Obama the ordinary, Putin the prick, Dubyah the doltish, Cheney the coward, ",1
Thanks Obama!,2
Guilty until proven innocent. Thanks Obama.,-2
obama is the worst president of all time and his presidency has reinvented racism.,-2
"You're probably thinking of Iowa or New Hampshire.  Ohio doesn't hold its primaries anytime special.

Sidenote: they were in 2008, but that's because the race between Barack Obama and Hillary Clinton wasn't resolved after Super Tuesday, and so it actually came down to states that held their primaries *later* to decide.",3
"In the last 6 years, Obama made it a regular part of foreign policy to bomb Funerals and Weddings of suspected terrorists, purely because there is likely to be a high amount of sympathizers or networked terrorists at the processions.

This act strongly violates the principle of ""double effect"" which is a cornerstone of international law.

The US Government also double bombs rubble in the SWAT/tribal regions in Pakistan, meaning they bomb a site, and then bomb the rubble where people are running into the fray to pull loved ones who are caught under debris. The principle to do so is the same--if you bomb a suspected terrorist, there are likely other ""bad people"" running into the fray, trying to pull said terrorists out from under the rubble.

Unfortunately, there are also mothers, fathers, and good people trying to pull their children out from the debris as well.",14
"He said evolution is a lie and thinks Obama is out to get him. Literally. Not the NSA, FBI, CIA, or ATF, just Obama. ",1
That President Obama planned the Sandy Hook Shooting. It's amazing how crazy some people are. ,1
"|It's true that the government isn't all good - I would never defend it on those grounds. But to lay the blame for the way the government is now squarely at Obama's feet is entirely inaccurate. Most of the problems now are largely historical, and to suggest that they are all recent developments is naive.

No, I don't blame Obama for it all by any means. But his promises to repeal the Patriot Act, stop the illegal spying, maintain an open government without secrecy and more were all broken. In fact he has moved in the opposite direction, strengthening the government's positions on all of these things.


|I completely agree with you that both parties are to blame for the current state of the government, and would further posit that the two party system encourages corruption. I really do wish that there were more viable choices.

I couldn't agree more.

|On an aside, I do want to interject how I really don't think that there's an 'obvious attack' of any sort on the second amendment - in fact, things are quite good for gun owners in the US now. As of 2010 48 states had concealed carry permits, Democrats voted to allow guns carried into public parks, and in 2008 the Supreme Court overturned the handgun ban in DC, setting precedent for all states. In fact, one could argue that there are GREATER freedoms for gun owners now than there ever were under Presidents Clinton and Bush.

I should have elaborated here. There is without doubt an attack on the second amendment and a wish for this administration to have some negative effect on our gun rights. It has been largely unsuccessful however. 
",1
Barack Obama,0
"I enjoy the things I see here, from President Obama ask me anythings to people with two penises. You can also get some nice conversations on here if you don't piss anyone off.

It's also a great place to get the latest news on something, like a celebrity or video game.",2
"Obama is Pestilence then, because ebola",1
This just happened yesterday. And yes he is talking about such actions. Like I say. He is not a right wing war monger. He doesn't panic. There will be sanctions. And there will be a price to pay. Obama's own words.,2
"Do you honestly think Mitt Romney or McCain would have better presidents? If so why do you believe that and what exactly is your issue with Obama?  You asked a pretty broad question.  

Do I think Obama is an amazing president? No.  Would I have voted Differently? HELL NO!   Is he the worst president in history?  Far from it.  Please educate yourself. ",5
Thanks Obama!,3
"No, that's just Obama's catchphrase every time he Kramer's through the door.",6
Michelle Obama's arms. ,4
"I had this stupid girl added on FB that I was good friends with in high school. She had left one of my friends and began dating this conservative, religious nutjob who brainwashed her. Most of the time she just had shared religious pictures. But there was two instances where I got offended to no end.

The first was a picture she shared of a man o' war jellyfish. It gave facts about how the jellyfish had no brain and could live for such a long time. It ended off with, ""Which is great news for Obama voters."" If there's one thing I hate, its people who don't understand what goes on in government and solely blames the president. But what offended me was the fact she thinks democrats and Obama voters (which I am both) are brianless idiots. I went off on her, saying she shouldn't insult people's political views as that's a sure fire way to cause a fight. She promptly deleted it.

The second time was when she shared an article from one of the most sensationalist web sources. Fedup or something? Its so bad that article refer to Obama's cabinet as corrupt criminals and shit like that. It feels like satire. Anyway, the article was complaining about how Obama wants to grant citizenship to tons of illegal immigrants in the U.S. which apparently is really bad now. Her ignorance was unbelievable. She compared granting citizenships to welfare, and how we don't have enough money for our own homeless. But that's not what offended me, it was the fact that she claimed immigrants brought incurable, new diseases to America and that they would recruit more members into the largest terrorist group in America: The MS13. Yeah, her and her boyfriend both believe a transnational street gang is a terrorist group. This is where I lost my shit, because this is Florida we're talking about here. Tons of people, myself included, and her friends were either immigrants or illegal aliens. And when I tried to fight her on these offensive claims that we're disease ridden and prone to joining gangs, her boyfriend jumped in to bitch me out for being a ""whiney bitch that shoves her nose into everything."" Well I'm sorry Mr. McDumbfuck but what else do you expect when your brainwashed girlfriend publicly speaks her retarded opinion on social networks? Fuck me.",0
"Obama said ""Laura,nice bush""!",1
"Job postings asking for a technical skill but only pay slightly above minimum wage. The fuck? I need to make my own business. These fuckers are getting too greedy. Really, Obama made a nice gesture with a 10.10 minimum for a specific group, but minimum wAge really needs to go higher, like 15+

Yeah so that angers and saddens me.",1
"That Obama was real, not just some myth made up by the TomCruise Dynasty to scare us",3
"Your a teacher? WOW! No wonder our education system is failing and ranked lower than number 5 in the world. Teachers think they know everything.. Have you even been out of the country? Yeah I am 20 but I have even lived in other countries due to my dads work and I have seen other cultures and experienced things outside of a damn book. I haven't just read about world history, I have seen it with my owns eyes. I haven't just researched other cultures, I have lived in and around them. In Europe, South America, etc. Teachers should encourage people to better themselves, not fear it. I bet you voted for Obama if you an American.. 

And if your a teacher over 30 and have nothing better to do than insult a 20 year old on reddit that is just trying to reach out and help others in areas I have struggled in than you are one of the biggest losers I have ever seen. I'm done.",3
"Whats Obama's favorite vegetable?

Broccoli.",1
"I had that exact same experience during the 1st Obama election. The racism still present was a sad and shocking, eye opening realization. ",1
"Probably a tie between Hitler, Stalin or Obama. ",-2
"Kinda like how Obama started every sentence with ""Bill"" last night.",1
"there are a lot of ways but they work differently. The problem is that you have to understand the people you are talking to and the GOAL you are trying to achieve which then gona devise your situation in different categories thus requires different tricks.

Job interview for example: the people you are meeting with a corporate employees, well experienced so they will have a certain expectation of how you are supposed to be according to your resume. Whether you are a very down to earth guy or a special cs nerd who dont care about appearance. The trick here is to BREAK that expectation of them by doing something else. That way their initial mental image will be shattered and they would like to find out more to fill up the void of their expectation. ""Something else"" here doesnt need to be a negative activity, for example a foreign student could get a great initial impression by demonstrating my pronunciation and usages of buffer words to surprise his teacher. Or a CS nerd could get bonus points in interview by demonstrating his social abilities, being able to make small talks about random topics before/after the interview.

Another example would be doing a presentation. In this example your goal is to be able to control the crowd in a way that you could transfer your speech effectively. Jokes is the most obvious hack here but there are also more: choosing your vocabulary better to help the audience understand your presentation of choosing MORE complicated words to impress the audience with your knowledge. Practicing your tone, pace of speech as well as using 'buzz words' that help the audience remember your speech is also widely used as hacks for most political runs. My tips: learn to pause while speaking, a pause at the right place could make a sentence 10000x times more effective. I strongly recommend watching the latest speeches of obama as well as his debate with mitt romney.

",1
Thanks Obama,206
Michelle Obama. Versace. Flow.   Marry one kill one fuck one,1
"That Obama is not a very good president. I understand that he hasn't done all that he promised, but he doesn't have as much power as many so believe. The president's main power lies in foreign affairs in which some have to be approved by the senate. Congress controls what laws are passed and what actions must be taken in the event of foreign and domestic affairs. It's annoying when common people blame drone strikes and additional taxes on Obama when in fact those acts were passed by the senate. And those senators were elected by the the people complaining about the president. The president isn't even elected by the people. He is elected by the electoral college. It just annoys me. ",5
"You're 100% accurate on both comments. I grew up with parents who were the rare ""rational conservative"" - they didn't think everything was a ""Communist plot to ruin America"" etc. Then I went to a private college and was surrounded by more typical Christian conservatives who sang loud at chapel every day and were completely comfortable using racial slurs toward Muslims, thought Obama was evil (literally evil, like demon-possessed), and treated homosexuals like garbage. That experience turned me off of conservatism completely.",2
"My Dad was a liberal who served in the Air Force for 20+ years. He said it works like this:

When a Democrat is President, everyone lets that rule slide. According to him, certain officers would routinely bash both Clinton and Obama during briefings.  

When a Republican is President, if you even hint that he might not be 100% infallible you get chewed out.    ",13
"""I voted for Obama because he's black/a really cool guy."" ",1
Obama,-2
Tell that to Obama. He thinks he's wise enough.,-2
"Yeah, you go ahead and believe the democrats are any better.  Never mind their decades-long effort to maximize dependence on the federal government and make themselves the 1%.  Never mind that the oh-so-awful inequality is caused by government interference, that it's a by-product of a few power-humgry, narcissistic political elites, your idol Obama amongst them.",0
"Some guy in singapore is mad about about people blaming the government, *thanks obama*",3
"Doubtful. It will probably die completely when the next Republican president follows Obamas precedent and delays implementation of essentially everything. Or, if not, studies show we'll still have a huge population of uninsured. ",2
"""Thanks, Obama.""",1
Nudes of Obama are leaked onto the internet.,4
"When Obama (or any US President) sells the White House to himself for the price of a Pokemon card, like Yanukovych did in Ukraine, I'll think about protesting.",0
"His poorly masked contempt for everyone who isn't wealthy didn't endear him to people who weren't wealthy.

Obama isn't really better on the actual policies, but he hides it better.",1
Obama has assassination insurance. It's called Joe Biden.,7
"I didn't make that presumption at all, I *quoted* someone who was speaking of a nebulous group.

But you've still failed to comprehend *why* I quoted it.

Here's the even more focused version:

&gt;Supposedly, those ingredients never fail because the recipe worked for them, forming the basis for their ""common knowledge"" of success. They honestly believe that because they have been able to work the system, having a path and the resources to do so, their experience directly applies to anyone and everyone.

It is possible for someone **to do everything right and still fail**.

This is what you're not understanding. Hard work, determination, taking every opportunity for advancement worked *for you*. That *does not* mean it works for *everyone* and that poor people are lazy. I have worked alongside people who own companies worth billions, and I've worked with immigrants on food stamps. And in my experience, they both run the gamut from hardworking and brilliant to lazy and stupid.

There is a huge influence of circumstance and plain old luck that makes a tremendous difference in who's successful and who's not.

You left a six figure job to start your own business. Starting a business is a stressful and difficult task no matter who does it, but knowing you had the education, skill set, and work history to go *back* into a six figure field if the business failed *is a ridiculous advantage* compared to what people at the bottom risk.

Right now, I've got a friend who just started a new, more lucrative job. He's doing well, but from the beginning he's known it's a temporary position for the next few months. He's using it to save money to move a couple hundred miles to go to school.

He knows he can go to the school, he's been accepted in the past, but *he has no idea if he'll find work* where he's planning to move to.

If he doesn't, or if it's not lucrative *enough*, then he won't be able to attend the school he wants. If he doesn't find work at all, he could very well end up homeless hundreds of miles from home.

He doesn't have anything to fall back on if his plan fails. He gets two different bits of advice, in general, the optimists are sure his plan will work, the pessimists think he's being foolish and should just parlay his new experience into another, even better job once his current gig ends, *but*, both of these views *presume* that he'll be able to do so, that there'll be a job available at one place or the other in time to avoid significant hardship.

They ignore the possibility that there simply won't be anyone willing to hire him, or, more likely, that there won't be anyone willing to hire him *at the pay rate he needs*.

I have ten years experience in my field. Military experience relevant to my career, half a dozen skill certifications, and I'm universally praised by my coworkers and my superiors.

I make what's standard for my position in my industry in the tristate area, which is *only 50¢ more than a recent High School Graduate who just walks in and applies.*

My boss, who has *less* experience than I do, but has a college degree in a completely unrelated field, makes *50¢ more than I do*.

We're a contractor, my company is hired to provide us. My company gets *$2M/yr to put us onsite.* My boss, my coworkers, and I take home less than $500k during the year.

*Could* we be payed more? Sure. But the last person who asked for a raise was fired (at will, no stated cause) the very day he asked.

Another site serviced by our company has a random visit from a labor organizer once. Everyone who worked the site was fired the next day.

I work for one of the better companies, we had decent health, dental, vision, &amp; life insurance (after a year with the company) before Obamacare ever came along. But their stinginess with pay and insistence on ridiculous profit margins is pretty standard for the industry in the tristate area. There's nothing better to move *to*, even with my (far, far better than average) qualifications.

And it's this way for nearly all my friends. Hard workers, well qualified, stingy businesses, no way out.

*Half the US* (that's 175 **Million** people) makes less than $30k/yr. Tell me again how they all must be lazy.",2
Be with Obama and see everything for the day.,2
"I'm sure it's been mentioned, but Barrack Hussein Obama  certainly did not deserve the Nobel peace prize.",2
"Level X+268: Finally out of Obama country, still seeing Sharktopuskracken, though.",1
"Thanks, Obama.",1
"They will either get fined (people without insurance will face fines from the government for not getting a plan) or Obama will just extend the date again lie he already did.

Kind of a weak law when you can just change the deadlines of it on a whim.",1
"I live in the south and I have heard a ton of people say this...and not just old people! People who were 17, 20, etc! People who should know how to fucking use google and not just believe chain emails from grandma.

Just last night my SO's brother posted on FB that the guy from Duck Dynasty should be president because he's a good Christian and Obama is a Muslim terrorist. I have to pull the post up to double check, but I'm pretty sure he wrote some shit about Obama not being an American citizen as well.

I have to have dinner with this moron tomorrow night.",2
And another kid asked what Obama's last name was.... ,1
"Neill Degrasse Tyson, Barrack Obama, Oprah Winfrey, Maya Angelou, Carol Moseley Brown, Anita Hill, Mae Jemison. Not to mention all the actors etc who are not ""criminals"": Will Smith, Morgan Freeman, Denzel Washington....These are off the top of my head. There are tons more African Americans from history who are wonderful role models as well (Thurgood Marshall, Web DuBois etc. Do some reading and get back to us.",3
Thanks Obama,1
[Obama didn't seem to mind](http://dailycaller.com/2014/10/16/obama-i-kissed-the-ebola-nurses/),2
I voted for Obama. ,4
"When HSBC was found laundering money to terrorists and drug cartels, Attorney General Eric Holder said this:

&gt;But I am concerned that the size of some of these institutions becomes so large that it does become difficult for us to prosecute them when we are hit with indications that if you do prosecute, if you do bring a criminal charge, it will have a negative impact on the national economy, perhaps even the world economy. And I think that is a function of the fact that some of these institutions have become too large.

[Source](http://www.zerohedge.com/news/2013-03-06/eric-holder-some-banks-are-so-large-it-difficult-us-prosecute-them)

Now keep in mind that he was appointed by Obama as Attorney General. Now what Obama should have done is come out making a statement along the lines of ""No! You prosecute those involved, or I'll find another Attorney General! The buck stops with me!""

What happens instead? HSBC had to a pay ""record setting fine"" (which by the way was less than they make in profits) and parts (keep in mind ""parts"" not ""all) of executive bonuses had to be deferred. Basically they walked away scot-free, yet if an ordinary person had done this they'd be shipped off to Gitmo in no time.",910
"Well, that's not why the Iraq pullout happened when it did though. George W. Bush set the Iraq pullout in motion in 2008 by signing the [Status of Forces Agreement](http://en.wikipedia.org/wiki/U.S.%E2%80%93Iraq_Status_of_Forces_Agreement) that set a timetable for US troops in Iraq. The 2011 withdrawal was set to happen before Obama was even a box on your ballot.",16
Catch Obama and Hillary Clinton in a sex scandal.,2
[Obama's Elf](http://www.youtube.com/watch?v=A_B5UrI7nAI),1
"Time is money and when money is taken from us through taxes and spent on things that serve us, it is the same as everyone putting in a bit of time into something everyone has equal stake in.  It is socialism.  It is far more structured than the most basic definition, but it's socialism nevertheless.  

The United States has had fully functioning examples of conventional socialism for quite a long time.  Real socialism, not the bullshit people try to pin on Obama.  ",0
I'm not talking about Obama. I'm talking about the bankers and corporate people who own the US who are hell bent on manipulating the people to be divided against each other. Democrats vs Republicans? It's nothing more than a show that's distracting us while there is a much bigger picture going on. ,-7
"I love the obviously fake ones though, like 'Obama having affair with Hillary'",5
Leave Obama a voicemail. chances are he's busy smoking a cigar and petting a cat but he'll get back to you before he leaves office. ,-2
"
""What is President Obama's ordinal ranking?""

Technically he's inaccurately listed as the 44th president (ordinal counting), in actual fact one (I think Grover Cleveland) was double counted so he's only the 43rd.
",28
"What if Obama gave an actual ""State of the Union"" address? Would it look something like this?
thecheapreporter.wordpress.com",0
"I do not think you understand the concept of ""first strike capability"" in how it relates to mutually assured destruction.
 
The Soviets sent landers to the moon. The US and Russia both built parts of the International Space Station (I suspect that is why it has that name).

So if we can build a space statio  with the Russians, we should be able to build a man site on the moon. 

No...not unless we want to spend tens if not hundreds of billions of dollars. An upper orbit space station is much easier to build and maintain that a permanent manned station on the moon. 

We use the Russian rockets because Congress refused to fund the Saturn V replacement rockets and Obama canceled the Constellation Program. NASA cannot do anything without money or approval.

",1
Obama. ,2
Obama never ran against GWB...,-1
"unlike those thoughtful, wise Obama voters who were proven to not even know who the vice president is...",-3
