"**Attention!** Please keep in mind that the OP of this thread has chosen to mark this post with the **[Serious] replies only** tag, therefore [any replies that are jokes, puns, off-topic, or are otherwise non-contributory will be removed](http://www.reddit.com/r/AskReddit/wiki/index#wiki_--.5Bserious.5D_tags--).

If you don't fall within the scope the question is directed to, please do not reply to the question as your comment will be removed. If the question is ""Bakers of reddit..."" and you're not a baker, your comment will be removed. All top-level replies need to be from someone who is in the group the question was asked to.

If you see others posting comments that violate this tag, please report them to the mods! 

Thanks for your cooperation and enjoy the discussion!


*I am a bot, and this action was performed automatically. Please [contact the moderators of this subreddit](/message/compose/?to=/r/AskReddit) if you have any questions or concerns.*",-2
"I'm not expert but my bachelor's is in history. My little pet projects are convincing people that 1) before becoming president Teddy Roosevelt was a warhawk who was integral in getting us into the Spanish American war totally unnecessarily just so he could shoot people and play cavalry, sort of what we blame Rumsfeld and Cheney for doing, and 2) Paul Revere played an extremely important role the night before Lexington and Concord, and wasn't just another rider. ",87
shrek is love,2
"I love the guy that he steals the phone from - ""The blood test came back... yeah, it's positive. Cool right?""",5
"I used to love doing this. I've studied music since whenever I've had the option to. At school, there was ongoing homework where one had to study a piece of music and write a short essay on it. Holst's Jupiter? Haydn's 'Surprise' Symphony? Sometimes, but I was generally the one to return with The Frail/The Wretched by Nine Inch Nails. Luckily the lecturer was all for it. At least it wasn't Pussycat Dolls.

I think that the more uncomfortable the markers are with the subject matter, the more leeway they give. My masters was on communication, and the big project was on authenticity in music. I'm convinced that neither of my tutors had any clue what I was talking about. It got a distinction anyway, so I can't complain.",3
"Not gonna lie, I have no idea what that ""grab her hips with your hands hard, digging your thumb into her hip bone"" would do. Is that like the end of it? Do you continue with the tongue on clit thing or do you stop that part of it for the hip thing?

I love trying things on my girlfriend, but that made no fucking sense to me. Please elaborate as to what actually happens.",6
"Didn't even know this happened until I saw it on South Park. Thanks Matt &amp; Trey, you make me better everyday!",1
"trans-pan pacific powerplay, you fuckwad",6
"What a terrible game, mostly because I want to say either ""skank or dank"" or ""skunk or dunk"" before ""skunk or dank."" It just hurts me to say it.",1
"As long as every guy I've been with, at least.",1
Star Wars Episode VII: The Cock Awakens,1
This movie isn't a glorification of Apple in the same way The Social Network wasn't a glorification of Facebook. They both examine the flaws in the main characters and don't paint them in a holy light. Don't believe me? Go see it.,1
Sneak into a container ship ,1
"I'm 22 and my mother doesn't understand why I never tell her about my love life.

BECAUSE YOU MADE FUN OF ME ANYTIME YOU SAW ME EVEN TALKING TO A GIRL.",4
Haha Oh wow you really are a woman. Cumming is essentially a given for me every time I have sex it's both a blessing and a curse.  the feeling of having sex right after I cum is pretty hard to describe but it's extremely sensitive much too sensitive for a wet vag! That's why there's that recovery period men have between cumming. Mine is relatively low so I could get back at it in about 5 minutes depending on wether or not I or she can get me hard enough to continue. ,1
"**Attention!** Please keep in mind that the OP of this thread has chosen to mark this post with the **[Serious] replies only** tag, therefore [any replies that are jokes, puns, off-topic, or are otherwise non-contributory will be removed](http://www.reddit.com/r/AskReddit/wiki/index#wiki_--.5Bserious.5D_tags--).

If you don't fall within the scope the question is directed to, please do not reply to the question as your comment will be removed. If the question is ""Bakers of reddit..."" and you're not a baker, your comment will be removed. All top-level replies need to be from someone who is in the group the question was asked to.

If you see others posting comments that violate this tag, please report them to the mods! 

Thanks for your cooperation and enjoy the discussion!


*I am a bot, and this action was performed automatically. Please [contact the moderators of this subreddit](/message/compose/?to=/r/AskReddit) if you have any questions or concerns.*",1
Kevin is a famous askreddit story from NoahTheRed and The swamps of whatever that planet Yoda went to is about a nasty ER story. You can find both by searching. ,3
Kris...Angel,0
"My mom has actually been a substantially outstanding parent and person in general, except for one thing that she's told me my whole life.

""Marry a rich guy.""

I want to believe that shes telling me this, because she herself, having children at a young age, has worked her ass off without assistance or welfare, and she doesn't want me to have to do the same.

But every time I hear it, I translate it into, ""You're too stupid and spoiled to be in college and learn a marketable skill, so gold dig instead because at least you're pretty."" 

I know it sounds like a personal problem, but its the situations shes said it in is what makes me believe otherwise.",2
Not really. It's weird to have a fascination with mass killers and anyone who wants to know more should be prepared for suspicion. ,1
"I always see this response when the issue of ""sagging"" comes up on reddit, and it really confuses me. I still see it constantly. Everywhere I go. Is it just a regional thing now? (I live in Virginia)",2
Wolf Creek they ass.,1
"My boat, bought back in 2008 and every summer has been a blast since.  Met my future wife on it and made many friends and have entertained clients.  Best ROI ever (fiance is a doctor and closed many deals and met new clients out on the water)",2
"They continue doing things which make me cringe. 

Assholes.",2
We would all likely die due to infections coming back from the dead.,1
"Totally. In fact, it's almost more likely because people that sign are prone to more exaggerated facial expressions and movements, so the absence of any of that would be more noticeable. ",1
"I hate getting anxious and sweaty, so I need either benzos, opiates or alcohol when using it",2
"Your ignorance is showing. Cars are constructed by humans. Concepts are human constructs. Can you see the difference? One is matter and will kill you, the other is an idea. 

So, you need to sharpen your English, and you need to learn the difference between matter and ideas.",1
Reddit. Lighten up about reddit. ,2
It's online gonzo journalism. ,1
"My friends and I have a different system. Driver drives, first one to shout shotgun gets front seat and first one to shout Aux gets the usb cable to play music. Ofcourse this is strictly between the five of us. ",1
...you didn't get out and move it?,-1
Look up the Shakespeare Insulter and the Martin Luther Insulter. They give you lines that are insults from each of their respective writings.,1
Cheers mate 🍻,1
"Take a walk, scrub. ",28
I've been there.,1
"Hmm. Nope. Not saying I couldn't use some therapy or that I shouldn't have left earlier, but you're clearly just filling in things from your own experience. The idea that she had some need to feel dominated is flat out hilarious. This happened years ago. You ARE just an internet stranger. Please don't assume you know everything.",1
"1)  If it really upset me to the point that I was ""triggered"" and tried to get the person fired from their job, I would not be fit to be an adult in the world.

2)  Let me rephrase:  I don't care what ""gender"" you call yourself.  You were born a guy or a girl.  Whatever you sleep with, dress like, etc, fine by me.  But these fucking Tumblinas need to stop saying it's ""transphobic"" if I don't desire to fuck someone who was born a guy then decided to be a girl.",0
Optimism  is my greatest quality ,1
"Late to the party but still:

Science should NEVER be based on religion.

Science should be based on what can be observed, faith and anecdotes have no place in a lab or in any equation.",2
"Alright you smug bastard, I'll bite. What is Dr. Strong?",1309
"If you don't seem like the kind of person who'd go for it (or you seem like the kind of person who would report it), the risk might not be worth it.",5
"By living things I assume you mean humans, deer won't start a civil war just because he had sex with the others wife",1
"Thanks, I'll try that tomorrow night! TGIF!!",3
Oh Michigan...,1
"I have been groped by so many women when I was a uni student dancing it was crazy.  Also I was shy as fuck,  didn't capitalise on it at all. 

I used to dance very well and ignore everyone female and so they invariably entered into my part of the dance floor because every other guy was skeevy and lecherous as fuck. Women would usually back up to me even when there was clear space and I'd ignore them,  which made it happen more and more,  touching and butt grabs and so on. All one way,  them to me. Have you ever been the centre of a group of girls attention?  It's pretty addictive in all honesty. One time even a hard 9, but that's a story I can't tell. 

Anyway It's been a few years post uni and I went back with some old coursemates to the same areas clubs for the first time to see if it still happened and unfortunately it did not. 

Made me realise I need to get back to my uni looks, confidence is not enough even if you can dance the same as you did before ",1
wow interesting one xD,1
"He was a *massive* racist douchebag.

Also I'm pretty sure there is a picture of him and fellow soldiers with Waffen SS insignia on their rifles and uniforms....

But who cares CUZ MURICA, SAVAGES, TERRORISTS, 9/11, AND FUCK YOU 

EDIT: I had a Freudian slip, for some reason I thought Kyle had an SS tag, not the Punisher logo. It's because of photos like [this] (http://www.whereexcusesgotodie.com/blog/wp-content/uploads/2012/02/Vacation.jpg). Still ridiculous though, it might as well be a swastika.

EDIT 2: So apparently the SS logo is used by the marine scout snipers. *So badass*. That's *literally* retarded, I don't care what the reason is, why not use the swastika too? What would all of the soldiers who died fighting nazi germany think about that? Fucking disgrace. Also, if you have never been in the military you can't criticize it because you've never been shot at enough to have a valid opinion. I'll just leave [this] (https://www.rt.com/news/marines-nazi-flag-scandal-965/) here, that last paragraph though! ",252
Yeah the being unfamiliar with it makes sense I never thought of it like that( IV lived with girls my whole life and am so desensitized to it) . But I mean if your ok with eating a girl out then pee hole bacteria is not a valid reason for not liking period blood in particular. Then again there are plenty of guys who won't even eat their girl out so there is that too...,0
"I vaguely recall reading somewhere that they actually didn't tell Jason Segel what would happen at the end of that episode, so his reaction was a natural response rather than scripted.",20
the food court menu is always changing,2
"That is sick part about golf, you can shoot 120 but if you stick one tight on 18 for birdie, you can't wait to get back out. ",2
I conquered ( ͡° ͜ʖ ͡°),19
"He most likely is, but it is just one of those things that makes you ask  the question: Why?",1
"Dewalt power tools, Milwaukee is now superior in almost everyway.",2
I think it's entirely possible that they spent more on the commercials and Kate Upton than they did on actually making the game. Not to mention that putting random sexy women in adds that have nothing to do with them is incredibly trashy.,1
"come on man thats not even enough to encompass what she was conveying. 

/u/bubbles_says is the more correct version, but man the most important part no one included is the ""people will forget what you did for them"" because it reflects the truth that people so often forget the sacrifices and effort you give for them, but they don't forget if you made them happy or sad, safe or scared, neglected or loved.",0
Nobody is going to die of asphyxiation from a candle in their car.,2
"The problem with obese people is that they want to be accepted but i've heard about and seen on multiple occasions fat or obese people criticizing people who aren't obese by saying ""why are you so skinny? You should eat more, boys don't like that."" So they want to be accepted, yet they criticize everyone who ACTUALLY takes care of themselves and want to be healthy, and also, they expect some sort of special treatment as if them being fat wasn't their decision due to their lack of self control, i understand that in certain scenarios its due to health conditions and those things are understandable but to put the only body that you're ever going to have at risk just because you cant control your own appetite is pathetic to me, human beings evolved to have the best stamina on the planet and theres people who cant even get up a flight of stairs without being out of breath, some cant even manage to walk up the stairs so they wait for the elevator to go up by 1 floor, these things are ridiculous and should not be hindered by the reason that people cant accept the truth. If they want to be accepted for being fat then they should accept the fact that they're most likely going to have a shorter life span and that they're not healthy at all. ",1
"I'll still come home to find my mail opened left on the counter. I remember when I first registered to vote, I was told my voter card would be mailed home. I never got it. I ended up using my driver's license to vote. I found my card in the recycling bin a few weeks later. My mom thought it was just junk mail.",6
I wish I had administrative control capabilities.,4
Oh man. You haven't truly enjoyed a musical until you're in one. I did pit orchestra for musicals and it was the most fun I had playing music in my life. I get so happy thinking about it.,1
I worked in a residential program for juvenile offenders.  I had to tell one kid his grandfather died.  This was even harder because he was from a broken home and his grandfather acted as his father.,2
I would assume because they don't want to be liable for giving advice while not knowing the entirety of a situation. ,1
"**PLEASE READ THIS MESSAGE IN ITS ENTIRETY BEFORE TAKING ACTION.**

Your post has been removed as it either violated [Rule 1 ](http://www.reddit.com/r/AskReddit/wiki/index#wiki_-rule_1-) or [Rule 2](http://www.reddit.com/r/AskReddit/wiki/index#wiki_-rule_2-). Please check that your post doesn't contain the following issues:

* **Your own answer to the question goes in the comments as a reply to your own post.  Your post will not be approved unless your own answer is removed from the text box.**

* **You must post a clear and direct question, and only the question, in your title.**

* **Your post can't be specific to your situation or involve a story. Please make sure to depersonalize your question and remove any unnecessary context before posting it again.**

Use the text box to explain your question if necessary, but do not use it to share an answer, add unnecessary context to the question or include your personal story. As the submitter, any answers or stories go in the comments section as a reply to the post. This is to allow for users to distinguish between the question being asked, and the submitter's answer, when voting.

Please note - once posted, the titles cannot be edited. If your title breaks the rules, please feel free to make a new post that fits within the rules.

[**When you've removed the answer or unnecessary context from the textbox, message the mods for review and reapproval**](http://www.reddit.com/message/compose?to=%2Fr%2FAskReddit&amp;subject=Post+Review+Request&amp;message=My+post+was+removed+under+rule+1,+please+review%3a%0d%0a%0d%0ahttp%3A%2F%2Fwww.reddit.com/r/AskReddit/comments/3qhxhs/which_meme_do_you_wish_would_just_die/) and ask the moderators to re-approve it.


*I am a bot, and this action was performed automatically. Please [contact the moderators of this subreddit](/message/compose/?to=/r/AskReddit) if you have any questions or concerns.*",1
"Greg lives in a pineapple under the sea
Spongebob Squares
Absorbant and pourous and yellow is greg
spongebob squares
",1
So what was it that she smelled in your suitcase?,1
Religion,2
"Its really tastey, really refreshing",2
"In that case, I'm pretty sure you mean power &gt; honor. ",1
Did you eat it?,1
TIL Sandwiches taste better when made by Hot Chicks.,2
On the driving range I'm a 2 handicap. On the course I struggle to break 80. Golf is maddening. ,2
"I wish I had figured this out before marriage, home loans and offspring prevented me from following your example.",1
Arguing aboit stupid shit with your mates. Everyone just googles shit and proves me wrong now.,1
Can I get an 8-4-4 continuous please?,1
that sketch looks like stephen harper.,1
Right? I have no problem making the first move. I also get satisfaction out of buying a man a meal or even paying for a date. I had an ex flip out on me once because I offered to pay for his food.,14
thats right. It can be spelled either way in my native language.,0
"Not true, we use the thing everyday. The Dutch eat a lot of cheese",3
"Huh. Weird. My car (a mini cooper) won't start the radio volume above half. You can crank it to 100%, turn off the car, turn it on, and the volume will be at 50%. ",1
What if he's an IT doctor?,1
Spend time with people that I love.,2
Ah yes. Being a kid in the passenger seat of my dads old truck with this on cassette. The following song was American Pie,2
"I flew to Australia with $3000 after a really bad breakup and backpacked around by myself. Ended up engaged, finishing my Masters soon, and  snorkeled with turtles in the Great Barrier Reef for my birthday this year. A+, would recommend.",1
"Holy guacamole, I can't imagine. That is truly terrifying.  ",1
Instead of noises I just make Donald Trump faces.,2
I figure anyone in those times would totally go along with the attention he garnered lol he would pretty much be the equivalent of a celebrity.,1
"I always find water to be the most beautiful thing when it is a very hot day and I've gone a long amount of time without anything to drink. At a certain point, when I am truly parched, all other beverage options become like sludge next to clear, glistening water. And Oceans are a tease.",1
"You go to the Chief, and you ask for a new partner. Tell him you're just a few days from retirement, and you're getting too old for this shit. ",2
"Luckily Farscape got The Peacekeeper Wars miniseries to wrap it up, or I would have been ENRAGED",1
"I have voted in every election since I was 18.  A lot of years.  Where I live, we have had mail in ballots for years.  I am voting tonight while I browse Reddit.  It will go in the mail tomorrow, so easy.",2
"Damn, that is a [good song](https://elhuervo.bandcamp.com/track/daisuke).",2
Is it bad that i knew which gif it'd be before i clicked it?,8
We don't want to think of ourselves as poor or privileged. ,4
"Their coverage of the Charlie hebdo massacre was all I needed to see.  When they sent thay memo to all of their writers telling them to avoid calling them terrorists and not connect the shooting with Islam in their articles....Fucking sickening.  All the correspondents obliged too, besides the American one. ",1
"Also, nothing we do actually matters",2
Getting karma. I guess I am just not cool enough. ,2
"Any super common last name used as a first name

The kid will suffer a lifetime of people making stupid mistakes when they mix up the names",0
"I like your style, your incharge of executions if needed.",2
Do we have the same dad? ,1
LMAO! I would buy that kid a beer!,0
"Sacked/quit
http://techreport.com/forums/viewtopic.php?f=2&amp;t=85582
Also a google search shows another cpu architect 'leaving'",1
"I live in the UK and I found a site that sells army stock. I haven't bought anything yet so I can't vouch for it's quality but it is military. They sell some excellent looking stuff at really good prices.

http://www.ex-mod.com/ Found it for anyone interested.",7
"Neil theBoss Tyson says it best I think http://youtu.be/5xvILvxYbFA

If 7% of the best scientists in the world pray to a god, would the average Reddit browsing atheist schmuck have any right to question their intelligence because of their faith?",3
"The watcher in the water / tentacle beast thing from Lord of the rings.
  
Honestly *what the fuck is that thing and goddamn it why is it there??*
  
Edit: Formatting",1
"As I mentioned in another comment this is more of a joke, but I've found it scarily valid. I don't think this is a causation, but some kind of correlation. Although for some people and hats this might be because the hat does shrink their field of view.

Also I'm not talking universally, but this is a common thing to say here in Finland. Your hat wont fade here driving a typical car :)",1
"You and a friend paint your faces orange and get a chain to both of your ankles and stand 10 yards apart at all times. 

Football yard chains. ",1
"Its not because you're old, it makes no sense to me either. ",1
"Yeah, there was a similar thread recently. Thanks for remembering!",79
"I think you're being harsh. I'm sure this person didn't mean 'get over it' like forget about it and never think about them again.

They could have meant how long until you can get back in to your normal routine/not be horribly depressed.",5
"Led Zeppelin. Must haves are ""Whole Lotta Love"" and ""When the Levee Breaks""",1
"Slavery/Human trafficking. Yes, it still exists, and is booming in some areas of the world.",2
I'm now married to an underage girl.,2
Only if you drink enough of it. ,2
As long as you don't snuggle the kittens up to your cheek. Those sharp little claws. . . .,2
I resent that I work my ass off in retail and get paid less than those guys.,8
I would travel to every mountain range and heli ski as much as possible,1
"Hello 2015! 

1985 here! What's it like all the way in the future?",3
This is brilliant ,10
"Right, but it's only my death I care about. If everyone but me would die, I'm sure I could find some meaning laying around and I'd probably get real good at guitar ",7
"I haven't gone to bed yet.
",2
only if you're planning on living in ZARDOZ,2
Good on you. I try to do the same but am sure I can do more of it... Anyone helping you is pretty awesome.,1
"**PLEASE READ THIS MESSAGE IN ITS ENTIRETY BEFORE TAKING ACTION.  YOU HAVE FAILED TO ASK A QUESTION IN YOUR TITLE**

Your post was removed as it looks like you failed to ask a question in your title. Double check everything, including punctuation, and try posting again. 

* **If you're wanting to tell a story or explain something, please try /r/Self.**

* **If you're needing advice of any kind, try /r/advice or /r/needadvice**

* **If you're looking for a fact based answer, try /r/answers**

* **If you're looking for something that has slipped your mind, try /r/TipOfMyTongue.**

Anything else not covered try one of the subreddits mentioned in our sidebar that better suits your needs.

If you need more clarification, or feel this was an error, please contact the mods and provide a link to this post, thanks!


*I am a bot, and this action was performed automatically. Please [contact the moderators of this subreddit](/message/compose/?to=/r/AskReddit) if you have any questions or concerns.*",1
Music scene by blockhead,1
When you invite someone over for dinner and they start to say grace and you just have to sit through it politely. ,0
There's a  troll doll in there!,1
"Fuck no, it's cold af.",12
"**PLEASE READ THIS MESSAGE IN ITS ENTIRETY BEFORE TAKING ACTION.  YOU HAVE FAILED TO ASK A QUESTION IN YOUR TITLE**

Your post was removed as it looks like you failed to ask a question in your title. Double check everything, including punctuation, and try posting again. 

* **If you're wanting to tell a story or explain something, please try /r/Self.**

* **If you're needing advice of any kind, try /r/advice or /r/needadvice**

* **If you're looking for a fact based answer, try /r/answers**

* **If you're looking for something that has slipped your mind, try /r/TipOfMyTongue.**

Anything else not covered try one of the subreddits mentioned in our sidebar that better suits your needs.

If you need more clarification, or feel this was an error, please contact the mods and provide a link to this post, thanks!


*I am a bot, and this action was performed automatically. Please [contact the moderators of this subreddit](/message/compose/?to=/r/AskReddit) if you have any questions or concerns.*",1
And I used to be the guy who loved selling you that gear!,1
Yup. October 2013.,2
Everything.,0
Any fuck the Patriots/Tom Brady post. Jets fan.,2
Probably just sit and stare off into space like I normally do when I have a long wait ahead of me. ,2
Nathan Fillion. Just seems like overall an awesome guy. One I'd love to grab a beer with.,1
"No one cares about your apology, just stop doing it.  You are not a slave to your feels.",5
"Baby talk.


Believing in astrology and asking you about your sign",2
The kid said there and not their?,1
Sorry  but by the time I read this I already found the spider orgy. ,1
