"well, the problem is that people actually believe that islam has something significant to do with 9/11. people don't think christianity had anything significant to do with the kent state shootings, oklahoma city bombings, waco, unibomber, the kennedy assassination, the assassination of malcolm x, the assassination of martin luther king, etc.

it's like if someone goes out in the street and says, ""fuck bush! we should tar and feather, then lynch that cracker!"" it's sort of different than saying ""fuck obama! we should tar and feather, then lynch that nigger!""  it's not some fucking conspiracy that favors black people, and neither is the problem with burning the quran on 9/11 because muslims in new york city are renovating their mosque.",1
"The answer is ""not quite"" -- but for the first time in history, it's a good question. 

To put it succinctly -- the big battles are done, and that's a great thing. However, there are a kabillion tiny little skirmishes to go.

(Pre-Obama, I found that black people would often lament that there's no ""black leader"" -- my response was always -- we don't need one, we need thousands, and it can be you and me.)",1
"Seriously though this really bugs me about disappointed Obama supporters, I understand their frustration, but how can he convince enough people to vote for important issues when all you need is 1 Republican to threaten a filibuster, on every damn issue!!! I mean its all part of the republican strategy, stall Obama's administration, and in 2 years they can have a way better footing to win back the presidency.  Its really disheartening to see how well this plan seems to be working :(",3
"People vote for a president not because he's an unselfish person or a smart guy.  They vote for him because they want him to represent them and push their agenda.  Problem with Obama is that he's not fighting hard enough for the agenda that the people who elected him want, but tries to play for a consensus.  Is trying to get people together a bad thing? no, is alienating your supporters because you want consensus rather than conflict going to affect your popularity among those people? yes.  Politics has nothing to do with doing the ""right"" thing or being an ""unselfish"" person, politics is politics.",2
"Hit him where it hurts.
One of his daughters - Mary - has cerebral palsy.
His mother - also named Mary - killed herself by drowning.
Have someone wear a T-shirt that says MARY on it, and then have them make fun of a cerebral palsy person, while pouring water down their throat and making gurgling sounds.
I think it is entirely appropriate that someone make fun of his daughter after he made fun of the Obama daughters.
More details here:
http://en.wikipedia.org/wiki/Glenn_Beck

",-8
"&gt; It didn't work out.

Yeah the Obama administration is going pretty poorly!",12
"I went to a suburban public school in the OC. My previous school was pretty much white and Hispanic even though it was in Irvine but it was pretty diverse and accepting. My new school was 80% Asian, more specifically Korean. Even though the new school was considered better, I had never faced so much racism, sexism, classism and homophobia in my life. A lot of my classmates didn't vote for Obama because his name sounded like O-bomb-ah. OMG there's a bomb in his name therefore he must be a terrorist. These people were in AP courses and went to universities and ivy league schools.

TLDR; My public school was filled with dumbasses.",1
"Unfortunately for all of us... not really. I feel like the word ""communist"" is like the word ""communist"" from the 50's - still referring to a typically ""white"" ideological construction, whereas the word ""terrorist,"" I think, if you'll forgive my coarseness, is more akin to the word ""nigger,"" as used in the early 20th century. The difference:

If you're a ""communist,"" we have a trial and get you ""blacklisted.""

If you're a ""nigger,"" no ones going to care if we hang you, regardless of your guilt in whatever we blame you for. 

Essentially, the term ""communist"" is still deployed in a political context (we can assume that it subsumes terms like ""socialist,"" ""fascist,"" etc), i.e. - ""Obama is really a communist"" (ways to rectify this - impeachment, obstructionism, etc). The word ""terrorist"" is deployed to talk about someone ""outside"" of our legal/political structures, someone who is able, without question, to be kidnapped, tortured, killed, indefinitely imprisoned, whatever we (in a rhetoric sense)  ""need"" them for. i.e. - ""Omar Khadr is suspected of terrorism, and that's why we've held this Canadian in Guantanamo Bay since he was 15 years old... six years ago.""",2
Barack Obama will not win a second term in the White House.,5
"Have him get an internship.   A daily newspaper in a city somewhere.   We always like interns.

He'll get brutal honesty.   Typically not from editors, depending on the daily, but rather from the cold, lunatic sociopaths who comment on daily news articles; the borderline literate subscriber who will give their opinions because they have a goddamn opinion to give, goddammit and why the hell didn't y'all print my letter to the editor about Obama being a sleeper cell terrorist in response to the article ""County Commissioners Dedicate New Dog Park to Senior Center"" which was written by an obvious COMMUNIST and there isn't ANYTHING WORTH READING IN THIS PIECE OF SHIT RAG ANYMORE AND YOUR PAPERBOY IS AN ASSHOLE WHO COULD LOSE SOME WEIGHT GOD BLESS.

I'll bet you a pizza he won't want to be a journalist after he sees what it is that we do all day.",2
"I assume you're British, and are talking about Clegg.  I'm not sure how British democracy is doing these days.  In America, I think we're fairly screwed.  Even, Obama, who was supposed to be this big harbinger of change, and the Democrat congress, have only seemed to be working toward minor beneficial changes, while leaving the actual larger problem firmly in place.  (i.e. ""Health Care Reform"")",2
"Why would you go on such a huge accusatory crusade about something you're not even sure of?  ""Obama didn't show us his birth certificate, so he's not a US citizen"".  Are you antisemitic?  ",0
"I think you misunderstand me, somewhat;

My initial assertion was that, Obama could have been promoted as the first mixed racial president. He wasn't, arguably to pander to voter perception.  Mixed race wouldn't have sold to the young, or the minorty vote. I also believe that his mother has been downplayed significantly, for the very reason that he needed to be perceived as 'black' by his voters.

As for context, I am fully aware of the white dominated media, and the underlying reasons behind ethnic festivals and parades. I do not have any ill feeling towards their existence, or right to exist. I don't have issue with BET. I do feel that there has been a lot of overcompensation made for injustices of the past, and all US caucasions have fallen under the term ""whites"". In that context, a person cannot embrace membership in that group in the same way a person can embrace being a member of the ""black community"".

I spent a large portion of my early life in relative poverty, in predominantly black neighborhoods. I have no hatred for any ethnicity. I am not looking to come across as a white supremist. I have lived and played with blacks, and latinos. I know intimately what it feels like to be a minority.

I also have a pretty decent insight into the underlying cultural values of these demographs. If Obama had not been perceived as ""black"", he would not have had the black vote. If Obama had been presented as interracial, or mixed race, he would not have appealed to young white voters, who have been brought up to feel that embracing ethnic diversity (specifically black diversity) is more important than cultivating a society that is fair for all. 

Obama's campaign was engineered to seduce as many voters as possible. His image was groomed to connect with as many voters as possibe. The result is this: In the US, half black = black. that is why I am irritated with his title as the ""first black president"". Obama's personal views on his identity are irrelevant. He is the ""first black president"" because the majority of his voters are most comfortable with that.  (I am aware that all presidential campaigns are like this, and that is another rant altogether).

*""Let me ask you something? I'm the mayor of a town...you come to me and you want to ""celebrate white heritage"" tell me what are you going to propose to me that isn't done for the other 364 days of the year?""*

I don't feel that white heritage needs a festival, or celebratory event. I do; however, feel that there should not be shame in feeling comfortable and proud of one's heritage...regardless if you are white. There should be no shame, or guilt.

Additionally, I wanted to compliment you on your succinct, and well thought-out response. 





 



",1
"There's a website that one university made that allows you to compare different cohort groups in different countries. The summation was this. In Europe, you have a slightly better chance of reaching old age due to the ease of attaining checkups, preventative healthcare, etc. In the U.S., you have a much higher chance of reaching 95 once you get past a certain age.

That's also why universal healthcare isn't going to cut costs unless we dramatically decrease care for the elderly, which ain't going to happen while the boomers still have breath in their body. Something like &gt;75% (I'm spitballing here. I don't remember the exact number.) of healthcare costs occur after 65 (spitballing again). In Europe, you get a moderate amount of healthcare for your whole life, but you have a dramatically more limited range of treatment past a certain age. You have a much higher life expectancy in the U.S. when you are old. Call it what you want—maybe it is more realistic to cut our losses—but the people who are being sold on universal healthcare (elderly) aren't willing to make those cuts.

The result is typical. Any reasonable tax for healthcare would have had the young paying the least for obvious reasons (less likely to use it, lower salary, etc.) and the middle aged paying the brunt, but AARP still got Obama to limit it to merely 2 times more. The result is that Obama's healthcare plan will result in a massive disproportionate burden on the young, who are already getting screwed by a poor job market. The boomers want everything: the kind of dramatic end of life extension care that they are used to now but at the cost of European universal healthcare.

You're free to look for my source. I actually posted it a year or two ago to /r/economics, but I'm not going to hassle my self by looking it up.",2
Stereotypes exist for a reason...and everybody is at least a little bit racist. EVERYONE. Yes that includes your beloved Obama.,2
"It has nothing to do with guts. There is only one person right now who is the president of the united states. Words are cheap when you're not in the position to actually do anything, that's why bush fucked everything up so spectacularly, he liked to talk and didn't care that his words actually meant something.

Obama's party is criticizing him for not pulling a bush and just ""doing things his way"" but what they don't realize is this solves nothing. Please the liberal minority of your voters and guarantee you don't get reelected while also destroying any credibility in the democratic party. Give the conservatives and republicans a huge % of the vote next election because the entire conservative/moderate public will say ""wow Obama didn't even care what we thought"" **AND** when they're back in office they have an excuse to say ""we're gonna do whatever we want because that's exactly what the democrats did."" At least Obama's administration is trying to restore political order in congress instead of just making everything even more partisan.

He's taking the road that makes him the bad guy in everyone's eyes but it's really just the public getting the medicine it doesn't want to take. Conservatives are going to hate him no matter what. Moderates are going to wait for him to do something radical so they can say ""whoa Obama, too far"" (remove troops, DADT) and liberals are going to bitch he's getting nothing done.

In the 2000 and 2008 elections both winning candidates lacked the support of nearly 50% of the voting public but apparently just winning means you're supposed to ignore that and do whatever the fuck you want. Bush did that and now almost every problem that is headline news is a remnant of his administration. It's a lot easier to fuck something up than to fix it.",16
America has very bad people running the country. . .and I am not talking about Obama. . .I am talking about the corporate masters behind the scenes. .,1
Look at this NSFW picture of Digg going over 9000 with John Stewart tearing Palin a new asshole on Fox news with legal marijuana and gay marriage...Obama.,5
"You're welcome. It's a good question. In some ways, the link I provided is an under-representation of what Obama has accomplished, given that it looks only at campaign promises. For example, in her [interview with Jon Stewart](http://www.indecisionforever.com/2009/05/15/jon-stewart-interviews-epa-head-lisa-p-jackson/), EPA head Lisa Jackson remarks on the fact that most of her time during the first few months of her term was spent undoing Bush-era environmental deregulation. I'd consider that an Obama accomplishment.",3
"I was talking about the draft metaphorically.  Putting them up on a stage and letting the white owners go after them and lock them into contracts.  They then have to move to wherever the team is and leave behind their extended families.  Sure they'll have riches for a few years but most file for divorce within a few years of retirement and most are broke a few years after that.  

Unfairly imprisoned yes.  But what most people don't understand is that when a crime is committed against someone, the police are required to bring in any suspects in the surrounding area matching that description to be identified.  So if you say a black man robbed you, they'll bring in every black guy in a  block area they can get.  Now, let's say you're a black guy a couple blocks away from a crime and you have some weed on you but you weren't involved in the crime, tough luck.  Of course, I agree with Bil Cosby and Obama on this, it's not entirely the system's fault.  In my scenario above, which I've seen happen, while the other people didn't commit the crime in question, they were committing a crime. 

On top of all that, if you've ever been in charge of hiring someone or have dealt with that, then you know all the incentives for hiring a minority.  Even people don't fill out a questionnaire asking them their race, a good recruiter will look at activities to see if they were involved in a black fraternity or community group.  

Bottom line, with anything else in life , if you want to succeed, you gotta make it happen.  The system could change, but it's not going to educate you any more than you educate yourself.  Drug offenses might get lighter penalties but you still shouldn't be carrying.  Put yourself in a position to succeed.  It's like they say in Poland, the best way to succeed is to just not drink. ",1
"It's so awesome that Obama made it possible for you to visit your ""wife"" in the hospital. 

Why are you not joining her? I can only guess it's because you have a work-related conflict, but I didn't think P.E. teachers had parent-teacher conferences.",0
"Case in point, [Raleigh Times](http://www.raleightimesbar.com/): Hipster Central, Great Beer List

The beer list even cycles fairly often, so you could even talk about that beer that was ""so great, but too bad so few people ordered it before they took it off the menu"".

Edit: [Obama with a PBR in Raleigh Times](http://thecaucus.blogs.nytimes.com/2008/05/06/raise-a-glass-to-the-tired-campaigners/)",1
Barack Obama gave me the same advice.,13
"Obama's performance, obviously. The pushover is a sitting D senator while the arrogant idiot is a sitting R senator.

The guy behind them in the clown suit chuckling is a teapartier who has removed the nails from the R's barstool while noticing the D is tipping his stool over anyway.

tl;dr: The focus Jon Stewart's show from the last week of September.",2
"I feel like he decline accelerated following Watergate, which is sort of when we stopped viewing presidents as honorable. Traditional non-voters really came out for Obama, though, who pushed a very positive message. May be worth looking for a correlation between approval ratings(?) and voter turnout, though causation would probably occur the wrong direction there.

Also, is there a demographic shift happening? (Looks like that's not the cause, but it's an idea: http://www2.parl.gc.ca/Content/LOP/ResearchPublications/2010-19-e.htm )",3
Only thing I found was that Obama does not have one =/,2
"She is too naive and stupid, there maybe some backlash against Obama from both sides, but he is way to charismatic to lose to her on any sort of platform.",2
"Sean Connery, Patrick Stewart, and President Obama.

It's be entertaining, at the very least...",1
"People that drive too slow. The general attitude of disdain that Police Officers seem to have for anyone who isn't one of them. People who want to shove their animals in my face. People that talk too much. Loud people. People that cut me off on the road. People that won't mind their own business. The religious. PETA. People who try to force their morals on me. A dog barking or growling. A dog on my property. Old people thinking that age=wisdom. Hardcore Republicans/Democrats. Snobby Europeans. Islam/Christianity/Hinduism/The Greek Pantheon/etc. People who live in a shitty situation, bitch how it is shitty, then actually become part of the reason that it is shitty. People who think Ronald Reagan wasn't one of the worst presidents ever. People who believe Mr. Obama is one of the best. George W. Bush. Mitch McConnell.

There are more things that do I'm sure.",1
I can't imagine Hillary having done much differently than Obama to be honest.  What exactly do you think she would have done differently to this point?,1
Obamacare.,4
"&gt;Tell that to Obama

Did you just cite a statistical outlier, the President of the United States, as a counter-argument to my claim of the general case?

&gt;If that person is a racist, they accept it

I guess you haven't seen anything from Stormfront.

&gt;Wow, this is nowhere near true in my experience. 

I think it's clear that our experiences differ and we'll just agree to disagree.

",1
"I'm mostly referring to public education there.  You know, evolution = atheism, Obama's message to school children = join Obama's socialist revolution, etc.  All nonsense.",0
"I knew this was gonna happen. This is not a good thing. 

The idea is anonymity. You can post a letter to your senator anonymously, so why cannot you make a forum post about him anonymously? 

Reddit would be foolish to think of this as Obama vs others. Its a privacy issue.

",-4
"What is the number of the Devil? 666

What is Barrack Hussein Obama's number? 676

What is Hillary Rodham Clinton's number? 766

What is Julian Paul Assange's number? 646

Together they make up the anti-christ's in our US Government as far as I know today.

Take subtract 1 from the 7's in the first two and add 2 to the middle of Julian's name. What do you get? 666

My guess is that Assange is hiding in plain site, so do not allow evil to take the nobel peace prize. It is as simple as that my friends.

And that is THE WORD

Also, if you deny my authenticity, please test my newest theory. Wear blue and white and see what happens when you follow blue and white in your every day life. You will be amazed to discover what you find. What do you got to lose? ",1
"I don't care nor do I pay attention, but to expect anything other than corruption all the way through is pretty damn naive. We've (the west) been fucking with other countries for so long now, paying them off, starting wars, what we (the public) see is nothing like what *really* happens. If obama and bin laden regularly meet for a jerk off I'd not at all be surprised, we're all beyond fucked. 

Wikileaks did nothing. ",1
He's an overly conservative republican who thinks Obama is gonna plunge our country into darkness. That should say enough.,1
"President Obama, I met him here in Austin before he won the election.  It was very brief and I had to elbow my way through a crowd, but I made it.  The coolest part was, I had to stretch my arm waaay out past two people crammed in front of me.  

He sees me reaching out and goes to return my handshake, when suddenly the douche nozzle in front of me jams his hand out and intercepts him.  At this point I'm going, ""Hey Barack!"" - he shakes the other dude's hand and then, with his arm outstretched, waits like five seconds for me while I'm struggling.  Finally I was able to get a good firm handshake in!  

Whenever I think back on that moment, it still impresses me how he waited to shake my hand.  He didn't have to do that, the place was an absolute chaotic mob.  That, my friends, is CLASS.",2
"Some criticizing is fine, but all day , everyday 100% negative about everything he has done. You will never hear them say "" obama did a good job at this"" 

The issue is republicans just hate obama, even if he did something they liked, they would find a way to hate him",1
"&gt;Meanwhile, he's sending more army-men with weapons to foreign lands pissing away more money on wars and every kind of intervention to enrich certain corporations.  

This is an incredible overgeneralization. Obama is drawing down in Iraq and is increasing operations in Afghanistan as he promised in the campaign.

&gt;he even gave away lots of money to the BANKS...and now he's putting on a good SHOW, saying it should be given back!

The bank bailout was started by the Bush administration and went threw with the approval of congress. Since Obama supported it in his capacity as senator he is partly responsible for it but it isn't like Obama had sole control over how the money was distributed. As for what Obama is doing now can you give some logical informed argument against it or is this some uninformed knee-jerk reaction?

&gt;Don't believe the HYPE! Don't believe the HYPE! Don't... Don't... Don't believe the HYPE!

The hype here seems to be coming from you.",5
"&gt;Wait, Obama *said* that? I love him!

&gt;`GOES TO NEXT THREAD.`

&gt;Wait, Obama *did* that? I fucking hate him!

What, you hate my formatting? =[",3
"My in-laws are horrible Glenn Beck supporting, right wing loving, Obama hating, ultra conservatives. Every discussion is about how America is going to hell and turning into an awful socialist country. The same man and woman also funnel their income through their children so they can be eligible for state aided healthcare. ",29
