"I'm a USian living abroad and I can tell you I think it's quite the opposite.  You hear the words ""Barack Obama"" and ""US officials"" on the radio news just as often as you hear the words ""Prime Minister"" and ""David Cameron.""  I don't know if I've ever heard about the British government on the radio at home, but over here they're reporting on nearly everything that Obama does... like when his wife planted that garden.  ",1
"To OP:

Not the same thing.
Drawing affected religious extremists, instead of the average sane Muslim, who doesn't care about drawings. 

Burning the Qur'an does affect the perception of the average Muslim ( and indeed the rest of the world) of America, and sends a message that the cornerstone of their faith is unwelcome.

Hate to say this. But as much as freedom of speech is a good thing. It should also be condemned in some cases. If someone threatens to assassinate President Obama, they would rightfully be monitored and if necessary taken into custody. Thus, some things are not and should not be put under the guise of freedom of speech.
",1
"I completely agree with what you're saying. 

That's why I said that the sweeping change that myself and other Americans expected was not realistic. That's also why I said he's done a lot for the country but is still bearing the brunt of the nation's anger because things haven't changed fast enough (though it's not Obama's fault). 

He said what he wanted to change, and to the American public, those statements sounded like promises. The inability of the right and left to work together to make even the least controversial reforms is despicable.


I think my initial comment didn't really reflect my views. Sorry about that.",1
"I had a long discussion with a British girl who was trying to convince me that Obama was 100% Muslim. She didn't think it was a bad thing. She just refused to believe me (and yes, I'm American) that he wasn't.",25
Mecha-Obama,1
"Yes. There is a fundamental lack of historical cohesion in the United States.  The story of the West (settled by outside individualist pioneers with nearly unlimited resources) is not the story of the East (former British colony, revolution, historical center of 'culture' and 'money' and 'government').  The story of the South (agriculture, slavery, lost) is not the story of the North (industry, density, won).  Texas clings to its heritage as an Independent Republic, as another example. The last states to join the Union were admitted just 50 years ago.  Arizona has been a state for less than 100 years.  And so on.  

For the United States to function properly, the people of the United States need more time, more common history, and more concern for each other. And I don't know if that's going to happen. 

I think of myself as being pretty civic minded and politically aware.  However I live in the Northwest and as far as I'm concerned the rest of the country can go fuck off (particularly the Supreme Court and Scott Brown-electing-Massachusetts - thanks a lot assholes!) and leave us the hell alone.  Dunno if that's going to happen though.  If I feel that way, I can't imagine that some backwater tea bag moran is going to be any more magnanimous.

I like my Senators a lot, and my Representative in Congress is great.  When I look around, I see people from other parts of the country that are screwing up MY healthcare.  I'm sure someone else from wherever thinks my Senators are trying to force 'Obamacare' down their grandma's trembling breathing tube.  So why do we continue to bother with this clusterfuck? Doom.
",3
"""no one gives a fuck about your expectations, right (they don't know, they don't care)""

Maybe they should.

But no, Joe Average will keep tailgating other drivers at high speeds to get home one minute faster. So he can sit on the couch and watch the Simpsons in his oversized box of a home. A home he has no means of paying for the instant he loses his job because he never built up a financial reserve first. That doesn't stop him from spending his entire paycheck (and borrowing on his credit cards) in an attempt to impress his equally extended neighbors, though. Tomorrow he will drive his brand new gas-guzzling SUV around the corner to go vote Republican because he can't actually remember that the financial crisis began on Bush's watch, much less the other gaffes and butcheries of the Bush years, so he blames Obama. And so he goes... (sigh)
",0
I think it is a way of calling Obama a nigger,-1
Barak Obama is a terrible president.,1
"Well. That entirely depends on what you believe. Do you think the oil spill will have any long term impact on the company's cash flows in the future? Meaning, will there be some regulatory change that will prevent BP from having the stable cash flows that they did before? If you say the status quo and nothing will change, then they're probably a good buy, but if you believe that Obama is going to overhaul the regulatory structure and make it incredibly more expensive for BP to operate, then it may be best to buy some puts or short the stock.

I would also consider 1st and 2nd derivative investments. Do you believe this will have an impact on Exxon or a processor like Honeywell's UOP?

I have no idea what is going to happen or what to recommend. The question is what do you believe is the logical response?",2
"I listen to the BBC, and I constantly hear how stupid some of these people really are. Obama's had ONE YEAR to fix bush'e eight years of fucking us, and yet there are those out there that say he sucks. I hate stupid people.",1
"But, I thought obama was onna dem communzai's, aren't they all russian, and pink like?",0
"Yeah, I actually found the event to be somewhat less significant than the way society reacted to it, tbh. It seemed like a lot of people voted for him for the colour of his skin (their prerogative I suppose) and the masses that suddenly became Obama fans over night was interesting to see (again, I'm not being facetious, I'm serious.) I think history will probably remember it for a while to come, for the fact that he was the first black president or for the hype that surrounded it.  ",1
[Barack Obama's 2004 DNC Keynote](http://www.youtube.com/watch?v=eWynt87PaJ0),0
"Because there was simply no way he could live up to the hype he had built up before being elected.  Many of his supporters failed to realize that at the end of the day he was still a politician, and that he was elected as president, not absolute ruler.

Obama talked a lot about rising about petty politics, working together with republicans to make a difference, etc.  He also promised a lot of reforms that simply weren't going to survive trying to cooperate and compromise with his political opposition.  Health care reform no going well certainly hasn't helped his approval ratings.  He tries to keep some of his more ambitious promises, but also tries to compromise when political opposition appears.  This makes him look like a radical extremist to those who disagree with the ambitious reforms he initially pushes for, and ineffectual and spineless to those who support those same reforms.",3
"It's not surprising that someone from Obama's ""hometown"" is on here shamelessly begging for a handout.",-2
I'm sure Obama would agree with you,-13
"No. That's horrible. It should be a person's choice, with the default being no forced control, what they do with their organs. Your body is not property of a hospital to be taken apart like a jigsaw puzzle, nor of the state who would make such a law. A person's right to choose trumps all other interests, commercial, medical, or judicial.

Also, America's stuck for a long time. If Obama even hints at this, then come the rumors that he'll use your grandma's fat to make soap or bones to make buttons. He barely got that watered-down health bill through, let's not push for something that even I think is rather fascist/corporatist.",0
"Reading all of these comments lead me to believe that it is possible she is so dumb that she has the definition of democrat mixed up with something else. 

If you are a democrat, watch Fox News, and think Obama is a muslim/terrorist you have some serious contradictions going on in your mind. 

also, upvote because you asked me not to. ",1
"RE the post you deleted:

If someone hates obama they live in a world where they find supports for that belief no matter how incorrect those supports are.",1
whats even worse - there was a pic in my local newspaper when Bush visited us of Bush and a kid doing exactly the same fist jab. And that was when this Obama controversy surfaced. At that time i though wtfuck Obama does it and is terrorist and bush doest it and no one cares..i wanted to scan it but forgot .that fucking sucks :(,1
Obama is president. We don't have anything to worry about. He will save us.,0
"The political argument goes back and forth, and that's why I typically stay out of it.  You're radical, they're radical, chill out, calm down, people aren't shooting each other in the streets, like they were in my father's country only decades ago.  Politics in the United States as a whole are the hindrance of solutions.  Our government is built on corporate bureaucratic bullshit on either side.  It's just a big business, and both parties are for it, this big business, big government, big money thing.  Just one wants gay marriage, and the other doesn't.  I'm not saying there isn't a religious undertone to it (which more or less violates the Constitution,) but a lot of people simply vote a certain way because they're neighbor told them to, or someone is has a better speech writing ability, or someone is their former senator.

This whole system needs a reform, new parties, new perspectives, new solutions to issues still plaguing us as they have been for several years.

You're also saying that Republicans like what Fox News has to say.  I know plenty of Republicans or conservative thinkers that disagree with what is said on that network, but as long as they have money (and they always will, just like most companies) there will be nothing anyone can do about them being on television.  And liberals have plenty of corporate backing.  Google, Microsoft (who owns MSN,) Goldman Sachs, Time Warner (who owns CNN.)  Look it up in Obama's campaign financing.

Oh, and on a side note, you wouldn't vote for Abraham Lincoln?  Haha",1
obama bin ladin,1
"Brock = Brock (Barack) Obama

What TM does he give you when you beat him? Bide. 

Brock and Bide 08. ",1
"I'm not saying it's true in this case, but that's not a bad default position to have on any random event in the news that's causing people to freak out about terrorism or something equally ephemeral.

Edit: more the ""conspiracy to undermine Obama"" and/or the Democratic Party part than anything else.",1
we are fucked because these retards are goign to try and impeach obama for not being pro corperate enough and try and repeal healthcare taht we desperately need.,1
"Buy defense &amp; oil stocks, sell off real estate 2006. Voluntr Obama Ill. st. senate. cmpgn. ",2
"When I was 18, the Clintons were in town campaigning for Obama, so I went to their hotel where they were doing a bit of a meet and greet thing, everyone was getting their pictures taken.  I got my photos and handshakes and went outside to leave, when a secret service agent told me to wait.  Bill Clinton walked outside to head to their car, but first walked straight over to me and shook my hand.  We had about a five minute conversation, where I told him a story about waving my flag as his motorcade drove by when I was a little girl, and stammered my way through it like a preteen meeting Justin Bieber.  He later told my story on the local news, I was so giddy.",1
"My father thinks that Consumer Reports is operated clandestinely by the government.

After Obama won the Nobel Peace Prize he told me it was proof that the organization was just an old boy's club. As an aside, he told me that Einstein wasn't that brilliant and that he paid the committee for the prize.

There's a vast repository of computer related lunacy, but my favorite is when he 'found out' that a New Jersey construction company was using his hard drive at night for accounting purposes. That **was** when he had the fastest computer in our town, though.

Sigh.",1
"That's the point. I didn't ask what reddit thinks of her.  I asked what reddit would do if she was elected. Would we take the same route that we criticize Republicans for taking against Obama (desire to see the President fail) or suck it up and try to do what's best for the country, even if that means supporting decisions that, although would help the country, would make her more popular and ""prove her supporters right."" ",1
Obama?,1
"Just the same as there are people in this country who think that Obama is a godsend and deliverer of all troubles.  Extremism works both ways, and there are people who are equally blind on both sides.

But that side-steps the issue of who is representing you.  Would you not rather it be your voice that is heard, and not someone elses, who may or may not be making back room deals, getting kickbacks, and works to circumvent your freedoms?",1
"Can I ask what your dad does for a living, or why you were meeting Obama and Biden?",1
Nice try Barack Obama.,1
"Get real. Obama is just like all the rest the two faced political party we suffer under
&lt;a href=""http://blogs.alternet.org/speakeasy/2010/05/11/obama-administration-%E2%80%98firmly-opposes%E2%80%99-marijuana-legalization-heres-why/""&gt;Obama Administration ‘Firmly Opposes’ Marijuana Legalization&lt;/a&gt;
He stepped up the wars. He continued almost all the anti-freedom policies that Bush started. He continued the financial giveaways started by Bush
If you can't see what is really happening you are blinded by faith in your hero.
He won't get a second term, he might not even finish his first.",2
"&gt; Prop 8 in California passed in small part because a heavy number of black voters turned out to vote Obama and while they were there they decided to take away rights from gay people because.

Citation needed",21
The obamanation democrat has the blood of 50 million slaughter unborn babies on his hands.,-13
"I have waiting with dread for someone to assassinate Obama.  All it takes is one bat-shit crazy wing-nut, who listens to Fox News, to think it would be their patriotic duty to take him out.",1
"I have to disagree with you regarding Anwar Al-Awlaki.

Glenn Greenwald has written some fantastic posts on his case. I can't do what he said justice but I will try. In short, nobody believes that an American soldier would not be within his rights to kill Al-Awlaki if his life was under immediate threat (in the middle of a firefight). But the Obama administration is claiming the right to kill him on sight, regardless of what he is doing. This is a complete circumvention of the legal process.

Also, the U.S. is trying to have it both ways with regards to his membership of Al-Qaeda. If membership in that organization can be deemed membership in a foreign militia, then by their own logic we are absolutely violating the Geneva Conventions, and by extension the U.S. Constitution which makes any treaty signed on par with the highest law in the land, by holding members of Al-Qaeda indefinitely, without trial, and torturing them.

I also have to disagree with you regarding Guantanamo Bay. Those prisoners were placed there essentially by fiat by President Bush. Obama could just as easily close the facility. 

At this point, he has enmeshed himself so thoroughly in all of these affairs by continuing them and refusing to prosecute everyone involved that he is just as guilty as they are and should also be tried for war crimes. 

I upvoted you because you were contributing to the conversation and were right about Obama's promise to ramp up the war in Afghanistan.",3
"I'm going to go ahead and say this, despite it hardly being popular opinion.

The United States is no more retarded than it ever has been.  History tends to ""forget"" things like Congressional elections, The Tea Party, etc. as historical blurbs, rather than real problems.

Congress has always been corrupt.

Congress has always hindered progress.

The Supreme Court has always legislated along partisan lines from the bench.

The disenfranchised have always had to fight, screaming and kicking for their equality.

Businesses have always been favored by Congress, except for periods of extreme populism (see: Great Depression, new financial reform, etc.).

The difference is the amount of exposure that we get to it from the internet, coupled with (I think for most people on reddit) coming of an age in which we start to pay attention to politics.  The problem, and why I think a lot of people over-react, is the over-exposure and a lack of perspective.  Congress is no worse than it was under Clinton.  Obama is leagues ahead of wherever Bush was and he's getting the same reception Bush did.  It's only in retrospect that perspective on politics is gained.",13
Approval rating below 50% I guess it depends on us. http://edition.cnn.com/2009/POLITICS/12/04/obama.approval.poll/index.html,1
Obama - developed psychosis in his final term brought about by years of drug abuse - oh the humanity,1
"Never said that, stop putting words into my mouth. Taking Revelation out of context to damn Obama as the anti-Christ isn't ""believing in the Bible"" and it is dismissing huge parts of the Bible.",3
"Well, from my point of view, here you had a man that ""waltzed"" in to the presidential race as a black man with a Muslim sounding name in a time where Americans were very divided.  He orchestrated this almost ""majestic"" ability to rally the people together (especially the younger generation) and not only managed to beat Hillary Clinton in the primaries, but pretty much cleaned house during the election.

His campaign's premise was ""change,"" so I don't see why I am so wrong in wanting to see this change occur.  The only thing I witnessed was the Republicans getting cleaned out of the House and Senate when everyone was mad at Bush and now recently the Democrats getting cleaned out of the House because people are starting to question Obama.

I just don't see much after almost two years, but I hear about the lead DEA guy going after pot smokers in California.  When is Obama going to put his fucking foot down and say, ""enough is enough with all this bullshit?""  I'm talking about the war on drugs, TSA, Patriot Act, etc.  

",1
"There are nearly 4000 oil platforms in the gulf. The first was built in 1947. These platforms survived Katrina without incident. There are accidents and explosions fairly frequently but none have resulted in a catastrophic spill until now. The platform blowing up and sinking and the blowout valve failing is the most unfortunate coincidence in the history of oil production. 

BP did not do this on purpose to commit corporate suicide.

The Obama administration had just announce more drilling in the gulf and along the eastern seaboard in areas that had previously been closed. I do not believe that the government would cause this disaster because there is no upside for them.

Obama's announcement of new drilling was a slap in the face to two groups. Apec because more American domestic drilling decreases their market share and limits their ability to set prices. The announcement also affects environmentalists for reasons that are obvious now.

The oil problem was two simultaneous failures - platform blowup and blowout valve failure that struck one well out of 4000.

It was either:

a) Tragic coincidence (likely)

b) Sabotage by APEC (maybe)

c) Sabotage by Environmentalist (maybe) 

 


This ",1
Obama's parents would like a word with you...,1
"I learned, after the 2008 election, that Republicans would be done forever and there'd be no getting up and Obama would sweep in a new era of prosperity. I learned that marketing is evil, that Sigmund Freud's nephew pioneered it to corral society into buying tons of shit they didn't need in a brainwashed like manner. I learned Old Spice guy is sooooo funny and cool and he likes us. I learned Ron Paul was great, and also Ron Paul was the worst ever. I learned that the sky is falling and continues too. I learned about how terrible Twilight was through constant links regarding the subject. ",2
"Alright, I'll start with *Going Rogue*, maybe move on to *The Obama Diaries* and of course anything by Ann Coulter is a must.
",2
No but i am considering leaving if obama has a second term.,2
"Well, I disagree.  Honestly, I don't think there's anything *either* the Republicans *or* the Democrats could have done.

This is 100% about the economy.  The problem is that the vast majority of Americans blame the government when the economy is crap, but they don't credit the government when the economy is great.  So you basically have a serious case of scapegoating.

But the government, on its own, can't turn the economy around.  So, basically, the situation we have now, and the situation we'll have in 2012, is fate.

Yeah, you heard me.  Right now, economists are forecasting that we'll still have around the same unemployment in 2012.  Obama will have a *very* hard time keeping the presidency if this is the case.  All these other issues don't matter nearly as much, politically.",1
"I made the exact same argument with my Obama-loving buddies!  Seriously!  If you have that kind of money, you are not needy.  For fuck's sake, I make 60K a year and I can't afford a new tv!  Some times, I wish I was a welfare mom :-/",-4
"Even if there was a picture of white-people Jesus, in all his glory, holding an Obama babe and giving the thumbs up while wearing an American Flag printed scrubs the bible thumpers still wouldn't believe.",75
"After you waited in line, did he remember you the slightest bit?

My high school English teacher knew Bill Clinton in grade/high school, but people move around at that age and separate. She hadn't seen him or spoken to him for at least 20 years, maybe 30. One day she was walking in the park, and a helicopter landed a ways in front of her. Out popped Bill Clinton (he was gov of Arkansas at the time), and he started walking with his secret service. As he passed her, he said, ""Oh hey Mary!"" Crazy right?

Guess I'm just wondering if Obama's memory has any kind of comparison.",196
"Yes. HCR, finance reform, a tax cut for 95% of the country, a pull back from many of the extreme bush positions. Go Obama Go!",1
"&gt;it meant something like 'will never bow to anyone'. 

So I take it Obama does not have one. ",-6
"&gt; I can't think of anyone I know of who went to a college and has a stable, decently paying job right now

Anyone you know **of**? What about your former professors? Or Barack Obama?",2
"Obama has never proposed any sort of single-payer universal healthcare plan (despite promises to do so).

Doctors in Canada do just fine.  Non-specialist physicians in Ontario who work full-time make well over $200K - starting salary for new graduates is $174K.  ""Concerns"" that somehow physicians won't be able to make ends meet if their compensation is set by a government insurer (who wants lots of work for little pay) instead of by a private insurance corporation (who wants lots of work for little pay) are just bullshit.  Doctors are an extremely effective lobby group for their own interests and they do *just fine* in single-payer systems.

",2
"There are 300 million Americans and you have more in common with 99% of them than you do with 99% of Iraqis. Just because you have less in common with a handful of Americans (e.g. Obama) and more in common with an Iraqi doesn't mean anything.

That invalidates your point.",3
"&gt;Yes, the President does influence these things. Many people like him. Your comments here are mere opinion (which is fine but hardly evidence

hence the title of this whole thread, what unpopular **opinions** you hold. As for evidence, you cant dispute that the national mood is much more pessimistic now then at any time under Bush and I do realize the economic situation has a lot to do with it, but keep in mind, most people do have jobs, most people have health insurance and practically no one is starving to death. Obama's influence on national mood could have been so much better. 

&gt;Any public figure has thousands upon thousands of pictures of him/her. You could pull up any number of faces/emotions. Not evidence.

But released by the white house does matter. Because its they who control the image and you would think their actions would reflect the mood in the white house. Depressed and incompetent president means depressed and incompetent staff who release pictures like this. 

&gt;Sure, maybe he did bulldoze. That's exactly what we don't need.

I think you do. Obama having a hands off approach and delegating too much power to congress leads exactly to the tea party phenomenon we have now.",1
So your complaint is that Obama and Rahm hid the bodies too well in pushing through healthcare. Forcing Democrats to march to their political death to get the votes was not a spectacle enough for you?,1
"You know how you can spot birther bullshit? It's when they call Barack Obama, Barack *Hussein* Obama.",3
i can hear it in barack obamas voice. it sounds like something he would say.. it also kinda sounds like a smooth talking politician...,3
"Thanks for perpetuating the idea that everyone who disagrees with Obama is a racist, a Glenn Beck fan, and/or a Bush apologist.",5
"""Can't Obama declare the health care crisis of national security and create universal health care with an executive order""
",11
I think my favorite part about that subreddit is that it's moderated by BarackObama,0
