"oh man! totally im in the states, in virginia. 30 mins from obama..",1
"""By the mid-2030s, I believe we can send humans to orbit Mars and return them safely to Earth. And a landing on Mars will follow. And I expect to be around to see it."" Barack Obama. ",1
"You're right, Wikipedia says;

[""Obama's current position is that Congress has exclusive authority to change the law.[citation needed] In May 2009, a committee of military law experts at the University of California at Santa Barbara[56] concluded that the President can issue an Executive Order to suspend homosexual conduct discharges.[57]""](http://en.wikipedia.org/wiki/Don't_ask,_don't_tell#Barack_Obama)

That is bullshit then, Obama's really got no excuse to not repeal DADT. ",2
"I would start be speaking very slowly and enunciating very carefully. After that, I got nothin'.  My brother's a Beck lover and he's just too intoxicated from the Kool Aid to listen to reason.  He gets loud and starts yelling about Obama being a Muslim, Kenyan, Nazi et al.  No one can reason with him in my family and he claims that everyone that he works with in construction agrees with him, and we are the ones in the wrong.  I feel like I've lost him to a cult, albeit one with its own major cable network news program.",3
"BRA BRA OBAMA, Barrack Obama! Bra Bra, Oo la la, and your BAD BROMANCE!",1
"i heard they hold secret meetings out of view of the media where they sacrifice black babies, and ritually murder and consume children of mixed decent, symbolic of what they wish to do to president obama",1
"But, but, but the Republictards hate the world and Obama is the anti-christ and we are killing billions of people in Iraq.

This is the worst time EVER to be alive in all of history, not that I would waste my time reading about history.",2
I'm latino and I don't think Obama is latino. ,-1
My mom throws in the kicker that the swine flu epidemic was used by Obama to try and pass the universal health care.,10
"From what I've read about his character, Obama can listen to a person and really make them feel like they've gotten through to him. Then, he'll go do whatever he intended to do in the first place. So I wouldn't hold out too much hope you can sway him on anyway.",11
"here is how you're wrong about your first point.  [In Graphs!](http://voices.washingtonpost.com/ezra-klein/2010/04/the_economy_of_the_2010_electi.html)

Here is how you're wrong on your second point.  In long winded paragraphs!

The united states was at an unbelievably low level of popularity by the end of the bush administration for a variety of reasons(war in Iraq against the wishes of the rest of the world, promoting the idea of a missile shield that instigates a fight with Russia and goes against our own prior treaties, torture, etc.)  I feel like i don't have to go very far into this first point because it is a pretty agreed upon notion.

When Obama came into office he did several things right off the bat.  He signed an executive order closing guantanamo bay(hasn't happened yet but the step in that direction alone has lightened the mood).  He made plans for an ordered withdrawal of Iraq(its already been talked about so I won't really go into it unless you disagree, but this has been enormous).  Then Obama [addressed the UN Security Council](http://www.guardian.co.uk/world/2009/sep/24/nuclear-weapons-un-security-council) in support of a resolution furthering the work to lessen the nuclear armaments around the world.  This was not only in support of a great cause(I know you disagree for some reason, but tell me your reasoning and we can get into it later)  but this also showed the world that the president of the United States actually respected the United Nations again.  

Now we can see the effect of all of Obama's work in lightening the anger around the world at the United States.  Ukraine has announced that it would surrender all of its highly enriched uranium from the cold war days.  There was a joint Canadian-Mexican project to modify a Mexican research reactor so that it no longer produces weapons-grade material.  Russia and China, for the first time in my memory at least, have agreed to substantive talks about Iranian sanctions(China may be in a role to simply draw the negotiations out, but that is something to look at in the future).  I think these are all very big deals and there is no way in hell any of this would have happened under Bush.  ",1
"While I do think that global warming is most likely happening, and it is probably due in some part a result of our carbon producing lifestyle. There is some merit in exploring the other side as well. I think most scientists would argue that to charge ahead with one ""assumption/theory"" while not bothering to explore the other avenues would be somewhat irresponsible. 

Also if you look back at historical scientific data the earth has had its fair share of warming and cooling cycles. 

Also the recent news about the inaccuracies in the UN climate studies as of late don’t do any good to shut the nay sayers up.

I think President Obama put it in the perfect context at his first state of the union when he said something along the lines of “Look, I know some of you don’t believe in global warming or the science behind it. However, even if you don’t believe in it, why not support the growing sector of renewable energy, it creates jobs, and offers alternatives to our reliance on foreign oil.”

If you think about it, it works, I mean so what if a decade from now we found out global warming wasn’t human made, can you really say that all the good science that comes from all this research is a waste? I doubt anyone would argue it in that way. Oil is finite, so we will have to do this renewable energy thing sooner or later.
",7
"Ummm... when did socialism mean democracy?  Maybe before ""Obama"", but we're not longer a democracy.",-4
"Never been to the States but I'll get there someday. I am from northern Europe from one of those semi-socialistic countries most Americans can't figure out if to love or hate. Growing up I always heard how great the US was in between listening to American music and watching tonnes of US movies, sitcoms and soaps ergo I've always felt that I could relate to you guys and your culture. Back when the US was our guardian against the big, red Soviet Union a vast majority of western Europeans adored the Yanks. I think we kinda understood that the bad things you occasionally did around the world fell into the category ""It's a shit job but someone has to do it"" so we were generally fine with it. The Americans were the good guys and everything was just swell.

Then the Soviet Union collapsed and everybody ran around confused looking for a new world order which to this day still isn't settled. Europe grew back together (although we still see the eastern Europeans as a bit off but it's getting better) and we felt as if a huge burden had been lifted from our shoulders. The European Union grew stronger and as a natural result the need for big brother across the pond faded. That is basically where we are now although we still feel strongly about our cultural and historical bonds. Most of us want the best for you guys and that's also why during the last decade more and more people have begun to shake their heads and think ""What the hell is going on over there?"" 

I think things really took off when Gore ""lost"" the election to Bush on some very dubious actions. Remember that many European countries have electoral systems very different from that of the US, under those systems Gore would never have lost. It was mindboggling. Here are some of the things I dislike about America as of 2010. Some are perceived and some only refer to certain partitions.

- The lobbying system
- The influence of religion in society and government
- The out-of-control corporate-consumer system
- The general lack of empathy towards the poorest
- The amount of guns and how easy it is to access them
- The lack of interest in the World outside of the US (getting better)
- The hardass police and their methods 
- The fact that you could elect a bafoon like Bush and then re-elect him
- The blatant disregard for the threats of global warming (improving)
- The fact that so many Americans have 2 or 3 two-ton cars.
- The fact that the US jumped on Iraq and Afghanistan on questionable grounds and without clear goals resulting in the chaos we've seen the last 5 years.
- The fact that so many Americans rant about Obama because he is a democrat and black and plenty seem willing to do something about it.
- That so many Americans watch the ""Fair and Balanced"" utter crap that Fox lets out on a daily basis and that a fathead like Glen Beck can muster a 6 digit number of people for his rallies.

I think it bugs many Europeans that you seem to have so many issues these days because we still see you as allies. Unfortunately you've gone from the likable first cousin to the slightly off uncle that the family members always dread inviting over for Christmas. 

We want to like you again America. Don't make it too hard please.",10
"You other posters are fucking INSANE!  You'd call the fucking police!?!  I'd say ""sure thing buddy, hop in"" then I'd blast speed metal all the way back to his place.  Maybe chat to him about the dangers of hitching rides at gas stations on the drive down.  Then I'd make sure he could actually get into his house before I left.  

Police my ass.  I can picture it a couple of years from now, the police arriving and saying ""woah, an 11 year old boy?!  I don't wanna go down as a sex offender, I'd better call the fire department.""  Two hours later and Obama is stood with the 300+ crowd of government employees saying ""ELEVEN YEARS OLD?  HEYYYYYLLL NAWWW"". ",110
"Reuters readers in the US get ""Obama seeks market-based yuan"".",3
"You can't just ""end a war"" like pick up your guns and walk away. Obama ended combat operations, they still have to stay and help stabilize the country. You can't go in blow them up almost cause a civil war and then walk away. ",4
A dog trained to kill Obama’s dog on sight.  But act really sweet to everyone/everything else.  ,-4
every time i learn about anyone's idolization of obama...,-7
"I don't pretend it's anything special but during one of the public meetings usually held by members of Congress in D.C., I shook Barack Obama's hand a year or so before he entered the national spotlight. He was reasonably well known in IL by that time, however, even beyond the recognition you have to command to be elected.",1
"Nope, that was the Obama campaign.",3
"If so, you can bet the Fox News headline will be:

""Obama's Nazi brownshirts attack innocent Christian patriots who were only trying to protect our Freedom and Liberty from the Muslim terrorists.""",1
"Hello,  This is her friend from Nigeria, Prince Obama tutu.  MY DAUGHTER is Illness.  I will meet her soon.  Tell her from me, I love her longest time for all America.  Why you no love me.

Regards,
Nigeria",41
"Im still in the same general area (prObama), but id like to think ive become a little more open-minded in some areas, but i also think ive gotten a little more closed off in others. ",1
Obama is a nigger war criminal thief.,-1
"You do your best to out-crazy him. He says ""Obama was sworn in illegally"" and you say ""Not only that, but Obama was born illegally, too. In the state of Hawaii, people have to apply to the state in order to have children. Illegal children are usually shipped to the frozen Alaskan wastelands, but Obama was spared that fate because of black magic and gingivitis.""",76
obama has a goat?,0
"&gt; I honestly don't follow politics very much, and I don't live in the states, but it seems like you guys got royally screwed.

Let me try to do this right.

Has Obama failed to keep his campaign promises? Not all of them, just some critical ones that are in the limelight now.

Let's look at why that might be:

1. filibustering.

2. filibustering.

3. filibustering.

4. filibustering.

5. change in priorities.

6. new information he was probably not privy to before (and we still probably are not)",5
"I see where you're coming from now. Your first comment lacked some information (or I didn't read between the lines well enough). My issue was with saying that you dealt with all of the OP's problems. Letting people decide for themselves is the right move, but just telling people ""Don't do this"" isn't really dealing with an issue. People still drive drunk. People still smoke while pregnant. People still hold their iPhone 4's the wrong way. That part of it is complicated; too complicated for canned statements, I think.

As for the Obama line, I wasn't aware of the way taxes on these things work. I think it would make sense, however, to place an excise tax on it given its similarity to tobacco. I don't know if that's a good reason to do so, however.

",1
"this statement is the left wing version of ""Obama isn't even a christian, I don't see why people would vote for him"" on some sort of a scale, somewhere.",4
"&gt;By what definition? Certainly not by any reasonable one I know of

By the same definition under which libraries are socialized.

&gt;he has not even pushed the little tiny possible bit, a robust public option, that was on the table.

Wrong. [Here](http://www.cbsnews.com/blogs/2009/06/11/politics/politicalhotsheet/entry5081425.shtml) he is in June 2009 pushing the public option. [Here](http://abcnews.go.com/Politics/HealthCare/obama-health-care-speech-urge-public-option/story?id=8525533) he is in September 2009 pushing for the public option.

What he *isn't* pushing for is the public option with a state opt-in clause that the senate has pushed for.  He is, however, pushing for a public option.  That's ridiculous to argue against.  He campaigned for it!

&gt;The issue here is not the big bad socialists

I'm not interested in straw men arguments here.  I've stated twice in my previous posts that I have nothing against socialized medicine or socialism in general.  I just don't see it as the only solution like Obama, Pelosi, and Reid do.

&gt;you see anything other than unregulated capitalism as socialism

No, I don't.  Repairing our capitalistic system is merely one alternative to government-run healthcare.  Please don't put words in my mouth.

&gt;And by ""fix"" you mean get rid of regulation, right?

Just a bit ago you said I see unregulated healthcare as ""socialist"" and now you are trying to imply I want to deregulate healthcare.  So are you calling me pro-socialist or anti-socialist? I can't tell.

But to answer your question, no.  The government can take an active role in promoting the entry of more competitors into the market.  The start of which is to pass the anti-trust bill you previously mentioned.

&gt;Consider person X who buys insurance. They get sick on day 364 of the policy. Clearly the insurance company will not renew that policy.

In a completely unregulated market, yes.  I do support limitations on what insurance companies are allowed to do.  It's one of the few parts of the current health care bill I actually see as useful.",1
I got one of these that was a $1000000 with a picture of Obama on it.   I thought it was going to be some batshit crazy right-wing screed but it was basic Accept Jesus script.,3
Obama/Palin?,2
"&gt; Has anyone filed their taxes and made use of Obama's refundable college tax credit?

Yes. ",2
"Is it Al Franken, Obama or Bob Dole?",1
"Well I'm no fan of Beck (or Obama for that matter) but the thing with tithing is that it's optional.  If you don't want to do it you don't go to that church and they can't force that money from you.

The government, however, can.",3
"[Here's the relevant Supreme Court case.](http://en.wikipedia.org/wiki/Gonzales_v._Raich)  Growing medical marijuana in your back yard and smoking it yourself is close enough to ""interstate commerce"" to let the Feds regulate it.  Pretty wild.

Obama's Attorney General [has said](http://www.washingtonpost.com/wp-dyn/content/article/2009/10/19/AR2009101903638.html) that the government won't go out of its way to prosecute cases like this anymore, though.",1
"Historically Lefties were more independent thinkers. A lot of that has to do with being independent enough to tell your teachers NO when they try to force you to be a Righty. Once society completely starts to accept Lefties, that trend may disappear. Obama is old enough that he was most likely raised in schools that didn't understand lefties.",6
"During the campaign, Obama came to Denver to give a speech.  Knowing traffic would be bad, I planned on taking the light rail into town -- but for that, I would need exact change.  So I found myself hunting around my room, muttering to myself ""change, change, I need change"".",9
Canadian actually. I was swept up in the Obamamania just like the rest of the world but alas he's still an american politician working within the american system so I suppose we were expecting too much. He is a step in the right direction though. ,1
I thought Obama just did everything...,1
"Exactly.  If anything makes me worry about the final outcome for Obama it is the same outsider issue.  He is handling it very differently and I think that this is why I see many things that I disagree with, that support positions taken by Bush, even amplify those positions.  Drill in the Gulf one day and abolish DADT the next.  Float like a butterfly, sting like a bee.

I grew up in Chicago and it was always a tactic to pull your enemies as close to you as possible.  The other tactic that I see with Obama is the tendency to make a speech like he did about BP the other day and then have 9/10ths of it lined up and finished the next day.  Real Chicago political strategists are known for doing all the ground work first and then announcing the news.  He has clearly done that a few times.  It leaves your political enemies with very little to criticize.",3
"Obama seems to be governing exactly the same as I would have expected a Hillary Clinton presidency would have. The differences are that she would have only had the cautious support of progressives from the start, rather than optimistic support (with Obama, the letdown is much more painful because he sold himself as something he is not).

Also, the Clintons know where the bodies are buried in the Democratic party. There's a possibility she could have twisted arms in the party more effectively than Obama has.

There is an additional liability for Obama in the nature of opposition from the right. While I feel that in most cases, it's too simplistic to call outright racism, Obama was a relatively unknown element in national politics up until '07 '08 where Hillary was a well known figure since the early nineties. Hillary would certainly be called a ""hardcore leftist"" by the Fox News set, but it would be harder for them to paint her as the next coming of Karl Marx or the Black Hitler or having ""no birth certificate"" or any of those other things that anyone with a grasp on reality finds ridiculous. It would just be the usual whining about her being a member of the Trilateral Commission or her hanging out with the Bilderburg Group some weekend, possibly the reincarnation of the Vince Foster murder. There wouldn't be this culture of conspiracy surrounding her like it does Obama.",3
HEY! HOPE IS RESERVED FOR OBAMA'S CAMPAIGN!,2
"Yeah... I know a couple Tea Baggers, among them my ex's parents actually, and their mantra is to ""classify"" everyone that doesn't believe Obama is a muslim Communist, as a Socialist. You are right... It isn't fair to classify ALL of them. How about just the ones I know?
",3
"Yeah, I doubt the lawyer's that ignorant. He's probably just pretty fiscally conservative and a jackass, though, and had a nice chance to hate on Obama, so I still don't like him too much.",1
"&gt; the United States has certainly been two-faced, and yes these documents certainly proved that. [...] how much of what was actually in there is true honest-to-god groundbreaking information?

The supreme leader who claims all agendas altruistic, to marginal if any objection (at the time of the deed), is shown to be two-faced. Yes it's expected, but I think it's an important thing to point out.

Now however it seems to me that the issue is no longer the contents of the cables, but how they are recieved. I see three main approaches:

* ""There's nothing there really, now over to John for the weather.""

* ""He dared attack us! He's a witch! Burn her!""

* ""Oh man there's a lot of data here. Do you feel like reading all that data? Didn't think so.""

That middle one is of course something that should be debated, and I think there's something to the other two.

&gt; Is Julian Assange uncovering that Barack Obama is secretly feeding an army of aborted fetuses to his terrorist muskrat-pet Phoebe?

Not this time. Who is?",1
"Jacqueline is a republican because libertarian = republican.

But I feel great because America is the best at everything. I am worried about Obama though because of his secret muslim ways and the proven fact he is a socialist.",-8
"And yet it still happened :\

[This](http://www.youtube.com/watch?v=5ZvWilRn0L8) is one of the main reasons I voted for Barack Obama.  *sigh*

Of course the primary reason was because he was not John McCain and Sarah Palin.",2
"But don't lie and say you are from Britain if someone in Europe ask you because i have seen people do it before and there is always someone to call theme out. 

Don't worry to much just be polite and sociable. Since Obama has been in power we like Americans a bit more. 

Oh and don't talk about the war or mention that you are in service. Have a nice time!",1
Reddit does not have its tongue up Obamas ass. Reddit just does not pander to the paranoid conservative bullshit. ,2
Is that at New Morning Bakery? It looks JUST like this place that's right across the street from where Obama had pizza in my town.,1
Obama.  Definitely more of a negative.,-1
"Most of the ""rabid"" folks you see opposing the bill actually don't know what's going on. 

During his campaign, President Obama promised healthcare reform and a ""public option"" (federal health insurance.) There was also talk of single payer, though I'm pretty sure anyone who did the analysis knew that wouldn't happen any time soon.

This talk was boiled down by the Republican talking heads as ""Obama wants the government to run healthcare, which is *socialism*!"" 

And that's pretty much what the rabble on the right who are yelling stupid epithets think happened. One of the biggest opponents in my Facebook crowd is a 40+ year old woman who doesn't carry health insurance. This makes zero sense. 

That's pretty much what most people were opposed to. ",1
"America has always been partially socialist. It will never be a fully socialist or even akin to UK socialism. We dont even have a (democratic)socialist party, like the UK Labour party. 

His predecessor spent money on wars we do not need. Obama spends money trying to keep the economy afloat and serve the American people.

The healthcare bill is not what he wanted, but the best he could get with all the political infighting. Its just the first step to building a fair healthcare system for all Americans.  

I wont even touch the truth/lies thing. Read some history and compare. 

Job loses peaked with bush and are slowly decreasing under Obama.

His foreign policy is fine with most of our allies and has gone a great way to improve relations with nations who did not like us. 

Iran, Korea and chavez are speculation and fear mongering. 

Your last statement is lies and hate. 
 ",0
"Ya, he is a terrible president. I mean better than bush, but he has no experience and has done nothing. And Lady Obama going on vacation?! To Spain?! Now come on go to the damn gulf like you said you would.

&lt;/Rant&gt;",0
"If you want to convince her that Obama is not a Muslim just show her how he fails at following every pillar of the Muslim religion.
http://www.youtube.com/watch?v=1jQ67cdzDyI",1
"not that presidenting isn't stressful but i think the hair thing is just natural aging. most presidents become president around the time you would expect them to start going gray (clinton, Obama), and/or they had already started going gray around the edges at the time they took office and it just progressed (carter, bush I)",2
"&gt;I think you are completely ignoring what the word, ""No"", means. As I stated in a nearby comment, I am thankful the McCain/Palin ticket was put down, because it was horrifying.

I think I did misunderstand you a bit. My point still stands, though. The Republican platform they released this week is really not much different, if any, than what McCain ran on. Republicans have not changed, at all.

And I think you are confusing TARP and the bank bailouts with the stimulus bill. At least we're getting most of our money back with the bailouts. As for the stimulus, most economists said it wouldn't work as well as Democrats hoped, but it has still done better than they thought.

As for me, I'm  a moderate. I voted for Obama knowing that I would not agree with fully 100% of what he would do. What I wanted the Democrats to do, they have done. I can live with the rest. ",1
"Well, let's start with specific topics here.  What do you think will become of Barack Obama in the 2010's?",1
"That's entirely different than saying they're not that different.  There are enormous ideological differences.  But politics is fucking hard.

And it may not seem like Obama's doing much about the environment, but a lot of it is under the radar because it's not in a big bill that can become a talking point.  I check [this site](http://www.energy.gov/organization/dr_steven_chu.htm) fairly often and I'm proud Steven Chu is my Secretary of Energy.",-2
