"I've called people out for saying sexist things about women, while still saying sexist things about men. Thankfully my bf called me out, because I didn't realize it, and I feel like I'm much better about it now. I'm still working on it though. 

(by call out I mean literally saying ""that's sexist"")",1
Free Bird - Lynard Skynard,1
"""Or maybe we could have a beer together, Budweiser.""",6
Mayo and hotsauce mixed together,1
Happy cake day!!,1
"Very possible. I don't tell most friends, but a handful know it, and they could have easily had a hand in it. ",1
"I code for dates all the time and I've never bothered to validate that any date falls between a certain set of years.

I imagine that Apple's flaw is that they're benevolently trying to internally use UNIX time everywhere, but that is as useless as a can of silly string in a gun fight if you have to work with any dates before 1970.",1
*ahem* lizard people ,19
"Maybe he was just going through the motions. I think whats confronting about it is it makes you consider how normal and mundane the process of his suicide was right up until the last moment. It wasnt like the movies with dramatic music and everything. It was just a guy driving to the beach, parking like normal, and jumping.",2
"The thing is, he seems like pretty standard dude in interviews. He knows his audience and what they want. No reason to change when he has been so successful.",47
"Yik Yak.

Actually I agree with this one.

My school is boring.",2
I think the reason not many people are saying Sales and Tech Support is because they're pretty matter-of-fact jobs that aren't as mentally or physically taxing as some other jobs mentioned.,2
Tiny kittens,1
Does anyone complain about too much salt in the food?,1
I some how can't see this as being reality. To me it kind of sounds like a massive human rights violation. I particularly find it hard to believe that they would do anything remotely similar in Germany with the happenings of WW2 (death camps and labour camps) ,1
"I think it might be Freakonomics because I remember reading that too.  The statistics holds true in general.  You are way, way more likely to die in a car crash over a plane crash.",2
"I like Ted. He's just a normal dude who's never wanted anything more than getting married, and is hopelessly in love with one of his best friends. ",13
"I live in a house that we all but our own food. My roommate thinks he owns the kitchen and threw a bunch of water bottles and soda away. I'm pissed because our water sucks. I started setting the oven alarm to go off when I'm at work and pouring sour milk into the water tank of the toilet( yeah, I realize that's petty shit). I just hate the guy so much and he's calling the landlord to try and get me evicted. I feel like if I leave he wins. ",7
"More makes me angry than annoyed - we were in a crash recently because someone pulled out of a side street at a T intersection without making sure that traffic was clear. We were driving along next to a bus (2 lane road) and as the bus has started to turn the corner, we have continued straight in our lane, when a car from the side street has clearly looked right and seen the bus was turning, and decided it was ok to go without considering there may have been traffic they didn't see.

Neck/back pain and a written off car later, I'm now a little jumpy when I see people approach side streets a little fast.",1
Stop collaborate and listen...,1
"In my opinion, political lobbies",1
I lick the cheese off my doritos before I eat them. ,1
there are gay shemale horses?,1
"Well gender is different than sex.  I mean if some guy wants to dress in women's clothes, why should I care?  That part I have no problems against at all.

Sex changes, on the other hand, I do have an issue with.  I think if you are that unstable and insecure where you feel you need an actual sex change to ""be who you are""... then you need psychological healing more than a sex change.  ",1
"There was this my little pony website that had old school games,I've gone back there and all I see is the current MLP news/games :(",1
"That guy, apparently.",1
"Water heater, it would completely ruin their shower and they would be in shock trying to figure out how and why someone would break into their house to steal their water heater and nothing else. ",1
"OK, *single-payer* then.  Are we happy now?  ",1
The Phantom Tollbooth.  Been reading that repeatedly since I was a child.,1
Runny (undercooked) scrambled egg. Every day. At 6am. Not ok.,1
"YEA I HAVE!


wait",1
"I was worried I'd run out of characters since it limits you to 300. In One of Stephen Hawking's books, I read about these experiments with light. I think it was Feynman's theory...double slit experiment that says light particles travel every possible way to get to a given point, but no one can see it happening. What if we do that, too? Or Wheeler-Feynman's theory...no, I just looked them up and Wheeler-Feynman's Wikipedia page doesn't mention Hawking, so maybe it was just the first one. I found this explanation online, ""This is where the intellectual challenge starts. The path integral theory asserts that a particle travelling from point A to point B takes all possible paths – including the straight line, routes through any slits, around the Moon and back etc. A particle-wave takes all these paths at once and “condenses” at one location in space only when it has been observed/detected."" (from a Wordpress site: da-boss.com/2012/11/14/the-grand-design-by-stephen-hawking-and-leonard-mlodinow-2/)
",1
"Ice T. He thinks he's way more famous than he is and feels the need to act hard at all the time, like he's super insecure or something. He tried to fight a security guard who didn't recognize him  and asked to see his pass at a music festival when he showed up to play with Body Count. (Not in the news, I was also working security and saw it happen)",62
"In the North, it is cold and snowy in the Winter, but in the Summer, it gets very hot and humid

In certain parts of the country it is warm all the time, but America is gigantic",1
That would be most excellent! We can all be comfortable with bony butts and have fine cuisine simultaneously. ,2
"I found it too serious and boring, i still liked it i think but i prefer the likes of goodfellas",2
REDRUM.,1
"Thank you! I'm surprised people are liking what I've written so much! 

I'm just a fresh graduate who's starting work soon in the government haha. I've been having a lot of thoughts about pursuing a more creative career path lately, and it's really motivating to hear something like this! Thank you.",1
"I'm one of 4 people that does the one. Sandy is a 10 year vet at this so she dips into the work when we have an overflow. She mostly handles escalations. If she were to leave or something were to physically happen to her, our department would suffer, so we do the grunt work. 

I'm not supposed to be in this department, however a national account changed their contract and we are handling their requests. Because of this, I was forced to do this full time for the last 3 months. I've been working in the department (full and part time) since September/October. 

Def not the only one doing the orders. I handle that national customers orders because there are just *sooo many*. The other 2 full-timers in this department do every other customer. 

The girl that mocked me does billing. I am ashamed to say that I have given her some of my orders to bill. I never wanted to use her but I swallowed my pride and wore my big girl pull ups.",23
I don't have them either! I thought this was normal. ,1
Went on a date with a beautiful older woman. I was in my early 20's she was in her late 20's. It was a huge deal to me. Date went great. She asked me in for coffee. I declined because I was starting a semester of college the next morning and wanted to get a good night's sleep. ,2
"Nothing.  The president doesn't actually have the power to do most of what candidates (not just Trump) promise; without solid support from Congress, the president amounts to little more than a figurehead.

At worst, he can direct the Attorney General to crack down on his personal peeves (which admittedly could get ugly, but the relevant laws already need to exist for him to demand their enforcement).",2
"Only if you give me 200,000$ first",1
"I have a similar story. My grandpa got older and could no longer take care of his dog, Tucker. He passed a few years later and we received a grandfather clock he had made. When the dog saw the clock the first time, he barked at it. Just once, then never again.",5
"You could have had a solid comment had you left this out: 

&gt;SJW can suck my hairy, non-politically correct balls",1
"Meh. I tend to stay off the ""cringy"" parts of the fandom if I can. I'm fine with people not liking the games, though it bugs me when people stereotype the fandom just by looking at the bad side.",1
There also have been no shark attack victims because none have come to tell us. Therefore there were no shark attacks.,0
Mate it says in the description i'm scottish. So im clearly voting for the next president of nigeria and I need your bank account details to make that happen.,4
Is there anywhere we can watch this? I loved this show. ,1
"It's sad how in recent years Comedy Central hasn't shown these stand-up specials as frequently as they used to except the occasional acts by big-name comedians like Jeff Dunham. I like those guys, but it's sad how they don't have as much variety anymore.",5
I'd add family connections off of number 2.  Some of my fondest memories are ball games with my dad or discussing USC sports.,3
Permanent solution to a temporary problem.,2
I didn't! :D All was well at home. ♥,5
"Five hours a day straight? Unless you like sun burn, sun spots, and possibly melanoma then yes it would be. Consult your doctor.",1
all&gt;top&gt;1hour,5
And what about Sakurai?,3
"And that's the reason she was able to learn to sign. She knew one word before she got sick: water. Anne Sullivan signed ""water"" into Helen's hand over and over and over again until one day it clicked. She ran around asking for the names of all kinds of stuff. Without that first 19 months (and without that sole word) she might not have ever learned. ",5
"Political belief.

....oh wait",3
"They are popular among women who ""say it like it is"", or who are ""strong and independent""....",1
"According to the FBI, [gun homicides have been going down steadily for years.](https://www.fbi.gov/about-us/cjis/ucr/crime-in-the-u.s/2013/crime-in-the-u.s.-2013/offenses-known-to-law-enforcement/expanded-homicide/expanded_homicide_data_table_8_murder_victims_by_weapon_2009-2013.xls) In addition, we are the most populated of the western countries, with the most freedoms. That isn't a fair comparison 

Criminals have been shown to get their weapons through straw purchases and theft for the majority of crimes. And a high percentage of gun deaths are suicides.

I think we need to nationally require firearms training for CCW holders, because it is to easy for someone, who has no idea what their doing, to get a gun",2
They don't give hints if they like you or not.   Even when you know each other well and it starts getting awkward.,-1
replace all of their silverware with shoe laces,2
I just try to look as shady as possible and run when I get close to the door... Bonus points if you knock something over while you're running away.,15
Probably because people seeking a higher education don't think that 'blessing' someone is very logical.  Could only be an American asking why 3000 year old superstitions aren't popular in today's day and age!,1
"Nothing. Only human beings are concerned with ruling and power. If we were taken out of the equation, nature will begin to regain its equilibrium",1
"Water. 
Really though, trying Fiji water for the first time after drinking great value bottled water for my whole life was a revelation. ",1
That's my preferred solution! ,2
Fish have legs?,1
"I was asked this question too about staining on my teeth, before I had a shit ton of cosmetic dentistry done, that I never wanted.

Eitherway, that school photographer was a tool. You're fine as you are!

",3
"Lik do you want movee a cinema or a big hugee theme like amusing typ park, disnee land hehe",1
¿Que?,2
Last of the Mohicans scored by Trevor Jones is my first choice. Braveheart with James Horner is a close second. Both have my heart and pump me up. I like to fantasize me in a world where the music could score my own adventures. It is my dork thing but I don't care. Not to bad a way to spend down time.,1
"I just find it hard now, 3 people quit in a week so my schedule is full. I've got to do 3 to 12 almost every day. They company made it so you get written up if you decide to doodle, even while no one is in the store. ",1
"I don't get high alone, so I'm always with friends. We usually just chill in a room, listen to music, and talk about life and the universe. It's actually really fun",2
"She will not be worth being sad over. You will find something you want to do with your life in a few years, and there's no place for her. There will be others, more fitting for your lifestyle and you will have enough trouble finding that person. No need to make yourself feel miserable when she leaves you.",1
Communism fails to account for the interests of the individual in the same sense as capitalism fails to address the interests of the whole community.  Both are flawed systems. ,2
Why is that? Does have to do with internet/digital media censorship?,1
"Peanut butter, bread and jelly",1
"Not wasting toilet paper on *everything*, like most girls do. I buy the expensive one for my nether regions and I sure as hell won't be wasting any to ""clean"" the bathroom floor/walls/sink/etc. ",3
Because you can take a bigger bite without getting the contents of the sandwich all over your face. ,1
"I'm taking westernised culture as European culture as a whole. Then again you just threw out the fact that Islam has been at war with European culture for generations.

Not quite the same, considering Germans are not nazis anymore. Islamic countries however, still kill people for not being Islamic, muitilate the genitals of boys and girls, support barabaric sharia law and much more. They still follow the same teachings in the Qua'ran that say thing such as kill non believers and such. All these teachings lead to what we see happening in Europe now, cologne rape crisis? The rape of native Europeans by Muslim migrants is a very real thing.",1
"Yes. But that's a completely diffrent meaning than when referring to  races of animals.

Also races from cars.",0
I'm pretty sure Comcast has an entire training course for that...,3
"Is the North Cyprus better than the south? I'm moving from country to country and I would stay a couple months in each, was in Armenia and currently in Rep. of Georgia. I think I better stay here...",1
Is this one it? https://www.wikiwand.com/en/Fox_v._Franken,1
"""message me hun"" ",2
"8th grade was crazy for me. I went from 5'3"" to 6'0"" and shoe size 8 to 13.... Between January and May. 20 years later I still have joint problems. ",14
"PB Crisps, Magic Middle Keebler cookies. Hostess Nina Turtle ooze pies. Cookie Crisp. The rodeo burger at Burger King. Hulk Ultimate Destruction from Playstation 2. Keebler Pizzeria Chips. ",1
***Sounds like you need to be really careful not to hang your nuts out down in Holzkirchen.*,1
Funny how you call him out on the mushrooms but not the parent commenter on the lava.,1
"Hitchhiking, duh",1
"My group had a similar situation. There was a wand on a desk in a magical circle. If you put your hands in the circle you were sent into the ethereal realm to starve to death. So half of the party is sent away until someone in our party just shakes the desk knocking the wand out of the circle, saving half the party.",7
Sports?,1
They'd be a noodle.,3
WHO IS PHONE!,2
Jncos,3
I'm willing to admit moto gp is up there. As well as the Isle of man. My knowledge of those sports are lacking but all things considered those are easily the top.  ,3
"the Asians actually always tipped me 15% never higher never lower. they were also the easiest to serve because they were all easy going and never demanded just ordered their food, ate it, paid and left. ",1
"You think I'm funny, funny how? Funny like a bad reddit meme ?",1
/r/enlightenedbirdmen,2
"So, the only alternative is to seize them?  There isn't a middle ground of setting up mini-acadamies across the galaxy?  Or move them *and their families* to Coruscant?

I have a hard time buying into the black or white ways of the Jedi.  They are just as bad as the Sith in this regard.  Obi-wan and Qui-Gonn seem to understand this, Qui-Gonn even going so far as to call Obi-Wan a much wiser man than him.  I think both of them are *reformers* within the system.  With a little more tolerance for reform from the Jedi Council, things would have turned out much differently.  

Think about it, they were dogmatic in their opposition of Anakin having regular training under Yoda before becoming an apprentice.",1
Mine is the more than brains University of Phoenix. It just stands out from the other stuff for some reason whether I'm in a different room or not.,1
"Portal 2. The first time I played through it, I was seriously filled with wonder and awe. Script is hilarious, puzzles are good, and the cake is a lie.",197
"Why isn't ""she' better than Trump"" a good enough reason? One of the two is going to become president. Unfortunately democracy often means voting for who you hate less. But it's still in your best interests.",1
"I don't have one large dividing event, I have multiple smaller ones. More or less little life lessons I learned along the way. Jobs, cars, girls, school, homes, shit even drinking! LoL. Where I'm at now I'm sure is a ""before"" on the flip side of an ""after"" I don't even know about yet! ",1
"Frankieonpcin1080p if you like gaming, epic shit right there",1
Dont give up on it.,1
Name recognition is powerful.,6
"Don't leave us hanging, I have to know what happens on tonight's episode of ""The Asshole, the Crook and the Socialist.""",1
"[Insert local internet service provider]

Jokes aside, I find political lobby groups to be immoral.",10
"Stop stealing other people's posts. 

[Repost](https://www.reddit.com/r/AskReddit/comments/4acch3/whats_something_youre_pretty_sure_has_only/d0z6ejt), [Original](https://www.reddit.com/r/AskReddit/comments/26s5o7/whats_something_youre_pretty_sure_has_only/chu6l6h)

[Repost](https://www.reddit.com/r/AskReddit/comments/49zfvb/what_is_the_weirdestcreepiest_unexplained_thing/d0w954x), [Original](https://np.reddit.com/r/Paranormal/comments/2ov3yq/what_is_the_most_creepiest_unexplained_or_bizarre/cmqyv3i)

[Repost](https://np.reddit.com/r/AskReddit/comments/4a31bc/whats_your_greatest_well_im_fucked_moment/d0wzkgd), [Original](https://np.reddit.com/r/AskReddit/comments/1lh7fi/whats_your_greatest_well_im_fucked_moment/cbzcvlo)",1
Bacon.,1
"If you didn't scream or constantly flinch, you're fine. Whining isn't a big deal and a nice chunk of clients confess that they're uneasy about needles.",7
Hmm. You're quite sensible.,1
You mean antfro?,2
become a billionaire like god king Trump,1
"Instead of LGBTQIA, you can use the ultra inclusive acronym QUILTBAG! (Queer, Undecided, Intersex, Lesbian, Transgender, Bisexual, Asexual, Gay)

EDIT : folks are asking for an ELI5 of these terms, I will do my best. 

**Q** : Queer is a blanket term for anything falling outside of heterosexual or cisgender identites. It's a catch-all for those who don't identify exactly as I,L,T,B,A or G. (More on these letters in a moment.) Q could also stand for Questioning, which is exactly what it sounds like. 

**U** : Undecided means similar to Questioning (which is why I like to include Queer over Questioning.) Sexual and gender identity for some isn't perfectly cut and dry. Sometimes it takes a little bit to figure out, sometimes it changes as we grow. These people deserve to be a part of the community as well. 

**I** : Intersex describes a variety of situations where the reproductive or sexual organs a person is born with doesn't fit easily into ""male"" or ""female"". For example, it's possible to be born with female genetalia but male inner organs. This also covers people with ""mosaic chromosomes""; that is, some cells being XX and others being XY. 

**L** : Lesbian refers to women who are romantically and/or sexually involved exclusively with other women. 

**T** : Transgender is when the gender you are born with does not match the body you are born with. Some trans folks get gender-confirmation surgery, some don't. Since gender is a spectrum rather than a binary, there is lots and lots of grey area to wiggle in, insofar as identity, presentation, and your physical body. 

**B** : Bisexuals are folks who are attracted to those who identify as men as well and those who identify as women. Pansexuals are similar but explicitly include those who fall in the previously mentioned spectrum. 

**A** : Asexuality is when someone does not feel a sexual attraction to anyone. It is the lack of a sexual identity. Asexuals also sometimes refer to themselves as ""aces"". Some asexuals abhor sex entirely, some are ambivalent, some are willing to put up with it for someone they love. 

**G** : Gay refers to men who are romantically and/or sexually involved exclusively with other men. 

A lot of these are just barely scratching the surface of the information out there, especially my descriptions of intersex, trans and asexuality. Please let me know if you'd like more clarification, or have any questions. ",182
"That one is pretty common, and used to be (in some cases still is) trotted out as a weight loss tip. ""Don't eat within two hours of bedtime, or you'll just pack the fat on while you're asleep and inactive.""

It's a myth, but still pretty pervasive. ",14
"Slave Lake, Alberta.  Beautiful area, radically under-rated beach. ",1
I did this and it's worth it.  But got myself into a career where I enjoy what I do a couple years later.  The 2 years of less money kind of sucked but now more money AND enjoy my line of work!,4
While Ted Cruz gives conflicting directions and Rubio just keeps bitching about Obama for some reason. Also Jill Stein is there but she doesn't actually do anything.,3
"You know your worst kid.  Picture him on meth, over dosing, belligerent, and physically fighting biting and scratching while trying to get them to the hospital to save their life.  Now picture that one kid who you really want to help.  But when you fail, they actually do die.  Im an assistant principal and deal with all the kids the teachers can't deal with and I still have it easier then her. Edit:  Just because I didn't make my point enough.  Now, picture it at the end of a 48hr shift and you haven't slept.  AND you do it all for $11.50 an hour.",30
People who make family or friends sit through videos they like and then get butthurt if the person doesn't like it are the absolute worst,0
"""I'm not a racist, but I like cake""",2
Exactly. Who's going to take you seriously when you can't do finger-guns properly?,2
"I knew I shoulda looked up the definition of that word first...I knew it, I knew it, I knew it.",2
Cheat,4
Never look away from the ball in a racquetball game or else you will get hit in the balls. ,1
"Well yeah it was an unidentified flying object, but I'm way too sceptical believe if was anything extraterrestrial. Still we saw a UFO which is pretty cool...",2
Get out of customer service!,4
"I talk more shit irl to be honest. Having the time to cohere my thoughts and make them fit into concise 140 character nuggets makes me come across as much better articulated. 

If you had asked me this irl my reply would have come out more as ""Idk man, [rambles for 10 minutes until I come to the same conclusion]"". ",1
I live in a Muslim country and we have drive through liquor stores lol,1
"I'm bad at stopping for the night, but once I've done that, I can sit on it for weeks. ",3
"""What do you think Reddit was like 200 years ago?""",2
"This guy who worked with my dad....we were hanging out for a while and then it happened and in the middle of it he stopped and said ""I can't, it's not you. I really like you and enjoy being with you but I can't stop thinking about your dad"". We moved from the couch to the bedroom and fell asleep. I got nudged awake and then the mission was complete but it was horrible. I didn't talk to him again for 6 months then we ran into each other again and he got a do over. That time it was good. ",4
"I wish that weekends have three days instead of two. One day to go out, meet people or do something fun. One day to do the mundane stuff like errands, chores and generally putting my domestic life together. One day to just lie around, nap and do nothing. I rarely get to do all of them in the current two-day weekend. It has always been forgoing one to achieve two. ",1
"It used to be better. Watch some 9th or 10th (especially 10th) doctor stuff. If you want a single episode to watch and reevaluate the series from, I think Waters of Mars was pretty great (though I haven't watched it in years).

11th doctor is basically designed to appeal to teenage girls and the masses, at the expense of longtime fans and people who can understand higher scifi.",1
"Being chased down by a psychopathic monster?  Running hard and need to escape urgently?

That'll be the first time ever that you've struggled to start your car.  Amazing that it springs into life at the crucial moment!",7
"Not every time.          
Source: I lived near a beach ",32
