"You literally said an appeal to nature wasn't a fallacy. So I  came up with an appeal to nature. If you think appelaing to nature works, you should agree with people who think it's okay to value other races less because it's natural ",3
Dat interest free loan for developers doe....,-1
"[Relevant xkcd mobile version](https://m.xkcd.com/552/)

",59
Got those pubes right off,51
"Hi there! Your post was removed because it uses the text box. Per [rule 1](/r/AskReddit/wiki/index#wiki_-rule_1-), use of the text box is prohibited. You can resubmit your post [here](/r/askreddit/submit?selftext=true&amp;title=Reddit, what is your trick to unfog glasses?) without the textbox.


*I am a bot, and this action was performed automatically. Please [contact the moderators of this subreddit](/message/compose/?to=/r/AskReddit) if you have any questions or concerns.*",1
The money. I might be an asshole but they'll be dead and unable to remind me.,2
"While that is also a problem, I would rather have my privacy invaded than being raped by a phantom.

Or do you mean the privacy invasion of an invisible peeping Tom is a different problem than misogyny? If so, how is sexually objectifying women by spying on them in a locker room not both misogynistic and privacy invading at the same time?

I'm trying to understand your though process here.",17
Why do you think the french hate you so much ?,2
"wait, are you even a country anymore?

[according to my country, you are not](https://www.cia.gov/library/publications/the-world-factbook/geos/uk.html)

hows *that* for misunderstanding?!",0
Handcuff myself to NDT.,1
Which scene? Fixing the phones in grand central or Freak at the most awesome cyber cafe/indoor skatepark of all time?,1
"I sincerely hope that was your teacher's first day. Otherwise, it's hard to imagine how she could fall for that so easily.",1
reddit gold.,3
Zelda's Lullaby is such a beautiful song. That song will always stay with me lol,1
"As someone in the semiconductor industry, I think most of you would be very surprised by just how many ""western"" products are not just made, but also designed in China. GE patient monitoring systems and Mettler-Toledo weigh scales, for example. This isn't new...I visited both those sites for the first time more than 10 years ago.",1
Whether your phone is still in your pocket. At least one person reading this has just lost it!,0
"At my high school, nearly the ENTIRE CLASS would shout it during a test or something else quiet. That's the only time.

Like... really? I'm trying to concentrate. There's a reason it's quiet. The sneeze broke the silence for less than a second (each) and now you all shouting doubled or even tripled that.",0
I'm thinking of it as two seperate events of sex. Which is obviously better than just one. ,2
[Not Tonight](https://www.youtube.com/watch?v=latAzm-2CP8) by Lil' Kim.,1
Careful or Leafy might start making fun of you.,1
"What did you hate as a kid, but now love as an adult? ",1
"Yup. I can already tell I look thinner. I was never what you would call fat, people were always baffled when I told them I was over 200 (the highest I ever weighed was 213). I'm going to keep it up though. It was tough for a week or so but I think my body has adapted and now a meal that would have left me starving before is plenty satisfying now. It's really too bad a lot of people think this is some kind of hocus pocus. ",3
Wait a second trash talk LOTR! lol  They're incredible especially the first one. ,1
"The Lock Ness monster, the only one that interests me since I was 4",1
Communication.,2
"Honestly, I've never used it in an altercation. What it's helped me with is maintaining my balance when I slip or catching something that's falling and so forth. One of the best things I learned in training was how to avoid situations that would require the use of physical force. ",1
"My dad would get up every day and make coffee in the morning.

I would tape the sink sprayer open so when he went to get water to fill the coffee maker he got sprayed...

I would hear ""God Damn It""...every April Fool's Morning",1
"Ok...so why can't the guy just ""deal with it"" and choose somewhere else to eat?",1
"No, wait, The Phantom Menace.",1
You can eat my D in the winter.,1
"If I lived in a swing state it would go to Clinton, because the prospect of a Trump presidency is honestly horrifying. 

But I live in a blue state, so it will go to Stein. Again. Voting third party is about as effective as just showing up at the polling place and muttering ""I don't like the system"" to no-one in particular before leaving, but I can't turn my back on the local elections so I may as well make the gesture.",1
"Whoa I wasn't expecting so many pets. How do you care for them all? Lol that is awful, I'm glad your vacation is a few months away. Enjoy! ",1
"That's a misconception, after a couple years most life insurance will cover suicide.",1
"Hi there! Your post was removed because it uses the text box. Per [rule 1](/r/AskReddit/wiki/index#wiki_-rule_1-), use of the text box is prohibited. You can resubmit your post [here](/r/askreddit/submit?selftext=true&amp;title=Islamic folks of Reddit, what's the strangest place you've had to pray?) without the textbox.


*I am a bot, and this action was performed automatically. Please [contact the moderators of this subreddit](/message/compose/?to=/r/AskReddit) if you have any questions or concerns.*",1
"You might find a little solice in thinking about how different your so-called ""real world"" and the experience of college are from the comparable one your parent tried to warn you about from their perspective. A college education means less and less the further from the 80s and 90s we get, its a lot harder to find a job for youth across the planet regardless of education, and, as far as i can tell, this ""real world"" you speak of is just a desperately self-denying, perpetual extension of high school. 

All of this coming from one currently working in a high school for their masters in teaching science, so obviously my perspective is biased",1
Those guys have zero idea what they're talking about. Although I don't watch reaction videos I feel the same way about sharing movies I enjoy with other people. Keep on doing what you love. ,1
"poor Mich, you shouldn't let it get to him",57
Mmmmm Bop. Hanson. ,0
"Hey, im going to be stopping in brisbane on the way back to you. I don't know what you think about the fact that you can give me a free pint every time you visit. I have done several cross country skiing trips to the moon and back. I am always concerned that the UK and I have been more than just friends. I'm not sure if this is a little more than a year ago. I have a couple more days left. I love you. 

- Turns out I have quite a few words at my disposal :)",3
"Heard 'Mama Kin' on XM the other day and was like, ""Aerosmith? Oh yeah, they used to be really cool. I forgot.""",2
I just assumed that I had some other (less extreme) injury and kind of brushed it off. It started to swell up a bit and didn't start feeling better so I eventually went and got it checked out. The doctor told me I was lucky that it was healing back as well as it was. I didn't need any corrective surgeries or anything like that,2
Ya...and neither is Sarah silverman or Liza lampanelli. ,0
"This is the best one.  Adulthood for me is the minute you realize that something is suffering due to lack of maintenance, and you are the person responsible. Adulthood is maintenance. ",159
"If you want to join so badly, just ask.",5
"Our entire food system is immoral, in almost countless ways.  You are not excluded because you don't eat meat.

There are huge human and environmental components to the farming of vegetables and starches.  People are used as slaves and indentured servants and are otherwise exploited here in the US and all around the world to grow the commodity starches (corn, soy, wheat, potatoes) that vegetarians most commonly use as their main sources of protein.  They are also enslaved to hand-pick tomatoes, berries, etc.  These people are forced to poop in the fields, sleep in the dirt and live on as little as possible so consumers can have mono-cropped produce for as little money as possible.  Farmers in Peru can no longer afford to eat their ancient staple grain, quinoa, because Americans will pay so much more for it.  So they have to grow it, but it gets shipped with fossil fuels to another continent.  Combines pump carbon into our atmosphere at astonishing rates while they destroy our nation's top soil and pollute our waterways.  They spray toxic chemicals on the plants, affecting the health of every living entity.  

A truly bio-diverse and moral approach to eating means seeking our foods from permaculturally raised plants, animals, bacteria and fungi that have all been treated with equal respect by humans who's lives were richly supported by cultivating the foods.",22
Once had a guy with a Southern drawl refer to my team as 'doodoo butter'. ,2
Rescues the day from sure destruction.,2
"A guy friend of mine just had his first date with someone he met on Bumble. I was surprised to read this thread, considering my friend's luck so far. I'd never heard of Bumble before my friend started telling me about this woman and his upcoming date with her, I kept forgetting he met her on Bumble and not Tinder.

Sounds like he's the one potential success from that app haha",1
You must take parenting classes before reproducing. ,2
"No its labor, thats why its entry level job. You learn basics and work your way through it. Its experience could take an average person 6 months to build a house with one person helping them ",1
For sale: Baby shoes; never worn.,-1
My own clone. ,1
Check out the two videos Chris Stuckman made about the movie. Specially the long analytical one.,2
Party in the USA,2
"Here have an extra vote just to push the 2,000 mark lol",1
"I have taken to (more sensitively, I'll add) explaining to an 8 year old that food is fuel, and if you don't fuel yourself, much like a car, you don't go any more.

I have Louis CK to thank for this frank honesty.",3
"Nevermind - Nirvana
I find every song to be memorable, and though people might not like it as much (and its not without its flaws), it helped me through many tough times and so, its a 10/10 for me",1
"""The people have a right to know""

When you're talking about a serious breach of peoples privacy and civil rights... No. No they do not have a right to know, regardless of whether a person is a public figure or not.",2
Nope. I have goals and ambitions that having kids will only destroy.,1
Awesome,1
Authentic emos don't feel like a moron for doing it. ,2
"Buy a hitman, drugs, kill a man, vandalism, arson, animal abuse, child abuse. I'm not sure if suicide is a crime or not",1
You could've been in his/her arms tonight. T_T,1
"7355608

The code to the bomb in Counter-Strike",1
"The whole thing is bullshit. Explanations like that have been put forth. But there's no mystery to solve. The original case wasn't mysterious. And many ships sink there because a lot of ships pass through there. 

It's a mystery created out of nothing. ",1
Any particular reason ?,1
"John dies at the end.    
It's my favourite book. I read it at least once every 6 months. David Wong is love. DW is life. ",7
"I am so fucking ready. Season 3 wasn't really my cuppa tea, but it won't stop me from tumbling head first into season 4. ",2
"Actually I'm not 100% surprised. I've known employers who'll give a pass on being late on an interview, being hard to contact etc. if it only happens once. 90% of the time the excuses are BS, but 10% of the time they're actually competent people who got a sudden stroke of crappy luck (phone conks out, sudden emergency, etc.). Companies with the extra time and patience (and already impressed enough with your CV) can be surprisingly flexible on this point. But you only get one pass. Two strikes and you're out.",3
Your link is dead link kindly check it,1
Dance of joy. ,1
"I wouldn't?  My point was that even though historical figures are probably gross compared to hygiene standards of today, they would at least be guaranteed to not have one of the worst STDs you could have today.  It keeps me from being spoiled at the idea of the question.",4
"Plot twist: He became a zombie, and has to pretend to be his own brother.",2
"Jay Baruchel - not that attractive in Hollywood, would probably be considered a total cutie IRL",5
"That moment when you know someone who's parents are on the forbes top 100, FeelsBadMan",16
Id love a big expensive wedding.,1
"This is my problem with the world. Right out of high school they make college to be something you *need* to go into, but the truth is that it's just not for everyone. You spend four years and thousands of dollars for a piece of paper that doesn't even guarantee you a job. Want to reach an even higher prestigious status? Pay more money and spend more years in a graduate program for more education. Even now so many people are getting degrees it's beginning to lose it's value more and more.

It's just all these people wasting their young years away paying for education. That in itself is ridiculous if you think about it. You have to pay to be educated? What kind of bullshit is that?",4
Definitely my pick for most rewatchable show. You're so invested in following the plot the first time through you miss a ton of the extra things that make it so intricate. I'm on my third rewatch right now and I can honestly say it has only gotten better. Oh indeed.,14
"**Attention! [Serious] Tag Notice**

* Jokes, puns, and off-topic comments are not permitted in **any** comment, parent or child.

* Parent comments that aren't from the target group will be removed, along with their child replies. 

* Report comments that violate these rules.

Posts that have few relevant answers within the first hour, and posts that are not appropriate for the [Serious] tag will be removed. Consider doing an AMA request instead.

Thanks for your cooperation and enjoy the discussion!


*I am a bot, and this action was performed automatically. Please [contact the moderators of this subreddit](/message/compose/?to=/r/AskReddit) if you have any questions or concerns.*",1
"Oh Fuck. I never knew this. I had a favorite shirt in middle school that was red and had a big black winged 88 on the front. I swear I wore that thing every week, I just thought it looked good and I liked the fit. Now I'm wondering if anyone silently thought I hated Jews.",2
"German here: Oktoberfest and bavarian culture is just a tiny fragment of our rich heritage. 

Most of us like beer - Lederhosen not so much.",1
A flatuant rapist. Not sure how much worse it can get.,3
"She leaves her phone when she roams too. So people call her and it just goes off forever. I should also add that it's her personal cell phone, nothing to do with work.",2
You're in for a ride. Just keep in mind that it's technically sci-fi and you're good to go.,1
"My second job, I deliver pizza.  I really hate the people who ask what is a good tip on a 200 dollar order.  I just made 4 trips from my car to your house, drove my own car, made some of the food myself, ""Somewhere around what you give in a restaurant, based on the service.""  Okay then 5 dollars good?  ""Yeah, thanks""  trying not to be too sarcastic!  The 8 dollar tips on our 12 dollar special help though; ""a 20, aw, just keep it man!  Hey you  want a beer or something!?""",6
( ͡° ͜ʖ ͡°),1
"What's 300 years to an immortal?

Anyway, you'd get to see some cool stuff from the past for real without the risk of being killed...",1
"Yeah, drop her. You don't need to keep her as a friend. She can act however she wants to, but you can choose not to participate in her drama by removing yourself. 

Also, her mother sounds like a real piece of work too. It's not normal to fight their battles for them past elementary school, and even then it's only for their well being to get them the best education they can with teachers. ",3
Luckiest ,5
Watership Down,1
"I love peanut butter, but eggs and peanut butter just tastes like eggs and peanut butter.

Eggs on jam is something magical. It creates a whole new flavor that you never knew existed.",1
"This is the best thing I've ever seen! Who made this, you?",1
I think you did way too much acid back then,1
"Like what one other thing?

Replace Obamacare with something ""much better""?

Tax the shit out of foreign imports to no purpose?",7
I work in IT. There are like three girls in the whole building.,2877
using a hooker and get syphillis is less pathetic get than staying a virgin forever,1
"I'm not gonna deny that being a minority does make it easier to get into college but at the same time we worked hard for it while having our own troubles. My parents never went to college so they couldn't help me with my homework nor could they tell me about the college process and SAT/ACT. They couldn't hire a tutor to help me with certain subjects. I did it all on my own because who else would have told me to take AP classes and be more involved? I'm not saying that white people don't suffer or have financial troubles, but as a Mexican-American, and I go to a rich white conservative private university on the Northeast, and I can tell you that these people had it much easier going through high school than I did. Most of them drive BMW's and Audi's on campus and some of them went to a private boarding school that cost like 30K/year. Not to mention that my school costs 61K/year. But the fact that they had a more quality education and I went to a shitty public school just shows that I worked just as hard if not harder than they did. And let me tell you, some of students are idiots when it comes to going to class and actually striving to do well in their classes. Most of them are here because their parent's are rich. ",5
Getting in college.,1
Red light green light....oh wait computer game...the original Mario bros.,1
Snap,1
Here's hoping his genitals fused into something heavier and larger than they originally were like an average sized penis. ,1
"http://pickyear.com/best-headphone-brands/

This is for you. The site isn't loading properly for me at the moment but Beats are at the bottom of a 32 brand list. Skullcandy is above them lol",35
call of duty zombie mode - teamwork.,1
"That people doesnt seem to be able to shut up. It's like everyone have to talk constantly. Like they die if they shut their mouths for a minute.  
Yes i like silence.",22
"I grew up on the edge of the establishment, going to public school and rubbing shoulders with a lot of these kind of people, even though I was a scholarship kid and not really part of that world. It literally cannot surprise anyone in those circles, and I genuinely believe that it still happens, they've just got better at hiding it. The stories I can remember just from school of how parents were bought off and teachers got away with completely abusing their position... and these people were small fish compared to Westminster.

",3
"Well, when I said I was from Cádiz, I actually meant Chiclana. I've lived in Chiclana for a decade. Now I live in Madrid though and I miss it. ",1
I can consistently surprise people with hard work and talent by intentionally keeping expectations low.,3
"I'd argue that Nancy Kerrigan lost her popularity even more.  She gained a lot of sympathy going in because of the incident but acted like a sore loser when Oksana Baiul won.  They were getting ready to receive their medals on the podium when there was a hold up.  Nancy was saying something to the effect of Oksana just fixing her hair but in actuality, people were scrambling to find a recording of the Ukranian national anthem.  

To be fair though, Oksana Baiul turned out to be an alcoholic train wreck and also pissed away her goodwill.  ",1
My brother once called me a hairdryer in his sleep once. Messed me up big time,5
Sawdust,1
"Contrary to popular belief the Chinese population aren't muzzled, oppressed robots.  A lot of them have grown serious balls and there is plenty of at least respectful, constructive criticism of government policy.",27
Do you have the chickens' free range/ biography/certified organic papers? ,4
" Nah, North Dakota here. Looked at my local listings, I can get a 2br apartment for under $400 a month.

You have to live in North Dakota, though.",86
"""how are you""
""good how are you""
""good""

Fuck that. ",3
"It also depends on which category. There are two categories, murder and violent crime. We rate lower in murder because (at least they say) we have a level 1 trauma hospital here",3
"I'm British, it's just a van, or box van, depending on how specific you are",3
Fax machines,1
Instead of 'God says abortion is a bad' there would be I think abortion is bad. ,1
"If you line up all the bones from a snake in a line, you get a snake.",1
Fried green tomato BLT,2
"I laugh in depressing/sad atmospheres.

Every funeral I attend is a ""WTF, brain"" situation.",0
Flip them off ,1
Office appropriate yoga pants,0
Jimi Hendrix. Need I say more. Bob Marley a close second. ,4
Around 4 I would guess. NY here,5
"It's so annoying. I guess if you accuse someone of being creepy, that's the end of the deliberation. They're guilty",0
"Not wanting a romantic relationship is ok, but not a reason to limit you to half of the world's population. Not everybody is looking for that, if you talk to women try and treat them the same as anybody else to get some new friends, and if they want a relationship just say no.",2
"I can't remember any questions that have been asked me ,but I do remember that while on very bad trip. I banged on my neighbor's door and when they answered the door I shouted ""are you Satan  ""at the top of my lungs. Im a very big guy i was 17 at the time. I fell awful about it now. After I left their doorstep I  proceeded to fight a shit ton of police that had showed up. They family who I screamed at moved out soon after. If your wondering why the police didn't just shoot me. Im pretty sure its ,because Im white. So on behalf of crazy assholes I apologize to you.",1
*buffering*,1
Homosexuality at a molecular level,3
"Hi there! Your post was removed because it uses the text box. AskReddit does not allow use of the text box, aside from a period. Per [rule 1](/r/AskReddit/wiki/index#wiki_-rule_1-), use of the text box is prohibited. [**When you've removed everything from the textbox, message the mods for review and reapproval.**](http://www.reddit.com/message/compose?to=%2Fr%2FAskReddit&amp;subject=Post+Review+Request&amp;message=My+post+was+removed+under+rule+1,+please+review%3a%0d%0a%0d%0ahttp%3A%2F%2Fwww.reddit.com/r/AskReddit/comments/49ukqe/what_are_termsphrases_someone_from_the_distant/) and ask the moderators to re-approve it.


*I am a bot, and this action was performed automatically. Please [contact the moderators of this subreddit](/message/compose/?to=/r/AskReddit) if you have any questions or concerns.*",1
"I get where you are coming from, but that went from zero to butthurt *real* fucking fast.",7
"Eating pizza- i used to eat it from the side first, but my dad taught me how to eat it correctly (point first)",3
"&gt; Susie likes hairy balls.

That's nice :)",1
I'm a man and I don't cry.,1
Apparently if you pick the wrong religion you are screwed anyway.,2
Were your parents librarians? ,2
"Jack Daniel's for me, thanks.",6
It only matters when other people think it matters. ,1
"I'm the same. If this internet cuts out one more time, I'm going to kill mys",1
"hahaha, glad to hear it.",1
"Im in the same boat. Been jobless since christmas, luckily i had an emergency fund so i've been doing pretty well, but i really need something soon. ",1
"&gt;mine for coal

""Seriously kid, it's like Minecraft, but real. You'll hit diamond ore in no time! Now get down there!""",13
"I mouse left-handed, but never rebind the clicks. When PCs were first made available at work our pod shared one for several months. And to be honest I never realized they could even be rebound. I have to instantly remap all key bindings on any game I play because F1 is pretty much useless to me. I don't WASD to move, I use the arrows. I use the numpad to target. And I'm definitely a ""mouse click caster"".

I was often called out in elementary school for not holding my paper and pencil correctly. I also really struggled with cursive writing. Pushing a pen across the paper as a lefty is completely different than pulling a pen across paper righty-style. I settled in to doing mash up of printing + cursive and people always comment on how nice my writing is ...? I twist my paper to the side. So the top of the paper is on my right and the lines vertical. Everyone says I write upside down and are a little freaked by it.

My father and I are very left-handed, my mom and brother pseudo lefties who only really eat and write left handed. I so wanted my son to be a leftie, but no. He would pick up his spoon with his right hand and I'd switch it to his left ... and he'd put it back into his right. Trying to teach him to tie his shoes was frustrating until it dawned on me that if we sat facing one another he could mirror my movements. It worked perfectly. I guess I did have some influence though because his snowboard stance is goofy. ",1
I'm in college and I don't think I've actually official declared a major.,1
"American? Gun.

Not American? Tactical Machete. You can literally cut someones arm clean off with a swing from one of these things. Guy in your house has a gun? Cut his hand off.",32
That kids are the best thing on earth. ,1
