Nightmare before Christmas or Sean of the dead.,2
"I also had a bit of a laugh right now, until I realized that person might either never be driving a car, or be a huge risk to their environment while doing so.",16
Population wont be much of a problem as things steadily decline. As things get worse so will food supply and disease and death. But with that also comes war and fighting. I think unless there's some sort of dramatic change... we will see these things in our lifetime. Humans are stubborn. We don't do well with change. Look at how hard it was for homosexuals to get rights to marriage. Now think about how difficult it will be to force people to change their way of life. ,1
The Piratebay. All of it. ,3
"Pink Floyd - ""Dark Side of the Moon""

I was going to say Animals, but considering that's just 4 songs that's kind of cheating.",9
Feminists don't give a shit about chivalry.,5
From Jack Chick?,9
"I didn't think any retail worker actually believes a customer when they say they'll be back so this whole ""letdown"" thing is new to me. At my job we take people's phone numbers/other info down and if they say they'll come back, *we call them the next day to check on them.* it's annoying on both ends I'm sure, but it increases my sales and thus my commission bc once I started harrassing the weaker ones they caved and bought things.

(just kidding I only call them twice over the course of a few days and sometimes I get lucky)",2
Event Horizon,3
"Usually, yes. At Woodcraft they have bowl blanks on sale for like 20% the original price sometimes, when I see one I grab it but it's rare that they're there because of the cost they tend to move quickly here.",1
"They have similar fan bases, but actually lumping them together isn't fair.",1
"yup - was gonna say, the song always makes me a little emotional, to this day.",1
"Age 13, playing with a new back massager when I dropped it on my crotch. At the time I had no idea why it felt like that, but I did not want to stop it. I held it there until I just squirmed and squeaked loudly. Had sticky underpants after that",2
"I don't think I have a moist vagina

Recently became single so I mostly just have reddit and like some video games",5
It counts times two,1
What's the item?,1
"True, thats a valid point. ",1
Nope.  You're a dumbass.,0
Crocodile mixed with ostrich. ,1
I'll go with treatment resistant schizophrenia. Being so disconnected from reality and the possibility of having command hallucinations terrifies me. ,1
America -- Freedom is an illusion and the American dream a fallacy.,1
There's usually some sort of tackleable reason why they're seeking attention though.,2
"Lady in the water. 24% on RT. I loved it. Amazing music, suspenseful, nice cinematography, and it made me feel so happy.",1
And I'm here wondering who the fuck eats candy bar flavored pudding.,9
"9th grade geography teacher (also a football coach) argued with our whole class that the Earth was 4,000 miles around the equator.  We told him he was wrong, 4,000 miles is the radius, It's almost 3,000 miles just across the U.S.  He wasn't going for it...",2
Filled up my car with gas...so the gas inside of the car exploads? ,1
"My favorite mixed drink no one has ever heard of is probably the Greenpoint. It's a sort of play on the Manhattan and is named after my home neighborhood in NYC. Made out of Chartreuse, whiskey, vermouth, and some orange and angostura bitters. ",1
You mean your daughter was [3],68
"Sing it, sister. You and me both. ",2
A net with holes slighty bigger than baby sized,1
"Haha, I actually have to do this with my SO. He's a programmer, and I frequently have to say ""okay, when you're finished what you're doing, save your work let's go do XYZ"" - if I don't, he'll just keep coding forever and not notice that I've just been killing time waiting for him to wrap up what he was doing. ",3
A strong independent black woman who don't need no man is an object? Nuh-uh!,5
"Hah, I did this with my brother. But in my defense, he WAS gay, and eventually came out. But he still says he wasn't having special relations with that kid when they were having sleepovers.",3
Thats the most fucked up jerk session ,1
"I don't recall a decisive moment when the religion table was flipped. I was raised jewish, went to a jewish school, synagogue on fridays, no hebrew school until I was in second grade for some reason. I remember when I was really little that it didn't seem like complete jackassery.

At some point it just seemed stupid. Science and history didn't agree with the stuff the rabbi was saying, god is supposed to be everywhere and all loving but fuck everyone who didn't live in a wealthy section of a well developed nation. Oh and everyone in general during the world wars. And I personally had a couple of really unfortunate mental and physical health issues that made life harder than it needed to be. Weird ones at that. Why did that exist at all? If there was some entity that was supposed to care about everyone and could fix anything, why didn't it? I was full blown atheist by 8, which I realize as a write this probably contributed to hebrew school starting around then. Got thrown out of hebrew school right quit however. Was forced into temple up until I moved out, which I intentionally made as unpleasant for all participants as they made if for me, adopted that ""I'm not trapped in here with you, you're trapped in here with me"" attitude. Dick move I know. Somehow remorseful however.",1
I've been drinking green tea all god damn day!,1
they would've been better off staying part of European Empires  ,-7
"Very dark brown. I want to change my hair color to dirty blond, but my mom disapproves.

Now I don't want to say its because my father has blond hair, but its because my father has blond hair.",1
That ain't enough time! My wallet will still be empty but I know there will be so many games I don't know of right now but will need when I see them on sale. ,3
Indian Reservation. ,1
Yes!  I'm in the 1% now bitches!  and I'm left handed!,2
I think there's a core out there...I can feel it...,1
Bartender must be familiar with asymptotes.  ,1
Lets reconvene in a few days then.,2
I once had a lady pay me for an ice cream in all nickels. I don't mind if it's just them or maybe one customer but there was a line of 9 people. I wanted to die.,1
The Northern Lights! ,2
"Wow, ""Doctor Strong"" means something pretty different in my hospital.  We are inpatient psych so it'd ""Doctor Strong to the Adult Unit"" if someone is being aggressive or trying to hurt themselves in a way where we need available staff to come from other units.  ",2
Holy shit. He's right.,118
Remember a small detail I told them at some point in the past,1
"Daria, the TV show. I didn't like it because my SIL called herself Daria because of the show so I didn't give it a chance for a long time but it was actually pretty funny.",1
This is me on so many levels.,2
*see you on the dark side of the moon*,1
Why would OP want to watch a sad movie though? ,0
Repost Card,1
I've seen multiple people write this. Can I ask you: what do you find a scary picture? Or are you (like me) desensitised to these kind of things?,1
I hadn't thought of that.  I see.,2
Why not play bejeweled then? ,1
"Every time I have sex, I'm in absolute agony. It has nothing to do with his cock size either, it just fucking hurts. I cant do it anymore.

I'm 27 FFS, I thought my growler would've loosened up by now.",1
"That's kind of what happens at the end of *Death Becomes Her*. The girls can't die, but their bodies continue to rot and fall apart.",1
"Novel, anxiety, London, books and books. ",1
either and/or both,2
"Well, I've borrowed someone's socks, worn them, and then returned them without washing them.",2
"soooo reddit K1 speed meet up..
",1
Have a kid...problem solved ;),2
Why did the old man marry the acrobat? So she could do a handstand while he dropped it in.,1
"I believe it was Malcolm Forbes who said “You can easily judge the character of a man by how he disses his boss around those who can do nothing for him.”

I pile on the guy so my co-workers won't think I'm a kiss-ass.",3
I fucking love night mode!,1
"*oof*

Alright, Ms. Bunbaker, I'll be off to my sleeping quarters. You have a lovely evening, ya hear?",1
"**Attention!** Please keep in mind that the OP of this thread has chosen to mark this post with the **[Serious] replies only** tag, therefore [any replies that are jokes, puns, off-topic, or are otherwise non-contributory will be removed](http://www.reddit.com/r/AskReddit/wiki/index#wiki_--.5Bserious.5D_tags--).

If you don't fall within the scope the question is directed to, please do not reply to the question as your comment will be removed. If the question is ""Bakers of reddit..."" and you're not a baker, your comment will be removed. All top-level replies need to be from someone who is in the group the question was asked to.

If you see others posting comments that violate this tag, please report them to the mods! 

Thanks for your cooperation and enjoy the discussion!


*I am a bot, and this action was performed automatically. Please [contact the moderators of this subreddit](/message/compose/?to=/r/AskReddit) if you have any questions or concerns.*",0
Petey Pablo!,2
Watching the reaction of a lizard that's on my windshield as I start to drive off and this is his first car ride ever and you can tell his mind is blown ( I live in florida),2
"Clarkson, Hammond and May are all working together on an as yet un-named Amazon Prime car show that's DEFINITELY not a re-branded Top Gear.",7
"Marvel. Chance of getting superpowers is high, chance of death is low as long as you live in the middle of nowhere.",1
"Tame Impala, Currents",1
Misophonia sucks :(,3
CK has said in several interviews that Carlin was a big influence on his comedy style.,18
"IIRC the $2m+ was punitive damages, which I imagine was reduced.  Frankly, I think it's a reasonable amount of punitives.  McDonald's -- a multi *billion* dollar company -- was trying to save a few dollars by keeping its coffee so hot that the poor woman had to spend 8 days in the hospital.  Punitive damages are meant to punish *and* to deter, yet $2m is barely a drop in the bucket for McDonald's.  The only reason I agree it was excessive is because the compensatory damages were way less, and SCOTUS has held that punitives can't be completely disconnected to the compensatory amounts. ",24
Giraffes and figure skating. I only choose this because a giraffe falling on ice would be extremely comical.,18
Ed Edd n Eddy,1
"And the Lord spake, saying, ""First shalt thou take out the Holy Pin. Then shalt thou count to three, no more, no less. Three shall be the number thou shalt count, and the number of the counting shall be three. Four shalt thou not count, neither count thou two, excepting that thou then proceed to three. Five is right out. Once the number three, being the third number, be reached, then lobbest thou thy Holy Hand Grenade of Antioch towards thy foe, who, being naughty in My sight, shall snuff it.",2
Yeah but.... Home alone... ,1
Stop/don't smoke.,1
Unprotected sex.  ,2
"Hey you don't have to defend it.  ""Feels good, man"" is good enough :)
",1
"Got piled on at Recess for reasons I can't remember, but I remember being tackled as weight kept being put on me. I felt and heard a slight snapping sound as my ribcage got pushed down further and further, and someone shouted ""Guys, he could die from this!"" and then another said ""Hah! Doubt it!""

Before my ribcage almost broke, the whistle rang, and recess was over. I was saved by the bell, nay, the whistle.",2
"What you call yourself isn't what you are. Those people are liars and  scammers. I can't just go into my garage pick up a dremel and a jewelry tool kit and call myself a dentist. If the scammers didn't misrepresent themselves then it is obvious they are not therapists; since they lack everything that would make them a real therapist.

By your logic, I am a movie star, race car driver, porn star, engineer, graphic designer, and accountant since I practice some aspect of all those things. I could even be a fucking astronaut if I just tell everyone I am. 

Just because you give yourself a title, doesn't make you that. Especially since you lack all credentials.",0
"I used to work for this company. They've always prided themselves as a company on cutting employees to the absolute bare minimum per shift. I had so many shifts where I was covering a few different departments, and stressing myself out far too much for 9 dollars an hour. 

Then they cut 30ish percent of their management staff in a really unfair way.

Now, they continue to make stupid, short-sighted business decisions to try to eek out a stupid profit for the shareholders every quarter. They always have been a ""me too"" type company. Try to play catch up and copy kinkos formula. Try to catch up and get into the Geek squad game. Stop selling cell phones, even in markets making a lot of money on cell phones, then bring them back years later and assume people will magically start buying them again. 

They are going to fail eventually because their terrible decision making will have caught up to them. If they keep closing stores and moving to online, this will only work for awhile until everyone just asks ""why the hell am I not just buying this from amazon?""",3
Arlington: The city everyone mistakes for Dallas.,2
"I once said to a girl I met in a club. 

Me: Do you have a boyfriend?
Her: No.
Me: Now you do.

We dated for 6 months ;)",1
"When I first saw Jurassic Park as a kid I couldn't believe my eyes, and it still holds up today even though it is a bit dated, the use of puppets/animatronics was perfect to balance it out. ",1
"Stopped giving fucks and learned to be funny.

Then learned when to pull back and avoid hurting people's feeling needlessly.",1
Why not just go for it?,1
....and the smell of moms basement.,2
U.S.M.C.  Go big or go home.,1
1999 freaks me the fuck out,2
"I think the only skippable things were the songs/poems. I loved everything else and felt it contributed to the overall atmosphere and world-building really well, besides just being interesting in its own right.",2
"In about a week, I'll have spent a quarter of a century on this planet, and I'm just now learning that mulatto isn't a kind of coffee with a lot of milk in it",2
You should follow /u/entropyx1 around and translate for him.  He's creating his own language up there,246
"Despite the fact that 90% of tattoos seem to be fugly as hell and downright cringeworthy, there's a very pragmatic reason I oppose tattoos - the various [medical conditions](https://en.wikipedia.org/wiki/Tattoo_medical_issues) that tattoos bring with them, be it heavy metal poisoning (pretty rare, admittedly), allergic reactions or the plain inability to get an MRI scan. Most tattoos have a pretty high metal content, and an MRI is basically just a big magnet - there have been cases of tattoos heating up so much that they caused severe burn trauma in some patients.",1
"The fact that you are required to sell your life's time to survive. Total BS. Welcome to adulthood! No more structured environment, no more safety nets, and best of all, if you want to wake up tomorrow and have something to eat, you must spend 70% of your life doing something you most likely hate, dealing with people you hate, because fuck you! Here's your complimentary health problems caused by stress and your free subscription to bills monthly! Enjoy!",4
"I had this friend named Zach who I was friends with for 2 years in junior high, and ate lunch with him every day. Things fell apart when I found out how anti-gay he was. We still go to the same school, but I don't talk to him.",1
Is that the same as balls to the wall?,9
Breathing. Asthma's a bitch.,3
My girlfriend. If I fall asleep before her she starts poking me in the side and she has horrible insomnia.,2
"For me, the OnePlus Two phone. It was hyped as the biggest thing for 2015, but it was a major letdown with it's features, specs and price compared to what other more reputable flagships were at the time. 

I stayed with my OnePlus One and never upgraded.",1
"That's a pretty low wage too. In Ontario, Canada, the minimum wage is $11.25 an hour, or $10.55 if you are under 18. It's $9.80 an hour for waitresses who serve alcohol in restaurants, because it's assumed they will get tips.",2
/u/payattentionimsmart should be on the bill of the largest denomination,1
"Kind of like the ending of No Country for Old Men

(although I actually liked it)",2
I'd just prefer to have nothing to do with them. ,3
Boom. Cancer.,1
This is where I excel.,2
Unions did that. Look at history,1
"Corporations are people, my friend",-10
"I guess my story is a little different than a lot of people's on here. In high school I was a C/B student, I'm a pretty smart guy who just didn't care about homework but when tests came around I got A's so it evened out. I was eventually recruited to play lacrosse in college where I was a D/C student, then deciding it would be cool to be a lawyer I took the LSAT and passed with a really high score. I was contacted by quite a few schools and reached to some but a lot said my poor grades were a no go, so my senior year I got all A's which boosted my GPA enough to get me in. I then attended law school where I was once again a C/B student, but I made a lot of good connections. Now I'm graduated, in a completely different state with a cool job doing contracts and negotiations for a finance company making much  more than I thought I would. I've never posted my GPA to any résumé and no one's ever asked so it didn't really effective me other than making me get better grades for a year, once. ",1
Undertale ,1
"scary
https://www.youtube.com/watch?v=R-QjTdyR63w",1
"(Talking about a kid in our class that is a really good kid and is smart, he just grew up in a bad family and made some bad choices) He is a flower that grew up in the wrong pasture.",1
"The definition sums it up pretty good;
*a form of sexual desire in which gratification is linked to an abnormal degree to a particular object, item of clothing, part of the body, etc.*

So i may like my toes licked but if it isn't a driving force to need it abnormally every time it is probably not a fetish.",1
Where the fuck is there a Nazi camp in Denmark,5
"Basketball. Started with no skill, but the slow progress and occasional made baskets keep me coming back day after day.",1
"[The Dyatlov pass incident.](https://en.wikipedia.org/wiki/Dyatlov_Pass_incident)

",2
What does the fox say! ,1
"Living downtown, you learn to hate garbage trucks. They produce incredible noise in so many ways. Air brakes, smashing around of metal on metal when they load and shake the bin. The long blast of their horn before they reverse and put on their ""beep beep beep"".

They do all their work around here between 4 and 7am",1
I think you're special &lt;3,1
"Toenail in my curry.
",1
"You're probably just going to get mad and call me stupid, but on the off chance you're genuinely interested I want to be clear that *I'm* not saying you're dumb or an evil bigot or anything like that. Just that there is a bit more depth to the issue than you may be taking into account.

First of all, you called homosexuality and transgenderism a mental illness. A mental illness *by definition* has to be something that negatively affects an individuals ability to function on a daily or near daily basis. It is *not* an illness.

Moving on from that, I'll assume you didn't mean it in such a negative way and go off of maybe you trying to talk about it is abnormal. In that case, you're missing the historical context of the world ""normal"", a term which was not used in a social setting until it was placed as a way to push eugenics in the early to mid 1800s. (Before that it was an engineering term simply to mean something was level.) 

""Normalcy"" doesn't actually exist in populations, it was developed as a way to promote an ""ideal person"" that doesn't actually exist. It's a warped way of viewing statistics in an attempt to rank people on a scale that historically rewarded the characteristics of the people pushing the research. ""Normal"" transitioned to ""ideal"" and ""abnormal"" turned to deviant.

Less common does not mean abnormal. Your assertion that being different is innately an illness is incredibly flawed from basically every reasonable discussion of biology, psychology, statistics, and philosophy. 

[Here, if you actually want to read more about what I mean by someone more eloquent than I am.](http://blogs.fad.unam.mx/asignatura/adriana_raggi/wp-content/uploads/2014/05/Davis.pdf)

I have a lot more if you care. I'm working on a graduate thesis that is closely related to this subject.",1
Thanks. I've been taking care of family a long time though. My chance for my own life will hopefully happen soon,6
Ah got it. Thanks much for the explanation :),1
Holy fuck I can't take these anymore.,12
Someone gave me a compliment on my looks once upon a time. WTF?,0
Fucking fufu berry man. So damn tasty. I haven't been able to find it in Ireland in years though :/,1
also came for this ~ best ever ~ ,1
"I think you just don't know how to cook, because my food tastes awesome.",6
"401k @ 9% = $90,000/year, but you can't spend a penny.",1
Wild West C.O.W.-Boys of Moo Mesa.  ,1
"What, you think I'm weird? 

Urgot gets me horny like no other. ",3
"they can tell it isn't genuine because they are also eating the chicken, not because of his tone",1
I'm touching my ballsack. Sorry what was the question?,82
"First, learn how to cook, well. That is the formula/recipe. ",2
"Bridesmaids, Love Actually, Mean Girls, and The Devil Wears Prada are all great",1
"This. Most people don't realize that neither them being alive or dead will matter in the great picture. Sure friends and family will be sad in this instance but in 50+ years your name will vanish
Edit: grammar ",4
How's your bro now? ,2
"I was willing to maintain a friendship with my ex fiancee right up until the point at which she was a total bitch to the woman I am now married to.

Bitch, I used to care about your happiness.  Fuck you for not being able to reciprocate.",2
The post I commented on said the average grade is an a. I see the two explanations being a) they're all really good students or b) they're artificially high as a reward for getting in to Harvard/making Harvard look good. ,1
"Joke was attempted, it died on the table though. Nevermind.",1
"I'm to lazy to buy a new lightbulb for my fridge, so I have to use my smartphone flashlight. ",9
"Riding a liter sport bike.






LOL JK. I have to clean jizz off my tank every time I park it.",0
"Socks 9/10

Socks with duct tape 10/10",6
Maybe a little later? ,2
Wasn't me,205
"Sorry, I am new to reddit. I first created an account about a week ago but forgot the password (I know I should be using a password manager), and this is my first time using this account. Thanks for the explanation of NSFW.",1
You're cool. ,25
"My old text ringtone used to be a bit from a rap song some friends of mine had done a few years back.  It was the first ten seconds of a song, which are roughly porno moaning, and a woman saying ""fuck me real good""",2
In,1
You gotta hand it to blind prostitutes.,2
"One tip - I had a hell of a time coming off SSRIs, and I wish I had known this trick: you can go to a compounding pharmacy and have it made into a liquid form that allows you to decrease the dose in tiny, tiny, increments - you can only split a pill into so many pieces.",2
Where is your god? Where is your god now?,14
"I'd pick whichever one that could prove its mythology to be fact.

If there is some higher power out there that wants to be worshiped then it needs to prove its existence.  Until then I have no reason to believe.  If it gives me reason I am 100% open to believing.

Edit: Responses of jedism and pastafarianism are getting upvoted when someone stating they are willing to believe in a god if it proved its existence gets downvoted.  This is why religious people annoy me, it's like they have no fucking brains.",-4
Dr. Grips and Zebra Air Fits are better if you pay $7-$20,4
"Xerox is still a huge company. The company still make copiers, printers and presses, but it's also diversified into all kinds of record-keeping. Xerox runs the EBT card systems for a lot of states...for some reason.",26
"It means you should ask the guy what he means, not us... we don't know the guy, and generalities won't help you because all guys are different...

Just go ask him and save yourself the confusion.",1
How offside works in sports like Hockey and soccer (football). ,2
Ghetto style,1
"It is interesting to me that when you cannot convince with facts (as the facts do not support your case) you instead go on a diatribe about me - someone you do not, and will never really know.  Most of the assertions you make are erroneous and grounded in misconceptions.  In fact, since you don't know me (and never will) this will always be the case.

You have built your home on shaky ground, my friend.  Ad Hominem arguments only make the person using them look bad.

I'm afraid you really have nothing new to contribute, and are locked in the culture of fear and brainwashing that pervades gun owners.  I wonder what it would be like if you turned that eye on yourself, rather than on a stranger on the internet.",1
"I know right. Kids today. Things like this make me feel old, and I'm only 30 goddamnit.

Still. Cell phones were pretty much only just becoming a thing when I was in highschool. I think I remember the Motorola Razor super slim flip phone being extremely popular when I was in senior year of HS in 2002/2003. That and the monochrome nokia you could play Snakes on.",1
"Just more proof that customers are idiots.
",3
it isn't what you think it is. It is some special feeling we only feel in our dick,9
