body,score
DK 64 for the 3ds,1
I would have preferred Skyrim but I won't complain.,12
"**PLEASE READ THIS MESSAGE IN ITS ENTIRETY BEFORE TAKING ACTION.**

Your post has been removed as it violated [Rule 1](http://www.reddit.com/r/AskReddit/wiki/index#wiki_-rule_1-).   You must post a clear and direct question, **and only the question**, in your title. 

Please note - once posted, the titles cannot be edited. If your title breaks the rules, please feel free to make a new post that fits within the rules.

If you feel this was removed in error, please [contact the mods](http://www.reddit.com/message/compose?to=%2Fr%2FAskReddit&amp;subject=Help+Related+Post+Review+Request&amp;message=My+post+was+removed+Rule+1,+please+review%3a%0d%0a%0d%0ahttp%3A%2F%2Fwww.reddit.com/r/AskReddit/comments/4291n2/is_the_ravens_progressive_matrices_iq_score/). 

*I am a bot, and this action was performed automatically. Please [contact the moderators of this subreddit](/message/compose/?to=/r/AskReddit) if you have any questions or concerns.*",1
"I went to a last minute wedding that went the other way. My cousin got engaged to his wife but she had previously been married. They wanted to get married at the Catholic chapel, but the church would have to annul he first marriage. Before invitations were sent out, it hadn't happened yet so the invitations listed the non-denominational chapel. Plans were changed the week of the wedding when her annulment was finalized. ",3
The big beefer,1
I used to turn a persona monitor off on their computer everyday I went into work just to bother them.,1
nah SRD is complete shit too. it's like SRS-lite.,19
Sharp cheddar on apple pie!,1
My parents almost every damn day with each other,5
"It's not, but pretty much everyone on my feed who did it said they were donating the full amount anyways.  Someone probably did that once when the movement was taking off, then it became the trend due to the desire to be more socially conscious than the other FB users.",1
So there is no pleasing you.,2
"She's so relatable I'm teenaged boy and I relate a bit too much to her ",1
I did it once and then an incredibly stressful night found me buying a pack. That first cigarette - holy shnikes the relaxation and stress-obliviation. But... smoking again.,1
Stop rubbing me please!,1
"Yep this looks similar to her mothers.... ",2
"MOTHER FUCKING ***BACON***



TOPPED WITH FREEDOM. BITCH.",2
"Ex boyfriend of mine. He was the singer and guitarist of a band. Very talented guitar player, and he could carry a tune, though he was not virtuoso by any means. He was gigging at a local bar, and I was there too, of course. In between sets, we were joking about not having girls in bands. All very lighthearted, no harm done. 

Later in the night, the manager asked me to go up and sing something, so I did. Now, I've been singing my whole life, so I'm pretty good. Also, perhaps more importantly, I'm young, blonde and fairly good-looking, and the crowd is probably 80% male and they're all wasted at this point. So I appeal to the audience. I go up and sing ""House of the Rising Sun,"" and by the time I'm done, everybody's cheering loudly. My boyfriend leans in right before I go sit down and says, ""See? This is why we can't have girls in the band,"" completely serious. 

Obviously I was very hurt that his first reaction to a small success of mine was jealousy. When I expressed that to him later, he was apologetic, but then went and told me sap stories about how he was bullied as a kid, presumably in an attempt to one-up me.",1
"How about Batman TAS?  I haven't watched it recently, but I think I just found it on Amazon Prime....  how does it hold up?  I do remember me and my roommate watching the old Fox Xmen from saturday morning cartoons in the 90s...and yes it sucks ass.",2
"A big part of martial arts is learning to see oppertunity. Sometimes you're set up to knee, other times you gotta go for a full kick. 

The best martial artists, though, and I've seen it, set you up. They know what to do to get you to react so that they can hit you how *they* want to hit you.",3
My SIL ran out of her macaw's favorite treat so she gave him a peanut. As she turned to leave she felt the peanut hit her in the back.,1
"Exactly. Welcome to being an engineer, where I graduated with a PhD, debt free. At least I made $30k/yr in grad school instead of -$80k/yr.",11
"Hi there! Your post was removed because it uses the text box. Per [rule 1](/r/AskReddit/wiki/index#wiki_-rule_1-), use of the text box is prohibited. You can resubmit your post [here](/r/askreddit/submit?selftext=true&amp;title=Is there any garbage in the article below, the article focuses on image optimization for SEO, isn't it suitable for submission over reddit?) without the textbox.


*I am a bot, and this action was performed automatically. Please [contact the moderators of this subreddit](/message/compose/?to=/r/AskReddit) if you have any questions or concerns.*",1
"Also, don't you do that awesome thing of having recycling bins in supermarkets, so you can get rid of excessive packaging materials without even having to bother taking it home first?",4
"I've heard that in the days of old when people's homes had straw rooftops, a popular prank would be to throw lots of pieces of bread on someone's roof and in the morning, tons of noisy birds would swarm and start tearing apart the tightly packed straw to get to pieces of bread that fell into the cracks. Thus, the ensuing cacophony wakes up the neighbor just in time to see his roof being torn apart.",2
I'd like to think objects are weightless for god,1
Extreme Inspector Gadget Dick,8
You can just upvote to agree with me.,0
Wow. Very interesting never heard that before,1
I'm almost old,1
"Playing free to play, freemium games, such a hollow soul sucking joy.",2
"with your dick cut off ",1
"Despite all the time since you posted this, and all the comments confirming it, I refuse to believe that this happened. Even though it did. What the ***FUCK*** was that company thinking?? I hate to say this because it's so dumb, but I can't even. ",1
I keep all my bitcoin under my mattress noob,2
"I have one friend who jokes about wanting to fuck my sister every time I see him and every time I'm just like ""... Okay. She's a bitch, have fun with that.""",1
Are you confessing to murder?,1
"Way to ignore the second half of my post, the part that I didn't shrug off myself.

What about bringing people together, what about the effect sports have on adults?",1
"Mary and Max.
It's an animated film about a long-distance friendship between an adorable but ignored little girl and an older guy that's suffering from Asperger's syndrome. ",1298
"Sounds like you just wouldn't want to be friends with him, not have him as a president.  Also, it is completely RACIST to say that because he comes from a white state he would be a bad president.",1
"Rattlesnake was a pleasant surprise ",1
mailman,1
"do you use those knife proof/chain mail gloves? or do you think any sort of cut proof glove is pointless/useless?
but yeah I bet !- how often do cuts happen?",1
More than frustrated he started crying,12
The lotto,1
"Looks like someone needs to put the hinges in your hands, fuckboy

Bless up",30
"I totally read that as ""Commentaries on the **Garlic** War"" and I was so confused. ",1
"Reich=dictatorship 
CCCR: communism 
Yes. ",2
its ok. talking only makes me remembers the great moments. and almost all of them were great....,1
"Get the book: Car buyers and leasers negotiating Bible on Amazon or your local book  store. It will save you lots of time and money. ",0
My house 2 blocks closer to the beach.,2
House with paid off mortgage.,2
Smoking.,1
Startroopers,1
"Pretty good. Wife and I cooked a delicious dinner. Watched some anime with my son, which cracked us both up. Got a good night's sleep. ",3
"He makes solo albums with sound rips. [Smash Mouth themed album here!](https://www.youtube.com/watch?v=dQFUA2cr1fw&amp;list=PL4Nm4rhtI5e5p_f8YmH2jk23Zvq_h-UE-&amp;ab_channel=NeilCicieregaMusic)

It's a shame, he doesn't do the whole Trapezoid thing anymore...or Lemon Demon :(",1
Most hours in would either be COD4 or Guild Wars 2...,6
My hologram foams are pretty dope.,1
Crucify him.,1
Rescuers Down Under,2
"Is that ""am a '98 baby"" or ""am 98, baby!""?",14
"Gesture mimicking. It was brought to my attention by the film ""Focus"" and I started to keep an eye out for it and it has helped me spot when a female friend of mine is interested.",2
"Oh no, high school memories: get back in the cellar of my mind!",3
"You need to call dad more. 

When my son is older I had planned to tell him the same thing.  ",1
"I am late to my thread! I had a long distance relationship with a female in Australia. She stayed with me for a bit and then it was my turn to stay with her.  So I fly across the world and she's not at the airport.  She was on a coke bender the night before.  She broke up with me and stole my rental car. Thanks for telling me before I left!! I guess I should mention that shortly after this I witnessed a fatal great white shark attack and have had PTSD ever since.  ",2
"well OBVIOUSLY it's not the best system, everyone knows that, but that doesn't mean it's irrelevent, because millions of people use it daily. ",2
"You say it like it's certain. I don't have children, I've not disappeared or been told off yet!",4
I think you're right,1
to finally admit out loud that Wikipedia is a useful source.,3
"&gt; they all were these perma-virgins who some how were also convinced they were the best thing to ever happen to women.

That's an [oxymoron](https://www.google.ca/search?q=define:+oxymoron&amp;ie=utf-8&amp;oe=utf-8&amp;gws_rd=cr&amp;ei=h0ScVsqcMcq1abeAupgM), completely contradictory. You cant have crazy confidence/arrogance while still being a virgin. ",0
"How can it be every 500,000 if earth only been around for 2016 years?????!!1",0
With that and a $5 bill you can buy a beer.,2
"Photography, brilliant skill. So easy to learn.",1
is your heart as twisted as your words?,7
"Convinced the principle that I did my final project and that it was taken by the mailman and mistaken for mail.

Passed on time, never did it.",1
"Make it a series of gifs, each one having the characters only mouth like half a word of the line. And have them all displayed at once in a confusing panel format.",1
"I fail to see how those would make working out any more enjoyable for me. I just hate exercise, but I force myself to do it because I know it's important. Also, I want to look good.

I've just realized that no matter how much I go, no matter how many different workouts I do, I just prefer being a lazy motherfucker. That's what makes it so hard.",4
"The other day my cat was looking at the bottom of his paw, so I pushed his paw into his face and yelled ""YOURE GAY"". He looked at me so confused, then his paw, then me again.",388
[removed],-2
"It's not that bad. I was a stupid child anyway. ",1
"The ""Legacy Contact"" option on facebook, which allows you to pick a friend to manage your facebook if something happens to you.

I sent my mom an invite to be my Legacy Contact and she freaked out for a moment, since I am about to go to Mexico for a few weeks. Hahaha, uhhh.",-1
I'm *pretty* sure most older people weren't born that way.,11
Quick loads might [not be all they're cracked up to be](http://youtu.be/vBkBS4O3yvY),1
Step one. Throw yogurt in the garbage.,1
"Right. From his point of view...

You know the rest.",3
"Apple. ",2
"Okay, that website seems so fake....",1
I hope you can quit too! But its so freaking hard! My god. And at weird times of the day I'll be craving it. I want to go buy more but I know a lot of people who care about me want me to quit and I want to keep trying. But it is probably one of the hardest things I've ever had to do,3
"Yup. Tough at first, but life gets better after a bit. If it wasn't for my kids, I'd say that it was the worst part of my life. Never say never, but getting remarried at any point in my life seems like a long shot. I value my independence. My stress levels dropped way way way down. Friends and family say I'm back to myself again after 10 years. Nothing worth doing is easy. ",2
"""I used to be a dumbass. I still am, but I used to, too""

-Not_Mitch",2
"I'm sorry I was never bullied? :/ I don't think you understand the upcoming generation. It appears to me (as a high school student) that bullying is like a culture. Some schools have it, a lot of schools now don't. So what I'm trying to say is that ALL of us are entitled spoiled little shits that are constantly asking for the minimum wage to go up and always crying about how the government took our drugs and threw us in jail and freedom and all that shit.

Not just the ones that got bullied. Stop trying to **segregate** us.

/s &lt;-- (That means sarcasm for the ill-informed)",1
"Toss up between Golden Sun: The Lost Age and Tales of Symphonia. ",1
When I was in elementary school I identified with Doug.  Then I turned into Jim Halpert.  It's hard not to when you sit next to a Dwight Schrute.,3
"""May you never go to hell but always be on your way.""",615
Baby brain?  It could be donkey brains.  Does she gave a certificate saying she doesn't have donkey brains?,1
"jesus christ this reply is fucking retarded. You could apply the same reasoning to all the other fundamental forces. What causes mass to ""give"" gravity is their interaction with the higgs field. As to why certain particles interact can not be answered just as why does an electron have a negative charge can not be answered. 
",-2
Soap. It's a never ending cycle...,7
"Rose Leslie - the chick that plays Ygritte on GoT. /r/RoseLeslie ",1
"Yes, original cast was best (except Andrea).",5
Cool. And I promise not to get butt hurt over the Obama thing. I just wish we could have an election sometime in my lifetime that wasn't Big Biz left vs. Big Biz right. The rest of us are getting rammed but good.,1
"If I choose not to floss, do I have to go a week without masturbating? ",1
"I ain't never had a plan to start with, and I ain't planning on starting now!!!",1
I'm sure there are other subreddits where this would be a more appropriate question..,2
"I saw one, it was on an index card.",1
Parasailing in Guam?,2
"Godse wanted a Hindu India. Nehru wanted a secular India. A huge chunk of the peaceful side of the Indian Independence was secular and even styled their rebellions on ideals from the Republic of France and the USA's constitution. 

Godse was tried as a murderer. In Indian law at the time, the punishment was he death penalty. Gandhi had little to do with the constitution. ",1
"My friend also had to have this explained to him, but I think he was 6.",2
Amazon?,1
"Shampoo bottle. Did it when I was twelve. Wouldn't fit so I stuffed as much as far as it would go. 

A few days later my penis was swollen and red up to the area I was able to get in.",1
RIP the offices of all the doctors who come in tomorrow after their patients read this comment on reddit.,0
"The point is definitely to inspire people to do productive and interesting things. There's nothing stopping people from lying about their achievements, but doing so only robs their self and totally misses the goal of the game.",2
Probably really hairy and smells like spices,0
"I got retweeted by Norm MacDonald ",1
Most adult act like they are still in high school.  They just let it out more on fb.,2
"Lost my grandpa and baby in one year ..so i guess not breaking down and losing it completely ",1
No that's the Hilton's you're thinking of.,1
"Not really a narrative here... there's never been a president that didn't do something good. Doesn't mean he was a good president. The whole ""Bush bad Obama good"" thing is getting annoying. I do believe Kathleen Blanco was governor at the time, but she did not request aid so the result was the same. Just a different person.",16
"Same as calling someone a retard. It started out at a label but became an insult. ",2
Be invisible for 24h!,1
"Yeah, he was a dick, but I fancied him at the time so of course I pretended it was no big deal. He always did crap like that to me.",2
Owning pets,2
Makes life so much easier to be able to find humor and pleasure in like everything.,1
Yeah....Its the system for sure......,0
"Interesting! I didn't expect to learn about penis temperature regulation so early in the morning. ",3
If you know you can't tell the difference then couldn't you just train yourself to stay away from both babies and muffins? Or maybe have someone tell you before you take a bite out of a baby?,1
"Well, there sure as hell wasn't any of THAT on sanic!",1
"It's an MD, bitch. ",-1
Username checks out...but how are you making the roux that it's taking so long?,1
"What did you do to him/why didn't he like you??

That's a little extreme",4
"My favorite question to pose to job applicants. ( for Linux sys admins). What is in the /etc/passwd file?. 

You would be shocked how many get it wrong, even after they claim to have Linux experience.",1
"I honestly want there to be something, anything, when we die. Not because I feel like this life is boring/not enjoying it, but because it feels sort of meh to think that this is it. That there is nothing after, makes me sad sometimes. 

But when you think about it from a 'logical"" stand point, why would it be anything after? There is no reason why just us humans just transcend to something higher, etc. ",1
"Yep, half black.  It would be funnier to be half eskimo though.",3
Bring it on down to burger town!,2
[removed],1
"I thought the yoda fight was dumb as hell. Yoda supposed to be wise, not a warrior",-11
"If you want to see how much you're actually writing on Reddit, this [word counter extension](https://chrome.google.com/webstore/detail/wordcounternet-at-reddit/mhjnphkhielgcccinpfmpafghjpedlfa) will tell you how many words and characters for every post or comment you make. (30 words)",1
I can't stop picturing an overly comical version of this.,1
"As others had said, it made me pretty lazy.  I had my AA at 17, went to asu.  Partied my ass off, dropped out and never had a real work ethic.  Finally went back and finished my degree at 25, after spending quite a bit of time unemployed.  Now I have a high concept job and automate any real/tedious work that comes my way.  My company has really well known clients and get sent around the world to run events for them.  

When you are 12 in calculus everyone calls you smart and brilliant, When you hit college and are 18 in class with 22 year olds + you get special treatment.  But when you get into the work force, you are only as good as useful you are to the company.  Being smart doesn't mean much unless you can actually put effort in and accomplish a large or important task.  Starting your own company typically means 80+ hours, you need to learn to actually do things that don't come naturally.",3
"Miso Soup (not a drink but who cares). 

I'm Australian by the way..",1
"Was he UI? I can't believe somebody would kill their SO in such an obvious manner. ",-1
https://www.youtube.com/watch?v=SnCKYzsokYE,1
A bong and a blintz?,1
Do the ones in your dreams count?,1
"hey, it's an internet mirror-- maybe we've crossed the event horizon into an alternate universe-- so do you have green eyes and brown hair, too?  lol",1
"Ugh, this is soooo true.

I used to work at an international nonprofit and did some hiring, and my pet peeve was when people would list ""international travel"" as a hobby/interest on their resumes for internships. I know I come off a bit judgmental, but it seems like something a spoiled rich kid would say. Like, who the fuck wouldn't like to take 3 week vacations and visit other countries?

It would be like saying ""my hobby is fine dining."" You like eating tasty food? How unique!",8
My boyfriend lol,1
"Keep your jeans buttoned and build some ambition in college .... it will be easier to get in the habit of writing at 20 than at 50. Create a career instead of floating from job to job. One day at a time doesn't mean you can plan a decent future for yourself. ",1
"I completely agree with the first half of this, being single and being taken have different pros and cons, and ups and downs are common for both statuses.

Simply being in a relationship does not mean one is happy, too often it's quite the opposite and people just hang on too long. But, being single often gets incredibly lonely. It really isn't a black and white question",1
"Same thing, except it was tauros. It tryed for a few months and said fuck it ",1
"awh man, no I haven't! That sounds awful!.. Everyone nowadays can't wait for a zombie apocalypse. I always worry though ""Wtf am I going to do when I get my period and we're scavenging for shit???"" I suppose you can just use literal rags. torn tshirts and shit. But man, how do native people do it? how do people deal with this?? 

Damn, sometimes I hate my ladybits.",15
"Apologize by Timbaland
My friend heard ""too late to abort the child"" instead of ""too late to apologize"" 
",2
"I completely and totally understand your argument. this is important, we're literally both on the same team.

I just think you're not considering the difference in risk between riding a plane unknowledgable to piloting and being in a boat unknowledgable to swimming. There's significantly more risk of a boat capsizing than of a plane falling out of the air. That's all there is to it. The risk-reward is so different between knowing how to fly and how to swim it's literally comparing apples and oranges. 

I like oranges better. and that sweater's dope yo (sorry if that's creepy af)",2
"Wow, that's way worse than my experiences. Hopefully you've recovered.",1
"Has anyone mentioned Disney's UP? 

https://www.youtube.com/watch?v=DlNY-siOl94",1
Doesn't matter...,1
"Jacking it. ",1
Pussy? no thanks. Im satisfied with my socks,25
"PC bullshit. People that are intentionally mean suck, but some people take that stuff way too far. ",2
"Päh, das niedere Volk im Süden.",1
Medical has come a long way.,1
Anything left in your bank account?,1
It's just who I am.,1
"&gt; Even if he's beat my pussy UP after a weekend and it brings me to tears in pain when he tries to fuck me, it still feels good and I still want him!

I'm the same way with my husband. There have been many occasions where I'm super bruised or swollen and still wanting to get fucked.

He normally will. ",14
"Your moma is so fat, that if she jumped up into the air, she would get stuck.",2
"My first (mathematical) approach would start like this.
Let us consider the 2D case first. Meaning you want to prove, that you don't live on a line. Since I can look left and right and don't see the earth going up into the sky, I can assume that I'm either at a local maximum (positive curvature) or the earth is flat (zero curvature). However, let I have limited sight, let's say of range R. At all points I have been, the curvature in a radius R around my position was either positive or zero (i.e. I've never been on the ""inside""). Further it makes sense to assume some continuity along the surface. However, I'm not really sure how to proceed from this... 

Any ideas?",1
"in some ways you can conceive of the m25 (the London orbital)  as infinite , it's definitely not awesome...
",1
Whats really sad is it would probably be a few days before I realized I was the only one here.,1
Tell that to kanjiklub,5
[removed],1
Thank you for helping us help you help us all.,1
Marilyn Monroe topless fail.,1
Please post pic!,1
honey,3
"Sadly, I think Trump really screwed over the Republicans with his trollish dancing in the limelight.  He never really stood a chance, but he took up most of the media time for the Republicans.  

Not that it matters, as it's all just More Of The Same.  Until America wakes up and realizes that there are more than two political parties that's all we can expect I think.  More Of The Same.",2
"Hours, but honestly, they probably would've just replaced everything.  After so much, that just becomes cheaper.",1
put a cold key down your back,1
[removed],1
"I sprained my ankle while using an elliptical. ",1
There are dozens of us?,5
"Are you my cousin? He's a pizzatarian. ",1
Pissing a lot. I consider it a superpower.,1
"I feel like Boogie Nights deserves a place on here. The first half of the movie is such a feel good 70's ride, then, starting with this NSFW scene (https://www.youtube.com/watch?v=JFX-qfYbHKg), the whole thing gets dark, the characters' stories as well as the tone of the movie in general. Well, I guess anything gets dark the moment William H. Macy makes his exit...",1
"Get the Italian sub. Lettuce. Tomato. Light on red onion. Oil. Vinegar. Salt, pepper, oregano on an Italian herb roll. Not toasted. ",1
Ok markey mark,4
"A big stretch after either sitting in a cramped position, or waking up and stretching.  ",1
Any party in New Orleans is always crazier than the last. Its hard to decide.,1
"Haven't had a chance to, my hearing was yesterday :D

Already looking into classes though. I'd much rather pay the lesser fine and maintain my clean driving record.",2
It's been proven than a cat randomly picking out stock has better results than traders. Ask a cat.,2
"It strikes me as odd to see people say ambian.is super scary. 
I watched my friend have a complete conversation/arguement with himself in the mirror who was supposedly a house intruder he was telling to leave.
Yuuuup dramamine tabs used recreationally.
Oh and trying ketamine for the first time at a rave. Watching kids lose 90% of their motor skills and enjoy not being able to move their bodies. Anywhere near effeciently. oh and ive seen some wacky gruesome shit 
From xanax blackouta
",1
That's pretty cool gotta admit,1
"The look on a woman's face when she's in peril and fears for her life. I could probably word that in a less serial killer-like way, but I doubt that's what you're looking for. ",24
