body,score
"TV show : The Twilight Zone used to TERRIFY me. Just the intro alone. 

Movie : Final Destination 1 &amp; 2. I would watch them all the fucking time and still leave traumatized. ",4
Stovetop is fast but you can usually only do 1 or 2 slices at a time and if the pizza is thick it takes a while to heat it satisfactorily. I recommend covering it and once in a while flipping it on it's cheesy tummy.,1
"Brushing teeth and dancing simultaneously, wouldn't be surprised it's always been a fear of mine.",1
"I think the thing that kind of degrades how incredible the film is that it feels almost like two entirely different movies. Both parts are incredible but I feel like if they had tried to meld the parts better people would like it more. ",3
"Financing something, thinking it'll save money if each payment is smaller.",1
"I like when women seem like.. women?
Seriously, those muscular types are let downs. I love my girlfriend because she is a petite, there is nothing better than cute women. ",0
Just get ready to buy or build a cage because they get hugeeeee !,1
You want to... give up taste? Do you hate food?,1
Almonds,7
"'Popcorn tastes good' by Alexis Ohanian. I like him, but he went too far that time. Although, he did apologize. 50/50 I guess. ",1
"I guess he died like Pierce, masturbating himself until he dehydrated his whole body :(",7
"Easy for you to say, Mr. Convincing Scientologist.",2
http://www.cc.com/video-clips/dxqff5/the-daily-show-with-jon-stewart-out--damned-snot,1
Most of the people in the top comments are genuinely shitty though.,191
[removed],2
Homeward Bound. D:,1
Megadeth,1
"B.B. King concert, a few years ago.",1
"Dude, that's a mom.",702
"I get your perspective, but IMHO it comes from an erroneous view that the purpose of life is to have a charmed life without struggle.  This is a common view, as well as the idea that life is all about doing as many ""cool things"" as possible like traveling, skydiving, writing a novel or what have you.

Struggle builds character, and making sacrifices for the other is the best possible way to show love to someone.

I believe the purpose of life is to love and be loved, and not in the cheesy romantic sense only.  This POV creates meaning.  People are sad, depressed and so on not because they don't have good things in life, but because they lack meaning and purpose.

That is why the West is so much more depressed than much of the world.

So, to me, being alive is inherently beautiful and good, no matter how terrible the circumstances.  This is no way meant to discount the gravity of anyone's suffering, my own or others'.

Edit: I agree people should use their brains regarding procreation, although I am not against having kids.  I would love it if all children were born into ideal circumstances for their being raised.  What that entails is another discussion. 

However, if all humans could easily overcome strong innate biological urges with reason, the world would be quite a 
different place!",1
You have no idea. I know some of the parents who lost their kids. I went to college with the teacher who gave her life protecting her students. I can assure you these are real people. And it affected us deeply.,1
"Sunglasses ",2
"Hello. My name is Inigo Montoya. You ordered some cheese, yes? Here it is.",6
Team Solomid and FC Barcelona.,1
Omg that's like so random,1
"The translation of US-References or jokes like this used to be pretty bad. They tried to do something with this joke but it fell rather flat. Wiggum accuses Bob of having a tattoo that says ""Die, Bart, die"", Bob shows the tattoo and says ""No, it says The Bart the."" This changes the joke a bit but the revelation is rather poor. 

Another bad example is a subway sandwich being literally translated as a subway sandwich (what?). Stuff like that. Some jokes just can't be carried through the translation. There was a halloween episode with Marge being a witch upon which Bart says ""Great, now I am also a son of witch."" It was just translated since the german words for witch and bitch don't sound similar.",1
It's those damn chorizo nachos and enchiladas supremes! They're so good!,2
"A man did not have the same pressures to marry. Yes it was preferable in order to have a son to inherit but he was not shunned by society in the same way a woman was if she chose to remain single. A man could still have a high social standing etc. A woman could not. ",1
"Me:  Do you want to know how I know we are going to hook up tonight?


Girl: ....


Me: Because I'm stronger than you!
",1
"I went in 2010 &amp; 2011. Was nominated in 2 categories, in 2010. Won nothing. But it was an amazing experience to be amongst many of the people I had idolized as a kid, &amp; even more far out to interact with some of them &amp; realize that they considered me a peer &amp; not a fan. I'll never forget that feeling.",1
"This one girl in our high-school, in order to become grade representative, said she would would raffle off PS3's (new at the time) to anybody who voted for her, also got catering for the cafeteria for 4 weeks straight. You can imagine who won.",1
"I made a comment that most bras are easier to remove with two hands; tricker to remove than one hand. Got downvotes and comments that I didn't know what the hell I was talking about; which I found a bit amusing - since I've been wearing bras for 25+  years. But yes young man whose post history is predominantly r/teenagers, by all means, please school me on the fine art of bra removal. I defer to your superior knowledge and skill. Funny. ",17
"Abdicate immediately and give it to someone who wants the position of power.

I do this before an ambitious person decides to assassinate me, stage a coup and seize power for themselves.

I want nothing to do with running a country.",2
DID YOU GIVE BIRTH TO JOHN CENA!?,1
"Frostbite.

I passed out in a car at -42C for 6-8 hours in Feb 2014.  I spent 6 months in the hospital.  Lost 3 left digits (pinky,ring,long)  In October I had my calf transplanted onto the bottom of my foot because It fell off with the necrosis.  

Frostbite is a bitch.  I'm in pain everyday and quite limited with what I can do.  ",20
"Internet stranger, I know I have no right to make demands of you, but if you could play Holiday Road on your next trip I could literally die a happy man! :) ",1
Some one needs to ALLAHU Akbar this,-4
This is when you snap the remaining cigs in half and throw them away.... then buy another pack the next time you're drunk.,2
After much research I see that you are correct. I responded in classic internet expert fashion and didn't even look it up beforehand.,2
You will get old.,1
Uncontrolable itch,1
"haha maybe...

in the meantime, I can answer any questions you have now!",1
"I think the problem is the two main party's don't desire or prepare for coalitions and when they finally got into one they just ignored the 'third' party, which is why it was a mess - the conservative coalition acted as if it was the their party was the majority and that the lib-dems were part of their own party... and not that this was supposed to be a compromise - which is surely what a coalition is.

The entire point of having seats in parliament is those people who don't get a majority still have their voice heard. But a seat majority overrides that, since [generally] a party will vote as one. Which is why a coalition isn't a bad thing - it means no party holds a full majority and it means ALL the party's -big and small- votes matter. It's far more democratic.

So as 'terrible' as the coalition was - it was still more Representative of peoples votes than before. Which if you ask me is more important.

We shouldn't be chastising the voters or the system or even the coalition as a possibility itself. We should chastising the shitty party's who did nothing to work together like they were supposed to.

The seat in parliament system is DESIGNED so that coalitions happen and are a perfectly valid option - any politician who whinges about it simply isn't doing their job. ",1
[removed],762
"Weed being smoked.

Once, when I was 15, my stepmother and I returned home  unexpectedly early from an event that had been canceled. My father was home alone and had expected us to be gone for many, many hours.

When we walked inside, I said to her, ""You know, it's so funny...sometimes your house smells ***exactly*** like Dad's old apartment when I was a little kid.""

Whereupon, she ran upstairs and had my father put out the giant joint he was smoking. It wasn't too long afterward that they just stopped trying to hide it.",26
I freeze up very frequently when I don't know what to say. Makes for a lot of awkward conversations (or lack thereof),2
"I cannot believe that this is not higher up the list. I think people are just burned out on her, but honestly, to be an attractive young woman and be in the spotlight for an 8 year career and remain completely squeaky clean while still going out of your way to do good things for people (and spending big money doing them) is tough to pull off in this day and age, even with the ultimate PR machine.",1
1. What started it all?,2
"You keep using that word. I don't think it means what you think it means. ",2
"

The man is EXTREMELY durable and almost seems like he is not COMPLETELY human, like an animal hybrid of sorts. He's twice the size of an average human and he is running THROUGH aisles and walls like swiss cheese. Bullets are not likely to phase him. People recording are bystanders and security try to stop him but ultimately fail. 

",1
"Deadmau5, Tiesto, Knife Party, Bassjackers, Steve Aoki",1
"I only have ever seen one Multi Level marketing program that was not bad. It was a jewelry company but if my cousin sold X amount of jewelry she would be flown out to run conferences and blah blah. Her parties weren't that bad either, if you were the hostess, based on the amount of money the guests spent on jewelry, you got a percentage, which in turn could be used to get more jewelry. I personally never saw anything bad with it, and she never seemed stressed out or pushy. 

It Works on the other hand is devil. So many people will try to follow me on social media then blow up my inbox with offers. Just because j have a child doesn't mean I want to diet or try your wraps. I'm not even chubby/overweight.",1
Ceramic Engineer is my personal favourite,2
"I am 18+ yrs. , 64kg weight and 6 ft. height. 
My problem is I couldn't get hard erections so I can't penetrate my penis to my girlfriend's vagina. As soon as I try to insert, it becomes soft. I have tried 3-4 times but none of the time i got success. It is really very embarrassing thing. 
I am masturbating since 3yrs. and at a rate of 1 to 2 times per two weeks average and I get hard erections during that but at the time of sex as soon as I put condom and try to insert my penis to her vagina, it gets softer and I can't insert it. It is really disappointing for both of us. I want to know the reason for this and a solution to get hard erections so that I can have sex. Please suggest me any homemade remedy or something like that.
Thank you in advance.",1
"too long, didn't read",8
"Well, I personally just watched it about a year ago. It's definitely one of the best movies I've seen in my life.",14
Hitler wasn't Australian. He was Tasmanian.,2
"This. 

(Let's see if it works.)",2
"Born the year Cher Horowitz was jeepin'  ",1
It's like a netflix for books,2
Jordan was overrated,0
"Yes, religion makes people feel better, but in many, many, many cases, makes the entire world far poorer. Someone feeling good about their chosen deity cannot justify the horror that organized religion has brought to the world. ",4
"Text box. Rule numbah one, friend.",1
"Ask to an 7/10 girl or up: If I asked you to have sex with me, would the answer to that question be the same as the answer to this question?

Enjoy your coitus.",-2
Allegedly.,60
"Thanks for spoiling the ending for me brah.

I'm not kidding; I got 40% of the way through, said ""fuck this shit"" and bailed. Now I don't have to read the fuckin' thing.

I loved the movie though. One of my favourites of all time.",1
"There is a 14 mile stretch of beach you can drive on in Pismo beach CA.  People trailer all sorts of weird things out there for camping on the weekends.  Nobody there on the week days.  

I'm a 6' 6"" 360 pound power lifter.  Although I would still need a nice hand truck,  I can do this with no problem by myself.  ",1
"They've started doing this bullshit in the UK. Damn you we have nothing to give thanks for. Why would Black Friday even be a thing?

It seems to have cooled down though. There's been a pretty serious backlash against the imposition of an American holiday that makes no fucking sense at all in the UK.",3
With the smell of pancakes and maple syrup,2
"&gt; Moskau
And since it's Moscow... How about [Russian version](https://www.youtube.com/watch?v=JhDHtKpfP0o). ",1
"Then religion might be correct. ",1
"This might be a stupid question but how exactly does on network. Should I always try to talk to everyone I meet and get their number? By this do you mean simply staying in touch with these people? ",1
"Born in Chicago, grew up in New York, going to college in the Bay Area.  A lot has changed, but I-80 never has.",1
"Stop crossing oceans for people that won't jump a puddle for you. ",1
I would probably use the term rapper for anyone who has rapped like for Example Markiplier or Danny Sexbang.,2
You have still failed to describe my position.,1
"As a nurse, thank you. But we are treated pretty well by patients and the public. When nurses go on strike it's the only time I rarely hear negative backlash about unions and such.  Patients tend to appreciate good care. But yeah we do get some special ones...ick Mr rub-me-harder...sorry.  A trip down creepy memory lane there.

People are especially nice after we give them the good drugs :P",2
Kang and Kodos,1
Forgiveness.,1
[removed],1
"Thank you so much Allan Almighty-hack,you are indeed my saviour.u did an extremely perfect job in hacking my ungrateful and greedy husband account.the pig spent almost all my parent hard erned money on ladies.after trying all fake and scammers calling themselves hacker,only you prove to rescue me out.i just dont know how to thank you because you saved my family and secured my children future.if you have any pin to pick or any help in hacking any ungrateful cheating spouse,contact him on his gmail. almightyhacker777 @ gmail .com.he's real and trustworthy i guaranty you.tell him you are been sent by diana.(thank me later).
N:B,he got pride ,so please massage his ego.
",1
"Indeed, and being British means you can't say ""no, thanks"" when someone offers you tea.",2
400 days,1
A neat rye whiskey usually does the trick.,1
Toilet paper! I mean think about it: some 100 years or so ago they didn't really have any and could live their lives all the same. Don't get me started on indoor plumbing...,1
Big Penisforvagina,2
rekt.,9
Yeah I think it will phase out eventually. Liver and onions sounds awful lol,2
As a university student...  60+ hour work weeks make me dead inside.  You start going crazy after only being able to sleep for 5*7 hours a week and having no time to relax by yourself.,1
"
The tangle teezer brush...it's amazing! ",1
"As you get older you have less time for games I find. Less desire to play top rated shit too, because it's really not worth the rating. Apathy sucks.",2
"Wait until the stock market drops really low and people are running to the bank to sell. Then buy up all of the stocks you can get your hands on because they are at their cheapest, and sell them off when they get high. ",1
"Antibiotics like Amoxicillin. (With prescription you can a 30 day supply for 4 bucks.)

Imagine having that during the Black Plague?",1
"A friend of mine was telling me about how he was stuck in traffic on the highway for a long time because of an accident. He had to piss terribly so he stopped at a convenience store at the first exit he could get to and they wouldn't let him use the bathroom. So he around back and while he was pissing, said to himself ""way of the road, boys"". ",1
They knew the risks,72
"I agree, and the facade is mind blowing. They really outdid themselves ",2
"That is a long collect call from the International Drainage Commission in Springfield. ",4
"It didn't have much characterization by words, but by actions. And the names were portrayed well enough so people new this guy's Max and she's Furiosa. For instance when they first meet they try to kill each other, then later Max is reloading for Furiosa with one hand while driving and later trusting her to snipe the leader of Bulletfarm.",1
"When she was still alive: she was accused of all the problems in France, really hated by the French people
I was myself thinking she was kind of a bitch who didn't care about her people the I red the biography of her life by Stephan Zweig which is really good (well wrtitten, with good information, and it shows an other side of Marie-Antoinette)
She was not the perfect queen infairly hated but she was neither an evil person",1
"In many systems, EMS is funding the fire-side of the department. EMS bills because Fire can't. They end up with more toys and better pay but usually its because EMS is getting shit for billing patients. ",1
"&gt; walk on your right side ",1
"Eh, it could also be the power level of the lasers is so miniscule.  Unless you're saying that the Enterprise's shields are magic, there is no way they can defuse planet-busting lasers like the Death Star's main beam.

If you look at the canonical power levels in Star Wars they are retardedly off the charts.  No way the Enterprise could survive that.",13
"All servers have to report a certain percentage of their tips as earnings but no server reports all of their tips. It's why they live getting tips in cash, easier to hide.",2
"that is something someone would say if they were secretly planning an invasion. ",1
"Told someone I didn't love him. During a drunk moment I had said I loved him, so I had to either pretend or be honest.  Even though I feel it was the right thing to do it doesn't change how much his silence broke my heart. Out of all my relationships that moment still makes me feel like a bitch.",1
"me too, man",0
"Cajun seasoning ",1
"I envy you Sir, or Madam!",1
My cause is I think it would be funny to beat the shit out of a bunch of peace-loving hippies and take their stuff so I have even more. There's your cause,-1
$230,0
Pink Floyd - Wish You Were Here,2
Didn't realize Will Smith was offered it. His mannerisms would have been a greater contrast to the agents.,3
"Yeah that's pretty good. I meant more like Weyerbacher Heresy, Kentucky Breakfast Stout, or Dragons Milk. Goose Island Bourbon County Stout if you're lucky enough to find it. Generally all above 10% with the exception of Heresy at 8%.",2
"For sure, and now I'll get to spend it doing something I love.  :)",1
"Do most people I run into on the street and in public really have utter contempt for me and are constantly mocking me, or am I just imagining they are?",6
"Unsealed Indalecio from Star Ocean 2. Holy sweet jesus. Imagine fighting a dude who just teleports to the other side of the map (by walking 800% faster than you) and casts World-Wide Armageddon every .2 seconds that can easily wipe your party. 

The Queen took longer to kill but she was a joke in comparison in terms of difficulty.",3
Great answer.,1
Imak,1
"I live in an almost-as-expensive place (San Francisco Bay Area). That said, I *cannot* afford to buy anything in either place yet. I can currently rent, at most.",1
"Wait til you hear about the theory that the earth is concave and the stars are very tiny and contained within the middle of this concave earth. Brought to you by the Lord and saviour, Steven Christ. Search him up on YouTube. He gets very and I mean VERY detailed with this theory of his. Angles, light, speed of the earth, etc. It's very interesting and almost makes you believe it. But of course it's a bunch of delusions from a sick mind. I feel bad for him.",1
"One of the best paying careers out there is programming, and only about half of professionals hold a degree.",1
Spot on. Basically as long as you're not a cunt then be whoever you want to be.,1
"Last day before back to work at a new job. Did absolutely nothing apart from taking the bin out. Ate a chocolate cup cake. Was pretty sweet, I love doing nothing. ",1
"Is it not?! That's the only thought that got me through a really weird night ",2
"I don't know if anybody is left alive. I'm recording this on January 14th, 2015. Nobody ever expected that the kittens would be our demise. It was the perfect invasion. They were already in every household. The government was taken down within hours. I don't have much time, I can hear them at the door. They've taken all our cream. ***Door can be heard breaking down, followed by the cocking of a shotgun***. Shit, they're in! You'll never get my cream while i'm alive, you fluffy motherfuckers! ***Multiple gunshots can be heard, and then screams of pain***. OH GOD! THEIR TONGUES ARE LIKE SANDPAPER! OH GOD! Ahhh^hhh^hhh^hhh",1
"To be fair, if you see calling someone little girl as an insult, youare at least somewhat little-girl-phobic.",3
I'd probably just let myself die,3
Agreed. Hopefully with my SO,1
"All of a sudden I'm homeless. Where do sign up to collect my rations? ",1
[removed],1
A group of us were watching this freshman year of high school. Had to pause the movie we were laughing so damn hard.,2
Ummm... How is that physically possible?,2
did you even little kid at all?!,2
"One thing that might make it a little harder for Latinos is that they're usually visually identifiable as non-white.  The Irish, Italians and Jews all looked exactly like any of their oppressors.  One generation later and the kids are basically just more unaccented white people without a great deal of ethnic identity.  The melting pot tends to struggle when people look different.  ",5
nothing much thanks for asking,1
"Isn't that what they use in planes ",1
"Hahaha, the sudden visibility of tiny subcultures makes me realize those ""cultures"" are infinitely worse than whatever the thing is that they have in common.",1
"All time leading rusher. Emmitt Smith - 18,355 yards",1
Bruce Willis because all of his acting ability come down to a smug look. There is nothing of note there.,1
Unprotected sex,3
"Just googled it. No, it's not that.",1
"Spoil the crap out of my kids, buy a new car and go to Disney Land! After that, I don't really know. Maybe just save up and live comfortably.",1
How fun is paying all those bills?,1
I read this in Jeff winger's voice,2
How could there be an odd number in a rectangular room,1
"&gt; None of that makes marijuana good.  

Define good. 

Like I said, no one is saying that it is physically healthy for a person. 

But the legalization of marijuana would do many good things for a society. One of the largest benefits is providing a much safer (less unhealthy) alternative than tobacco, alcohol, or hard drugs. I would say that is good.",-1
"The sticky in /r/fitness. It's pretty straightforward, but nobody reads it.",1
"TIL /u/RokBo67 is Midas. ",19
"What's your validation requirements for new method developments and how often do you perform your linearities there-after? 

I am a Toxicologist. Anyone who is an expert using Mass Spectrometers (LC/MS/MS or GC/MS) should easily be able to answer that. ",1
"Remembering personal stuff. I need to see your adress once and I'll never forget it. It's cool if I know your second name, but knowing someones parent's name and their adress is really creepy",0
i'm going all cross-eyed now.,1
That kid is going HAM on vapor wave. Shit.,1
"Pretend I am swedish, then at least I won't be butt raped.",1
"Seriously, doesn't get more ruthless than this.  If he liked you the stake would be pointed so it would go through faster and you would die quicker.",2
"Please do something about light pollution your highness. ",14
"The Forever War.

One of the best sci-fi stories I ever read, besides being a great social critique on its own. So much potencial for a good movie in the right hands",6
"**PLEASE READ THIS MESSAGE IN ITS ENTIRETY BEFORE TAKING ACTION.**

Your post has been removed as it violated [Rule 1](http://www.reddit.com/r/AskReddit/wiki/index#wiki_-rule_1-).   You must post a clear and direct question, **and only the question**, in your title. 

Please note - once posted, the titles cannot be edited. If your title breaks the rules, please feel free to make a new post that fits within the rules.

If you feel this was removed in error, please [contact the mods](http://www.reddit.com/message/compose?to=%2Fr%2FAskReddit&amp;subject=Help+Related+Post+Review+Request&amp;message=My+post+was+removed+Rule+1,+please+review%3a%0d%0a%0d%0ahttp%3A%2F%2Fwww.reddit.com/r/AskReddit/comments/43fz53/who_is_the_silver_heeled_basement_stairs_dancing/). 

*I am a bot, and this action was performed automatically. Please [contact the moderators of this subreddit](/message/compose/?to=/r/AskReddit) if you have any questions or concerns.*",1
That the Pentagon is actually in the shape of a pentagon. Like 18,2
"Colonel *was* 'coronel' until the mid 17th century, then it got altered by linguistic 'purists' to more closely resemble its origins, the Latin 'columna', meaning 'column'.

The other one is an adaptation of the Old English name of another town, and thus naturally makes no fucking sense to one whose native tongue is Post-Modern English.",23
