body,score
"Oh yeah that explains it. You know in the jailbreak community at one point 95% of paid tweak downloads were pirated? 95%+ of people won't pay for the most indie, doing it for the love of it type thing you could possibly imagine. Not all media is made by giants, but all of it is pirated at pretty much similar rates. 

And yeah, the media industry is a total dick. But pirates started it. Media's first move was ""don't copy that floppy"" and ""you wouldn't download a car"" and when that didn't work they went on to suing people and scare tactics, as well as pushing for really fucking bad legislation. Which they'd have virtually no interest in pushing if it weren't for 95% of people using their shit not paying for it. You have to understand it's an extreme reaction to an extreme situation.

And yeah, you pirating to ""not give them money"" is not going to help. If magically piracy stopped tomorrow, they'd be elated to not have to pay billions of dollars to try to protect their copyrights. You pirating to stick it to them is what is making them do what you don't want them to do.

So please, eat a dick. ",-6
"I don't know what you mean by tuition increasing every year. Where I go to school it's at an all time low.

EDIT: Suck my dick.",-6
Jeff Bezos,-1
Try 25,-1
Fuck you too,-2
The euphoria is strong in this one.,-2
I must have hit a nerve with you that you now have to comment on multiple of my posts. This is amusing lol.,-2
*dap,-2
"Thanks for the answer, I was really concerned there was some kind of additional tax applied to these that I didn't know about. ",-2
It's the culture that is promoted through football at all levels.,-4
"Liking a girl back. Girls seem to like the hard to get guys. ",-2
"&gt; Is he a good singer? 

Average to weak

&gt;Is he a good rapper? 

Yes

&gt;Is he a good musician?

Once in a generation talent

",-1
No difference than drinkers. If you're not partaking it's divisive and why are you here then?,-6
"For about 9 and a half months?
",-1
So troll.,-1
"Source:

http://www.cnjonline.com/2015/04/11/what-talking-wont-cure-fishing-will/",-1
"I downvoted you while I read that, and when I hit the end, the sarcasm hit me. Take your upvote.",-2
*hamophobia?,-4
Well so is fucking your teenaged cousin but that doesn't stop anyb- hold on I mean of course it does. It definitely definitely does.,-1
"Meaning women settle?

Yes, sir.",-6
"Maybe not the most, but Debra Morgan got annoying real fast.

She has so many emotional breakdowns (almost one per episode) that the Dexter OST has a track called Deb Cries made specifically for those scenes. I mean, come on!",-1
"Rules are for people too stupid to operate without them anyways. ",-1
Suspension of disbelief doesn't allow the audience to believe any sort of nonsense. Suspension of disbelief allows an audience to believe in spaceships with hyperdrives but not that medical personnel will accept organs without question.,-1
Definitions describe how people use words. They do not prescribe how to use words.,-1
"If you're willing to look through my entire post history to find dirt on me, that just goes to show you the true craziness of a modern feminist.",-3
"Not saying you should/should've done this but wouldnt you just get the gun and shoot him instead of yourself idk probably what I would of done ",-5
50 cent to me is a poor mans Tupac,-1
"Seek help and fap often ",-4
"Abrasive or genuine ",-17
"Fair enough, I guess.",-1
"How dare I? It is not a stretch, its a fact. Women are attracted to men who display power and the ability to provide/protect them and produce strong offspring. It is not up for debate. ""I don't know any, so it can't be true!!"" You probably don't know any men who get women to sleep with them just the same, yet you think one half of the puzzle makes the whole picture. You have this idea that men who chase women bow to peer pressure, but its much more likely that a guy who is afraid to put himself out there is the one who succumbs to peer pressure than one who is bold enough to risk rejection on a constant basis. You also have no ability to separate yourself from the argument and have made the arrogant mistake of inferring that I am talking about you personally, when the reality is that I am not. Not everybody finds the same things attractive, but there is a pattern, and that pattern does not support the idea that women prefer interesting men over those who can protect/provide for them and their offspring. 
 
You people are all the same. You act like men are shallow animals, but women are beings that have ascended into a plane of pure consciousness.  ",-1
I've seen it all,-1
"Nope. F em. They want to act a fool, let em act a fool in their own country. At some point, you have to stop playing babysitter. ",-1
I feel you %100. For the life of me I can't stand her an her stupid face an her I'm going insane act . Her youngest son I hate equally aswell just creeps me out.,-1
That wasn't just pre...,-2
"Don't go, the less people who have degrees, the more it's worth for those who do. People think the job market is bad now, imagine what It'd be like if tuition was free.",-1
You have to follow my time line. You are simply swapping out your student loans for unsecured debt. And at a future date you are unable to keep up with those payments. If you just get a loan and not make a single payment then it will look fishy.,-4
depressed,-1
The cops took my waffles. They claimed I was defrauding the neighborhood of waffles.,-1
"The fact that you acknowledge correlation means you admit that the result, worsened race relations, is true, so I only need to show a causal link, such as his behavior.

What would be causative? Events like supporting Trayvon Martin over George Zimmerman? Sending White House Officials to Michael Browns' funeral? Sending White House officials to Freddie Gray's funeral? Not sending any supporters to the funeral of a NYPD cop, slain by a black criminal? Supporting Al Sharpton and Jesse Jackson, both professional race agitators? ",-8
"And it's funny. Bitch. ",-2
"When will the occupation of Iraq, Saudi Arabia, Iran, Syria and Egypt end?",-1
Sander's campaign...,-2
"I would rather have people arguing than everyone agreeing at the unison on something. 


Discussions and debates are healthy and should be encouraged and are not synonyms of conflict.",-1
"Back in high school there was a girl who was your typical attention seeker - loud, obnoxious and really OTT with her body language. One time as she was headed towards our group I said something along the lines of ""hey, let's ignore her and see how long it takes her to lose interest"". She came over, said maybe two lines and when we didn't react, she walked away. 

Looking back on it, even if you weren't an attention seeker you'd probably walk away if the five people you were trying to talk to actively ignored you. I feel pretty bad about it now. ",-1
"That's so meta even this acronym ",-4
Same reason people post stupid questions.,-1
"No, it's because people who aren't part of SRS browse SRS, see the funny posts, upvote and laugh at how counterproductive SRS is.",-4
"""Im going to tongue punch your fart box""",-1
/r/justneckbeardthings,-1
To protect the world from devastation!,-1
"Clinton. 

I will never help put an Islamaphobe in office. ",-2
"Farting. You can fart in my face all day, baby.",-1
his employer was basically stealing his hours so fuck him.,-6
This,-18
"In the interest of full transparency, he changed his vote to ""Fuck you, that's why!""",-2
I have so many questions. Why were you snuggling up to your mother?,-8
"Okay, here's a better idea. Fuck off, with your ethics discussion on /r/AskReddit you fucking dweeb. Nobody cares.",-4
This comment.,-4
"0%

He is too much of a used car dealer to be taken seriously.",-1
"Its a circle jerk.  Its more like a redbull video, cool looking, neat music montage,  but not a great movie.  Remember being disapointed at the end. If it wasnt for Bale, would you still like it?   A good movie should be propelled by story, not whos a cool actor.  Actors should just add to it, not be it.",-9
"I'm out of the loop because you don't know how to use google? This is the shit I'm talking about. ",-5
"Awful song, awful ""rapper,"" just absolutely awful music cmon",-2
Sterilize the human race.,-1
"Video Game- League Of Legends
Board Game- Risk
Card Game- Cards Against Humanity",-1
My fiancée.,-1
We have 512GB SD cards.,-3
A place fur da prostatootz brueueheuehueheueueh,-1
"Smoking, drugs, alcoholism, aggression, atheism.",-1
Then I'd smash your smug face into the computer for being a tool,-21
"Wow, funny how completely untrue statements like this get upvoted. 

Really highlights how the upvote and downvote system is based on our personal biases, rather than facts.

&gt; Inb4 the anecdotal comment about how someone's not biased",-1
"But being inconsiderate is certainly not limited to people who maintain a childlike joy, and maintaining a childlike joy sounds like a good thing if you aren't inconsiderate.  So shouldn't failing to maintain a childlike joy be the capital-S ""Syndrome?"" 

Saying someone has ""Peter Pan Syndrome"" sounds more like people trying to ennoble their stifling decisions by demonizing the person who has given themselves permission to explore a greater degree of freedom.",-2
"I suppose she was an anomaly which sparked an obsession, although I think you may find I was the one wronging her.",-6
"ITT: Facts that not little known. ",-2
France. To many surrender monkeys,-1
"&gt; That's what lobbyists are -- experts in their fields

The problem is that they're *self-appointed* experts in their fields, or experts hired by private interests. If politicians actually needed an expert in a field, they could go out and find one. Instead, they get a stack of people rolling up to their office saying ""Here's a paid-for opinion which comes attached to a bribe and/or a subtle warning about how many of your voters my employer can influence.""",-1
http://lmgtfy.com/?q=autochorissexual,-14
"You do know that the resolution of any apple product is easily avalible right? It's not like they're trying to hide something or pull a fast one on the consumer. ",-1
"Capitalism. ",-6
Soup. Fuck soup.,-1
"Up vote for ""wrastling"".

 Also, I prefer guys who are not swole over a beefcake. I also prefer the whole ""this is how my body looks because of my lifestyle"" kind of muscle over ""crossfit junky"" kind of muscle.",-2
"Well, maybe men get sicker than women? ",-1
"Hate me all you want, but it doesn't bother me and doesn't seem like a big deal.",-1
Yes but I'm a straight white male so no body would give a fuck and people would just make fun of muh white/straight/male privilege,-2
Laugh at someone calling a downs person a retard? Real mature thing to laugh about huh.,-9
[removed],-6
If only there would be a way of not having guns laying around in every american house...,-2
/r/punchablefaces,-1
"marriage ",-2
"Get rid of gender. Solves 80% of the world's problems in one go. ",-1
"Ghetto is good... Ghetto is not good and is perpetuating the crime culture and is creating more and more issues. One such issue is the whole thing with cops killing people.... No well cultured person has ever been shot by a good cop in history. If you behave yourself and do not give a cause for police to pay attention to you then theres going to be no issues. ",-5
"***i worked at the cheesecake factory for two years, and olive garden before that. I think tipping should be outlawed in the US***

Found the problem",-1
"1% seems high. Thats a large portion of the population. ",-1
She asked you to sleep with her? You never said that. You said she asked you to come back up to her room to get to know each other. I would've done that because I'm not a dick. Where's the sleeping with her part in this?,-130
"&gt; hilarious

I'm glad you enjoy the common use of a slang term so thoroughly. 

I'm also glad you chose to be pedantic and critical about a minor detail of my comment instead of actually addressing my point that your ""dislike female character = dislike all females"" assumption is baseless and ridiculous. ",-3
Because we have the most/best access and we lead the easiest lives.,-2
"Apple products.

They're incredibly reliable and efficient. On top of that, there are a heap of free apps on the iTunes store and their customer service is superb.",-4
"Apparently the plan is to treat em like crap for wasting my day, charge em extra per word and shun them for being unable to pay such a silly fee. 

Or we could overhaul the whole system and start with the idea of preventative care so that people won't be so afraid to set foot in a hospital due to insane bills that they wait until they absolutely have to see a doctor because their medical issue is now severe. 

So smaller appointments more often to manage health without fear of bankruptcy. 

sounds like a wonderful idea. ",-1
Ezio. Assasinates the one who crucified Jesus.,-1
"It is you fucking degenerate. ",-4
"Oh my bad I thought you were the same guy who said

&gt;Not trying to defend the guy but in as far as you know the guy didn't actually do anything. The guy looked for children but he talked to an adult (presumably) and then had his life ruined.
",-4
Fund raising with Mike Myers. Yet another thing Kanye ruined.,-2
"I hate this comparison. Apparently everyone is Hitler. I've heard every damn politician, candidate, or anyone with power referred to as literally Hitler. At least switch it up with Stalin or some shit lol",-2
"Terra from true blood. 
Just kidding she is as annoying as fuck throughout the whole show",-1
Whats the brag part!?,-2
Mad Max: Fury Road,-1
Thats not manningface,-1
I came here to say this,-3
"Wow, that must have been an awkward drive home...",-1
Some people don't like being blessed. Me for example. I'm not gonna make a big deal out of it and I'll say thanks but deep down my respect for you lowers and the flame of hatred inside me gets some fuel.,-2
"I finally started hitting the gym a week ago (5'10, 180 lbs, not happy). Ate tons of nuts and such for proteins all week barely any meat. Went to BWW last night and ate 16 wings and I feel like I ruined the five pounds I lost last week.

I mean, I'm compensating for it now, but it was not a fun time post-meal. ",-4
"Guess you've overall had pretty good sex then, if this is the worst you've got.

Who even uses a washcloth anyway?",-1
"I've been an asshole long before just now. ",-1
"You make games and play it all by yourself?
Now thats sad.",-6
It is indeed hard to understand...,-1
"I was just kidding, I did this to see how many of y'all would get salty =)",-3
Your ignorance is showing. Iraq is a mess due to politics not our military's inability to do their job.,-7
"Roses are red
Violets are dead
Sugar is awesome
Oh those are your ashes, my bad. ",-1
Someone has been watching Fox News,-1
"Get my girlfriend to not only love sex, but also want it. Like begging for it.",-2
"I once killed my friend with laughter although instead of dying, he got a hernia.",-1
R,-8
Who the fuck gets personal satisfaction from their job? Fuck this bourgeois propaganda - no one enjoys their job and the fact that you don't doesn't mean you're too inadequate to serve the plutocracy.,-24
"All my friends. 

We have everything; the medic, the leader, the planner, the strong one, the fast one, the kind one, the builder, the random-things-maker, and the tag-alongs. 

Plus I recon we'd just have fun together. 
",-2
"Yea, but Forrest is retar...oh I see. ",-1
What show is that from?,-1
"Because the types of foods that come with a ketogenic diet are foods very high in fat, and saturated fat.  
Fat is fine, within the AMDRs. Saturated fat (yes I know, certain saturated fats, specifically medium chain ones aren't as bad for you) can be troublesome.  
A diet high in saturated fat can increase your risk of stroke/heart attack. My gripe with it, is you're removing carbs (fruits, grains), and then expect to get your fiber from where, solely vegetables? I guess if it's planned properly, with legumes, beans, and nuts, those are good sources, but all I hear is eggs, bacon, red meat, pastries, etc. which (barring eggs), generally aren't healthy for you.  
Another issue is the sustainability. We eat food for pleasure, as well as health. By severely reducing your intake of carbs, that limits the foods you can eat, on a ketogenic diet.  
The reason why most dietitians wouldn't recommend it (here in Canada), is because it doesn't follow Canada's Food Guide. That said, if you insist upon following it, dietitians should be able to help you with designing one that could potentially be healthy. There's nothing wrong with carbs, and in fact, to reap some of the best benefits of fibre, you need to eat foods high in carbs (whole grain wheat bread, oats, fruits &amp; some vegetables like carrots).  
So while yes, fats *and* protein have a higher satiety factor (fill you up quicker, compared to carbs, with the same amt. of energy), it's a very hard diet to follow, and if you ever introduce carbs into your diet again, you'll likely see a trend back towards your previous weight (or at the very least, a spike in your weight immediately, due to increased glycogen stores, and water with them).  
Plus ketones smell, they make your breath smell, and I'd imagine you might have constipation issues eating all that fat and protein with little fiber. Essentially, just eat healthy foods, no single macronutrient is *bad* for you. we went through a low fat phase, now it's low carb, I wouldn't be surprised if protein is next.",-3
Because there was a group of people that 'had' spirit animals that were important to them and their culture. And using it for dumb shit is mocking the meaningful phrase.,-1
Every teenage boy smells his fingers after finger blasting a girl.,-1
"Without America introducing, manufacturing, and exporting them, they never would have existed. Anywhere in the world, a muscle car is seen as pure Americana. 

I'd say that makes them uniquely American. ",-1
Food for prey,-1
"You mean those incredibly beautiful Korean girls who dance around in skimpy clothes and pretend to sing? How do I become a Korean music producer then? ",-1
I would spend those 5 minutes trying to get away from Kanye West.,-1
*whoosh*,-1
Let's go back to the bar.,-1
Dumb and Dumber,-1
/trigger!,-7
"just heard this from a friend of mine who is an IT student. I was hoping for someone to confirm on me here. 
",-17
[removed],-4
I take my phone into the bathroom and Reddit while making poop.,-1
"Yup. Generally, if it doesn't benefit your typical white, college-aged atheist, a lot of Reddit won't give two shits on the matter.",-2
"Be a fanboi then. Champion pick and playstyle are not the same. Twitch chat teenagers votes don't affect me. ",-5
"lmao
",-2
"Wall-E was a fucking dick. He leaves all his friends for a woman. ",-1
Thank you for your service,-4
it's sad. don't do it.,-6
"But if it was anyone else that did this, it would be considered pretty creepy.",-6
"Do you not believe individuals ought to be sovereign over their own bodies? I lean much more toward the person having a choice in any case, by default. You would definitely have to have a solid logical reason for taking that choice away if you wanted to convince me. ",-2
"Well, as an American, I want a politician who can also do shit for Americans...Not just being great at Foreign policy when we have SO many issues right here in our own backyard. Bernie wants to make it a coalition more so than an American led war....which is economically responsible, and lets us focus more on shit at home after only talking about war and immigration for 13 fucking years. ",-2
It must be good to have quick catching reflexes as a bartender.,-1
Bro if you need a surgeon general's warningl steer clear of that shit,-1
How much?,-2
"Republicans! Haha! ",-3
Dude that is a kids show meant for little girls. Please stop watching it,-8
I've seen a few on various sites that act directly outside of self-interest and tell others why they should too in a pretentious manner.,-1
"Yeah, I saw this thread and immediately thought ""Probably still work.""",-1
r/titlegore,-9
Bodies - Drowning Pool,-1
"&gt; The temperature of the coffee had zero effect on whether the coffee was spilled or not

You're right, which is why her suit claimed the lid was not all the way on. If that's true then she is clearly not at fault. And if it had been the correct temps, her burns wouldn't have been so bad due to their faulty lid-putting-on skills.

I get cups from drive-thrus ALL the time where the lid isn't properly secured. I've had a couple spill over the years, we all have. It's not hard to believe at all.",-3
AND SWEDEN,-1
"Some how I don't believe you were in Stars. Chinese guild who played on Taiwanese servers and got the world first for Alone in the Darkness. ",-7
It's cold,-1
it is in me arse.,-1
"By, by the gods, you just invented the best thing ever good ser.",-1
[removed],-2
"Get high value coupons, buy the items with the coupon and then return the item. Pocket the extra money back",-1
"There's videos of a woman being beheaded in the middle of a highway with a fucking sword while laying on their sides, begging for a trial because she was ACCUSED of raping and murdering her own daughter. ",-1
The kitty who smelled feet,-4
I'm all for it.  but don't give me dirty looks if I watch.,-16
"This reads really pathetically, dude. This is the equivalent of guys who donate money to female streamers on twitch because they think the girl cares about them. 

Edit: Missed the ""personally knows"" part, but still. That would make things awkward when you saw her next time, more then anything else, no?

edit: welp, off to make a new account i go. Im in the negative so everything is gonna get caught in the spam filter. Thanks alot pricks. ",-2
"Credit card info really isn't a big deal. If he used it for something I didn't want him to I would just call my credit card company and say, ""hey this wasn't me."" and then charge him with fraud. He would also lose his job if he spread nudes of me around as it would break his personality clause. Again I have dated 11 other guys in my life and he is the first one I trusted with this information but with some people there's just a level of security.",-2
"Jon Stewart with no one close.  After him, I'd go with Ashton Kutcher.  Smart and young. ",-1
"You mean ""It is so common said that way"" right? ",-1
"In my life? Yeah obviously. In like the past 5 years or so? Not that I can think of, I'm sure if a family member died or something I would, but that hasn't happened in a long while so no.",-12
" Macdonalds",-1
My mom has severe Alzheimer's and this is offensive,-3
"Kids. He was obviously very young because that kind of teasing certainly would not happen in high school ",-1
"They hate us cuz they ain't us ",-3
"&gt; Unfortunately for many Americans, their ~~right to own a gun~~liberty is worth all of those lives. In their view I mean.

FTFY.",-8
"But Levi's jeans are actually good, whereas Beats are not.",-1
"She wants the ""P""",-1
"""Final Countdown"", and be holding a rocket launcher.",-1
You sound like a closet vegan subtly trying to push your shitty foods on us,-3
"/r/shitredditsays and /r/mensrights. Both are so sensitive it's hysterical. Product of the pussy generation.  ",-3
"I think the last two books came out after the movie, right?

Personally I think Paolini lost is talent as he got older, but IDK.",-1
Ha! Hideki is a very real person in Japan. Hopefully he's coming in October to come visit the Texas State Fair!,-3
"Disappointment. ",-2
To be a playa you got to know how to play,-3
10's don't exist bro!,-1
"&gt;He or she is not misrepresenting anything.

Bull.  Fucking.  Shit.  If you were half as clever as you thought you were you'd clearly realize that this conversation has fuck all to do with art.",-3
Gonna go with Paris. Gold toothed gypsy children pestering me to buy single shoes and broken microwave doors. Toothless old men banging on my car window begging for money. Absolutely horrid,-2
"What?  That is incredibly stupid.  The fetus isn't a person, regardless of whatever the woman thinks.  You can't tell me that women legally have the ability to determine the person-hood of fetuses.",-1
Yes but now the circlejerk is making fun of Bernie and his supporters.,-3
DEEZ NUTZ. Zang,-1
"Self confidence,  or at least a solid sense of self worth. Lack thereof is a deal breaker. ",-1
That he's a decent person?,-9
"Its about time you give up. I'm not being an asshole, just pointing out where you completely went off track. I'm can't say I'm surprised that you jumped to name calling, it's fitting.
Have a great day.",-1
If you don't like the political discussion go improve it.,-9
a lot of jobs also have to take their work home btw,-4
I'm 99% sure the 1% just won,-2
You're welcome ;) Glad I could enlighten more peasants.,-10
"&gt; The wiki

If you are going to believe a wiki page you might as well believe anyone",-4
"Which is exactly why I prefer the term gender equality over feminist. from what I've seen the men's rights movement started out with great causes, fairness in child custody cases, support for speaking out against sexual assault on men, spousal abuse against men, and negative male body image issues. However the cause got dragged down by men who have perverted it into maintaining the status quo where men have all the power and women sit there looking pretty fellating them.",-2
Welcome to the club.,-4
"Not where I live it's not. Where you live it is.

Edit: Got downvoted for saying that it's not common where I live? Nice to know reddit is a place where people downvote you for living in an area where people don't do Xanax...",-2
Completely agree with both. Not believing in global warming is like not believing we're cutting down too many trees.,-1
