body,score
"What did she do that makes her underappreciated? Her [Wikipedia page](https://en.wikipedia.org/wiki/Lot%27s_wife) just says that they were fleeing from their city and she looked back (despite being warned not to), and then God punished her. I think we can argue that looking back was a very human and understandable thing to do and that she was unjustly and disproportionately punished, but I don't see anything here that makes me go ""that woman is amazing"". Did Wikipedia miss something?",4
"Starvation ",2
"I think S6 would've been significantly worse without Dawn as an idea. Because she meant Buffy had serious real world responsibilities that she couldn't run away from. 

She was a character done poorly, but I think the show would've become worse for a while without her. ",2
"YOLO!

A few weeks ago I heard a girl telling someone they left their drunk friend at the bar without her purse. She laughed when the person asked her why and said this. ",2
19 year old Connecticunt,1
the best way teach is to actually have sex with them.  which is another thing which is wrongfully socially unacceptable.,0
Well that is until you get all negative.,1
People who open my door and then when they leave they don't close it all the way...,2
"Don't ask for reddit gold.   You won't get it. ",1
"One of the school principals had anger issues. 

* Some students were late that morning and he stomped out screaming to the front gate, ordered the gate locked, and raged on the students and almost sent them all home. The executive principal had a talk with him.

* At a Saturday detention, he screamed at a late girl (she was 5 minutes late, mind you) and said something along the lines of, ""DO YOU THINK I WANT TO BE HERE? IT IS A SATURDAY! HOW COULD YOU BE LATE TO YOUR SATURDAY DETENTION? BLAH BLAH ALARM BLAH BLAH RESPONSIBILITY? **GO HOME! YOU'RE WORTHLESS, YOU'LL NEVER AMOUNT TO ANYTHING, WHY ARE YOU EVEN AT SCHOOL?**"" Yeah. 

* I didn't know ""Huh?"" was a rude and obnoxious response for western countries. He was white, in an Asian school. I was in trouble for some uniform thing, and he said something quietly and we didn't have the habit of saying, ""Sorry, what was that?"" or ""Excuse me?"" so ""Huh"" was a fairly acceptable response for most situations. Not to him. I said ""huh"" out of habit, and he SCREAMED AT ME because he said that was rude. I had no fucking clue. He said something again and my reflex was back and I huh'ed and he LOST IT AND RAGED AT ME put me on top of his black list.


.....


edit: formatting.",2
"Was a manager of a retail store at the local mall. It was a typical Saturday afternoon, I was folding some shirts and gossiping with my best friend who also happened to work there with me when suddenly the most attractive guy that I have ever seen in my life comes in to look at some pants that were on display in the front. I start freaking out and getting butterflies while my friend begs me to go talk to him. I walk over and awkwardly ask if he is finding his sizes okay and he says, ""Yeah, just browsing."" and makes a beeline for the exit almost immediately. I walk back to my friend defeated and tell her jokingly, ""The love of my life just walked out that door."" and go back to folding, thinking nothing of it. A few minutes later he comes back in and introduces himself, says he had to at least know my name, that he is only in town for the weekend with some friends for some event, and we exchange numbers. Long story short I ended up marrying the guy and the friend I was working with that day was in our wedding. Our love at first sight story! Freaks me out to think that if I wasn't working that day or if he hadn't agreed to go out of town with friends I would never have met him!",2
"Jack Bauer, Angus MacGyver, Sherlock Holmes, and Jason Bourne",1
Thinch.  The piece of toilet paper that comes off when you grab it between thumb and forefinger and it tears rather than rolling.,2
"Can't be unseen. ",1
"You can't prescribe heroin anymore, however the other two still can be legit prescriptions.",2
"know your enemy ratm

bleed it out linkin park
",2
Trees?,1
Im guessing you dont sustenaince farm in a mud hut then? :),1
"Although, as far as anthropomorphic personifications go, he seems a pretty nice guy. Just remember to be good to cats. ",1
Whut.,1
"You must not live in the South. Squirrel's a delicious meat that's completely normal to eat around here. I know it sounds weird, but don't knock it before you try it!",3
"Their Eyes Were Watching God.

I never would have read that book if I wasn't required to, but I ended up liking it a lot.",1
Oh my god mom! And I thought you were dead like my dad told me for all these years!!!,0
The Soviet party-line response to the abundantly stocked American grocery stores was that none of the people could afford to shop there because of the greedy capataiststore owners.,1
Backdoor Whores 25: The Black Hole.,3
February,1
"There's also the hassle of handling potential property dmg and taxes on second home, sometimes the maintenance is just not worth it.",1
"*It's Summer, and the Darkies are gayyyyy!*

Roger singing ""My Old Kentucky Home"" in blackface was fantastic. ",14
where's OLD BOY at in this thread!,1
I feel like Kanye is really shy and awkward and he is unable to fully project his new-found bravado.,6
Green Frog Convinces a son to kill his father,3
"Not if he was using my shitty microwave. ",2
"Little Secrets by Passion Pit.
It's about heroine addiction. The children's choir really brings it in.",1
"Lefty loosy, righty tighty.",26
"Weird I don't remember seeing you.

BTW it was actually just my bday...",1
"You sir are smart! Sorry, i'm not an english native speaker",1
"She did a ton of bad things, but that doesn't make the GOOD things she did bad",-1
Boys soul,55
"Also the nononoyes jump scares:

Character is doing something, the audience can see mr skeletal's reflection, camera looks away for a second, mr skeletal's reflection isn't there anymore, camera focuses onto character who looks at the mirror and sees mr skeletal's reflection, character turns around, mr skeletal isn't there, character phews, character turns back, and DOOT DOOT MOTHERFUCKER",2
"Every 2 or 3 minutes? Constant scanning is the key. (At least in metro Detroit traffic it is...)
",4
I don't think tomatoes and baby tomatoes count as two separate fruits/vegetables haha,3
"Socks are coarsely woven cotton. I detest cotton. Will not touch cotton balls! When socks get warm from body heat it makes the texture even worse. Its like miniature individual cotton prisons for ten guilt- free appendages. Nope! Sorry. I hate my feet being imprisoned in any material but cotton socks...no.

EDIT: spelling",1
"My sarcasm funnily enough. ",1
"Hi there! Your post was removed because it uses the text box. Per [rule 1](/r/AskReddit/wiki/index#wiki_-rule_1-), use of the text box is prohibited. You can resubmit your post [here](/r/askreddit/submit?selftext=true&amp;title=What thing are you currently procrastinating from doing by being on reddit right now?) without the textbox.


*I am a bot, and this action was performed automatically. Please [contact the moderators of this subreddit](/message/compose/?to=/r/AskReddit) if you have any questions or concerns.*",1
"While on the surface I may appear quite stern, internally I must bow before your superior boat-pun-making abilities.

Please, take my wife, show her your captain's log.",3
"Least he seems smarter than your mother.
No offense.",0
[removed],1
Fellow recovering addict here. Congratulations on the 4 months! Keep it up!,2
"Because I was 16, the guy was a douchebag and I had no interest in marriage especially not to him. ",2
I'm from Houston. I can't quite sound it out in my head though. What is it phonetically?,1
"I'm sorry, it seems I had a wrong assumption that annual inflation of the dollar is above 2%, which it isn't. [This site](http://www.usinflationcalculator.com/) claims 0.3% inflation from 2014 to 2015, so you'd lose roughly 4m in value from your 1.3B jackpot in a year (with inflation levels staying the same). Of course, if you took out all 26m that accumulated with the 2% interest, your bank account would be worth a bit less, but you can keep it stable and withdraw 22m $ annually.",2
"Using a throwaway because my main can be linked, and it's something  I want to keep private for the time being.

I am/was addicted to xanax for a period of 4-5 months, I have been detoxing/going through withdrawal for it for nearly 3-4 weeks now, my family doesn't know and most of my friends neither. My friends mainly don't know because I'm just generally afraid they'll see me as lesser, weak and unstable. Or if they do know that I got problems, I barely turn to them on the shittiest days (the ones where I literally want to die)

How did it begin? I have been diagnosed with borderline personality disorder, anxiety and a mild case of depression. I am not certain I have all of this but I do experience panic attacks, depression etc, but that's not that important.

Why I'm telling this is that me getting hooked on xanax was due to it being prescribed to me. I had a few months of just going to a psychologist, my anxiety etc was pretty mild then and I dropped it by not seeing it as a huge problem or obstacle in my life. Last year it got to the point of panic attacks multiple times in a week which lead to more anxiety and depression and even some periods of suicidal thoughts.

My friends told me to go see a legit psychiatrist who well..after some time of talking to me diagnosed me with what I'm ""diagnosed"" with right now and prescribed with me with some SRI's (don't remember which ones exactly), those didn't do shit and then I guess she figured it was due to anxiety and prescribed with xanax off the bat, the strongest benzodiazepine there is. For 2-3 months or so I took it with the doses I was told, but at some point (I listen to a lot of rap and they glorify xanax abuse), I decided I should try it with alcohol. So I did, and let me tell you holy shit it felt amazing. I had not tried any other drug than weed and shrooms before that and I generally felt really relaxed and okay. That was the point where constant abuse of the drug started happening, something which eventually lead to me getting addicted to it.  Why did I start abusing it? I was in a shitty place mentally - I was insecure about everything. My looks, my personality, my disorders (I still am and hate myself) and it was a nice way to escape it, and while it doesn't have the effect of opiates etc, it worked for me.

At that point I was getting into partying a lot more. A big circle of my friends consisted of DJs and just people who party a lot (still are, but I'm trying to distance myself from them, even if it means losing a big portion of my friends). I started hanging out with them and well at some point the routine went as follows: daily xanax doses, if I had a shit day I'd drink alcohol also. On the weekends? I partied with them and got wasted and high. I probably had a period where I wasn't even sober for an entire week.

I manipulated with doses so I didn't create any sort of suspicion although I OD'd a couple of times. A few weeks ago since I saw that this is a hole I can't and won't want to climb any more deeper in, I decided to call it quits.

I went to a new psychiatrist, explained my situation and got new benzos to help me with withdrawal (hospital-based detox wasn't an option, my family can't know). Was told that since my doses weren't that high that I should be able to deal with it.

The physical part is well, I guess gone. The start was horrible - shakes, nausea, the pain was horrible and I wanted to die (no seizures luckily) but I'm seeing signs of the emotional one starting. Suicidal thoughts are resurfacing, my anxiety is coming back and I'm scared, I won't off myself, but I'm scared of falling back into something else or just generally fucking myself over. I've been lucky, I haven't lost a lot. I've lost friends, especially one who was the sweetest and most amazing person in the world for me, but she couldn't handle it anymore. My academics have obviously gone to shit, but thats the least of my worries right now. I hope I'll manage, but I just want to say - this shit is nothing to fuck with. Mental illness is treated like shit in most places, you'll probably just get prescribed a drug and left alone, and that's where things like this start.



Whether it be oxy, xanax or regular SRI's, please talk to people if you think you might start or are already abusing them. Go to your psychiatrist first of all, but talk to your friends and family, just don't let this shit happen to you. I'm pretty sure I will never escape this and my perception of myself has changed forever, I'll always see myself as an addict, something which you don't want to see yourself as, because of the stigma mainly and well, just thinking that you're that weak as a person that you can and are an addict. (even if it is not true that addicts are weak, I still see myself as weak due to this)",9
"I've literally drawn blood over that remark. ",1
"Only been unemployed for about a week... But: wake up, hang out with my partner until he goes to work, apply for jobs, binge watch New Girl, exercise, make myself a nice meal, read. I have three interviews this week so I'm feeling pretty positive! Two of them are at coffee houses, but whatever!",2
I don't see how that makes it shady.,1
"I'm a fan of the Wachowskis, and would take either a bullet for or the penis of Tom Hanks because I love him so dearly, but I couldn't do it.

I had started reading the book a week or so before sitting down to watch it (and I've still not picked it back up again) so I knew what a complex thing I was getting in to but, not matter how hard I tried, I couldn't get into it.  It utterly failed to engage with me on almost any level.  It looked good, I'll say that for it, but I don't think they got the structure right.

It might be worth pointing out that one of my favourite films is Magnolia, another long, complex, interweaving set of narratives.  ",1
isitchristmas.com,2
"Hi there! Your post was removed because it uses the text box. Per [rule 1](/r/AskReddit/wiki/index#wiki_-rule_1-), use of the text box is prohibited. You can resubmit your post [here](/r/askreddit/submit?selftext=true&amp;title=How many people watch The Tonight Show with Jimmy Fallon? Does anyone enjoy his interviews?) without the textbox.


*I am a bot, and this action was performed automatically. Please [contact the moderators of this subreddit](/message/compose/?to=/r/AskReddit) if you have any questions or concerns.*",1
I just love the fizz tbh,1
"So I'll also work my relatively shitty-paying job and make an extra 30k. I'll be comfortable. To be truly honest, though, I'd have to debate adding a couple seconds.",2
"As much as I want to say ""be a billionaire"", I'd rather end all child and animal abuse permanently. ",3
"He can't exactly say he isn't going to win.

If he stepped on stage and said ""We all know I won't win"", everybody will walk out. At least Bernie has to act like he thinks he has a chance.

It's like when people get angry at the Pope because he insults islam or puffs up about the catholic church or something. What do you expect?

It's his church, he's gotta be the strongest proponent.

Same with Bernie and his campaign.",1
Adoption can be pretty expensive.,93
THIS. Everytime I see it I just can't help but get mad.,1
"I really want to ask this girl out, but I'm just worried of the outcome.",2
Rebar less then 1% of the world can do what i can longer then a week.,2
Hey I saw that o....I mean Wut,5
So did you reply?,7
It's really not dead. It's just a small sub. There are posts pretty often.,1
After someone tells you they love you.,1
Buy somebody for a day... sigh,1
"Internet going out. It's a mild inconvenience to deal with tech support, but tv writers think that anyone under 30 should be having some sort of unbearable phsyiological reaction to it.",1
"Woops, thanks for heads up. ",1
"I'm undecided if it's a regret or not but here it goes...

I'm 22 year old female and currently in a relationship but this is my second ever sexual relationship too. Now I'm kind of happy that I haven't slept around but then that means I don't have a lot of experience BUT I really like watching porn and then try new things out... 

I can never make up my mind if it's a good thing or not! Boyfriend says he respects me more my decision not to sleep around but sometimes I feel like I frustrate him but then again if he asks me to do anything I'm totally up for it because I want to try new things out too! ",1
"Peanut butter and tomato.
It's not even that odd, but no one I've told about it wants to try it.

",1
"yeah you are right actually, i seen an awful one with RDN in not too long ago, he had a family and they moved to some small town and i think they were on the run from people, it was so shit.",1
"00:30 AM In UK. ",2
The man bun.,14
"Also don't let us make decisions unless you give us a clear *this* or *that*

Subtlety hinting how you like lasagna will get you frozen lasagna from the supermarket, not a date to some posh Italian restaurant in 99% of cases",131
I want to go back to Scotland.,1
"Even that can be bull these days.

Source: I've published three 1-star books on Amazon.",1
"Not exactly spine chilling but there's a video I like by Mac Demarco for the song ""My Kind of Woman"" and it's a great song too. ",2
Amerika...,1
I think we need more information to help you.  Can you elaborate on the situation?,1
"Oh boy not me, but another guy at my work recently left in what I would call... close to what I'm reading here...

So I work at a pretty decent financial firm in Boston. Around the time that reviews and promotions are happening (my company is big on filling higher positions from within), one guy who works at my company, lets call him 'Steve', starts leaning on his supervisor (a real hard ass from what I've been told) for a promotion that he's  been gunning for, for apparently about 8 years. So this year, Steve has had it, and he isn't being subtle about wanting that promotion. Steve's supervisor looks at him, and plainly states that Steve is simply not a good enough, nor intelligent enough worker to be considered for the position.

Well, later in that day, Steve's boss is sitting in a small meeting with some board members on the 28th floor. What does Steve do? Why, he walks into the meeting, and without saying a word, he punches this guy square in the face, taking him right out of his chair. From there I think he must have realized what he had just done, and he proceeds to flee the property. 

Sad thing is, I think Steve is still in jail... You don't fuck with people with money like those guys have I guess. Still thought it was a killer way to say 'i quit'.

Update: There seems to be a little debate over this. To add more information, the boss was a jerk, and apparently really difficult to work with if he didn't like you, so good on Steve for leaving. At the same time, word got around, and apparently, Steve was, in fact, a terrible worker, and apparently he was jailed for this assault and how he handled it over the next few days (apparently things devolved into things involving drugs and him fleeing from the police). I can't really remember how drugs were involved but I remember them being a part of the story. Mostly it was just him fleeing police I guess.",27
"My fiance is in the navy and she tells me about it all the time. As a male, I'm sorry you have to deal with that bullshit. Trust me, a couple of my fiances co-workers are on my ""on site"" list. ",1
"Take the time to learn about Cologne/Perfume and find a good quality fragrance that suits your age and the setting. 

People seriously underestimate the overall effect of smelling nice to the opposite sex. If you smell fantastic you are instantly more pleasant to be around. The sense of smell is connected with the Limbic System which is also associated with memory, mood and emotion. 

",4
"Otherside - RHCP

This song refers to one of the band members, Hillel Slovak who died of a heroin overdose on June 25, 1988. This song talks about his struggles from this addiction. The name of the song, ""Otherside"" is also used to say ""afterlife"".",27
Ocarina of Time is the 5th Zelda game.,22
"When someone makes a slurping noise for every fucking sip of their drink. Just tilt your cup, man. It's not hard. ",1
"One big reason for that is that there's a lot more risk of life and safety for women in casual hookups. Another is that the majority of women who regularly pursue casual sex report that most of their partners don't care if they (the women) enjoy it or not, and don't bother to try and help them get off.",2
"Ah, good ol HMCIBBISFYMBMFMMFCSNTYMDCIGFYA.",132
"But think about the reason why women are getting paid less in the first place - companies don't think women are as efficient as men. Their logic is that they would pay slightly more for a man because they can probably do better and get more work done compared to a woman. ",0
"Nope, sorry forgot about drugs. I don't do them.",5
"Tickle people from afar. ",9
"Waking up from a VR set in a virtual reality arcade, my memories coming back to me instantly. Then I think about my experience in it's profoundness, even tearing up as I begin to understand and even envy the concept of death, and though I know it is an impossibility in this dimension of which I exist in as an eternal consciousness, I find comfort in the fact that this arcade has an infinite amount of quantum VR systems that tell the same (or different) stories from different angles, different times, or even different circumstances that change everything completely, and I plug back in",1
"Hi there! Your post was removed because it uses the text box. Per [rule 1](/r/AskReddit/wiki/index#wiki_-rule_1-), use of the text box is prohibited. You can resubmit your post [here](/r/askreddit/submit?selftext=true&amp;title=What is your favorite cheat code for a game?) without the textbox.


*I am a bot, and this action was performed automatically. Please [contact the moderators of this subreddit](/message/compose/?to=/r/AskReddit) if you have any questions or concerns.*",1
"Ah, but it *is* still running.",4
"**Attention! [Serious] Tag Notice**

* Jokes, puns, and off-topic comments are not permitted in **any** comment, parent or child.

* Parent comments that aren't from the target group will be removed, along with their child replies. 

* Report comments that violate these rules.

Posts that have few relevant answers within the first hour, and posts that are not appropriate for the [Serious] tag will be removed. Consider doing an AMA request instead.

Thanks for your cooperation and enjoy the discussion!


*I am a bot, and this action was performed automatically. Please [contact the moderators of this subreddit](/message/compose/?to=/r/AskReddit) if you have any questions or concerns.*",1
"The United States of America

Come for the ~~Grand Canyon~~ Wisconsin Buttery from Steak and Shake, stay for the ~~Freedom~~ Frisco Melt from Steak and Shake.",5
I'm also a scout main,1
literally less shit.  i have IBS.,8
"For the longest time because my veins were too small and deep. As you get older they get more prominent, so when I had surgery I was finally able to ""donate"" for myself.  It still took them a while to get the needle in, those suckers are large.

Afterward I was so nauseous I almost threw up the cookie and juice. Then I fainted on the train ride home.  I don't have a problem with needles, but I just don't think I'm a proper candidate.  ",1
Matt Damon and Mark Wahlberg,5
"yes exactly, and also knowing if she has an attitude that shes aggressive in a good way and confident. Which who doesn't love confidence.",1
"Humility is my deal breaker. When I meet someone, if they come off as even slightly arrogant or lacking basic manners I turn off to them immediately. Being kind and polite on a day-to-day basis is one of the easiest things to do and if someone does not exhibit these traits, I get the feeling that they're not truly a decent person. ",1
Black women like to fuck you and white women like to get fucked.,11
"Essential oils are a cure all. No need to vaccinate, take your prescriptions, or go to the doctor anymore. ",1
Isn't Pottermore kinda like this? Although it's more like alternate reality than RPG.,1
Forsaken,1
"It gives me hope for the future seeing that there are still young people like you out there. I'm being serious. If nobody has told you that they're proud of you lately, I'm proud of you! ",3
Not cumming on my ex girlfriend's face. She would at least let me jack off into her mouth whenever I wanted. I also wish I would have tried harder for her to at least let me put my fingers in her ass. I also should have pushed her to try more kinky stuff.,2
They'd let you in Arlington after your death,4
Reddit is fun if you're on Android. Google fit too! Great for tracking walking and running,6
"**Attention! [Serious] Tag Notice**

* Jokes, puns, and off-topic comments are not permitted in **any** comment, parent or child.

* Parent comments that aren't from the target group will be removed, along with their child replies. 

* Report comments that violate these rules.

Posts that have few relevant answers within the first hour, and posts that are not appropriate for the [Serious] tag will be removed. Consider doing an AMA request instead.

Please contact the moderators versus replying to this message, if you have any questions or concerns.

Thanks for your cooperation and enjoy the discussion!


*I am a bot, and this action was performed automatically. Please [contact the moderators of this subreddit](/message/compose/?to=/r/AskReddit) if you have any questions or concerns.*",2
Sex toy...,1
friday- rebecca black,1
