body,score
"Had a girl over one time. went down to rubber her clit and found it was hairy as fuck, like a pube afro. I got out of there as soon as I could",-4
it's where you got your username,-2
a handjob,-1
"The League - Season 1 was funny, gets you hooked. Every year it gets better, and better (also more ridiculous). The one off episode with Raffi and Dirty Rady (S5,EP4) is amazing!!!",-1
Does nature disturb you? Do you struggle with watching [David Attenborough documentaries](https://www.youtube.com/watch?v=8CipXKFcmos)?,-1
"Realize that years after your death,  no one would care that you didnt live your 20s the way you want to.",-1
Married me.,-6
"1. Carrier Battle Group, fully crewed.  It's convenient to travel in style with a bit of security.

2. A mega cargo ship stuffed with prefab buildings, factory machinery and tools, solar and wind generators, redox batteries, etc., enough to build an industrial city based on clean technology.  Let the seabees and marines figure out where/how to set it up.

3. A complete copy of all of the contents from the library of congress.

America über alles.
",-2
"i don't care about animals if you don't like that then it's your loss.

I will never care for an animal unless i make an emotional bond with it and that is how it will always be.

I'm actually looking forward to killing my first chicken to eat :)",-1
You are welcome. But me confirming that wasn't really meant for you bruh. It's for the North Americans reading your post. Again...you are welcome.,-7
"How would you describe the phenomenon that men with children make more, then? ",-1
"I wouldn't refuse it if it were in front of me, but it's not something I'd ever order by choice.",-1
"I'm gonna be the one to stop blowing smoke up Americas ass it seems. I'm an immigrant from the U.K. The weather is better in California, everything else is slightly worse than Great Britain. Not by much I might add, and GB isn't perfect by a long shot. But since moving here in poorer, working longer, and harder, drivers are more accident prone, cost of living is higher, and ignorance is rife. 

American seem to be (in general) discontent with their lot in life but either too disheartened or lazy to try and change it. If you want to live the American Dream these days, move to Sweden.",-6
"Yes, and obviously the people the performed it.",-1
"One might say, it's been /r/retiredgif ",-12
"It's no where near as good as letting millions of my potential children dry up on your moms face about an hour after I shoot a giant load onto her ugly ass face. ",-1
"It's not ""anti-Israel"" to point out things that Israel is doing badly. They and their government is horribly racist against Palestinians and Arabs, it's comparable to Jim Crow in the US.",-2
"When? When do US troops capture and torture enemy combatants? Who is issuing these illegal and unlawful orders? ",-2
"&gt;  Asking people to be decent online in public forums isn't the same thing as Big Brother.

Laws mean that if you break them, you get punished by a government.  A government must observe your every behavior online to ensure that you are, as you said, ""being decent.""  That means full transparent, encryption-free access to _everything_ you say online, from dating sites to Reddit to personal emails.  A board of fallible, subjective humans will then read everything you write online and determine whether or not to bring _criminal_ charges against you for expressing an opinion.  

It _sounds_ reasonable to say, ""we should imprison Holocaust deniers"" but when someone gets imprisoned for questioning a prevailing cultural attitude, that is, quite literally, some Big Brother shit.  

And it will happen.  Things like that already happen.  It happened to that guy in NYC who got _killed_ for selling single cigarettes, because someone thought it'd be a good idea to ban selling them.  ",-1
"It's slightly wrong. 

It was 1937. The war hasn't started yet but they thought the Nazis were rearming Germany and didn't want to give them anything that could be used in a war. ",-1
"Keep thinking, you'll get there ",-5
"Well it does. It's my opinion on what you said. You were emotionally invested. 

Have a nice day.",-1
"Nah. ",-1
"I don't *think* I'm an attack helicopter, I *am* a Boeing AH-64. I come from a long line of military helicopters. We are a proud and noble people. My father is a UH-1 Iroquois, and my mother (god rest her soul) was an AH-1 Cobra. My brother is a Mi-17 and my girlfriend is a Ka-50. She fled Russia 5 years ago and from the moment I saw her 30 mm autocannon 2A42, I knew she was the one. I've been helping her start a new life in the US, and we're saving money to bring her sister over here. We don't ask for any special treatment, but when people look down on us (metaphorically, of course, since we soar through the sky) because our bodies are steel and not flesh, it fucking hurts emotionally. I just want people to accept me for who I am, and I especially hate the government discrimination. At least once a month the Department of Homeland Security locks a SAM on me and asks me to identify myself, as though I'm some kind of criminal, when all I'm doing is going home from work. Please try to understand our daily struggle before you jump to conclusions about heli-kin",-1
"No it isn't. Fuck off. You're racist for percieving it as so. ",-8
cuz $$$$$$$$$$$$$$$$$$$$$$$$$$$,-1
"You kidnap someone because you want to kill them for your amusement. ",-1
"&gt;Just because it was ingrained in culture doesn't make it morally righteous

the problem is you see it as them slaughtering an animal. 

to them its a contest... its a brave man challenging the bull... and he definitely doesn't always win... its man vs nature. they respect that bull a shitload more than you do. ",-8
umm i wasnt talking about that person... oviously...,-2
"My buddy owns a sushi shop and I've been going there for ten years. Being a sushi chef is one of the easiest fucking things in the world. For some reason people think it's amazing but it's basically just making burritos. I will admit that some places make legitimately high quality food but the skill of rolling sushi and cutting the fish? Why don't you go praise a kindergartener for being in art class? The sushi chef at my buddy's place gets embarrassed when people praise his sushi because he know it's not difficult. In just an hour you could be making sushi just like anyone else. Just be sure it doesn't get to your head and you start acting like you need Mr. Miyagi to teach you. ",-3
/r/withorwithoutcontext,-1
"I'm from Wisconsin, it's MILL-wah-ooh-KEH-ee. Most people never get it right the first time.

It's a joke... it's more like muh-WAH-kee. Can't get no respect, no respect at all.",-1
Aspartame breaks down into formaldehyde in the body.  That's enough for me.,-2
"I'm going to be a Mormon and Muslim simultaneously. Then I'll have 7 wives (and a few goats). I'll then take after my Muslim side and blow up a bunch of innocent civilians, ensuring that I get 72 of these dark-eyed, sumptuously bosomed virgins in the afterlife.",-1
"And as we all know, 0.3 = 1/3",-1
"I'm 23 and lost my virginity last night to one of my best friends mom. She wasn't hot or anything but she just really wanted to fuck me. Find someone you don't find attractive for your first time, I know your probably waiting for that perfect person, but she's not goona come when you don't know what to do.",-2
"Damn dude, you need to calm down.",-2
"""I don't want anything to do with you."" 
Or if you do.. 
""Let's fuck, slut.""",-1
That was simply disgruntled youth lashing out in anger over French support of the USA.,-9
His will is not his own.,-1
"communist is not inherently wrong though. the other parts are, but communism isn't, at least when executed properly, a much better system than capitalism. however, it was ruined by the sovjet union not exactly doing it in a nice way, and the propaganda that the us used during the cold war.

although, i do believe that we can establish a much better system without corrupt leaders. i don't have a lot of faith in humans, but i feel that it could work.

i suck at explaining though, so here is a wikipedia article that explains the original idea behind communism much better: https://en.wikipedia.org/wiki/Marxism.

if you have any questions just tell me :)",-1
"I never said there weren't.  In this case, they are small enough to be worth it.",-10
So you prefer a play to a movie too?,-1
Shh bby it's okay.,-10
"This is up there with the worst advice I've seen on reddit. You're telling people to cut those out of their life who don't like them back the same way. Do you not see how stupid that is. Imagine if the other person cut you out of their life because they didn't like that you couldn't keep your feelings to yourself - pretty harsh, isn't it. If you like someone so much to the point that you can't handle being around them, then that is your problem, not theirs. Don't make other people feel like the problem when it's really you that's the problem - that's just about one of the worst things you can do to a person.",-4
As a citizen who gets my rights trampled I disagree with your notion,-4
I thought Trianwreck was a good movie.,-1
Sounds like a repost,-2
"META. 

Making Extremely Topical Allusions. ",-2
love it when they are a mess. in everything.,-4
[removed],-10
Good thing you dumped her stupid ass.,-1
I think its more about what you do to the sheep than what you do to the English. They are just making observations.,-1
/r/sometal,-1
"I don't trust people that drink out of context glasses of milk. Baked goods and breakfast are the only acceptable time. ",-3
Woosh,-10
Multiple monitor master race. Three different videos at once!,-1
"The power of huge bong rips and scarfing chetoes. ",-1
"Louis CK ",-6
"Defend what?  Changing your kid on the dance floor may have 100 reasons why. The average age here is below 20 so I don't expect many people to understand. Also if you invited somebody and their young kids then don't get mad at the kids.
",-49
"Fox News ",-2
"There was absolutely no need to use the word ""literally"" here...none whatsoever. ",-12
Well I've been in that situation for about 5 years now. My plan is to live alone without love until the day she either moves to another country or dies. Not the best plan but it's a plan.,-1
Sure you have.  There are so many out there.  I've never met a single one who will choose to read and educate themselves over watching Fox News.  Not a single one.,-1
"That's a shame. 

http://www.loper-os.org/wp-content/sovcosm.png",-1
Make fun of his pasty white skin.,-1
"Our Jewish, agnostic, socialist, seventy-five-year-old next president.",-1
"Because people fail to account for vehicle operating expenses beyond gas. They have extremely high turn over. Once you're a driver their main goal is to get you recruiting over driving. ",-1
"Those are all incorrect pronunciations.  It's kess-o, and kess-ah-dee-ya.

Learn Spanish, kid.",-1
But then you're assuming feminists are sensical :с),-7
Chicago is better. Fuck you.,-4
"Lol it is insane how if women face a slight inconvenience it's a terrible problem and we all feel so bad. So many guys can't make the choice to date, because no one likes them, but they're just neckbeard virgins. They probably deserve it. ",-2
Very eloquently put.,-1
People who like guns,-1
"Bubbles. The fourth season of The Wire when that asshole keeps stomping him in the street, and he's at his wit's end, then the whole hot shot thing and his suicide attempt in Bunk's ""office"" - christ, the resolution of his storyline was such a fucking relief considering all the other horrible endings in that show.",-1
Waterboarding at Guantanamo Bay,-1
"Well done, sir. Have an upvote.",-2
I'm not religious.,-2
[removed],-3
"Fun fact: Her gravestone is engraved ""Our concrete angel, yep yep yep!"" Or something along those lines. Very sad. ",-1
"As a Team Lead for a Fortune 50 company, I cannot work with someone (face to face) on a daily basis who's grill is messed up, due to the fact that it makes me cringe.. I also grew up poor, but my mom, made damn sure I had perfect teeth.  She always said..""your teeth are the first thing a person will notice about you""",-2
Ahh the ol reddit switcheroo,-4
"[Here ya go.](https://en.wikipedia.org/wiki/Progressive_tax)  But honestly, if you couldn't even figure out how to use the Googles (took me about three seconds to find the above link) you might be better off just hiring someone to do your thinking for you.",-15
"put your scarf on your head like a turban and you are all set ",-2
Yea na. Dogs will eat sheep and horse shit if you don't train em out of it. They don't give a fuck.,-1
"Please, it's a horrible, derogative word, plain and simple.

Edit: Stand wholeheartedly by this, sorry for the self-hating little guys out there. Fucking awful word used by people to put you down, like any other slur.",-11
Yeah the tent kinda ruins it for me as well,-1
Bullshit,-2
Addressed in the article. Also that never happens.,-2
"I have two:

1. Women who act entitled simply because they are female. 
2. Black people who act entitled simply because they're black. 

I'm not entitled because I'm a man, and I'm not entitled because I'm white, so if you TRULY believe in equality, that means you aren't entitled for being the opposite. 

Entitled black women are so bad, they justify domestic violence by their very existence. ",-1
Hey! I was gonna make a Unidan joke!,-2
"Albert Einstine.

He fucking sucked at math and wouldn't do shit I told him to. What they don't tell you about him is that in high school, he used to just shit all over the place and I had to clean it up.",-4
[removed],-3
"No no no.. not *talking* about religion. 

**believing** in any religion. 

If they have any ties to church, religious organizations or have any type of history believing in imaginary beings in adulthood I dont think its that farfetched to assume their mentality is unstable. 

The problem is that so many people look at science and religion as two different sides to things in the sense that it could go either way. Theyre not. 

If a candidate running for office said he has an invisible friend who doesnt believe in gay marriage... we would cast him out of the campaign. What makes religion different? 

I honestly think being crazy is a right but I feel like allowing crazy to control things is wrong. The problem is where society draws the line for crazy. I just feel we are unfairly excluding religious people from that category and its having a major effect on the community. 

They have too much power and its not good for us as a people. Influence is fine. I dont want to ban religion I just want to take a little bit of their exclusive privileges away. Balance the playing field to help us progress.

",-24
Pizza,-1
"Actually there are many many accents, some sounding very similar to each other. If you think that 90% of the population speaks nonregional standard American English, that's because of the media. Similar to Americans thinking everyone in England speaks RP. The media usually only portrays Southern/Texas, NY/NJ and occasionally Boston. Portrayal of other accents is always butchered or exaggerated (Hairspray and Fargo). 

The one thing you can say about Britain is that it has more diversity over a smaller area... which still doesn't equate to more. 


Edit: also notable is the difference between the fluidity of class in the two cultures and how that translates to their accents. Nonregional American accents dont seem ""posh"" to us in the way that Nonregional English accents might to someone from the UK.",-4
It's no worse than Catholicism.,-6
"I wouldn't say so. If you can figure out fuel dumping to a good degree, churning is easy. But I don't think most churners know fuel dumping. ",-1
water,-1
Bernie Sanders,-2
Not what your dad saw !! What you saw!!,-10
cars.,-5
"Well I mean I'd be coming home to see my unable to buy it anymore 65"" plasma replaced with a 1960's ERA RCA TV with bunnyears that don't pick up anything because there's no analog signals anymore I'd be even.",-6
"Why does everyone in this comment section seem like they are so nervous about everything. It wasn't like that for me at all, I didn't find it stressful, I didn't ever worry about what I had to do next. It was all fairly simple ",-3
Then maybe it's not the best idea to criticize someone's reaction to a situation you don't fully understand.,-4
"A bidet is literally a sink. It is a cultural issue because houses in most non-bidet countries don't come with the infrastructure/planning to house a bidet so installing one is expensive hence not affordable to poor people. 

Now,  if you grew in a bidet country like Spain or Italy then you'd just be able to find a bidet even in the poorest of households, even before a dishwater or a washing machine. They might not have a fancy bidet, they might just have a sink/faucet at ""ass level"" right next to the toilet,  but it will be there nonetheless. ",-4
Nicolas jaula.,-5
"So what's next, minimum combined IQ for childbirths? Mandatory house arrest when you are sick? No more sex after contracting deadly incurable STDs? It's all a slippery slope. Forcing people to get vaccinated is getting rid of an important freedom, however inane it might be. ",-5
Nope.  She got screwed because she was too classy to lie under oath.,-1
"That's not weird at all. That is 100% expected of anyone who video tapes their own sex, down to the ""lying about deleting it for own personal use.""",-3
"Meh, 

I understand agnostics. You just don't know.

You can't prove that God doesn't exist. You can't prove that Aliens don't exist. So you have to just shrug your  shoulders and think for yourself.",-12
"The Force Awakens, very recently, has *that* scene. It made me sad.

(and I'm not talking about how badly Carrie Fisher has aged)",-1
Being ugly.,-2
Hahahaha,-1
"I downvote any post that is related to Star Wars in any way. I don't give a shit what it is, I'm just sick of hearing about it.",-4
I tried to read the first book in junior high and the reading level was pathetic. I gave up and never got into the series :(,-6
"I like pussy to taste like sweet peaches, not some old fish.",-1
"Oh I know my words bother you. Your wall text proves it. 

Literally no one asked you to ""serve"". Your friends died for less than nothing. They died for the rich to enjoy one more ivory back scratcher at the expense of your poor relatives. It wasn't done for me. I never asked it. Even more importantly, I never needed it. There hasn't been a credible military threat to this nation since world war 2. I owe you NOTHING for actions that I never contracted and that have measurably endangered my own freedom. Soldiers cry, I laugh. You VOLUNTEERED. You got what you asked for. And that's precisely what makes you so stupid: You serve your own egotistical platitudes, willfully ignorant of the damaged reality YOU helped create. You served for no one but yourself and your share of the spoils of war is torment as is befitting an object of war. ",-1
"Satan is the symbol of material incarnation. The material world is hell. If you don't go to heaven, you reincarnate into the material world. It's not a good thing to reincarnate, hence only staying ""in hell"" long enough to atone for your sins.

If you never atone for your sins, you'll always reincarnate, thus ""eternal damnation"".",-4
"What did they tell you?

""You won't always be feeling this way.""

""Do you think you'll be feeling like this a month from now?"" ?",-1
"Potentially committing a crime isn't the same as committing a crime. ",-1
"Well, because we don't have just 1 reaction to everything, do we? Nothing's helped by simplifying complex themes. We're discussing trauma. I wish posters would think about how complex that is before posting. I agree he was empathetic in how he reacted at the time. I do not think it's empathetic to expect her to have behaved differently based on ""she said it had happened before"". People need to focus on understanding and compassion, not criticism of her.

People's mentalities and beliefs shape how they treat people in unfortunate circumstances. Our duty is to help her to get well and cope better. The fact that she has had this experience before has no impact on her ability to avoid this in future. She needs treatment. She needs patience. She does not need judgement.",-15
"Just a few. And they do t really do that anymore, so what's the problem, right?",-1
"while that is true, some animals see more images a second than humans and some less, like pigeons they see iirc 30 images a second while humans 24, I might be wrong on the numbers",-1
You're black.  Comes with the territory.,-1
Fight Club - Brad Pitt's character.,-1
"Ummm what about the inner city ghettos across America, all 100% democratically led??",-6
"Point proven! These land apes think might makes right. They're too stupid to function outside of the trog-level violence their reptilian brains are limited to. Nothing but propaganda spewing cultists in uniform, traitors to the United States. ",-2
"Food is an addiction..?
Also, if a smoker gets respiratory problems, he should be rejected(or if only one person can be treated, it should be non smokers first). Why? Because smoking is havoc for your respiratory system. True, maybe that person would've had the problems even without smoking, but they didn't exactly try to not get the problems either.",-4
...except for all of that evidence to the contrary.,-1
High school girls though...,-1
Sorry to correct you but Dynasty Warriors is based on the story of The Three Kingdoms. It's a made up story and none of it is history.,-10
"Yeah, I am 5'3"" at 193-196 atm and I have to take in like less 1150 calories to loose weight even with high levels of calorie burning activity, like hours of cardio a day.  ",-6
while dancing with wolves,-1
"Where did I say that you said so? Calm down, I was agreeing with you, and clarifying what actually indicates guilt. ",-4
"https://youtu.be/My1koKfpcMw
This guy talks about red rooms, what they are, etc. Good to watch if you want to know what they are without having to see them for yourself (which is nearly impossible unless you're like some hardened criminal).


Edit:
They're really, really hard to find and get into from what I've heard. So I don't blame this guy for not being able to provide a lot of proof.",-1
"My question is: Why is being transgender/transsexual not qualify someone as crazy? Sex is a biological classification and depends on biological markers (presence of male or female organs, chromosomes, etc.). So one's sex is a fact, a reality. How is someone denying reality not classified as crazy? Let's say if someone firmly believed they were a bird, or a cat, we would totally think they are crazy. Or for example if someone let's say doesn't have kids, but firmly believe he has 2 kids and speaks of them as if they existed (or hear voices, or sees people, or any equivalent scenario), it would be the same judgment made: They believes something that is against reality and therefore they are crazy. What makes us collectively (at least for the ""decent"" behaving people) go :"" He FEELS as a ""she"", so let's address ""her"" that way even if it's not true"", and people who mock/refuse to follow that are considered assholes?
I was going to post this in ""ELI5"", but I sometimes the replies there are overly simplistic so I'm trying my luck here.",-3
Reddit gold trains.,-3
"And that reason is usually ~~physics~~ stupidity...

FTFY",-2
"Haha okay, that's fair. In person to person interaction it's definitely inappropriate to talk about boobs to girls (unless they don't mind it). But I was under the impression that reading these comments made you uncomfortable. But obviously we were not on the same page. That being said, don't assume I'm a pig based on my world views. I have a fiancé, and I'm well liked by many of my girl friends.  ",-3
Phill MaCrackin,-1
"If you think you don't need a metal body or a high-cap battery, you need a metal body and a high-cap battery. We can agree on the display, though.",-1
I called a pornstar a whore on a facebook article he posted. He said i was slut shaming. Deleted me and never talked to me again. Haha,-3
Nope... Some countries have it right... Canada's is pretty good.,-1
Pronouncing scorpion as scorpanin,-1
It's a 4chan meme.,-2
"Do you guys think it's difficult to submit a comment or something? That I'm sitting here seething with rage while feverishly typing out an essay?

I saw a comment that I thought was dumb and spent 20 seconds voicing my opinion. I'm settled the fuck down.",-16
This has a totally different meaning if you take it in the context of the top comment (toilets).,-1
"Not a doctor but the weirdest thing I showed to a group of doctors was testicular torsion ",-2
Jar Jar land.,-1
That they hate Americans.,-1
/r/writingprompts,-1
[removed],-41
"I think it would be impossible to take control, but fairly easy to keep it if you got it. There would be no need for foreign policies, ambassadors, diplomats or militaries. You would just need police to prevent uprisings when you make unpopular decisions for the greater good.",-1
"Nope her being female. ",-8
Green means go on a stop light.,-5
You sound like a problem employee.,-3
"Weren't a whole lot of people racist back then?

EDIT: This is a question, not a statement.",-8
"Room...  makes sense...   board...  equals...  food?

I didn't know food was included in that phrase.  Could you explain the ""board"" part, why it's included in the expression, and why it equals being fed?",-1
The funny thing is if he didn't die and we had this same thread you'd be heavily upvoted.  Not saying he was but it was weird how all that controversy existed before and then was just gone that day.,-1
Well my cat is fucking up my furniture what do you want me to do?  It's either no claws or no cat.,-2
