body,score
"Maybe, but you don't get the skills you do from math. Formal logic is essentially a flowchart. With a lot of ""Does the evidence totally refute? No. Does it mostly refute? Yes."" involved. Math however, Builds you up over years to see through the lines and recognize patterns. Pattern recognition is ESSENTIAL to humans in general. It helps adjust you socially as well as let you notice when something is amiss. 

There was a study that I don't have the time to go grab but google should help that took those with math education and compared them against those without. Basically, those with an education were a ton more attuned to their environment and more perceptive. ",1
"Oh, so, so much. ^^^^^never^look^in^my^""reading^list""",1
No mention of Nikki and Paolo?,80
"Drink 8oz of water in between every drink. Don't drink til you're puking. Eat food. Don't mix alcohols, if you're drinking beer stick with beer and if you're drinking liqueur stick with liqueur. ",2
"Hi there! Your post was removed because it uses the text box. AskReddit does not allow use of the text box, aside from a period. Per [rule 1](/r/AskReddit/wiki/index#wiki_-rule_1-), use of the text box is prohibited. [**When you've removed everything from the textbox, message the mods for review and reapproval.**](http://www.reddit.com/message/compose?to=%2Fr%2FAskReddit&amp;subject=Post+Review+Request&amp;message=My+post+was+removed+under+rule+1,+please+review%3a%0d%0a%0d%0ahttp%3A%2F%2Fwww.reddit.com/r/AskReddit/comments/40c3v9/your_partner_the_good_cop_had_no_luck_getting_the/) and ask the moderators to re-approve it.


*I am a bot, and this action was performed automatically. Please [contact the moderators of this subreddit](/message/compose/?to=/r/AskReddit) if you have any questions or concerns.*",1
Pizza.,2
A boxer engine,1
"Ouch. ",2
"Obviously things like murder, rape, and theft would be illegal. No cars (bikes are fine, and there'd be excellent public transport). There wouldn't be complete freedom speech (e.g. threats, etc). No capital punishment. Marijuana would be legal and taxed. Prostitution would be legal and regulated through brothels (no street prostitution). No getting involved in foreign affairs unless necessary. Can't think of other things without getting too in-depth.",1
"Can confirm, am addicted to fathers.",1
"“I ask the chair, you know what this is?” he said. “It’s a snowball, and that’s just from outside here, so it’s very, very cold out, very unseasonable.” There is no climate change. -Infoe",2
"Seek help. ",1
"Did you normally wear underwear under your tights? That sounds terribly uncomfortable 
",1
Netflix,2
"That movie scarred me for years. My husband picked out the movie and I sat down to watch it having no idea what it was about. At that time we were trying unsuccessfully to have a baby that I dearly wanted and I was starting to think it would never happen. That opening sequence was like my own personal worst nightmare--that we would be unable to have a baby, that we wouldn't ever pursue our dreams, and then that one of us would die and the other would be left alone (I'm crying even typing this...good grief.)

I was so not prepared and I sat there for a while trying to hold it together, but it was really hard because I had this awful wailing cry building up inside of me and it was so hard to try to hold it in. Finally I said I didn't want to watch any more and left the room.

My husband finished watching and for years afterward always talked about how good the movie was and how I should have stayed and watched it. I couldn't even hear that movie *mentioned* without being on the verge of those awful tears again. Just thinking about it or even hearing the title of the movie mentioned made me feel so sad. It was so upsetting I never could even explain to my husband why it had bothered me so much because I knew I'd end up sobbing uncontrollably that really horrible kind of crying you never want to let out.

It's only now, years later, that we've had a baby that I feel like I could ever watch that movie. Until I had the baby (I mean right up until she was safely delivered), there was no way I was ever going to watch that movie. Still haven't seen it, though. Not sure anything in the rest of that movie could ever make up for the torture of the opening sequence.",1
"If you fuck Flint, fuck.",1
Do you really want somebody else playing your wife?,2
"Nobody exists on purpose, nobody belongs anywhere, everyone's gonna die. Come watch TV. ",2
"I like it, but there's so little in it right now.",1
"When someone gives off the self-entitled vibe...

Seriously, bitch. No one cares now nor will they ever. Leave.",1
The only way to get my money back in my life is to get my nails done tomorrow.,2
"I thought that episode was fantastic, but in a ""so bad it's good"" kind of way. ",1
"What got me about Tosh was that she was the mission control for everyone and even as she was dying she didn't tell anyone because what they were doing was more important.  She couldn't let them be distracted.

Even as she talked Owen to his final death she played that she was alright. Stabbed in the gut, probably in sheer agony, and she's comforting a literal dead man walking, they were reminiscing about the weird shit they've been involved with (""Space pig?"" ""Space pig."").

She held out long enough for confirmation that the other three survived, that Owen was gone and then she died.

Jack's grandson was another hard death; that Jack had to sacrifice a kid was bad enough but for it to be his last living grandson, thus destroying any hope he had for keeping in contact with his daughter was worse.

Ianto knew that any minute could be his last, Own knew, Tosh knew, hell, even Susie knew but this little boy didn't sign up for this shit and he trusted Jack so much...",7
"This might be horrible, but after working a lot of customer service jobs, I am always extra nice to black customers because they seem to be the most picky and willing to complain if I do something they don't like. I have always thought that it might be because they have to deal with so many negative influences all day (like people thinking they are inferior for one reason or another) that they are more on edge about even unintentional and essentially harmless poor treatment and therefore might assume I made their coffee wrong because I don't care about getting a black person's order right and not because I am tired and make mistakes sometimes. 

I also began to assume while working at a place that mainly serves coffee and smoothies that black people would order smoothies rather than coffee like 90% of the time.",1
"The cinnamon challenge was some idiotic idea to try and swallow like a half cup of ground cinnamon, which is really fucking stupid for a shit ton of reasons. Other such challenges like that milk bowl idiocy or the Kylie Lips thing are batshit insane and Adam Sandler stupid.

The ""knockout game"" is played by getting your gang together and seeing how many hits it takes to knockout some poor sap walking down the road. It happened to wind up killing a few people for various reasons (because it's really bad to get knocked out duh). 

Some teenagers with less sense than your average dumbfuck is going to play the ""Hit Points Game"" and wind up murdering people because it's funny. That's not funny. ",1
"Huh. It's pretty much a reference from ""our time."" You're not old. you're sheltered. Haha. ",1
"You should have taken it upon yourselves to reintroduce meat to her diet for the same reasons.  

""Love that soup eh?  It's the hearty beef stock that makes all the difference.""",1
"The Game has Changed - Tron Legacy soundtrack.  https://youtu.be/DSx_N18TWjs?list=PLB9FB4E1138286D3C

This soundtrack does not get enough recognition/love that it deserves.",1
"Dieting... Juicing, Cleanses, etc.",1
"Fuck it, I like to live dangerously.",1
"Sorry, I'm over 25. The most important priority I have is not legalizing marijuana in this country. I'm for it, there are just more pressing issues.",1
Is almost raping a hooker almost rape or almost theft?,0
"Where the fuck do you live that 6 pm is considered a dangerous time? 1am I understand, but 6?",1
LIOOONNN,1
"I don't agree with this one. As someone who got denied credit on a 30 buck a month phone plan because I had no credit history at 26, not having a credit card early on fucked me over.

Credit checks are everywhere today, not having a credit history is unacceptable as it pops up when you're doing lots of adult-person-things.

I'd change it to say hey, kid, apply for those credit cards, get one, buy only gas with them for maximum point bonuses, then pay them off every fucking month or I will rip out your throat and shove it up your ass.",1
"I work for a gas station that sells tickets in a state that participates. These people are animals. Wednesday and Saturday will be the death of me until somebody wins that fucking thing. ",2
"Lol I did my extended essay the weekend before it was due. I didn't really need any points from it to get full IB ",1
&lt;3,2
"What do you mean ""out of it""?",1
Cutting in line.,1
"Done right: teach me how to fuck.
Done wrong: Cheated on me like a dirty, scummy, whore",2
She took R2 to the movie instead?,1
"Of course not (my post never insinuates 'abolishing the institution')! I just wanted to know if other people felt they were helpful *the way they are now*. Of course most systems could be improved, that doesn't mean we get rid of them if they are bit subpar.",1
"&gt; I don't remember the exact question ",8
[The Internet doesn't weigh anything](https://www.youtube.com/watch?v=iDbyYGrswtg),1
laser hair removal is an AMAZING thing,3
Abortion. Because wasted bacon.,1
"Implying that his working at an artisan chocolate shop could make him pretentious. ",11
"On the plus side, you have a basic awareness of Iron Maiden's best song, which many people die without. 

Anyway, we don't know that time is linear...it just seems that way to us. It could be that it washes backwards and forwards, like a tide, and that we live our lives over and over again. ",3
Chav's don't all pretend to have money. I don't think you're even from the U.K and if you are you don't understand it. Drop it.,1
"Older than the Internet but born after the Berlin Wall fell. ",1
"Something in Kelly Heroes except they use tank shells filled with paint. ""Scares the hell out of them but paints pretty pictures""",2
Nice expensive cheese. Not like the kind you get at Walmart. There's lots of different kinds of it,1
"Breaking bad makes you realise the power of money, in a sense.",3
"Pow! Pow! Pow! Pow! Staying alive, staying alive",2
"Ok, so it's a 160 degree (or 140?) cone from Earth. The dots in the gif, are they pulsars?",1
Honey mustard and bbq sauce,1
"Hi there! Your post was removed because it uses the text box. Per [rule 1](/r/AskReddit/wiki/index#wiki_-rule_1-), use of the text box is prohibited. You can resubmit your post [here](/r/askreddit/submit?selftext=true&amp;title=what are your favorite youtube videos?) without the textbox.


*I am a bot, and this action was performed automatically. Please [contact the moderators of this subreddit](/message/compose/?to=/r/AskReddit) if you have any questions or concerns.*",1
"5 nights in a row all involving me dying and standing over my dead body ",1
"There's no one answer because the police forces are so imbued with criminals and criminality, but the unions certainly protect and defend their members, regardless of fault.",1
"Yeah, very interesting history. I enjoyed reading about the reality behind Samurai culture, especially how Bushido reinforced homosexual tendencies in samurai; since the plight of a samurai could never be understood by a woman, love between two samurai seemed to be valued higher than love between a man and woman.",1
"Yes, if I liked them enough to date them, how I met them wouldn't really matter to me.",1
You know what I meant.,2
I'm trying really hard to buy 1st world made clothes but sweatshops do play an important niche,2
Finding your wallet after hours of panicked searching.,2
"Ceremony was performed by a priest who spent the entire 45 minute ceremony talking about how ravishingly beautiful the bridesmaids were, and how all the married couples should celebrate the wedding by ""having lots of copulation"". The bride and groom were told to make an appointment for the baptism from 9 months from the date. And then more talk about ""intimate copulation"".Both bride and groom were beet red and the guests didn't know whether to intervene or laugh. Felt so bad because the bride and groom are very modest and were thoroughly embarrassed. Then at the reception everyone tried to play it down to no avail.",83
I would teach classes.,0
"The amount of crap I bought for my son because I thought I'd need it, there is only a very few things you actually need!",2
"TIFU by assassinating the archduke

TIFU by stopping in front of a deli to ask for directions

TIFU by being in a country I'm hated in and my armies occupying. ",1
"James Madison played a huge part in inventing the American form of government. He then battled Patrick Henry and a very strong opposition in his home state of Virginia to ratify the new constitution by a slim margin. He did all this while suffering from debilitating anxiety. Many years later, like an after thought, he became the fourth President.",19
Bermuda is actually one of these fake islands,1
"No touring boots allowed either. ",1
"The explanation I heard for the high number of venomous animals here (as well as the prevalence of reptiles, and low number of mammals) is that Australia is a 'low energy ecosystem'- a lot of desert, or semi-arid scrub. Even in more temperate areas, there is less food, slower growing plants, etc.

This means warm blooded animals, with the extra energy needed to regulate temperature, don't fare as well. It also means that anilmals are better off minimising the time they spend tracking prey, which explains the highly venomous snakes.

Worldwide, desert (low energy ecosystem) snakes tend to be very venomous- like rattlesnakes.

",1
Most of those people are never going to vote for a Democrat anyway.,1
"Yeah, they would snitch. What a Bitch",3
White stripes.,1
"She said: ""Once more unto the brioche, dear friends.""",5
"BAH GAWD KING, HE'S GOIN' FOR THE TRIPLE WORD SCORE!",14
"Yes, but he wasn't arguing over why people do eat meat, but rather if it is morally justifiable to do it.",2
Reddit gold.,2
neat.,1
I'm on my phone. I fixed my typo for you ;),1
"&gt; pretty dead

I didn't know there were degrees of being dead (aside from the whole brain death question).",1
"In fairness to you I only meant to commit myself to that, I didn't mean to drag my fellow Texans along with me. I speak for myself alone, yah hear.",2
"I dealt with a lot of kids who weren't ""gifted"" constantly trying to downplay or make it seems like it wasn't actually a thing. I didn't really care either way. I didn't really have an opinion on it. I know my intelligence and that's all that should matter to a person, but holy shit they would get themselves worked up by talking about it and just become mean after a while. Like I was going out of my way to rub something in their face, when in reality, they would always bring it up in the first place. ",1
"Even when on live tv they cant keep their shit together, its hilarious. And Mac not understanding the rules was the best part, he gets the host so agitated. ",4
"Donald Trump

It might literally crash reddit.",9
"all planets but the earth
Someone has done the math.
http://www.universetoday.com/115672/you-could-fit-all-the-planets-between-the-earth-and-the-moon/
",1
"From your best friend:

You're the closest thing to a friend I have.",21
Same thing basically.,3
"Maybe not simple depending on how you think about it but I had to explain Star Wars to my 26 year old friend. He barely knew Han Solo was Harrison Ford. ",1
"Thanks. ",1
"Clickbait, but we all know that's not going anywhere.",1
"I work in SF, have a nice apartment (that's in the east bay...but still) &amp; a brand new car I'm paying way too much interest on &amp; I live on less than $50k/year for me and my wife. Half of that goes on rent.

What the hell do these people do with money?",1
"I also agree with you that it is your responsibility, and I would forget about it. that's just my personal opinion. ",1
"Spider-Man.   



This is a brilliant scientific mind.   He invented a miracle adhesive that could have limitless potential in practical home application and law enforcement.   


He invented spider tracers well before GPS technology was readily available.   


He squandered all of his gifts because his guilt complex.   Many people close to him have been killed as a direct result of his activity, and inactivity, as Spider-Man.  ",2
Agreed.,1
*tips fedora*,1
"Myself by a long shot. ",6
"I always liked The Last Crusade more, but damn, they were both good. I can proudly say that my childhood was delivered mostly by Harrison Ford (Star Wars, Indiana Jones).",1
You make it seem as though those who start smoking weed in their adolescence can't get high as adults and that's simply not true.,1
I read [fanfiction](https://fictionpad.com/) when im bored. Try pick up a hobby,0
"One foot on the floor, one hand on the wall.",2
Oh yes! Any Berry really... Except for the infamous blackbery.,1
[removed],1
are you a bear?,1
"&gt;Sexuality is complex and it has to do with more than just whether a person has a dick or a pussy

To me it is that simple.  Don't get me wrong there are trans girls that can be more attractive than some girls, but once i find out they used to be a guy all attraction is gone.  Can't help it its just what happens",1
"Bad Memories that has been twisted into bad dreams. They aren't that bad. ",1
"I realised this now. Should have been three or four, then again some people never knew their grandparents ",2
My mom and her boyfriend would do the same thing.,2
Apart from a 12yo 'shadowing' you.,1
My tax return,2
Tell that to Kanjiklub,2
"Mom- ""Visitors are coming over this afternoon!""",1
[removed],1
"It's a fighting game term. I didn't know if it was used in boxing or not. ",1
Jessica Rabbit.,1
"Mine is Mindstreet by an Indian rock band called Motherjane. It combines both rock and carnatic (classical indian) music.

Link : https://www.youtube.com/watch?v=CpnAWWDDqD8",2
"Only law enforcement does that in effigy, though.",1
"quote movies aloud 
examples:
lotr
the hobbit",1
Wuddup,3
"I wish I knew. Hopefully something good, but it won't make a difference to me after the fact.",1
I neva make mistake,1
"Poor friend are normally more about the simple fun things in life (going for a random walk in the woods/having a night in cooking something)
Rich friends are more about going out and partying getting far too drunk and spending a fortune and then a day in would consist of being antisocial sitting infront of the computer/gaming console 


Much prefer my poorer friends",2
broke up with my ex and stayed at the same university rather than go home for a year,2
I'll give Reign and Revenge a shout out. They started strong...but who knows where these seasons are going...,1
"Damn, that's depressing.",1
"While most male mammals have nipples, male rats &amp; male horses do not.",1
"A ladybug as a kid. Kids put bugs in their mouth sometimes, right? Well ladybugs secrete their bug-blood from their kneecaps. It tastes soo bad. Thats their defense. Tasting bad.",1
What's it wrapped around? Or is it in something like a tortilla?,0
"My dad thinks email, Facebook, and text messages are the same thing. ",1
I got it from my daddy,14
"Butthole. I really love me some butthole. ",1
You sound like my SO. His enjoyment of something is directly proportional to the quality/amount of food it provides.,3
"15 year old GMC truck.  225,000 miles.  On second transmission, second transfer case.  Burns oil.  Gets 15 mpg.  Lifters clatter like a box of rocks on cold start.  Steering has about 3"" of play from worn out tie-rod ends.  Smashed tailgate and rear bumper where I backed into a tree with the tailgate down. Headliner fallen down.  Headlights are hazed over.  Half the dash lights don't work.  R/F speaker doesn't work.  Shitty DIY roll-in bedliner (from PO) has oxidized and gets black shit all over you if you touch it and anything you put in the back.  


And it's paid for, and I'm fine with it.",1
"I was young and me and my family were driving to vegas. It was late night and we were between cities. The guy in front of us was swerving really bad. My dad decided to pass him so we could leave him behind. We also called the cops but knew it would be long before anyone would show up where we were. Once we passed him he sped up and stayed right behind us. We were going nearly 100 mph. My dad saw an abandoned rest stop and decided to pull over and let him pass. Then the drunk guy decided to stop too, so we took off real quick. He continued tailing us for a long time until he spun off the  road into the medium. We thought that was the end of it but he got back on the road and caught up with us. Finally we got to the winding canyon before the Hoover damn. It was a two way with a fair amount of traffic but my dad managed to pass quite a few people to get some distance between us. Getting to the damn wee saw a cop and pulled over to tell him the whole story, but the entire time we were stopped we didn't see the drunk driver's car come out of the winding canyons. We figured he must have crashed. 

Now that I'm older it isn't as big a deal. Just an exciting story to tell. When I was young I was absolutely terrified.  ",1
"The Nexus 6P has a pretty fantastic camera. 12 Megapixels. 

You can probably find it at a tech retailer to test the camera quality for yourself. My cousin switches between Android and Apple every few years and he loves both brands.",3
My aunt's house &gt;.&gt;,1
"In a way, people tend to be selfish about most of the things they do, so this makes sense.",2
"1
JULY 28, 2011
It’s possible, Pig, I might be bluffing. It’s conceivable, you miserable, vomitous mass, that I’m only lying here because I lack the strength to stand. But, then again… perhaps I have the strength after all.",1
"I wish that were true. ""I hate drama"" followed up by a bunch of shit talking posts and followed up by quotes about ""who your real friends are"". Regularly. This bitch loves drama. ",1
*Warning: this thread will probably contain spoilers*,11
[removed],1
"Ah.

I retract my comment in that case.",1
"http://i.imgur.com/09S9vCP.png

Proof. Now stop hating on Samsung.

EDIT: my second 840 evo even gets better scores.",1
Cuck,0
"No because I liked his music and would have enjoyed seeing him live? ",2
"From opiate withdrawal, horrible!",11
"Late to the party but

http://imgur.com/a/QDvRD",5
CoCo Ichibanya,1
No. But the sky is gray. Just about what you'd expect in England..,2
Don Julio blanco,1
"There is indeed something sinister about class rings. I sought to fulfill my desire for the vindication and revelation of the truth, but instead ended up becoming a pawn in a much larger conflict that I could not fully comprehend.

My warning to you friend: just let it go. Do not investigate this matter further.",2
"Have any further info to support this?

edit: nvm, kept reading the comments and saw what I was looking for, thanks!",1
Bacon Club,2
"Mine feels like I'm sitting in the bottom of a steep metal bowl. If I look anywhere other than directly down it's too bright and it hurts. If I try to climb the sides I either slide down ineffectually or they turn in to razors and flay all my skin off. 

Anyone who tries to help turns in to a great and terrible monster as soon as they touch the bowl. Ropes and ladders turn in to angry, venomous snakes. In the mean time some disembodied voice keeps laughing at you and reminding you that you are the one who got in to the bowl in the first place. 

And at the same time it feels like nothing at all, and all you really have is a dim awareness that you should be very afraid that you feel nothing at all. 

It's how it felt the first time a crush rejected you, except you feel it all the time about everything and there is no real cause and nothing makes it go away. ",2
Yep. Iirc the dog's an Akita,2
"The score of a party is determined by the number of successful interactions between Sims at your party. Get your guests interacting and the score will rise. Get them into the hot tub, using the bubble blower (from university), dancing, even just watching TV together, and they will interact. If you have your Sim do one of those actions, they can ask other Sims to join them. You can then have your Sim cancel the action, and the invited Sims should still stay interacting. Your Sim can also go around the party and talk/joke to everyone. Try to stick to interactions that you know will succeed, because if an interaction fails, the score will fall.

Basically, the more green plus signs you see, the higher the party score will be.",1
CAVEMAN COFFEE.,1
ill have mints,2
Darwinism &gt; the strong survive &gt; the strong rule &gt; the strong like their power and want to keep it &gt; the strong take away your power (guns),1
"Call me a contrarian, but I loved him from the start.  I thought Jack was the lamest, dorkiest, cheesy guy and he was so damn earnest about everything.  Then here comes Sawyer, pissing in his Cheerios every step of the way.  ",8
"Runners also get killed a lot, for other runners to find.",2
"I worked at a boarding school for a year, and discovered through the help of an acquaintance that there was an unfinished tunnel that lead from the laundry room to the kitchen/cafeteria. 

We got tipsy one weekend and strapped on headlamps to raid the kitchen. And raid the kitchen we did. ",1
I had a university professor at a rather large state school say this the other day. I was sad,6
mine either,1
