body,score
In my opinion I don't think he's making it worse. By addressing he is educating the public. There are a lot of uneducated idiots in this country.,-3
How is that a combo?,-1
"Doing OP's mom. 

On a serious note, gaming in general. Still the only medium of entertainment that is not considered good enough. Obviously people spending thousands of hours on one game doesn't help the cause.",-5
"Mmmmm... nope, pretty sure us simply not wanting to kill each other is what keeps society from going down in bloodshed...",-10
black lives matter and gay pride parades,-5
"I'm not sure how anything I've said translates into that. If you're not attractive - deal breaker. If you have a high partner count - you're not serious long-term relationship material, only casual dating, FWB, or booty call at the most. 

I like how women pull that same tired line, ""I feel sorry for you"" when something doesn't line up with their opinion, imperative, or prerogative. 

Darlin', you don't have to feel sorry for me, my life is fucking amazing. I've done and accomplished more before the age of thirty than most people have by the age of 60. My life is completely in my control, and part of the reason it's bullshit-free and easy-going is I don't get seriously involved with slutty girls. If other guys did that, they'd have a pretty care-free life too (and would get a hell of a lot more done). 

Right now I'm writing this from a gorgeous tropical island in the Gulf of Thailand. Next week I'm going to Japan before heading over to Siem Reap, Cambodia. I have a gorgeous girlfriend who has only been with two men in her entire life and goes out of her way to make my life comfortable by cooking for me, massaging my shoulders when I get injured at boxing, and spending quality time with me on mutual interests. She has a wonderful personality and she's someone I enjoy being around on multiple fronts. She also meets my requirements - the ones you seem to think are my ONLY ones. 

So, you shouldn't feel sorry for me, you should feel sorry for all those girls out there who are going to get used up by all the guys they're fucking and get stuck as a last option in their late twenties, while those who didn't turn to fucking every swinging dick that comes (because ""you go girl - you do you!"") get wifed by successful men, caring, stable men. ",-1
Nevuary 31 2000neverhater,-6
John Cena,-2
Dank memes on clipboard....I won,-1
"No one's saying free shit yo. We're saying we have certain rights as human beings that should be paid for by the collective taxpayers of the country, (you are too actually, we just draw different lines in the sand as to how far these should go) I'm sure you're still in favor of roads, firefighters, police, the military, social security and a bunch of other things. I also believe that healthcare should be a right (which we pay for anyway, just way more than we have to). Yes there will always be leeches, but as any socialist country will show you, there are more workers than leeches.",-1
"But it does guarantee that you keep your dignity and self-respect, rather than having to bear the shame of being the kind of person who skates through life doing as little as they can and abusing government programs that were meant for people who actually need them. ",-3
"Apparently not the wittiest of warlocks
",-1
"Fun fact, nearly dead from old age grandpa running for democrat nominee has similar economic policies to the genocidal ussr.",-3
I love some fucking eggs. What's your favorite way to fucking cook them?,-1
"I used to believe that the government shouldn't spy on our every move. Privacy, you know?

Now I know that ~~we~~ the government just wants to protect ~~you~~ us citizens. In fact, I think the government should be able to watch anybody, anytime, anywhere. For the safety of all of us, of course.

Edit: In case anyone thought this was a serious comment, read my name.",-1
"Thats a bet you'd win... I just got back from a 3 day house party ",-1
"They mock us for snow, but they can't drive for shit in the rain",-5
"I give up. I'm done. I give up. I hate reddit's hive mind. I hate it's obscure upvote downvote snowballing. Some things get upvoted to no end and somebody saying similar gets downvoted into oblivion. I hate it. I hate humanity. ",-2
just don't expect to jump up any curbs or look cool,-2
"Be slightly mean to girls, they like it and it will get you more women compared to being the nice guy, by mean I'm not talking about insulting them, rather poking fun. For example if they trip, say "" Wow Mrs.Coordination over here "" and *then* help her up. You can't be a sheep. ",-2
"Uhm no. You are not, that was a statement...",-24
I saw a paper-cut once.,-7
"but people from east asia and the middle east look completely different , different races, same continent, in america, only east asians are called asians, i know in some places its different",-1
"That's cause nobody likes to be referred to as a cracker, man!

....That was my first reaction when I quickly (mis)read your comment. Hah!",-1
"agreed, sounds like bullshit but it's true, we simple devalue human life when it doesn't have a certain physical form or a certain number of cells.",-1
"Friday, Friday!

That whiney voice is probably what does it though.",-1
Predictable because you knew what happened already? Predictable because every movie since has made Citizen Kane's innovations appear mundane? Or predictable because you're full of shit?,-2
"Ok, first of all; this was at about 10pm, I can say that for sure because I had just been forced by a couple of drunk guys to drive down to the store and get more chips and dip and whatnot, and that store closes at 10pm, and the police arrived about 10-15 minutes after we got back. Secondly, the music wasn't that loud, we're talking wall-to-wall apartments, so they would hear it. Thirdly, the neighbours knew full well there would be a party, and that we would leave for town at about 11:30, but his neighbours are more than unreasonable, they seem to spend all their spare time to think of reasons to be mad at their neighbours. And fourthly (Idc if that is the incorrect way to say it), he didn't spit it at once, he tried reasoning with them for a long time but they were straight up refusing to hear what he had to say because he was intoxicated, they were absolutely refusing to hear what anyone had to say, drunk or sober.

Tbf to them, this was during a time that, for reasons I won't bother getting into, a lot of partying takes place for a couple of weeks. Russetid, if any Norwegians should happen to read this. So, they were probably very sick of being called out because of drunk guys, but lashing out on us because of other drunken people having annoyed them isn't right? Had they just acted like a friend and asked us to calm down, we would have. But they didn't and drove my friend to spitting his gum on them. Sure he is an asshole, but not *the* asshole of the story. They both were.",-2
"What the fuck? Jesus Christ, people are literally protesting in the street about it. It's not really blackface anyway, since they're not supposed to represent black people, the blackness comes from chimneys if I'm not mistaking.",-4
No. Never. Even if it is on the ground on your property.,-2
[removed],-1
"""Boys will be boys"" 

Reinforces toxic masculinity and normalizes violent behavior in males 

Feminist rants are kind of my thing ",-2
"Yes, but I was talking about the public sphere, not about what some private businesses do. The government has no right to deny insurance to people just because they are obese. This is an arbitrary rule the same way it would be if it applied to smokers.",-3
Do you now for sure they were inbred and not just deformed? Just wondering how you knew.,-1
"[This](https://www.youtube.com/watch?v=i6dWKYLDqkQ) is what is being referred to. Until very recently, being a nerd wasn't a label you assumed yourself, it was plastered on you *because* you liked Spider man/comics/video games etc. It's hard to imagine now, where it's verboten to make fun of anybody because of anything, but being a ""nerd"" wasn't something you wanted to be.

Now, you have [girls like this,](https://youtu.be/tlbIHIEIndM?t=532) who've never bought themselves a drink at the bar, much less done *anything* for themselves, appropriating a label that at one time meant that you were made fun of and ostracized.

You didn't become a nerd or a geek because of street cred, but because of the scars you accrued over time.",-1
"It has to be done in KY. And I think it used to be exclusive to bourbon county Kentucky but I don't know if that is still true. 

Also I think Jameson buys the barrels for their whiskey from my distillers. ",-1
-tips fedora-,-3
"Yeah, he probably should buy new slippers :-P I sometimes also wear pony shirts, but they are subtle. ",-1
"&gt;he and his husband
???",-4
"Yes, this is why.  My wife works in a school full of shitty, shitty dominican children and ""I have to go to the bathroom"" means ""I want to fuck off as long as possible.""",-3
"When the dude with the book told them to say ""I do"", the groom said ""I don't"" and she ran away, tripped on her dress and died. Later on, the husband got a bazooka and smashed it to the ground cause he was angry, THEN the groom woke to life and smashed another bazooka in his face. Guest weren't too shocked.",-12
"So? Corruption isn't considered as being abnormal either. Does that mean the whole world should abide by it? I hate how you butthurt Indians always defend your shithole country. Is it any surprise then how fucking awful India is? Because if you don't even acknowledge or accept what's wrong then how do you expect to change? 

And to reply to your point - staring is considered rude socially. Period. Over here if we catch someone staring, they nod or smile. They don't just continue staring shamelessly and creep the person out. Just because a shithole third-world country with a record number of idiots and illiterates thinks it's alright, it doesn't make it alright.",-5
Obligatory list of burn centers link that's broken,-12
"being the most successful entrepreneur EVER sure does.

also the only person ever to run 2 separate multi BILLION dollar companies at the same time",-1
"Do you honestly believe self driving cars will even be available in your lifetime? There will be lack of a social and political push for this.

There will be major legal, moral and social issues deriving from this as well. How will insurance work? Who will be held liable? What if a pedestrian is hit? Is the company liable for a faulty car? There are already major flaws with cars now. New flaws will arise, surely, but who will be held accountable? Car companies already only get a slap on the wrist for mass production issues.

Edit: also, what kind of social services do flamethrowers have? That's a joke of a comparison.",-1
We'll do anything for the gold.,-1
"AskReddit in particular drew me in. ",-2
Lol are you seriously brigading me? You're pathetic,-4
deflating your mum,-3
All Harry Potter films except maybe the fifth one.,-1
"Do it. Pussy. ",-1
"uhh

you do realize right just because young people are considered attractive (and im talking adults here) that doesnt mean that most people would have sex with them",-2
"There's one photo.  She looks really young,  but im pretty sure it's her.  ",-1
"&gt; There are many games which hold the same level of nuance and storytelling as good film

No there isn't. The best level of storytelling in games is on the level of straight to video films.",-3
Wiping.  You're supposed to do it sitting down!,-1
Your mom's bed.,-2
"Does this not prove the point that guns are a problem then? 

If DC has the lowest gun ownership, and highest gun crime, does it not stand to reason that guns are a danger to society, no matter what laws are in place?

Furthermore, part of the issue here are the illegal guns being used sold and traded, without being part of a registry. It would make sense that high gun ownership may have lower gun deaths (relatively), if that state is properly enforcing laws, or has laws other states do not. I would bet, that if you compared all the data you supplied, you'd find a correlation for the premise that less guns = less deaths, or strict gun laws = less gun violence, etc. 

I would really be shocked if 3/4 of the States had strict gun laws, and lowest gun ownership, but still had higher gun crime then the 1/4 of states that don't.",-1
"Think about this, the first gasoline car was built in 1893, the first mass production of cars started in 1901, Henry Ford started the first assembly line in 1913. That's 20 years for the car to go from a one off prototype to a mass produced item. That's also without the mass communication we have today allowing the spread of technology and ideas to spread exponentially faster. I'm not saying it will be tomorrow, but realistically we are within 20 years of driverless cars becoming common, or at least not obscure.",-1
"Twilight

Eragon

Harry potter

Hunger games

Oh wait... You said good books.",-1
"Condoms protect you from STIs. Vaccines protect you from diseases.

Guns protect you from people trying to kill you, and wild animals. ",-1
"Skepticism is a universal solvent as it dissolves all certainties-- as all truth statements must be founded on assumptions and all assumptions can be questioned.

You can choose where you wish to stop your skepticism, but in doing so you are accepting some assumption which underpins your truth.
",-1
"I was taking a shit during finals week and a man went into the stall next to me and started crying and punching the stall and finally started to shit and just wept. I talked to him and even held his hand, sometimes anxiety results in bathroom mistreatment.",-1
No. I wish I'd never wasted my time with it.,-1
"Legislation and education is a horrible idea and people shouldn't use drugs they are fuckin' bad and detrimental to a functioning society.

Why would you teach drug use in schools?  That's crazy fucked up.  The only thing I could imagine rationalizing teaching would be the dangers of drug use and harm reduction.

Before a person uses a substance they should research the effects both positive and negative.  Fully understand the risks and the effects on the body.  Ways they can be sure of their product, it's purity, methods of ensuring purity through ""washes"" and how to reagent test so they can be positive of what they are getting.

You know, what a rational, responsible individual would do.  We don't need those people who blindly take substances in the community.",-6
"I know it's a joke,but I doubt psychopaths will ever succeed in politics,it takes too much EQ.

Edit:I am wrong",-7
Thats the polite thing to do,-3
not if it's referenced somewhere else,-2
IT'S BEEN A WHILE I SAY WHAT I WANT WITHOUT SOURCES (begins to rapidly hump a trashcan while screaming mayonnaise),-4
Season 2 and 3 are pretty bad tho,-1
"I honestly don't want to know what she tells them. I am a biz school prof and we keep the econ folks in a trailer on the other side of campus. 

They have to be mostly students or unemployed. There's no way they could function in a high paying career with that mentality.  

They sure are entertaining though. ",-6
"Not entirely sure why that is dumb in itself. Arguments could be made that while it is a valuable right, it is abused in some ways. ",-1
"Oh shit I was going to post the exact same thing! Haha!

Also, drink.",-1
"What do you mean ""unlock?""",-1
Hahaha,-1
"I know plenty because quite literally everyone in my immediate family has been an addict from one drug to another. So I REALLY hope that you get drug tested one day and lose your job. People like you who think that it is okay to get high is what is ruining society.

By the by, I am atheist and about as left on the political spectrum you can get. Marijuana being illegal is the only thing I believe conservatives have ever said that is intelligent. ",-9
[removed],-1
"The tests you're talking about had ""experts"" describe perceived flavored in the wine.  The ""leathery, earthy red fruit"" shit is all pretension, but a 5$ bottle and a 20$ bottle has drastically different flavors.  Look up ""fortification.""",-2
"An unopened box of condoms. 
""She's not a whore,yay!""*bold*

But maybe it's just unopened because she just finished another one. 

""Meh.""

You can never win ",-1
"Where, what, and how many?",-1
Username checks out,-1
If he pays for the date at least do hand stuff,-1
"Your mom's virginity ",-1
"I banged my friend's sister once. She just happened to be her other sister.

Did not go well.",-1
I know ugly girls who are even more shitty. Your setting it up as if you developed a thick skin being rejected or having the fear of being rejected by hot girls. Settling and saying life is good is just a cooing mechanism which seems to work for you I guess... also your old.,-1
"Women who think they're hot, even though they wear makeup. That's not your real face. It's one thing to be confident, but it's another to actually believe your own bullshit. Men don't care, we'll fuck you even though your face doesn't look like that, but don't think we don't know. ",-7
So it wont send them bankrupt if I do not buy anything else?,-1
"I graduated 1995 had, just diverse and ready to date again.",-2
"&gt;Okay then, how about you cite a statistician saying it?

I cited an entire comment thread run by people who *do economics for a living*, including besttrousers, who has years of expertise in econometrics. If that's not enough, [here](http://andrewgelman.com/2006/04/28/amusing_example/).
&gt;This sentence makes literally no sense.

I gave an example with my AIDS experiment. Do you understand why controlling for patients who die of pneumonia gives you a bad statistic on mortality of AIDS patients?",-1
"Hehehe I love you. ",-1
"Piss comes out of dicks, and period comes out of vaginas. Both smell really bad if you don't wash them. Seriously not the best argument for you to use. Genitals in general can get pretty nasty but we're only gonna focus on the ass?",-3
"Just as a candle cannot burn without fire, men cannot live without a spiritual life.

",-5
"Why the arm pit hair. 
Honestly if she grew her hair out she'd be super hot.",-2
"From the outside looking in I care because I am sick and tired of reading about the mass shootings of children and unarmed adults by semi-automatic wielding boys / men.

Who will determine whether a government is despotic?

What if large blocs of the gun owning population disagree on this?

 I suggest it's a recipe for civil war.",-1
"Take your inferior DNA back to Africa, you stupid porch monkey. If you were smarter you'd know the difference between a circle jerk and a discussion, retard. ",-2
"He drives a stolen car, sells smuggled alcohol, and beats people up when drunk.",-1
Not many,-1
...because people realised there is truth in astrology? Cmon man it's pretty obvious.,-1
Corbin Bleu,-7
Turn on the heater... makes me so hawt.,-1
"Proper lifting. Some exercises are easier than others but some people try deadlifts on their first days and arch their back. ",-1
Awesomenauts,-1
Upvoted for honesty.,-1
"&gt;Whatever, ignore all of human history where one human owning another was more than normal.

Slavery wasnt always brutal, it beat out ezexuying a defeated army. It was progress at times. Slaves were highly educated in rome and could work pn sundays. I wont get to deep into slavery, but it wasnt as evil as you think. People would become temporary slaves to pay a debt as well.


&gt;Whatever, ignore all of human history where women being forced to marry whomever their families picked for them was more than normal.

This was so the girl would have support, and the two were supposed to grpw to love eachother. Of course the man was trusted. Not that i support this 

&gt;Whatever, ignore all of human history where having no established rights unless your liege wanted to give them to you was more than normal.

Well i would argue all over the world right were inate before colonization and imperialism 

&gt;Do you see how this argument holds no real authority? A girl may be physically mature enough to be attractive while emotionally and mentally being too immature for a guy of a certain age. Us grown-ups can acknowledge that, say, ""Oh, she's very pretty,"" and then CONTROL OURSELVES instead of being creepy old fucks hitting on RIDICULOUSLY inappropriately young women.

You just rearranged your old argument and ignored my finer points. What age is too young? What do you personally believe the magic number is for a girl where any age guy can fuck her? Please im dying to hear this atbritrary number with no bearing on biology.",-8
"But the question is...

Does that surprise you at all?",-1
"thats not philosophical ",-1
[removed],-1
"OP said ""get a beer"". You heard ""fucking raging getting trashed every night"". OP said she never smiles. You heard ""she's boring for the sole reason that she doesn't drink, which I need to be doing all the time"". Idk I guess it's just annoying that people use the scenarios people post as opportunities to jerk themselves off even though they know what they're saying probably doesn't apply, which I'm sure you know. ",-4
"The question mark for starters....

And the meaning of sentence is: A phrase, or gesture that seeks information through a reply. ",-1
i wouldnt say hilarious,-31
"That s a terrible quote. 

Just because person x says person y hurt them, it doesn't mean that it actually happened. People lie all the time.",-30
"That's not a definition, that's an acronym. Just because some mollied out wanker coins a term doesn't make it true.",-2
"An ex of mine in high school agreed to try anal sex.  It was the first time for both of us.  We were not prepared.  She was laying downward dog and told me to insert my penis into her ass, I went in way too fast and without lube.  

After about three dry thrusts she asked me to stop and ran into the bathroom where she locked the door.  I could hear her sobbing when I noticed the blood on my dick and her tear stained pillow.  

Her parents never agreed with our relationship.  It was doomed to fail.  Not many parents are accepting about their high school daughter dating a 37 year old.",-6
[removed],-10
"Star Wars 
*opps*",-2
Every reddit account is a bit except you.,-10
"I'm going to have to downvote you for your unnecessary and irrelevant references to ethnicity and religion here, I'm sorry. There's no possible way that those details are relevant to the story.",-6
"Suck my 33 ACT score asshole.

11B til 2018 then I'm GTFO.",-2
"Veganism as a ""don't hurt animals"" is stupid. But veganism is totally justifiable as an environmental act. Animal agriculture accounts for more greenhouse gas emissions than all of transportation, and 80% of cleared rainforest is for grazing lands. Animals are a way less efficient way to get calories. We have enough grain and stuff to feed the world, but it's going to farm animals instead.",-3
"If the question asks ""&lt;specific occupation or type of person&gt; of reddit..."", parent comments should require some sort of proof that the commenter *is actually* that occupation or type of person.

Not necessarily as strict proof as /r/iama, but something.",-1
"Either we're alone in our solar system, or we aren't. Either scenario is frightening ",-2
Fight Club.,-3
Overdose on Tylenol? Ok buddy try that out.,-1
"lmaoid

(Laugh my ass off I did)",-4
Yeah I think BBT is waaaaaay worse,-1
HITLER DID NOTHING WRONG THE JEWS DID IT!!!1!,-5
"IQ.

It's more of a curse than a blessing.",-3
"Yes, fucking muslims are infesting the Western World at a great rate.",-6
"You actually learn how to communicate without saying stupid things like, ""What are the best things of being an adult?""  It's called ""grammar.""  Most of us learn it in grades 2 and 3, and should have it locked down by the time we reach adulthood.",-3
"no, but working around that assumption promotes easy communication ",-5
Yes but men *seem* to have an easier time grasping it then women.,-2
Go back to Tumblr,-1
"&gt;Selective service is male only because women couldn't serve in combat roles until recently. 

&gt;This is likely to change now that women can serve in combat roles.

Women have been able to serve in combat roles for 40 years now in the United States military. It isn't exactly a new concept. 

Edit: 
Source for you retards that are downvoting me. https://en.m.wikipedia.org/wiki/Women_in_the_military

&gt;In 1917 Loretta Walsh became the first woman to enlist. But it was not until 1948 that a law was finally passed that made women a permanent part of the military services. In 1976, the first group of women was admitted into a U.S. military academy.

2nd paragraph after the ""See Also"" section in the ""Women in Combat"" section. 1976 is when women were finally officially accepted into the military, although there are laws and women trying to enlist that predate the first entry of women.  
",-5
"Actually, the ""???"" was a direct quote from post I was replying to, and relevant to the joke, the ""*"" was just me not trying to swear (didn't think it was called for) and there was no ""!!!!!"". Try to keep up, there, sparky!",-1
Do you say this out of personal experience?,-13
Even the most bat-shit real religions are saner than scientology.,-2
"Uhh, you might be surprised. I don't know anyone smokes 40, but 20 could easily happen in any given day and certainly when they are celebrating. ",-1
"Rick and Morty. ",-1
