body,score
"&gt; Weaver says he did not.

So do you believe all cop killers or just the white supremacist ones?

&gt;Nothing I've been able to find suggests that he armed his kids and told them to kill cops. Can you cite that claim?

http://www.usmarshals.gov/history/degan.htm

&gt;sent him a summons with the date a month after the actual trial date.

He had 16 MONTHS to turn himself in.  His wife, his son, and Marshal Degan's blood is on his hands.",-2
"Yeah cause you're so fucking smart right? You people sound so pretentious, no actually smart person would ever say something like that ",-16
Door hinge doesn't rhyme with button,-4
Yep,-1
"nope, those kids had a certain magic, call it what you will ""being a natural"", perfect place at the perfect time etc., that will never be replicable again. And I mean, they too will fall into utter mediocrity into adulthood. The majority of them will look ridiculous for the way they acted in HS, but a select few will always have a mysterious cool, because they were cool in high school. There is no better thing to be, EVER, on earth. I don't care if you become the CEO of some clothes company, or end up dealing drugs for the cartels. They will always be able to smirk at you. Of course, until the day you utterly dismiss them and say fuck it. there's nothing we can do right?

Lol. Just, the one thing you ABSOLUTELY don't want to become is the guy who seems like he's trying to make up for those years. These are usually the guys with the shakey passive aggressive undertone (you know, they're squashing everyone beneath them now that they have some power?), and seem like they're gonna snap at anything you say to them. And are the kind that usually join BJJ or MMA gyms in their mid twenties........ But if you take it as it is, there to learn BJJ and not to become a cool guy, that's PERFECTLY fine!",-5
"Would you rather pay 4% of your initial investment on the front end, or pay 4% on the back end after 20+ years of growth?  $400&lt;$400+interest+dividends. They gotta make a living somehow, and usually front end load fees end up being the best for the consumer in long term investments.

Source: licensed professional ",-3
Perhaps read the submitted paper first,-1
Reddit: the stormfrontpage of the internet.,-3
"Economist here. We consider ourselves forensic scientists of a sort, considering we investigate things that fuck over the whole world at a time.    

Had a project once that involved modeling (cost-benefit) the economic ramifications of a man-made river in Spain. This river was supposed to bring water from the central areas down to very arid and touristy locations south of Valencia. 

Here's the fun part. We estimated the costs to be XX,XXX,XXX,XXX Euros (withheld, not sure if still secret...) with annual operating costs between 8%-8.5% of the total as well. Lets just say that the Spanish government came back and told us ""there is no way we can get the EU to fund this fucking shit with numbers like that, fix it or we will deport you and your fucking family"" (my family came with me for a year stint). This wasn't the only threat made. 

Cutting this story short, the numbers were booked, pretty badly too and if I recall we did that on purpose in the hopes that Spain would get caught red-handed and bitch-slapped by the EU. They didn't really... :(
Spain received hundreds of millions of Euros to build this river, neglecting most of the cost estimates because the EU wouldn't fund a river with such high operating costs, and the actual net benefit from the river would be less than 1/3 of what Spain reported. 

The river wasn't ever built. Coastal Spain built desalinization plants instead, equally disastrous. One of the many reasons Spain is a terrible place. ",-13
"Yo momma ",-1
Aww hows your mom doing with your broken arms.,-4
Sure. But cholsing your fights like that  very different from being a quitter.,-3
"That is not ok and they should not be forced to do that someone needs to stop them.

That doesn't mean i'm about to stop using products just because they came from slavery...if i did that i would need to stop eating or drinking or using anything that isn't made by me.",-1
She is a full grown women by now. She is old enough and has the money to get away from it. She just continues to drag herself back down the shitter. Don't think for one second she didn't choose this life as well.,-4
When i last dropped my mixtape it ended up becoming the sun.,-3
Chose to see Fun with Dick and Jane one holiday (the Jim Carrey version). It was a terrible mistake that I will never forget.,-1
debatable.,-4
"For starters when I was 12 didn't care about how I dressed ;I was a pussy (couldn't fight for shit) and I was in Private school (6th grade). 

What my 12 year old will be sad and depressed is that I don't have a girlfriend. Also that I am homeless and suicidal. So it may create a paradox of depression and drug overdose. So I believe keeping quiet will be the best option.

Edit: Ok I guess this is a bit dark but it's true though. Sorry.

Edit2: The only top shockers I will tell myself is that 1) You still talk to yourself even go on tangents . 2) You did served in the Navy for five years and have a chance to go back to college. 3) Despite your old man have fell, he's restored and coming back strong 1,000 percent. ",-1
"Depends where you are ",-37
"Except that is actually is better? At the base level of comparison, it has at least double the amount of ad blocking lists than ABP.",-3
Best comment I've seen in a long time,-5
"Well I eat an insane amount of Thai food and it's not too hot. And breeding a new strain is considered inventing something. Just like you can create/invent strains of marijuana, you can too with hot peppers. Don't play semantics with me high school chap! Also, I'm not american you ding dong.",-11
Only a girl would come up with these mental gymnastics,-2
"You use big words...you a nerd or something? ",-1
That means you overdosed on Alcohol.,-3
"All the people on Reddit claiming that seeing the same commercial over and over makes them hate that product? Yeah, I work in advertising. All our data points to the contrary so just shut the fuck up.",-4
Ok.,-2
"Don't get it twisted, your friend is anorexic. She hates herself and thinks shes too fat.
Thing is, she's also damn lazy. CBF *actually* being anorexic.
And she loves a burger, who doesn't? You should give her attention",-3
It had Ashton Kutcher in it... What were you expecting?,-1
*^crickets ^chirping*,-9
That comment is oozing with self-consciousness,-7
"Woah, what's wrong with shitposting?",-3
"Bernie sanders supporters. Honestly the most annoying people. Kind of like vegans and crossfitters who just have to let you know what they're about. ",-2
"Political correctness causing more issues than solving ",-2
"&gt;On May 6, 1986, ten days after Chernobyl, there was a risk of an even greater explosion that would spread radiation across half of Europe and kill millions.

Sounds like an anti-science conspiracy theory. Causation != correlation, superunscientific fellow reddit intellectual. 

Neil deGrasse Thyson never told me anything about this so it's not true, why are you slandering a clean and safe energy source? Last week my six year old daughter told me that she wants to be a goat-herder instead of a scientist when she grows up, so I beat her with a belt to make sure she doesn't turn into Jenny McCarthy.

SCIENCE, FUCK YEAH!",-1
"You too man, if following league of legends like a total f****** loser doesn't bring you great renumeration, I've read that you can make a lot of money sucking dudes dicks, which given your love of violent uniformed thugs, should be quite the wind fall for you.",-15
Read the rules on claims.,-2
"Ah, like a girl.  *nods sagely*",-1
He looks like a caveman,-2
"Well, yeah, I am not a mathematician.  

A lot of people are a lot better at their profession than I am.  I am simply trying to understand something that doesn't make sense to me. 

Can you explain it  better?  I mean, infinite is not defined, correct?  It is incalculable, right?  ",-1
Lol have you seen this thread?,-1
Himself. Don't be someone's fool.,-2
That's weird. I definitely pre ordered my ps4 from Walmart...,-1
A heaven-like place where everyone has cool superpowers.,-2
pics or GTFO. I'll tell you if you do or not,-10
"You'll find a way. ",-1
The holocaust was real,-7
"I agree with the overall sentiment of your post, but can't bring myself to upvote it because you say that human nature is relevant for anything.",-2
And they say the slippery slope is a fallacy.,-6
"But looking through your post history you have posted to multiple circlejerk subreddits ",-1
They can be fun if you have ads turn off. You can have instant graditude with the knowledge that you aren't supporting the shittiness.,-1
"r/nosleep is a great place for fictional stories such as yours ",-9
"- Snow White and the Seven Dicks
- Beauty and the Sifilis
- The Lion Prostitute
- Sex Toy Story",-4
How to cook your man a proper meal.,-9
"How are they still alive if hitler killed them all ",-1
"You should make a post with the before and after. ",-1
You reaaaaalllllyyy need to look into what the democrats are actually doing because you are severely misinformed.,-1
Magic isn't real silly.,-11
"I second this. Police are useless and the justice system is stacked in the abuser's favour. I know that sexual violence is never OK, but you need to rent a storage locker, drug them both, bind and gag them both and when they wake up rape the father with a knife to his throat while the mother watches. Then walk away. Just up and leave and come back two weeks later to dispose of the bodies.",-1
"Dick ",-1
the low tax rate in america,-2
"Yep.. Guys have a physiological urge to fuck based on appearances, whereas women focus on emotion and romance.",-2
"Because it's shit that's why ",-1
"Physically fitting a dick into a tiny pussy, the actual process of doing so, would be difficult. Tightness doesn't feel good once you pass a certain size threshold, therefore those who want a tight pussy must have a small dick. Not hard to follow the logic. Its not some remark about psychology, like if someone has a big truck they must have a tiny dick. Its the physical aspect of a large dick fitting in a tiny pussy.",-7
"No, the problem is that you seem to think that ""being a man"" means giving money and attention to any woman who lacks the sense to abort or give up the egg.

That's being a stooge.",-3
~~That's not true at all. What unsafe practices? All I've seen is unconditional love for those felines.~~,-3
"This. It's very serene. Load a bowl.

Edit - fucking retards",-5
Chip-olt-lay,-6
"It is because the original saying is stupid. ""you can't eat your cake and have it too"" would be a better way of phrasing it.",-1
"Sometimes I feel like I am the only person on the internet that does not like cats lol ",-4
Nothing because I never had sex,-3
"God, or any sort of higher power for that matter.",-3
"Don't worry, with all those Syrians you have been taking in over there you will be living in a theocracy in no time. Enjoy that. ",-5
"So you can have said kink, but not have a sexual preferences aside from bisexual by having said kink? I'm not attempting to be incriminating or rude, but the obvious answer is to separate the hairs by biological gender in seperate bowls, allowing the couple to choose which one they get.",-1
"Like I said, not worth the immunity.And I'm not a bro",-1
I am not a white supremacist. I merely acknowledge that white privilege exists.,-1
"I'm a big fan of Shikako.

I'll be so happy if someone gets this reference. ",-1
"Comfort. Having a job that pays you just enough so your comfortable. ",-1
Yes.  Both rot off.,-7
"Well I'm speaking only from my own experience. I'm gay and a virgin, quite the introvert. But I'm curious would I be able to live on my own on this salary",-1
"ineffective bureaucrats protecting the laws a corrupt organization through force. ",-1
"he's not?

he's still better than most of the other hip hop trash coming out nowadays",-1
Is Charity his favorite stripper?,-2
LOL,-4
"There's a fundamental problem with this.  Everything boils down to being able to pass as the opposite sex.  What if you can't?  What if people knew you before the change?  Is a person supposed to move far away to avoid detection?  If a someone finds out that you are not the sex you are attempting to appear as, the operation is for naught, it all comes crashing down.  God forbid a transsexual has a coworker find out about it and tell people. How would that work for someone like Bruce Jenner?  If I were to see him on the street and call him Bruce, what would happen?  Is everyone in the world supposed to play along with the delusion?  Is that the end game, to force everyone who knows the truth to conform?  That isn't healthy.

I don't believe the only treatment is transition.  I don't believe a sex change should be recommended at all for the reasons above.  Any time a person has a problem with their brain chemistry, they are prescribed medication to correct it.  It does not make sense to tell a person to get a sex change that may or may not fool people.  No one tells a a delusional who thinks they are Napoleon to dress and act like Napoleon, no matter if his brain chemistry is identical to the real deal or not.  If reality drives a person to suicidal actions, then they should be hospitalized until they can deal with reality.

EDIT:  And another massive problem with this: if a trans person is supposed to pass as the opposite sex, what about a sexual partner?  What incentive would there be for a passing trans person to tell someone they are with who doesn't know, the truth?  Is it okay to do that to people?",-5
Godfather III was terrible.,-1
"Slight of hand. It's really amazing what people can have lifted off of them by someone that is very talented. ",-2
"Wrong. The 6+ came out last September in 2015, the 6 came out in 2014.",-4
"Not sure I follow. You're saying that people think Earth is 2000 years, divided by, 5000 years? It's probably just me, but I haven't heard of people saying this.",-1
My number ;),-6
"Not unless you grow up to be transgendered. ",-4
"never mind, i'm obviously dealing with someone with an IQ of 10",-1
Damn that's terrible. There are lots of good drug addict parents out there,-1
"HIV. I mean the chances are pretty damn low of getting it. If I'm not going to share blood with the person. There's a pretty damn good chance of not getting it. I know a few people in the medical field who think people with HIV are death. If they get touched they will die. In reality, the chances are less than one percent for sex and about less than 0.1 percent for needle sticks. ",-2
"i find songbirds using the full extent of their capabilities to wake me up before dawn more annoying. ",-3
"Being fuckable is not an achievement. Nor is it a skill. And it's certainly not a valid occupation.

Do you know how to do *anything* practical? Do you have any skills that aren't social in nature? Would you survive in a disaster situation?",-2
Would you have done the same if it were a folder of porn?,-8
What about Bernie or Ron Paul?,-1
When I came here and read the comments and realized I wasn't an alcoholic.... heck yes.. time to celebrate with a beer!  🍻,-2
"I'm an atheist myself, I'm just saying that some people depend on religion for guidance and it gives them comfort and if that was taken away from them then some may feel like it's their only option.",-1
"You see, the fundamental differences are our perspectives.  You believe is something (evolution) and I believe in something (the Bible) and our view points mold to that perspective.  People call Christians close minded, and I agree that we are - our narrow view point is molded by the Word of God - but evolutionists are just as close minded.  Even you have to admit that.  You go by what evidence you have and I go by what evidence I have.",-5
The best reactor is tyrone magnus. His reactions are actually pretty fucking hilarious.,-2
10s of millions a year? Something... something tells me that's BS.,-1
"&gt; they're literally just there to make sure no one has a panic attack, why is that a bad thing?

Because inevitably, the use of triggers becomes mutated to range in meaning from ""this will make me have a panic attack"" to ""this topic is bad, I don't like it, therefore don't discuss it"". To be precise, the latter leads to censorship and avoidance of ""troublesome"" topics. The vagueness of a word like ""troublesome"", left entirely to the demands of an individual, is what leads to the criticism of the use of trigger warnings. 

There is also research that suggests that exposure to triggers rather than avoidance is better in the long run for overcoming the response. [Here](http://www.psmag.com/health-and-behavior/hazards-ahead-problem-trigger-warnings-according-research-81946) is an article with more info. 

Of course this doesn't mean that trigger warnings should be abolished, but they should retain a grave use rather than simply preemptively tagging everything with a TW/CW. Also, this does emphasize a certain role on the individual to seek out materials that they might find discomforting and/or panic-inducing and avoid them if they so wish. A parent can check out questionable details of a film on iMDb before showing it to their child, for example. It is not on the movie to describe every single sexual, violent, graphic, etc. encounter or dialogue that occurs in the movie.",-5
"The way my friends and I look at Kanye there are two main eras. They are the pre and post-douche bag eras. Anything before has good lyrics and means a lot, and afterwards is just him jerking himself off verbally. Where exactly that line is depends on the listener, but if you only listen to his recent stuff then I can see why you would think that. ",-1
"Sounds like you deserved to be bullied and were causing them to act this way towards you. ",-3
"I'm in support of people not expecting everybody to know the details of what they are making jokes about. ",-8
"Yeah I'm sick of people fucking rolling over and crying they got offended.. Fucking grow some skin, stand up for yourself, and offend the fuck outta that little bitch that offended you. Life's just all around better when you don't back down and assert your dominance.",-1
"Everything you said was wrong and you clearly never watched clone wars.

Yoda is the strongest force user in the Jedi Order, Dooku is the best swordsman and excellent with the force to boot.

Anakin, was growing more powerful than both of them by RotS.

Yoda trained Luke well enough in a few weeks/ months in order to fight Darth Vader and manage to get a few hits in and not die.

So Yoda managed to train someone to survive against one of the strongest beings in the universe in a few weeks.

Yoda never resented Anakin after Obi-Wan took him as his learner. Anaking often got in trouble for his risky war tactics, but was also commended at the same time because they got the job done.

On top of all this, Palpatine was manipulating the force to confuse the Jedi, as well as all the political shit.

And lastly, Yoda went to Degobah to train in order to keep his consciousness alive from the living force to the cosmic force.",-1
"Newark, NJ",-1
PCMR being somewhere else and not bragging about how elite they are? Bullshit! :P,-4
Volcano insurance.,-2
Tight pussy.,-1
Mass Shootings!,-3
"Nah. That would require effort but you seem like the guy who clicks on the  ""how to grow your dick"" ads",-3
"In my opinion, yes.",-1
"&gt; ""What's that got to do with the price of fish?""

I have seriously never heard this one, it's terrible. It's supposed to be ""What's that got to do with the price of tea in China.""",-1
"I think it was the guys girlfriend right? He don stuck his dick in crazy ",-1
"Fellatio helps. ",-4
The washouts make really good escorts though.,-1
"The rebels in Star wars, bit thats just my personal opinion ",-1
"I look down on people who support racist, sexist, hateful people. Simple as that.",-57
"Walt was a more thoroughly interesting character.

Mike was a cantankerous old curmudgeon with a particular set of skills, working as the guard dog for the main antagonist. He tries to pit Walt and Jesse against each other and is pretty much a shithead most of the time. None of that is particularly interesting or appealing.",-9
It's close enough.,-6
"On the contrary I see fussy eating as a mental illness brought on by poor parenting.

The cure is cognitive behavioural therapy, making fussy eaters open their mind so they can see how their thought pattern is holding them back and move past it.
",-8
Dollarydooos,-1
"Lol, if only.",-4
sooo...beside my lazy ass...no one's gonna provide a pic?,-1
"Swedish """"""people"""""" are emigrating at the highest rates since the 80's. They will assimilate to new cultures. Who cares about them?",-2
"At least what you thought was kind of logical!

I'm glad you changed.

I don't think you were a twat.

It seems like you were a deep thinker in high school.

I wouldn't have thought about that.",-9
"Sorry, I forgot every other drug user uses kits constantly on every amount of drugs they use",-2
"It would be completely fine if it was just that.  She wasn't really firm in expressing that she didn't want to get serious, but she didn't want to get serious with him.  It more just played out that, no I don't want to get serious, I don't want to get serious... break up.. I'm getting super serious with this dude I've know for a short while.  So yeah it wasn't I didn't want to get serious... I just didn't want to get serious with you.  And I didn't make that part perfectly clear.  ",-4
Dried cow fetus!,-2
Religions.,-5
"music piracy from millionaires. ",-3
"Angela Merkel, since she will be dead long before she can start her delusional refugee policy.",-11
"You realize it's always been a guy, right?",-1
I dont. I love him,-1
"&gt; Do you not see how this might make people nervous?

I didn't qualify anything, I answered that. Nobody sees how this might make people nervous as very few people are oversensitive paranoids.",-2
"Ah Jesus, your mom's pussy is definitely at the top of my list. ",-1
"Is it a spoiler to *Rogue One* to tell people that, ""many bonthans died?""",-3
"I kept hitting ctrl+f i couldn't find you, and then I remembered to sort by controversial!  And here you are at the top.",-1
"I have no first hand experience with the military, but I find it hard to believe that they give a crap about your mental/emotional/spiritual/financial welfare or your relationship status. 
Some of your friends in the military, sure. But the organization as a whole...just doesn't make sense to me.",-15
Probably because the series with Freeman and Cumberbatch is better.,-5
So I want to mention the Eagles in Lord of the Rings but I feel like it's too obvious.,-2
"Undergrad in Econ, but I have not studied Comcast so correct me if I am wrong.

It is not that the government **protect** the monopoly, it is the government **allows** the monopoly. The key difference is anyone CAN open up a competing brand, it is that market forces prevent it from happening.

In order to compete, you would have to figure out how to get fast, reliable, cheap internet to every house in a gigantic area. This is so crazy expensive, and so crazy risky (because people already have the product you are trying to sell them, you can't be sure they will be willing to switch). Mix that with the fact that margins are so low, that two companies will not survive without increasing prices DRASTICALLY. That is why the government relaxes the anti-trust laws when it comes to companies like that.

Important note: Again, I have not studied Comcast. I described the *type* of government permitted monopoly that I *think* Comcast is. so please correct any mistakes. ",-8
"yes

also, I love how someone downvoted me xd",-2
Yaaaas. You get a way better shave. And feel like a badass,-1
Fuck feelings and spill out the truth,-2
you'll drop off the cliff like the rest be assured,-2
"You're thinking too big. Why can there be multiple communes? Thousands and thousands of them, loosely organized into groups. ",-1
"Lets say, hypothetically, that's true. What is the solution?",-1
Bernie Sanders would be an empty plate telling you to go steal someone else's burger.,-3
"You're predicting an alternate timeline based on a video game? ",-1
"i can't understand his appeal, his jokes are unoriginal and his delivery stinks.  that show undateable that he's on is fucking terrible.",-1
"I'm 6'3 , 335lbs and promise to never miss. ;) haha",-6
"Beer pong, I haven't lost in a couple years",-1
Victory. The aroma of a freshly vanquished foes shat pants.,-1
"When did I say I'm against liberals, fucktard? ",-2
"When my 18 year old sister thinks it ""is weird your getting drunk"". I am 23 and could out drink that slut like no tomorrow.  NEWS FLASH: YOU ARE NOT THE FIRST GENERATION TO DO THINGS",-2
"Those science denying asshats are the same ones who've actually advocated on our behalf. They're idiots, but they've actually worked hard for us, whereas you coasties don't give a shit so long as you keep getting your cheap organic kale and overpriced coffee.

And you want to talk about science denial? We could have avoided the global warming problem 30 years ago by ramping up nuclear power, but the fucking environmentalists didn't want to acknowledge it. As a result, we're stuck here with our thumbs up our asses, awaiting the solar messiah that the coastie environmentalists keep promising is only 10 years out. They're all idiots; yours just hide behind their smugness.",-9
Why keep them alive?,-4
Tell that to teen Brits who fight/fought in the British armed forces. I think the fighting age during WW1 and 2 was much lower than it is now as well.,-11
Non handicap people parking in handicap spots.,-1
